Code/Ref,Company_Name_cl,License_type_cl,Date of application,Date of award,Expiry date,Commodity_cl,Area_acre_cl,Location_state_cl,Coordinates of the license area,Award_d,Award_m,Award_y,Expiry_d,Expiry_m,Expiry_y,Group_cl,Block_cl,Award_date_cl,Expiry_date_cl
1,Ngwe Hein Htet Gems,Private,Oo Si(2/10)(14.5.11),3.1.2011,3.4.2016,Jade,1,Kachin State,Maw Maung(246),3,1,2011,3,4,2016,Maw Maung,246,2011-1-3,2016-4-3
2,Ngwe Hein Htet Gems,Private,Oo Si(2/10)(14.5.11),3.1.2011,3.4.2016,Jade,1,Kachin State,Maw Maung(247),3,1,2011,3,4,2016,Maw Maung,247,2011-1-3,2016-4-3
3,Ngwe Hein Htet Gems,Private,Oo Si(2/10)(14.5.11),3.1.2011,3.4.2016,Jade,1,Kachin State,Whay Khar Mhaw Taung(181),3,1,2011,3,4,2016,Whay Khar Mhaw Taung,181,2011-1-3,2016-4-3
4,Ngwe Hein Htet Gems,Private,Oo Si(2/10)(14.5.11),3.1.2011,3.4.2016,Jade,1,Kachin State,Whay Khar Mhaw Taung(184),3,1,2011,3,4,2016,Whay Khar Mhaw Taung,184,2011-1-3,2016-4-3
5,Ngwe Hein Htet Gems,Private,Oo Si(3/13)(15.2.13),24.12.2011,24.3.2017,Jade,1,Kachin State,Mhaw Si Sar(228),24,12,2011,24,3,2017,Mhaw Si Sar,228,2011-12-24,2017-3-24
6,Ngwe Hein Htet Gems,Private,Oo Si(3/13)(15.2.13),24.12.2011,24.3.2017,Jade,1,Kachin State,Mhaw Si Sar(229),24,12,2011,24,3,2017,Mhaw Si Sar,229,2011-12-24,2017-3-24
7,Ngwe Hein Htet Gems,Private,Oo Si(3/13)(15.2.13),24.12.2011,24.3.2017,Jade,1,Kachin State,Whay Khar Ga Toneyet(86),24,12,2011,24,3,2017,Whay Khar Ga Toneyet,86,2011-12-24,2017-3-24
8,Ngwe Hein Htet Gems,Private,Oo Si(3/10)(28.9.10),11.10.2010,10.1.2016,Jade,1,Kachin State,Sat Pyar Chaung(2),11,10,2010,10,1,2016,Sat Pyar Chaung,2,2010-10-11,2016-1-10
1,Paing Phyo Thiha Gems,Private,Oo Si(3/13)(15.2.13),6.1.2012,6.4.2017,Jade,1,Kachin State,Ka Lar Mhaw(95),6,1,2012,6,4,2017,Ka Lar Mhaw,95,2012-1-6,2017-4-6
2,Paing Phyo Thiha Gems,Private,Oo Si(3/14)(11.12.14),7.3.2015,6.3.2020,Jade,1,Kachin State,Maw Maung(270),7,3,2015,6,3,2020,Maw Maung,270,2015-3-7,2020-3-6
3,Paing Phyo Thiha Gems,Private,Oo Si(3/14)(11.12.14),7.3.2015,6.3.2020,Jade,1,Kachin State,Maw Maung(271),7,3,2015,6,3,2020,Maw Maung,271,2015-3-7,2020-3-6
1,Eight Thousand Gems,Private,Oo Si(3/14)(11.12.14),6.1.2015,5.1.2018,Jade,1,Kachin State,Mhaw Ga Lone(287),6,1,2015,5,1,2018,Mhaw Ga Lone,287,2015-1-6,2018-1-5
2,Eight Thousand Gems,Private,Oo Si(3/14)(11.12.14),6.1.2015,5.1.2018,Jade,1,Kachin State,Mhaw Ga Lone(288),6,1,2015,5,1,2018,Mhaw Ga Lone,288,2015-1-6,2018-1-5
1,Tun Naing Aung Gems,Private,Oo Si(2/10)(17.5.10),2.4.2010,2.7.2015,Jade,1,Kachin State,Mana(275),2,4,2010,2,7,2015,Mana,275,2010-4-2,2015-7-2
2,Tun Naing Aung Gems,Private,Oo Si(2/10)(17.5.10),2.4.2010,2.7.2015,Jade,1,Kachin State,Mana(277),2,4,2010,2,7,2015,Mana,277,2010-4-2,2015-7-2
3,Tun Naing Aung Gems,Private,Oo Si(1/10)(4.2.10),13.7.2008,12.10.2015,Jade,1,Kachin State,Mana(139),13,7,2008,12,10,2015,Mana,139,2008-7-13,2015-10-12
4,Tun Naing Aung Gems,Private,Oo Si(3/13)(15.2.13),2.4.2014,2.7.2019,Jade,1,Kachin State,Mana(272),2,4,2014,2,7,2019,Mana,272,2014-4-2,2019-7-2
5,Tun Naing Aung Gems,Private,Oo Si(3/13)(15.2.13),2.4.2014,2.7.2019,Jade,1,Kachin State,Mana(273),2,4,2014,2,7,2019,Mana,273,2014-4-2,2019-7-2
6,Tun Naing Aung Gems,Private,Oo Si(3/08)(1.11.08),29.12.2009,30.3.2015,Jade,1,Kachin State,Sha Yaung Kha(298),29,12,2009,30,3,2015,Sha Yaung Kha,298,2009-12-29,2015-3-30
1,Shinning Star Light Gems,Private,Oo Si(1/11)(14.5.11),18.4.2011,17.4.2014,Jade,1,Kachin State,Myauk Phyu(95),18,4,2011,17,4,2014,Myauk Phyu,95,2011-4-18,2014-4-17
2,Shinning Star Light Gems,Private,Oo Si(4/11)(3.11.11),15.7.2011,14.1.2014,Jade,1,Kachin State,Mat Lin Chaung(172),15,7,2011,14,1,2014,Mat Lin Chaung,172,2011-7-15,2014-1-14
3,Shinning Star Light Gems,Private,Oo Si(4/11)(3.11.11),15.7.2011,14.1.2014,Jade,1,Kachin State,Mat Lin Chaung(173),15,7,2011,14,1,2014,Mat Lin Chaung,173,2011-7-15,2014-1-14
4,Shinning Star Light Gems,Private,Oo Si(3/13)(15.2.13),14.2.2012,13.2.2015,Jade,1,Kachin State,Whay Khar(Sai New)(216),14,2,2012,13,2,2015,Whay Khar (Sai New),216,2012-2-14,2015-2-13
5,Shinning Star Light Gems,Private,Oo Si(3/13)(15.2.13),27.7.2012,26.7.2015,Jade,1,Kachin State,Taung Kauk(104),27,7,2012,26,7,2015,Taung Kauk,104,2012-7-27,2015-7-26
6,Shinning Star Light Gems,Private,Oo Si(3/13)(15.2.13),22.7.2012,21.7.2015,Jade,1,Kachin State,Taung Kauk(110),22,7,2012,21,7,2015,Taung Kauk,110,2012-7-22,2015-7-21
7,Shinning Star Light Gems,Private,Oo Si(3/13)(15.2.13),27.7.2012,26.7.2015,Jade,1,Kachin State,Maw La Kin(54),27,7,2012,26,7,2015,Maw La Kin,54,2012-7-27,2015-7-26
8,Shinning Star Light Gems,Private,Oo Si(3/13)(15.2.13),27.7.2012,26.7.2015,Jade,1,Kachin State,Maw La Kin(58),27,7,2012,26,7,2015,Maw La Kin,58,2012-7-27,2015-7-26
9,Shinning Star Light Gems,Private,Oo Si(3/13)(15.2.13),27.7.2012,26.7.2015,Jade,1,Kachin State,Maw La Kin(67),27,7,2012,26,7,2015,Maw La Kin,67,2012-7-27,2015-7-26
10,Shinning Star Light Gems,Private,Oo Si(2/11)(19.6.11),18.4.2011,17.4.2016,Jade,1,Kachin State,Maw Maung(180),18,4,2011,17,4,2016,Maw Maung,180,2011-4-18,2016-4-17
11,Shinning Star Light Gems,Private,Oo Si(2/11)(19.6.11),19.8.2011,18.8.2016,Jade,1,Kachin State,Nant Mhaw(201),19,8,2011,18,8,2016,Nant Mhaw,201,2011-8-19,2016-8-18
12,Shinning Star Light Gems,Private,Oo Si(2/11)(19.6.11),19.8.2011,18.8.2016,Jade,1,Kachin State,Nant Mhaw(202),19,8,2011,18,8,2016,Nant Mhaw,202,2011-8-19,2016-8-18
13,Shinning Star Light Gems,Private,Oo Si(2/11)(19.6.11),19.8.2011,18.8.2016,Jade,1,Kachin State,Nant Mhaw(205),19,8,2011,18,8,2016,Nant Mhaw,205,2011-8-19,2016-8-18
14,Shinning Star Light Gems,Private,Oo Si(6/11)(18.12.11),31.1.2012,30.1.2017,Jade,1,Kachin State,Nant Mhaw(263),31,1,2012,30,1,2017,Nant Mhaw,263,2012-1-31,2017-1-30
15,Shinning Star Light Gems,Private,Oo Si(6/11)(18.12.11),31.1.2012,30.1.2017,Jade,1,Kachin State,Nant Mhaw(265),31,1,2012,30,1,2017,Nant Mhaw,265,2012-1-31,2017-1-30
16,Shinning Star Light Gems,Private,Oo Si(3/13)(15.2.13),31.5.2013,30.5.2018,Jade,1,Kachin State,Maw La Kin(4),31,5,2013,30,5,2018,Maw La Kin,4,2013-5-31,2018-5-30
17,Shinning Star Light Gems,Private,Oo Si(2/11)(19.6.11),6.1.2011,6.4.2016,Jade,1,Kachin State,Myauk Phyu(96),6,1,2011,6,4,2016,Myauk Phyu,96,2011-1-6,2016-4-6
18,Shinning Star Light Gems,Private,Oo Si(1/15)(26.3.15),1/8,9.4.2015,Jade,1,Kachin State,Taung Kauk(82),8,1,,9,4,2015,Taung Kauk,82,1900-1-8,2015-4-9
19,Shinning Star Light Gems,Private,Oo Si(1/15)(26.3.15),1/8,9.4.2015,Jade,1,Kachin State,Ma Mon(70),8,1,,9,4,2015,Ma Mon,70,1900-1-8,2015-4-9
1,Ever Win Nar Gems,Private,Oo Si(2/08)(15.3.08),2.2.2008,4.5.2015,Jade,1,Kachin State,Mat Lin Chaung(180),2,2,2008,4,5,2015,Mat Lin Chaung,180,2008-2-2,2015-5-4
2,Ever Win Nar Gems,Private,Oo Si(2/08)(15.3.08),2.2.2008,4.5.2015,Jade,1,Kachin State,Mat Lin Chaung(181),2,2,2008,4,5,2015,Mat Lin Chaung,181,2008-2-2,2015-5-4
3,Ever Win Nar Gems,Private,Oo Si(2/08)(15.3.08),2.2.2008,4.5.2015,Jade,1,Kachin State,Mat Lin Chaung(182),2,2,2008,4,5,2015,Mat Lin Chaung,182,2008-2-2,2015-5-4
4,Ever Win Nar Gems,Private,Oo Si(2/08)(15.3.08),2.2.2008,4.5.2015,Jade,1,Kachin State,Mat Lin Chaung(183),2,2,2008,4,5,2015,Mat Lin Chaung,183,2008-2-2,2015-5-4
5,Ever Win Nar Gems,Private,Oo Si(2/08)(15.3.08),2.2.2008,4.5.2015,Jade,1,Kachin State,Mat Lin Chaung(184),2,2,2008,4,5,2015,Mat Lin Chaung,184,2008-2-2,2015-5-4
6,Ever Win Nar Gems,Private,Oo Si(2/08)(15.3.08),8.3.2008,7.6.2015,Jade,1,Kachin State,Sha Yaung Kha(129),8,3,2008,7,6,2015,Sha Yaung Kha,129,2008-3-8,2015-6-7
7,Ever Win Nar Gems,Private,Oo Si(2/08)(15.3.08),8.3.2008,7.6.2015,Jade,1,Kachin State,Sha Yaung Kha(131),8,3,2008,7,6,2015,Sha Yaung Kha,131,2008-3-8,2015-6-7
8,Ever Win Nar Gems,Private,Oo Si(2/08)(15.3.08),8.3.2008,7.6.2015,Jade,1,Kachin State,Sha Yaung Kha(133),8,3,2008,7,6,2015,Sha Yaung Kha,133,2008-3-8,2015-6-7
9,Ever Win Nar Gems,Private,Oo Si(2/08)(15.3.08),8.3.2008,7.6.2015,Jade,1,Kachin State,Sha Yaung Kha(135),8,3,2008,7,6,2015,Sha Yaung Kha,135,2008-3-8,2015-6-7
10,Ever Win Nar Gems,Private,Oo Si(2/08)(15.3.08),8.3.2008,7.6.2015,Jade,1,Kachin State,Sha Yaung Kha(136),8,3,2008,7,6,2015,Sha Yaung Kha,136,2008-3-8,2015-6-7
11,Ever Win Nar Gems,Private,Oo Si(2/08)(15.3.08),8.3.2008,7.6.2015,Jade,1,Kachin State,Sha Yaung Kha(137),8,3,2008,7,6,2015,Sha Yaung Kha,137,2008-3-8,2015-6-7
12,Ever Win Nar Gems,Private,Oo Si(2/08)(15.3.08),8.3.2008,7.6.2015,Jade,1,Kachin State,Sha Yaung Kha(138),8,3,2008,7,6,2015,Sha Yaung Kha,138,2008-3-8,2015-6-7
13,Ever Win Nar Gems,Private,Oo Si(3/10)(28.9.10),24.10.2010,23.1.2016,Jade,1,Kachin State,Ma Mon(36),24,10,2010,23,1,2016,Ma Mon,36,2010-10-24,2016-1-23
14,Ever Win Nar Gems,Private,Oo Si(2/11)(19.6.11),8.3.2011,6.6.2016,Jade,1,Kachin State,Sha Yaung Kha(128),8,3,2011,6,6,2016,Sha Yaung Kha,128,2011-3-8,2016-6-6
15,Ever Win Nar Gems,Private,Oo Si(2/11)(19.6.11),8.3.2011,6.6.2016,Jade,1,Kachin State,Sha Yaung Kha(130),8,3,2011,6,6,2016,Sha Yaung Kha,130,2011-3-8,2016-6-6
16,Ever Win Nar Gems,Private,Oo Si(2/11)(19.6.11),8.3.2011,6.6.2016,Jade,1,Kachin State,Sha Yaung Kha(132),8,3,2011,6,6,2016,Sha Yaung Kha,132,2011-3-8,2016-6-6
17,Ever Win Nar Gems,Private,Oo Si(2/11)(19.6.11),8.3.2011,6.6.2016,Jade,1,Kachin State,Sha Yaung Kha(134),8,3,2011,6,6,2016,Sha Yaung Kha,134,2011-3-8,2016-6-6
18,Ever Win Nar Gems,Private,Oo Si(3/13)(15.2.13),11.12.2011,12.3.2019,Jade,1,Kachin State,Nant Mhaw(282),11,12,2011,12,3,2019,Nant Mhaw,282,2011-12-11,2019-3-12
19,Ever Win Nar Gems,Private,Oo Si(3/13)(15.2.13),11.12.2011,12.3.2019,Jade,1,Kachin State,Nant Mhaw(284),11,12,2011,12,3,2019,Nant Mhaw,284,2011-12-11,2019-3-12
20,Ever Win Nar Gems,Private,Oo Si(3/13)(15.2.13),11.12.2011,12.3.2019,Jade,1,Kachin State,Nant Mhaw(286),11,12,2011,12,3,2019,Nant Mhaw,286,2011-12-11,2019-3-12
21,Ever Win Nar Gems,Private,Oo Si(3/13)(15.2.13),28.8.2012,27.11.2019,Jade,1,Kachin State,Sha Yaung Kha(375),28,8,2012,27,11,2019,Sha Yaung Kha,375,2012-8-28,2019-11-27
22,Ever Win Nar Gems,Private,Oo Si(3/13)(15.2.13),28.8.2012,27.11.2019,Jade,1,Kachin State,Sha Yaung Kha(376),28,8,2012,27,11,2019,Sha Yaung Kha,376,2012-8-28,2019-11-27
23,Ever Win Nar Gems,Private,Oo Si(3/13)(15.2.13),28.8.2012,27.11.2019,Jade,1,Kachin State,Sha Yaung Kha(377),28,8,2012,27,11,2019,Sha Yaung Kha,377,2012-8-28,2019-11-27
24,Ever Win Nar Gems,Private,Oo Si(3/13)(15.2.13),12.9.2012,12.12.2019,Jade,1,Kachin State,Mat Lin Chaung(107),12,9,2012,12,12,2019,Mat Lin Chaung,107,2012-9-12,2019-12-12
25,Ever Win Nar Gems,Private,Oo Si(3/10)(28.9.10),29.11.2010,28.2.2016,Jade,1,Kachin State,Maw Maung(53),29,11,2010,28,2,2016,Maw Maung,53,2010-11-29,2016-2-28
26,Ever Win Nar Gems,Private,Oo Si(3/10)(28.9.10),29.11.2010,28.2.2016,Jade,1,Kachin State,Maw Maung(101),29,11,2010,28,2,2016,Maw Maung,101,2010-11-29,2016-2-28
27,Ever Win Nar Gems,Private,Oo Si(2/11)(19.6.11),10.5.2011,8.8.2016,Jade,1,Kachin State,Maw Maung(212),10,5,2011,8,8,2016,Maw Maung,212,2011-5-10,2016-8-8
28,Ever Win Nar Gems,Private,Oo Si(1/11)(14.5.11),11.1.2011,11.4.2016,Jade,1,Kachin State,Nat Mhaw(246),11,1,2011,11,4,2016,Nat Mhaw,246,2011-1-11,2016-4-11
29,Ever Win Nar Gems,Private,Oo Si(1/11)(14.5.11),8.12.2010,8.3.2016,Jade,1,Kachin State,Nat Mhaw(283),8,12,2010,8,3,2016,Nat Mhaw,283,2010-12-8,2016-3-8
30,Ever Win Nar Gems,Private,Oo Si(1/11)(14.5.11),8.12.2010,8.3.2016,Jade,1,Kachin State,Nat Mhaw(285),8,12,2010,8,3,2016,Nat Mhaw,285,2010-12-8,2016-3-8
1,Kyaut Kyi Kone Gems,Private,Oo Si(6/11)(18.12.11),20.2.2012,21.5.2017,Jade,1,Kachin State,Whay Lone(65),20,2,2012,21,5,2017,Whay Lone,65,2012-2-20,2017-5-21
2,Kyaut Kyi Kone Gems,Private,Oo Si(6/11)(18.12.11),20.2.2012,21.5.2017,Jade,1,Kachin State,Whay Lone(66),20,2,2012,21,5,2017,Whay Lone,66,2012-2-20,2017-5-21
3,Kyaut Kyi Kone Gems,Private,Oo Si(6/11)(18.12.11),20.2.2012,21.5.2017,Jade,1,Kachin State,Whay Lone(67),20,2,2012,21,5,2017,Whay Lone,67,2012-2-20,2017-5-21
4,Kyaut Kyi Kone Gems,Private,Oo Si(6/11)(18.12.11),20.2.2012,21.5.2017,Jade,1,Kachin State,Whay Lone(68),20,2,2012,21,5,2017,Whay Lone,68,2012-2-20,2017-5-21
5,Kyaut Kyi Kone Gems,Private,Oo Si(6/11)(18.12.11),20.2.2012,21.5.2017,Jade,1,Kachin State,Whay Lone(69),20,2,2012,21,5,2017,Whay Lone,69,2012-2-20,2017-5-21
6,Kyaut Kyi Kone Gems,Private,Oo Si(6/11)(18.12.11),20.2.2012,21.5.2017,Jade,1,Kachin State,Whay Lone(70),20,2,2012,21,5,2017,Whay Lone,70,2012-2-20,2017-5-21
7,Kyaut Kyi Kone Gems,Private,Oo Si(6/11)(18.12.11),20.2.2012,21.5.2017,Jade,1,Kachin State,Whay Lone(71),20,2,2012,21,5,2017,Whay Lone,71,2012-2-20,2017-5-21
8,Kyaut Kyi Kone Gems,Private,Oo Si(6/11)(18.12.11),20.2.2012,21.5.2017,Jade,1,Kachin State,Whay Lone(72),20,2,2012,21,5,2017,Whay Lone,72,2012-2-20,2017-5-21
9,Kyaut Kyi Kone Gems,Private,Oo Si(6/11)(18.12.11),20.2.2012,21.5.2017,Jade,1,Kachin State,Whay Lone(73),20,2,2012,21,5,2017,Whay Lone,73,2012-2-20,2017-5-21
10,Kyaut Kyi Kone Gems,Private,Oo Si(6/11)(18.12.11),20.2.2012,21.5.2017,Jade,1,Kachin State,Whay Lone(74),20,2,2012,21,5,2017,Whay Lone,74,2012-2-20,2017-5-21
11,Kyaut Kyi Kone Gems,Private,Oo Si(6/11)(18.12.11),20.2.2012,21.5.2017,Jade,1,Kachin State,Whay Lone(75),20,2,2012,21,5,2017,Whay Lone,75,2012-2-20,2017-5-21
12,Kyaut Kyi Kone Gems,Private,Oo Si(6/11)(18.12.11),20.2.2012,21.5.2017,Jade,1,Kachin State,Whay Lone(76),20,2,2012,21,5,2017,Whay Lone,76,2012-2-20,2017-5-21
13,Kyaut Kyi Kone Gems,Private,Oo Si(6/11)(18.12.11),20.2.2012,21.5.2017,Jade,1,Kachin State,Whay Lone(77),20,2,2012,21,5,2017,Whay Lone,77,2012-2-20,2017-5-21
14,Kyaut Kyi Kone Gems,Private,Oo Si(6/11)(18.12.11),20.2.2012,21.5.2017,Jade,1,Kachin State,Whay Lone(78),20,2,2012,21,5,2017,Whay Lone,78,2012-2-20,2017-5-21
15,Kyaut Kyi Kone Gems,Private,Oo Si(6/11)(18.12.11),20.2.2012,21.5.2017,Jade,1,Kachin State,Whay Lone(79),20,2,2012,21,5,2017,Whay Lone,79,2012-2-20,2017-5-21
16,Kyaut Kyi Kone Gems,Private,Oo Si(6/11)(18.12.11),20.2.2012,21.5.2017,Jade,1,Kachin State,Whay Lone(80),20,2,2012,21,5,2017,Whay Lone,80,2012-2-20,2017-5-21
17,Kyaut Kyi Kone Gems,Private,Oo Si(6/11)(18.12.11),20.2.2012,21.5.2017,Jade,1,Kachin State,Whay Lone(81),20,2,2012,21,5,2017,Whay Lone,81,2012-2-20,2017-5-21
18,Kyaut Kyi Kone Gems,Private,Oo Si(6/11)(18.12.11),20.2.2012,21.5.2017,Jade,1,Kachin State,Whay Lone(82),20,2,2012,21,5,2017,Whay Lone,82,2012-2-20,2017-5-21
19,Kyaut Kyi Kone Gems,Private,Oo Si(6/11)(18.12.11),20.2.2012,21.5.2017,Jade,1,Kachin State,Whay Lone(83),20,2,2012,21,5,2017,Whay Lone,83,2012-2-20,2017-5-21
20,Kyaut Kyi Kone Gems,Private,Oo Si(6/11)(18.12.11),20.2.2012,21.5.2017,Jade,1,Kachin State,Whay Lone(84),20,2,2012,21,5,2017,Whay Lone,84,2012-2-20,2017-5-21
21,Kyaut Kyi Kone Gems,Private,Oo Si(3/13)(15.2.13),27.8.2012,26.11.2017,Jade,1,Kachin State,Nant Mhaw(294),27,8,2012,26,11,2017,Nant Mhaw,294,2012-8-27,2017-11-26
1,Tun Tauh Sa Gems,Private,oo si (1/14)(10.6.14),31.7.2014,30.7.2017,Gem,1,Shan State,loi saung htauk(pha la-180),31,7,2014,30,7,2017,loi saung htauk,pha la-180,2014-7-31,2017-7-30
2,Tun Tauh Sa Gems,Private,Oo Si(2/11)(19.6.11),3.6.2011,1.9.2016,Jade,1,Kachin State,Taung Kough(47),3,6,2011,1,9,2016,Taung Kough,47,2011-6-3,2016-9-1
3,Tun Tauh Sa Gems,Private,Oo Si(2/13)(18.1.13),20.2.2012,21.5.2017,Jade,1,Kachin State,Whay Lone(103),20,2,2012,21,5,2017,Whay Lone,103,2012-2-20,2017-5-21
4,Tun Tauh Sa Gems,Private,Oo Si(4/15)(18.12.15),8.1.2016,7.1.2019,Jade,1,Kachin State,Namachi Satkyin Phawhtoke(653),8,1,2016,7,1,2019,Namachi Satkyin Phawhtoke,653,2016-1-8,2019-1-7
5,Tun Tauh Sa Gems,Private,Oo Si(4/15)(18.12.15),8.1.2016,7.1.2019,Jade,1,Kachin State,Namachi Satkyin Phawhtoke(654),8,1,2016,7,1,2019,Namachi Satkyin Phawhtoke,654,2016-1-8,2019-1-7
6,Tun Tauh Sa Gems,Private,Oo Si(4/15)(18.12.15),8.1.2016,7.1.2019,Jade,1,Kachin State,Namachi Satkyin Phawhtoke(655),8,1,2016,7,1,2019,Namachi Satkyin Phawhtoke,655,2016-1-8,2019-1-7
7,Tun Tauh Sa Gems,Private,Oo Si(4/15)(18.12.15),8.1.2016,7.1.2019,Jade,1,Kachin State,Namachi Satkyin Phawhtoke(656),8,1,2016,7,1,2019,Namachi Satkyin Phawhtoke,656,2016-1-8,2019-1-7
8,Tun Tauh Sa Gems,Private,Oo Si(4/15)(18.12.15),8.1.2016,7.1.2019,Jade,1,Kachin State,Namachi Satkyin Phawhtoke(657),8,1,2016,7,1,2019,Namachi Satkyin Phawhtoke,657,2016-1-8,2019-1-7
9,Tun Tauh Sa Gems,Private,Oo Si(4/15)(18.12.15),8.1.2016,7.1.2019,Jade,1,Kachin State,Namachi Satkyin Phawhtoke(658),8,1,2016,7,1,2019,Namachi Satkyin Phawhtoke,658,2016-1-8,2019-1-7
10,Tun Tauh Sa Gems,Private,Oo Si(4/15)(18.12.15),8.1.2016,7.1.2019,Jade,1,Kachin State,Namachi Satkyin Phawhtoke(659),8,1,2016,7,1,2019,Namachi Satkyin Phawhtoke,659,2016-1-8,2019-1-7
11,Tun Tauh Sa Gems,Private,Oo Si(4/15)(18.12.15),8.1.2016,7.1.2019,Jade,1,Kachin State,Namachi Satkyin Phawhtoke(660),8,1,2016,7,1,2019,Namachi Satkyin Phawhtoke,660,2016-1-8,2019-1-7
12,Tun Tauh Sa Gems,Private,Oo Si(4/15)(18.12.15),8.1.2016,7.1.2019,Jade,1,Kachin State,Namachi Satkyin Phawhtoke(661),8,1,2016,7,1,2019,Namachi Satkyin Phawhtoke,661,2016-1-8,2019-1-7
13,Tun Tauh Sa Gems,Private,Oo Si(4/15)(18.12.15),8.1.2016,7.1.2019,Jade,1,Kachin State,Namachi Satkyin Phawhtoke(662),8,1,2016,7,1,2019,Namachi Satkyin Phawhtoke,662,2016-1-8,2019-1-7
1,Hole & one Gems,Private,Oo Si(1/10)(4.2.10),19.3.2010,18.6.2015,Jade,1,Kachin State,Mat Lin Chaung(123),19,3,2010,18,6,2015,Mat Lin Chaung,123,2010-3-19,2015-6-18
2,Hole & one Gems,Private,Oo Si(2/08)(15.3.08),11.3.2008,10.6.2015,Jade,1,Kachin State,Whay Khar Mhaw Thit Kone(317),11,3,2008,10,6,2015,Whay Khar Mhaw Thit Kone,317,2008-3-11,2015-6-10
3,Hole & one Gems,Private,Oo Si(2/08)(15.3.08),11.3.2008,10.6.2015,Jade,1,Kachin State,Whay Khar Mhaw Thit Kone(319),11,3,2008,10,6,2015,Whay Khar Mhaw Thit Kone,319,2008-3-11,2015-6-10
4,Hole & one Gems,Private,Oo Si(2/08)(15.3.08),11.3.2008,10.6.2015,Jade,1,Kachin State,Whay Khar Mhaw Thit Kone(320),11,3,2008,10,6,2015,Whay Khar Mhaw Thit Kone,320,2008-3-11,2015-6-10
5,Hole & one Gems,Private,Oo Si(2/08)(15.3.08),11.3.2008,10.6.2015,Jade,1,Kachin State,Whay Khar Mhaw Thit Kone(321),11,3,2008,10,6,2015,Whay Khar Mhaw Thit Kone,321,2008-3-11,2015-6-10
6,Hole & one Gems,Private,Oo Si(2/08)(15.3.08),11.3.2008,10.6.2015,Jade,1,Kachin State,Whay Khar Mhaw Thit Kone(322),11,3,2008,10,6,2015,Whay Khar Mhaw Thit Kone,322,2008-3-11,2015-6-10
7,Hole & one Gems,Private,Oo Si(2/08)(15.3.08),11.3.2008,10.6.2015,Jade,1,Kachin State,Whay Khar Mhaw Thit Kone(323),11,3,2008,10,6,2015,Whay Khar Mhaw Thit Kone,323,2008-3-11,2015-6-10
8,Hole & one Gems,Private,Oo Si(2/08)(15.3.08),11.3.2008,10.6.2015,Jade,1,Kachin State,Whay Khar Mhaw Thit Kone(324),11,3,2008,10,6,2015,Whay Khar Mhaw Thit Kone,324,2008-3-11,2015-6-10
9,Hole & one Gems,Private,Oo Si(2/08)(15.3.08),11.3.2008,10.6.2015,Jade,1,Kachin State,Whay Khar Mhaw Thit Kone(325),11,3,2008,10,6,2015,Whay Khar Mhaw Thit Kone,325,2008-3-11,2015-6-10
10,Hole & one Gems,Private,Oo Si(2/08)(15.3.08),11.3.2008,10.6.2015,Jade,1,Kachin State,Whay Khar Mhaw Thit Kone(326),11,3,2008,10,6,2015,Whay Khar Mhaw Thit Kone,326,2008-3-11,2015-6-10
11,Hole & one Gems,Private,Oo Si(2/08)(15.3.08),11.3.2008,10.6.2015,Jade,1,Kachin State,Whay Khar Mhaw Thit Kone(327),11,3,2008,10,6,2015,Whay Khar Mhaw Thit Kone,327,2008-3-11,2015-6-10
12,Hole & one Gems,Private,Oo Si(2/08)(15.3.08),11.3.2008,10.6.2015,Jade,1,Kachin State,Whay Khar Mhaw Thit Kone(328),11,3,2008,10,6,2015,Whay Khar Mhaw Thit Kone,328,2008-3-11,2015-6-10
13,Hole & one Gems,Private,Oo Si(2/08)(15.3.08),11.3.2008,10.6.2015,Jade,1,Kachin State,Whay Khar Mhaw Thit Kone(329),11,3,2008,10,6,2015,Whay Khar Mhaw Thit Kone,329,2008-3-11,2015-6-10
14,Hole & one Gems,Private,Oo Si(2/08)(15.3.08),11.3.2008,10.6.2015,Jade,1,Kachin State,Whay Khar Mhaw Thit Kone(330),11,3,2008,10,6,2015,Whay Khar Mhaw Thit Kone,330,2008-3-11,2015-6-10
15,Hole & one Gems,Private,Oo Si(2/08)(15.3.08),11.3.2008,10.6.2015,Jade,1,Kachin State,Whay Khar Mhaw Thit Kone(331),11,3,2008,10,6,2015,Whay Khar Mhaw Thit Kone,331,2008-3-11,2015-6-10
16,Hole & one Gems,Private,Oo Si(1/10)(4.2.10),19.3.2010,18.6.2015,Jade,1,Kachin State,Ba Zan Chaung(29),19,3,2010,18,6,2015,Ba Zan Chaung,29,2010-3-19,2015-6-18
17,Hole & one Gems,Private,Oo Si(1/10)(4.2.10),19.3.2010,18.6.2015,Jade,1,Kachin State,Ba Zan Chaung(30),19,3,2010,18,6,2015,Ba Zan Chaung,30,2010-3-19,2015-6-18
18,Hole & one Gems,Private,Oo Si(1/09)(5.4.09),3.8.2008,2.11.2015,Jade,1,Kachin State,Whay Khar Mhaw Thit Kone(318),3,8,2008,2,11,2015,Whay Khar Mhaw Thit Kone,318,2008-8-3,2015-11-2
19,Hole & one Gems,Private,Oo Si(1/09)(5.4.09),14.10.2008,13.1.2016,Jade,1,Kachin State,Ba Zan Chaung(15),14,10,2008,13,1,2016,Ba Zan Chaung,15,2008-10-14,2016-1-13
20,Hole & one Gems,Private,Oo Si(6/11)(18.12.11),26.8.2011,24.11.2016,Jade,1,Kachin State,Mat Lin Chaung(47),26,8,2011,24,11,2016,Mat Lin Chaung,47,2011-8-26,2016-11-24
21,Hole & one Gems,Private,Oo Si(1/09)(5.4.09),26.11.2009,4.2.2017,Jade,1,Kachin State,Whay Khar Mhaw Thit Kone(308),26,11,2009,4,2,2017,Whay Khar Mhaw Thit Kone,308,2009-11-26,2017-2-4
22,Hole & one Gems,Private,Oo Si(1/09)(5.4.09),26.11.2009,4.2.2017,Jade,1,Kachin State,Whay Khar Mhaw Thit Kone(309),26,11,2009,4,2,2017,Whay Khar Mhaw Thit Kone,309,2009-11-26,2017-2-4
23,Hole & one Gems,Private,Oo Si(3/13)(15.3.13),13.2.2012,14.5.2017,Jade,1,Kachin State,Mat Lin Chaung(20),13,2,2012,14,5,2017,Mat Lin Chaung,20,2012-2-13,2017-5-14
1,Seine Mate Swe Gems,Private,Oo Si(3/10)(28.9.10),15.10.2010,14.1.2016,Jade,1,Kachin State,Taung Kouck(84),15,10,2010,14,1,2016,Taung Kouck,84,2010-10-15,2016-1-14
2,Seine Mate Swe Gems,Private,Oo Si(3/10)(28.9.10),15.10.2010,14.1.2016,Jade,1,Kachin State,Taung Kouck(85),15,10,2010,14,1,2016,Taung Kouck,85,2010-10-15,2016-1-14
3,Seine Mate Swe Gems,Private,Oo Si(3/10)(28.9.10),15.10.2010,14.1.2016,Jade,1,Kachin State,Taung Kouck(86),15,10,2010,14,1,2016,Taung Kouck,86,2010-10-15,2016-1-14
4,Seine Mate Swe Gems,Private,Oo Si(3/10)(28.9.10),15.10.2010,14.1.2016,Jade,1,Kachin State,Taung Kouck(34),15,10,2010,14,1,2016,Taung Kouck,34,2010-10-15,2016-1-14
5,Seine Mate Swe Gems,Private,Oo Si(1/11)(14.5.11),26.10.2010,25.1.2016,Jade,1,Kachin State,Taung Kouck(111),26,10,2010,25,1,2016,Taung Kouck,111,2010-10-26,2016-1-25
6,Seine Mate Swe Gems,Private,Oo Si(3/13)(15.2.13),3.12.2010,3.3.2016,Jade,1,Kachin State,Taung Kouck(16),3,12,2010,3,3,2016,Taung Kouck,16,2010-12-3,2016-3-3
1,JADE DRAGON,Sharing,Oo Si(2000) ,20.1.2000,20.4.2018,Jade,61.7,Kachin State,Pharkantgyi-1,20,1,2000,20,4,2018,#REF!,,2000-1-20,2018-4-20
2,SHWE GAUNG GAUNG,Sharing,Oo Si(2000) ,21.8.2000,8.11.2016,Jade,98.5,Kachin State,Maklinchaung-1,21,8,2000,8,11,2016,#REF!,,2000-8-21,2016-11-8
3,YADANAR TAUNG TANG,Sharing,Oo Si(2000) ,21.8.2000,8.11.2016,Jade,81.67,Kachin State,Maklinchaung-2,21,8,2000,8,11,2016,#REF!,,2000-8-21,2016-11-8
4,MYANMAR SITHU,Sharing,Oo Si(2000) ,26.4.2000,9.7.2018,Jade,123.89,Kachin State,Mamon-1,26,4,2000,9,7,2018,#REF!,,2000-4-26,2018-7-9
5,KAUNGMYATTHUKHA,Sharing,Oo Si(2000) ,26.1.2001,26.4.2018,Jade,56.55,Kachin State,Mamon-2,26,1,2001,26,4,2018,#REF!,,2001-1-26,2018-4-26
6,YAZA HTARNI,Sharing,Oo Si(2000) ,25.1.2001,25.4.2017,Jade,90.97,Kachin State,Kayinchaung-1,25,1,2001,25,4,2017,#REF!,,2001-1-25,2017-4-25
7,SEILOM TAUNG TANG,Sharing,Oo Si(2000) ,3.10.2003,1.1.2018,Jade,155.4,Kachin State,Kayinchaung-2,3,10,2003,1,1,2018,#REF!,,2003-10-3,2018-1-1
8,PHOE THER HTOO,Sharing,Oo Si(1/07)(16.2.07),8.4.2007,7.7.2017,Jade,136,Kachin State,Fawah-1,8,4,2007,7,7,2017,#REF!,,2007-4-8,2017-7-7
9,SHWE BYAI PHYU,Sharing,Oo Si(1/07)(16.2.07),24.8.2007,22.11.2017,Jade,83,Kachin State,Fawah-2,24,8,2007,22,11,2017,#REF!,,2007-8-24,2017-11-22
10,JEINFAW ACADEMY,Sharing,Oo Si(1/07)(16.2.07),2.1.2007,2.4.2017,Jade,40,Kachin State,Tawhmaw-1,2,1,2007,2,4,2017,#REF!,,2007-1-2,2017-4-2
11,JADE LAND,Sharing,Oo Si(1/07)(16.2.07),8.4.2007,7.4.2013,Jade,25,Kachin State,Tawhmaw-2,8,4,2007,7,4,2013,#REF!,,2007-4-8,2013-4-7
12,U YA GEMS,Sharing,Oo Si(1/07)(16.2.07),9.4.2007,8.7.2017,Jade,127,Kachin State,Sankahtan-1,9,4,2007,8,7,2017,#REF!,,2007-4-9,2017-7-8
13,MYANMAR FIRST,Sharing,Oo Si(1/07)(16.2.07),7.4.2007,6.7.2017,Jade,114,Kachin State,Warjie-1,7,4,2007,6,7,2017,#REF!,,2007-4-7,2017-7-6
14,SILVER ELEPHANT,Sharing,Oo Si(1/07)(16.2.07),7.4.2007,6.7.2017,Jade,68,Kachin State,Warjie-2,7,4,2007,6,7,2017,#REF!,,2007-4-7,2017-7-6
15,SHINNING STAR,Sharing,Oo Si(1/07)(16.2.07),8.4.2007,7.7.2017,Jade,62,Kachin State,Warjie-3,8,4,2007,7,7,2017,#REF!,,2007-4-8,2017-7-7
16,GRADE GENESIS,Sharing,Oo Si(1/07)(16.2.07),19.1.2008,20.4.2018,Jade,73,Kachin State,Warjie-4,19,1,2008,20,4,2018,#REF!,,2008-1-19,2018-4-20
17,AYAER JADE,Sharing,Oo Si(1/07)(16.2.07),7.4.2007,6.7.2017,Jade,166,Kachin State,Ngo Ping-1,7,4,2007,6,7,2017,#REF!,,2007-4-7,2017-7-6
18,LINN LATT WIN,Sharing,Oo Si(1/07)(16.2.07),9.4.2007,8.7.2017,Jade,146,Kachin State,Ngo Ping-2,9,4,2007,8,7,2017,#REF!,,2007-4-9,2017-7-8
19,KHUN PAO,Sharing,Oo Si(1/07)(16.2.07),8.4.2007,7.7.2017,Jade,100,Kachin State,Ngo Ping-3,8,4,2007,7,7,2017,#REF!,,2007-4-8,2017-7-7
20,Emerald Garden,Sharing,Oo Si(1/07)(16.2.07),7.4.2007,6.7.2017,Jade,103.34,Kachin State,Ngo Ping-4 (A + B),7,4,2007,6,7,2017,Ngo Ping-4 ,A + B,2007-4-7,2017-7-6
21,Sein Nay Chi,Sharing,Oo Si(1/07)(16.2.07),7.4.2007,6.7.2017,Jade,51.66,Kachin State,Ngo Ping-4 (C),7,4,2007,6,7,2017,Ngo Ping-4 ,C,2007-4-7,2017-7-6
22,WAI AUNG KABAR,Sharing,Oo Si(1/07)(16.2.07),7.4.2007,5.7.2017,Jade,154,Kachin State,Ngo Ping-5,7,4,2007,5,7,2017,#REF!,,2007-4-7,2017-7-5
23,JADE MOUNTAIN,Sharing,Oo Si(1/07)(16.2.07),8.4.2007,7.7.2017,Jade,185,Kachin State,Ka te-1,8,4,2007,7,7,2017,#REF!,,2007-4-8,2017-7-7
24,MYAT YA MON,Sharing,Oo Si(1/07)(16.2.07),8.4.2007,7.7.2017,Jade,165,Kachin State,Ka te-2,8,4,2007,7,7,2017,#REF!,,2007-4-8,2017-7-7
25,MYANMAR SITHU,Sharing,Oo Si(1/07)(16.2.07),7.4.2007,6.7.2017,Jade,119,Kachin State,Malaung-1,7,4,2007,6,7,2017,#REF!,,2007-4-7,2017-7-6
26,THIYAW MANI,Sharing,Oo Si(1/07)(16.2.07),7.4.2007,6.7.2017,Jade,85,Kachin State,Malaung-2,7,4,2007,6,7,2017,#REF!,,2007-4-7,2017-7-6
27,MYANMA SEINLEIAUNG,Sharing,Oo Si(1/07)(16.2.07),9.4.2007,8.7.2017,Jade,130.65,Kachin State,Malaung-3,9,4,2007,8,7,2017,#REF!,,2007-4-9,2017-7-8
28,"KACHIN NATIONALS 
DEVELOPMENT & PROGRESS",Sharing,Oo Si(1/07)(16.2.07),24.8.2007,22.11.2017,Jade,65,Kachin State,Mawmaung-1,24,8,2007,22,11,2017,#REF!,,2007-8-24,2017-11-22
29,KYAI INTERNATIONAL,Sharing,Oo Si(1/07)(16.2.07),10.8.2007,8.11.2017,Jade,25,Kachin State,Myaut phyu-1,10,8,2007,8,11,2017,#REF!,,2007-8-10,2017-11-8
30,JADE DRAGON,Sharing,Oo Si(1/07)(16.2.07),7.4.2006,7.7.2018,Jade,13.26,Kachin State,Mamon-4,7,4,2006,7,7,2018,#REF!,,2006-4-7,2018-7-7
31,MYANMAR NAING GROUP,Sharing,Oo Si(1/07)(16.2.07),2.1.2007,2.4.2017,Jade,4,Kachin State,Mamon-5,2,1,2007,2,4,2017,#REF!,,2007-1-2,2017-4-2
32,SHWE PYITHER,Sharing,Oo Si(1/07)(16.2.07),8.4.2007,7.7.2017,Jade,101,Kachin State,Kalarhmaw-1,8,4,2007,7,7,2017,#REF!,,2007-4-8,2017-7-7
33,HTOO INTERNATIONAL,Sharing,Oo Si(1/07)(16.2.07),2.1.2007,2.4.2017,Jade,43.31,Kachin State,Taungkawt-1,2,1,2007,2,4,2017,#REF!,,2007-1-2,2017-4-2
34,MYANMAR NAING GROUP,Sharing,Oo Si(1/07)(16.2.07),22.11.2007,20.2.2018,Jade,31,Kachin State,Waikhar-1,22,11,2007,20,2,2018,#REF!,,2007-11-22,2018-2-20
35,MYANMAR WIN GATE,Sharing,Oo Si(1/08)(15.3.08),24.5.2008,23.8.2018,Jade,98,Kachin State,Warjie-5,24,5,2008,23,8,2018,#REF!,,2008-5-24,2018-8-23
36,RICHEST,Sharing,Oo Si(1/08)(15.3.08),28.4.2008,28.7.2018,Jade,95,Kachin State,Warjie-6,28,4,2008,28,7,2018,#REF!,,2008-4-28,2018-7-28
37,KHIN ZAW AUNG&BROTHERS,Sharing,Oo Si(1/08)(15.3.08),24.5.2008,23.8.2018,Jade,44.5,Kachin State,Ngoping-6,24,5,2008,23,8,2018,#REF!,,2008-5-24,2018-8-23
38,PHYO THIHA KYAW,Sharing,Oo Si(1/08)(15.3.08),24.5.2008,23.8.2018,Jade,200,Kachin State,Inmar-1,24,5,2008,23,8,2018,#REF!,,2008-5-24,2018-8-23
39,KAUNG MYAT THUKHA,Sharing,Oo Si(1/08)(15.3.08),17.6.2008,16.9.2018,Jade,63,Kachin State,Inmar-2,17,6,2008,16,9,2018,#REF!,,2008-6-17,2018-9-16
40,SEIN THURA SAN,Sharing,Oo Si(1/08)(15.3.08),24.5.2008,23.8.2018,Jade,10,Kachin State,Mawsisar-1,24,5,2008,23,8,2018,#REF!,,2008-5-24,2018-8-23
41,KYAI INTERNATIONAL,Sharing,Oo Si(1/08)(15.3.08),10.3.2008,9.6.2018,Jade,14,Kachin State,Mawsisar-2,10,3,2008,9,6,2018,#REF!,,2008-3-10,2018-6-9
42,MYANMAR RICH LAND,Sharing,Oo Si(1/08)(15.3.08),24.5.2008,23.8.2018,Jade,77,Kachin State,Mawsisar-3,24,5,2008,23,8,2018,#REF!,,2008-5-24,2018-8-23
43,AYAR PYIT PHYO,Sharing,Oo Si(1/08)(15.3.08),12.6.2008,11.9.2018,Jade,72,Kachin State,Mawsisar-4,12,6,2008,11,9,2018,#REF!,,2008-6-12,2018-9-11
44,KHAING LON,Sharing,Oo Si(1/08)(15.3.08),4.7.2009,4.8.2016,Jade,33,Kachin State,Mawsisar-5,4,7,2009,4,8,2016,#REF!,,2009-7-4,2016-8-4
45,PYITAN YADANAR,Sharing,Oo Si(1/08)(15.3.08),20.8.2008,19.11.2018,Jade,60,Kachin State,Mawsisar-6,20,8,2008,19,11,2018,#REF!,,2008-8-20,2018-11-19
46,NATIONAL PROSPERITY,Sharing,Oo Si(1/08)(15.3.08),30.4.2008,30.7.2018,Jade,22,Kachin State,Mawsisar-7,30,4,2008,30,7,2018,#REF!,,2008-4-30,2018-7-30
47,SAN TAWIN,Sharing,Oo Si(1/08)(15.3.08),8.3.2009,7.6.2019,Jade,16.15,Kachin State,Mawsisar-8,8,3,2009,7,6,2019,#REF!,,2009-3-8,2019-6-7
48,YADANA MOE MYAY,Sharing,Oo Si(1/08)(15.3.08),10.3.2008,9.6.2018,Jade,80,Kachin State,Sabyitwa-1,10,3,2008,9,6,2018,#REF!,,2008-3-10,2018-6-9
49,MYO NEW,Sharing,Oo Si(1/08)(15.3.08),26.6.2008,25.9.2018,Jade,127,Kachin State,Mana-1,26,6,2008,25,9,2018,#REF!,,2008-6-26,2018-9-25
50,ARCHER,Sharing,Oo Si(1/08)(15.3.08),24.5.2008,23.8.2018,Jade,5.1,Kachin State,Mana-2,24,5,2008,23,8,2018,#REF!,,2008-5-24,2018-8-23
51,KYAI INTERNATIONAL,Sharing,Oo Si(1/08)(15.3.08),10.3.2008,9.6.2018,Jade,7,Kachin State,"Kyatpaun
gchaungphyar-1",10,3,2008,9,6,2018,#REF!,,2008-3-10,2018-6-9
52,RICHEST,Sharing,Oo Si(1/08)(15.3.08),10.3.2008,9.6.2018,Jade,79,Kachin State,Mamon-3,10,3,2008,9,6,2018,#REF!,,2008-3-10,2018-6-9
53,LAW LU,Sharing,Oo Si(3/08)(1.11.08),10.5.2009,9.8.2019,Jade,141,Kachin State,Sankahtan-2,10,5,2009,9,8,2019,#REF!,,2009-5-10,2019-8-9
54, 1 - 1 - 1 ,Sharing,Oo Si(3/08)(1.11.08),24.6.2009,23.9.2019,Jade,108,Kachin State,Warjie-7,24,6,2009,23,9,2019,#REF!,,2009-6-24,2019-9-23
55,WAN BROTHERS,Sharing,Oo Si(3/08)(1.11.08),23.3.2009,22.6.2019,Jade,31.5,Kachin State,Ngoping-7,23,3,2009,22,6,2019,#REF!,,2009-3-23,2019-6-22
56,UNITY,Sharing,Oo Si(3/08)(1.11.08),19.3.2009,18.6.2019,Jade,30,Kachin State,Ngoping-8,19,3,2009,18,6,2019,#REF!,,2009-3-19,2019-6-18
57,SUPER NATURAL,Sharing,Oo Si(3/08)(1.11.08),19.3.2009,18.6.2019,Jade,28,Kachin State,Ka te-3,19,3,2009,18,6,2019,#REF!,,2009-3-19,2019-6-18
58,PAN HOTE DUWAR,Sharing,Oo Si(3/08)(1.11.08),15.3.2009,14.6.2019,Jade,31,Kachin State,Ka te-4,15,3,2009,14,6,2019,#REF!,,2009-3-15,2019-6-14
59,MYANMAR NAING GROUP,Sharing,Oo Si(3/08)(1.11.08),11.12.2009,11.3.2017,Jade,25,Kachin State,Ka te-5,11,12,2009,11,3,2017,#REF!,,2009-12-11,2017-3-11
60,POLE-STAR,Sharing,Oo Si(3/08)(1.11.08),30.6.2009,29.9.2019,Jade,33,Kachin State,Inmar-4,30,6,2009,29,9,2019,#REF!,,2009-6-30,2019-9-29
61,KYAUK MYAT MINN,Sharing,Oo Si(3/08)(1.11.08),18.3.2009,17.6.2019,Jade,35,Kachin State,Inmar-5,18,3,2009,17,6,2019,#REF!,,2009-3-18,2019-6-17
62,AUNG HEIN MINN,Sharing,Oo Si(3/08)(1.11.08),9.3.2009,8.6.2019,Jade,33,Kachin State,Inmar-6,9,3,2009,8,6,2019,#REF!,,2009-3-9,2019-6-8
63,NEW GOLDEN TRIANGLE,Sharing,Oo Si(3/08)(1.11.08),10.5.2009,9.8.2019,Jade,45,Kachin State,Inmar-7,10,5,2009,9,8,2019,#REF!,,2009-5-10,2019-8-9
64,KAUNG SU YADANAR,Sharing,Oo Si(3/08)(1.11.08),19.3.2009,18.6.2019,Jade,25,Kachin State,Inmar-8,19,3,2009,18,6,2019,#REF!,,2009-3-19,2019-6-18
65,THEIT WIN HTET,Sharing,Oo Si(3/08)(1.11.08),15.3.2009,14.6.2019,Jade,49,Kachin State,Inmar-10,15,3,2009,14,6,2019,#REF!,,2009-3-15,2019-6-14
66,SEIN SHWE KYAW,Sharing,Oo Si(3/08)(1.11.08),5.9.2009,4.12.2016,Jade,65,Kachin State,Inmar-11,5,9,2009,4,12,2016,#REF!,,2009-9-5,2016-12-4
67,WIN PY KYAW,Sharing,Oo Si(3/08)(1.11.08),15.3.2009,14.6.2019,Jade,50,Kachin State,Inmar-12,15,3,2009,14,6,2019,#REF!,,2009-3-15,2019-6-14
68,MYANMAR SUN RAY,Sharing,Oo Si(3/08)(1.11.08),30.6.2009,29.9.2019,Jade,38,Kachin State,Inmar-13,30,6,2009,29,9,2019,#REF!,,2009-6-30,2019-9-29
69,JADE POWER,Sharing,Oo Si(3/08)(1.11.08),27.6.2009,26.9.2019,Jade,43,Kachin State,Mawsisar-9,27,6,2009,26,9,2019,#REF!,,2009-6-27,2019-9-26
70,WIN PY KYAW,Sharing,Oo Si(3/08)(1.11.08),15.3.2009,14.6.2019,Jade,15,Kachin State,Mawsisar-10,15,3,2009,14,6,2019,#REF!,,2009-3-15,2019-6-14
71,"""HTOO"" GEMS",Sharing,Oo Si(3/08)(1.11.08),26.6.2009,25.9.2019,Jade,40,Kachin State,Mawsisar-11,26,6,2009,25,9,2019,#REF!,,2009-6-26,2019-9-25
72,SI HTUN,Sharing,Oo Si(3/08)(1.11.08),24.6.2009,23.9.2019,Jade,24,Kachin State,Mawsisar-12,24,6,2009,23,9,2019,#REF!,,2009-6-24,2019-9-23
73,HOT KYI,Sharing,Oo Si(3/08)(1.11.08),5.7.2009,6.8.2016,Jade,30,Kachin State,Mawsisar-13,5,7,2009,6,8,2016,#REF!,,2009-7-5,2016-8-6
74,KAUNG MON YADANAR,Sharing,Oo Si(3/08)(1.11.08),25.6.2009,24.9.2019,Jade,48,Kachin State,Mawsisar-15,25,6,2009,24,9,2019,#REF!,,2009-6-25,2019-9-24
75,SU HTOO PAN,Sharing,Oo Si(3/08)(1.11.08),28.6.2009,27.9.2019,Jade,33,Kachin State,Mawsisar-16,28,6,2009,27,9,2019,#REF!,,2009-6-28,2019-9-27
76,KYAUK MYAT MINN,Sharing,Oo Si(3/08)(1.11.08),18.3.2009,17.6.2019,Jade,15,Kachin State,Mawsisar-17,18,3,2009,17,6,2019,#REF!,,2009-3-18,2019-6-17
77,KYAUK AUNG,Sharing,Oo Si(3/08)(1.11.08),18.6.2009,3.7.2016,Jade,17,Kachin State,Mawsisar-18,18,6,2009,3,7,2016,#REF!,,2009-6-18,2016-7-3
78,SAI YADANAR AUNG,Sharing,Oo Si(3/08)(1.11.08),18.9.2009,17.12.2016,Jade,27,Kachin State,Mawsisar-19,18,9,2009,17,12,2016,#REF!,,2009-9-18,2016-12-17
79,SAN TAWIN,Sharing,Oo Si(3/08)(1.11.08),8.3.2009,7.6.2019,Jade,4.78,Kachin State,Mawsisar-20,8,3,2009,7,6,2019,#REF!,,2009-3-8,2019-6-7
80,BARANI,Sharing,Oo Si(3/08)(1.11.08),18.6.2009,17.9.2019,Jade,51,Kachin State,Jankhap-1,18,6,2009,17,9,2019,#REF!,,2009-6-18,2019-9-17
81,MYIT HTET ZAW,Sharing,Oo Si(3/08)(1.11.08),27.6.2009,21.7.2016,Jade,20,Kachin State,Namtmapyit-1,27,6,2009,21,7,2016,#REF!,,2009-6-27,2016-7-21
82,NGWE HEIN HTET,Sharing,Oo Si(3/08)(1.11.08),23.3.2009,22.6.2019,Jade,24,Kachin State,Mawankyi-1,23,3,2009,22,6,2019,#REF!,,2009-3-23,2019-6-22
83,AUNG SHWE NAN,Sharing,Oo Si(3/08)(1.11.08),25.6.2009,24.9.2019,Jade,25,Kachin State,Mawankyi-2,25,6,2009,24,9,2019,#REF!,,2009-6-25,2019-9-24
84,JADE EMPERIER,Sharing,Oo Si(3/08)(1.11.08),25.10.2009,23.1.2017,Jade,30,Kachin State,Mawankyi-3,25,10,2009,23,1,2017,#REF!,,2009-10-25,2017-1-23
85,GWEKHAR,Sharing,Oo Si(3/08)(1.11.08),13.3.2009,12.3.2014,Jade,48,Kachin State,Mawankyi-4,13,3,2009,12,3,2014,#REF!,,2009-3-13,2014-3-12
86,SHWECHID NAPYITAW,Sharing,Oo Si(3/08)(1.11.08),23.3.2009,22.6.2019,Jade,15,Kachin State,Thaungcho-1,23,3,2009,22,6,2019,#REF!,,2009-3-23,2019-6-22
87,RICHEST,Sharing,Oo Si(3/08)(1.11.08),28.5.2009,27.8.2019,Jade,9,Kachin State,Thaungcho-2,28,5,2009,27,8,2019,#REF!,,2009-5-28,2019-8-27
88,NEW GOLDEN TRIANGLE,Sharing,Oo Si(3/08)(1.11.08),10.5.2009,9.8.2019,Jade,25,Kachin State,Thaungcho-3,10,5,2009,9,8,2019,#REF!,,2009-5-10,2019-8-9
89,HTOO INTERNATIONAL,Sharing,Oo Si(3/08)(1.11.08),19.3.2009,18.6.2019,Jade,4,Kachin State,Thaungcho-4,19,3,2009,18,6,2019,#REF!,,2009-3-19,2019-6-18
90,MYATBONESI,Sharing,Oo Si(3/08)(1.11.08),19.3.2009,18.6.2019,Jade,13,Kachin State,Thaungcho-5,19,3,2009,18,6,2019,#REF!,,2009-3-19,2019-6-18
91,SUT KABAR,Sharing,Oo Si(3/08)(1.11.08),29.1.2009,30.4.2019,Jade,17,Kachin State,Mawmaung-2,29,1,2009,30,4,2019,#REF!,,2009-1-29,2019-4-30
92,NGWE SI HEIN,Sharing,Oo Si(3/08)(1.11.08),28.5.2009,27.8.2019,Jade,17,Kachin State,Mawmaung-3,28,5,2009,27,8,2019,#REF!,,2009-5-28,2019-8-27
93,MYANMA SEIN YAOCHI,Sharing,Oo Si(3/08)(1.11.08),25.6.2009,24.9.2019,Jade,23,Kachin State,Myauk phyu-3,25,6,2009,24,9,2019,#REF!,,2009-6-25,2019-9-24
94,AYAER JADE,Sharing,Oo Si(3/08)(1.11.08),9.3.2009,8.6.2019,Jade,7,Kachin State,"Kyatpaung
chaungphyar-3",9,3,2009,8,6,2019,#REF!,,2009-3-9,2019-6-8
95,JADE ROYAL,Sharing,Oo Si(3/08)(1.11.08),18.7.2009,17.10.2019,Jade,14,Kachin State,Maklinchaung-3,18,7,2009,17,10,2019,#REF!,,2009-7-18,2019-10-17
96,THEIT WIN HTET,Sharing,Oo Si(3/08)(1.11.08),15.3.2009,14.6.2019,Jade,9.135,Kachin State,Mamon-6,15,3,2009,14,6,2019,#REF!,,2009-3-15,2019-6-14
97,"MYANMAR MYAYKYI 
SHWETHIE",Sharing,Oo Si(3/08)(1.11.08),18.7.2009,17.10.2019,Jade,46,Kachin State,Mhawshansapot-1,18,7,2009,17,10,2019,#REF!,,2009-7-18,2019-10-17
98,SHWE HEIN HTET,Sharing,Oo Si(3/08)(1.11.08),23.3.2009,22.6.2019,Jade,39,Kachin State,Mhawshansapot-2,23,3,2009,22,6,2019,#REF!,,2009-3-23,2019-6-22
99,SU HTOO PAN,Sharing,Oo Si(3/08)(1.11.08),19.3.2009,18.6.2019,Jade,21,Kachin State,Mhawshansapot-3,19,3,2009,18,6,2019,#REF!,,2009-3-19,2019-6-18
100,KAUNG SU WAILIAN,Sharing,Oo Si(3/08)(1.11.08),23.3.2009,22.6.2019,Jade,48,Kachin State,Mhawshansapot-4,23,3,2009,22,6,2019,#REF!,,2009-3-23,2019-6-22
101,SEIN URU,Sharing,Oo Si(3/08)(1.11.08),27.7.2009,26.10.2019,Jade,33,Kachin State,Mhawshansapot-5,27,7,2009,26,10,2019,#REF!,,2009-7-27,2019-10-26
102,NAY LA PWIT,Sharing,Oo Si(3/08)(1.11.08),9.3.2009,8.6.2019,Jade,11,Kachin State,Mitekye-1,9,3,2009,8,6,2019,#REF!,,2009-3-9,2019-6-8
103,MYANMAR SITHU,Sharing,Oo Si(3/08)(1.11.08),18.6.2009,17.9.2019,Jade,65,Kachin State,Waikhar-2,18,6,2009,17,9,2019,#REF!,,2009-6-18,2019-9-17
104,B-M-W,Sharing,Oo Si(3/08)(1.11.08),3.7.2009,2.8.2016,Jade,36,Kachin State,Tarmakhan-1,3,7,2009,2,8,2016,#REF!,,2009-7-3,2016-8-2
105,WIN NAR,Sharing,Oo Si(3/08)(1.11.08),24.6.2009,15.7.2016,Jade,120,Kachin State,Tarmakhan-2,24,6,2009,15,7,2016,#REF!,,2009-6-24,2016-7-15
106,HTAY MYINT MAW,Sharing,Oo Si(3/08)(1.11.08),29.10.2009,27.1.2017,Jade,57,Kachin State,Kaukaw-1,29,10,2009,27,1,2017,#REF!,,2009-10-29,2017-1-27
107,SHWE PYITSHAN,Sharing,Oo Si(1/09)(5.4.09),15.11.2009,13.2.2017,Jade,200,Kachin State,Fawah-3,15,11,2009,13,2,2017,#REF!,,2009-11-15,2017-2-13
108,YE MAN HEIN,Sharing,Oo Si(1/09)(5.4.09),15.11.2009,13.2.2017,Jade,190,Kachin State,Sankahtan-3,15,11,2009,13,2,2017,#REF!,,2009-11-15,2017-2-13
109,SUPER SEIN,Sharing,Oo Si(1/09)(5.4.09),15.11.2009,13.2.2017,Jade,206,Kachin State,Sankahtan-4,15,11,2009,13,2,2017,#REF!,,2009-11-15,2017-2-13
110,UNITY,Sharing,Oo Si(1/09)(5.4.09),8.11.2009,6.2.2017,Jade,197,Kachin State,Jankhap-2,8,11,2009,6,2,2017,#REF!,,2009-11-8,2017-2-6
111,RED MOUNTAIN,Sharing,Oo Si(1/09)(5.4.09),1.2.2010,2.5.2017,Jade,200,Kachin State,Jankhap-3,1,2,2010,2,5,2017,#REF!,,2010-2-1,2017-5-2
112,BAWA TATLAN,Sharing,Oo Si(1/09)(5.4.09),4.2.2010,5.5.2017,Jade,92,Kachin State,Mawanlay-1,4,2,2010,5,5,2017,#REF!,,2010-2-4,2017-5-5
113,THIHA & THREE BROTHERS,Sharing,Oo Si(1/09)(5.4.09),29.9.2009,28.12.2016,Jade,22.4,Kachin State,Mawmaung-4,29,9,2009,28,12,2016,#REF!,,2009-9-29,2016-12-28
114,KHAING MYANMAR,Sharing,Oo Si(1/09)(5.4.09),12.11.2009,10.2.2017,Jade,75,Kachin State,Bazancyauk-1,12,11,2009,10,2,2017,#REF!,,2009-11-12,2017-2-10
115,JADE ROYAL,Sharing,Oo Si(1/09)(5.4.09),27.2.2010,28.5.2017,Jade,15,Kachin State,Bazancyauk-2,27,2,2010,28,5,2017,#REF!,,2010-2-27,2017-5-28
116,BAWA TATLAN,Sharing,Oo Si(1/09)(5.4.09),4.2.2010,5.5.2017,Jade,19,Kachin State,Bazancyauk-3,4,2,2010,5,5,2017,#REF!,,2010-2-4,2017-5-5
117,NAY LA PWIT,Sharing,Oo Si(1/09)(5.4.09),4.11.2009,2.2.2017,Jade,47,Kachin State,Bazancyauk-4,4,11,2009,2,2,2017,#REF!,,2009-11-4,2017-2-2
118,HOLE IN ONE,Sharing,Oo Si(1/09)(5.4.09),17.9.2009,16.12.2016,Jade,9,Kachin State,Waikhar-3,17,9,2009,16,12,2016,#REF!,,2009-9-17,2016-12-16
119,SAI IN WAI,Sharing,Oo Si(1/09)(5.4.09),25.11.2009,23.2.2017,Jade,5,Kachin State,Waikhar-4,25,11,2009,23,2,2017,#REF!,,2009-11-25,2017-2-23
120,MOE MINN HTET,Sharing,Oo Si(1/09)(5.4.09),8.7.2009,7.10.2019,Jade,33,Kachin State,Waikhar-5,8,7,2009,7,10,2019,#REF!,,2009-7-8,2019-10-7
121,MYAT NOE SANEAIN,Sharing,Oo Si(1/09)(5.4.09),8.11.2009,6.2.2017,Jade,2.5,Kachin State,Waikhar-6,8,11,2009,6,2,2017,#REF!,,2009-11-8,2017-2-6
122,DAGON YADANAR,Sharing,Oo Si(1/09)(5.4.09),11.12.2009,11.3.2017,Jade,5,Kachin State,Waikhar-7,11,12,2009,11,3,2017,#REF!,,2009-12-11,2017-3-11
123,JADE LAND,Sharing,Oo Si(1/09)(5.4.09),25.1.2010,25.4.2017,Jade,72,Kachin State,Jankar-1,25,1,2010,25,4,2017,#REF!,,2010-1-25,2017-4-25
124,LINN POWER,Sharing,Oo Si(1/09)(5.4.09),1.2.2010,2.5.2017,Jade,20.44,Kachin State,Natmaw/Hkanti,1,2,2010,2,5,2017,#REF!,,2010-2-1,2017-5-2
125,AUNG HLAING KYWEWA,Sharing,Oo Si(2/09)(2.8.09),2.2.2010,3.5.2017,Jade,56,Kachin State,Nampjam-1,2,2,2010,3,5,2017,#REF!,,2010-2-2,2017-5-3
126,MYANMAR MAIN,Sharing,Oo Si(2/09)(2.8.09),15.2.2010,16.5.2017,Jade,56,Kachin State,Nampjam-2,15,2,2010,16,5,2017,#REF!,,2010-2-15,2017-5-16
127,JADE YADANAR,Sharing,Oo Si(2/09)(2.8.09),1.2.2010,2.5.2017,Jade,200,Kachin State,Nampjam-3,1,2,2010,2,5,2017,#REF!,,2010-2-1,2017-5-2
128,SHWE YWET HLWER,Sharing,Oo Si(2/09)(2.8.09),1.2.2010,2.5.2017,Jade,105,Kachin State,Ngoping-9,1,2,2010,2,5,2017,#REF!,,2010-2-1,2017-5-2
129,GOLD JADE DRAGON,Sharing,Oo Si(2/09)(2.8.09),8.11.2009,6.2.2017,Jade,8,Kachin State,Ka te-6,8,11,2009,6,2,2017,#REF!,,2009-11-8,2017-2-6
130,YADANAR WHITE LOTUS,Sharing,Oo Si(2/09)(2.8.09),8.9.2009,7.12.2016,Jade,16,Kachin State,Ka te-7,8,9,2009,7,12,2016,#REF!,,2009-9-8,2016-12-7
131,GEMS KING,Sharing,Oo Si(2/09)(2.8.09),8.11.2009,6.2.2017,Jade,11,Kachin State,Ka te-8,8,11,2009,6,2,2017,#REF!,,2009-11-8,2017-2-6
132,A-R-S,Sharing,Oo Si(2/09)(2.8.09),1.2.2010,2.5.2017,Jade,208,Kachin State,Inmar-14,1,2,2010,2,5,2017,#REF!,,2010-2-1,2017-5-2
133,YADANAR SIN THIRI,Sharing,Oo Si(2/09)(2.8.09),1.2.2010,2.5.2017,Jade,180,Kachin State,Maungmaung-5,1,2,2010,2,5,2017,#REF!,,2010-2-1,2017-5-2
134,UNITY,Sharing,Oo Si(2/09)(2.8.09),29.1.2010,29.4.2017,Jade,16,Kachin State,Maungmaung-6,29,1,2010,29,4,2017,#REF!,,2010-1-29,2017-4-29
135,SHWE WAR MYAY(MADALAY),Sharing,Oo Si(2/09)(2.8.09),29.1.2010,29.4.2017,Jade,17,Kachin State,Maungmaung-7,29,1,2010,29,4,2017,#REF!,,2010-1-29,2017-4-29
136,YADANAR MOE MYAY,Sharing,Oo Si(2/09)(2.8.09),1.2.2010,2.5.2017,Jade,31,Kachin State,Sabyitwa-2,1,2,2010,2,5,2017,#REF!,,2010-2-1,2017-5-2
137,MYASEIN YAO CHE,Sharing,Oo Si(2/09)(2.8.09),1.2.2010,29.4.2017,Jade,23,Kachin State,Pharpyin-1,1,2,2010,29,4,2017,#REF!,,2010-2-1,2017-4-29
138,YADANAR CROWN,Sharing,Oo Si(2/09)(2.8.09),1.2.2010,2.5.2017,Jade,23,Kachin State,Pharpyin-2,1,2,2010,2,5,2017,#REF!,,2010-2-1,2017-5-2
139,MYANMA SEIN LEI AUNG,Sharing,Oo Si(2/09)(2.8.09),11.12.2009,11.3.2017,Jade,30,Kachin State,Mhawshansapot-6,11,12,2009,11,3,2017,#REF!,,2009-12-11,2017-3-11
140,NEW JADE INTERNATIONAL,Sharing,Oo Si(2/09)(2.8.09),12.11.2009,10.2.2017,Jade,62,Kachin State,Waikhar-8,12,11,2009,10,2,2017,#REF!,,2009-11-12,2017-2-10
141,JADE VARIETY,Sharing,Oo Si(2/09)(2.8.09),18.2.2010,19.5.2017,Jade,128,Kachin State,Waikhar-9,18,2,2010,19,5,2017,#REF!,,2010-2-18,2017-5-19
142,MYANMA SEIN LEI AUNG,Sharing,Oo Si(2/09)(2.8.09),11.12.2009,11.3.2017,Jade,104,Kachin State,Waikhar-10,11,12,2009,11,3,2017,#REF!,,2009-12-11,2017-3-11
143,KYAW NAING & BROTHERS,Sharing,Oo Si(1/10)(4.2.10),13.5.2010,11.8.2017,Jade,190,Kachin State,Sankhar-1,13,5,2010,11,8,2017,#REF!,,2010-5-13,2017-8-11
144,SHWE WAR MYAY(MADALAY),Sharing,Oo Si(1/10)(4.2.10),20.5.2010,18.8.2017,Jade,65,Kachin State,Nampjam-4,20,5,2010,18,8,2017,#REF!,,2010-5-20,2017-8-18
145,LONEKHINN AUNGMYAY,Sharing,Oo Si(1/10)(4.2.10),12.3.2010,10.6.2017,Jade,98,Kachin State,Inmar-15,12,3,2010,10,6,2017,#REF!,,2010-3-12,2017-6-10
146,SHWE WAR MYAY(MADALAY),Sharing,Oo Si(1/10)(4.2.10),8.4.2010,7.7.2017,Jade,155,Kachin State,Jankhap-4,8,4,2010,7,7,2017,#REF!,,2010-4-8,2017-7-7
147,SEILOM TAUNG TANG,Sharing,Oo Si(1/10)(4.2.10),19.3.2010,17.6.2017,Jade,17,Kachin State,Karlichaung-1,19,3,2010,17,6,2017,#REF!,,2010-3-19,2017-6-17
148,TUN NAUNG AUNG,Sharing,Oo Si(1/10)(4.2.10),14.3.2010,12.8.2017,Jade,34,Kachin State,Ba la ka-1,14,3,2010,12,8,2017,#REF!,,2010-3-14,2017-8-12
149,SHWE WAR MYAY(MADALAY),Sharing,Oo Si(1/10)(4.2.10),20.5.2010,18.8.2017,Jade,48,Kachin State,Mawshansapot-7,20,5,2010,18,8,2017,#REF!,,2010-5-20,2017-8-18
150,KAN PWINT Oo,Sharing,Oo Si(1/10)(4.2.10),27.5.2010,25.8.2017,Jade,75,Kachin State,Mawshansapot-8,27,5,2010,25,8,2017,#REF!,,2010-5-27,2017-8-25
151,KYAUNG BROTHERS,Sharing,Oo Si(1/10)(4.2.10),6.4.2010,5.7.2017,Jade,15,Kachin State,Sai taung-2,6,4,2010,5,7,2017,#REF!,,2010-4-6,2017-7-5
152,KYAUNG BROTHERS,Sharing,Oo Si(1/10)(4.2.10),8.4.2010,7.7.2017,Jade,11,Kachin State,Bazancyauk-5,8,4,2010,7,7,2017,#REF!,,2010-4-8,2017-7-7
153,NYUT NYUT AUNG,Sharing,Oo Si(1/10)(4.2.10),31.5.2010,29.8.2017,Jade,30,Kachin State,Haopar-1,31,5,2010,29,8,2017,#REF!,,2010-5-31,2017-8-29
154,THEITHI AUNG NGWE MOE,Sharing,Oo Si(1/10)(4.2.10),18.2.2011,17.2.2016,Jade,122,Kachin State,Sankahtan-5,18,2,2011,17,2,2016,#REF!,,2011-2-18,2016-2-17
155,SHWE EAIN SI,Sharing,Oo Si(2/10)(17.5.10),21.11.2010,19.2.2018,Jade,45,Kachin State,Sankahtan-7,21,11,2010,19,2,2018,#REF!,,2010-11-21,2018-2-19
156,SHWE NAGAR THITSAR,Sharing,Oo Si(2/10)(17.5.10),21.10.2010,19.1.2018,Jade,70,Kachin State,Sankahtan-8,21,10,2010,19,1,2018,#REF!,,2010-10-21,2018-1-19
157,WIN PEAK,Sharing,Oo Si(2/10)(17.5.10),21.10.2010,19.1.2018,Jade,65,Kachin State,Sankahtan-9,21,10,2010,19,1,2018,#REF!,,2010-10-21,2018-1-19
158,AUNG HEIN MINN,Sharing,Oo Si(2/10)(17.5.10),22.10.2010,20.1.2018,Jade,65,Kachin State,Sankahtan-10,22,10,2010,20,1,2018,#REF!,,2010-10-22,2018-1-20
159,"ZAW COOPERATIVE.,Ltd",Sharing,Oo Si(2/10)(17.5.10),22.11.2010,20.2.2018,Jade,18,Kachin State,Mawsisar-21,22,11,2010,20,2,2018,#REF!,,2010-11-22,2018-2-20
160,MAHAR JADE,Sharing,Oo Si(2/10)(17.5.10),21.10.2010,19.1.2018,Jade,20,Kachin State,Mawsisar-22,21,10,2010,19,1,2018,#REF!,,2010-10-21,2018-1-19
161,CRYSTAL RED,Sharing,Oo Si(2/10)(17.5.10),17.10.2010,19.1.2018,Jade,8,Kachin State,Nyainchantharyaar-1,17,10,2010,19,1,2018,#REF!,,2010-10-17,2018-1-19
162,THEIN KABAR AUNG,Sharing,Oo Si(2/10)(17.5.10),17.10.2010,19.1.2018,Jade,50,Kachin State,Malan-1,17,10,2010,19,1,2018,#REF!,,2010-10-17,2018-1-19
163,SPIRIT STRENGTH,Sharing,Oo Si(2/10)(17.5.10),14.10.2010,12.1.2018,Jade,15,Kachin State,Bazancyauk-6,14,10,2010,12,1,2018,#REF!,,2010-10-14,2018-1-12
164,LONESEIN,Sharing,Oo Si(2/10)(17.5.10),22.10.2010,20.1.2018,Jade,6,Kachin State,Bazancyauk-7,22,10,2010,20,1,2018,#REF!,,2010-10-22,2018-1-20
165,LAO BYIT,Sharing,Oo Si(2/10)(17.5.10),21.2.2011,22.5.2018,Jade,3,Kachin State,Waikhar-11,21,2,2011,22,5,2018,#REF!,,2011-2-21,2018-5-22
166,JADE YADANAR,Sharing,Oo Si(2/10)(17.5.10),21.10.2010,19.1.2018,Jade,198,Kachin State,Waikhar-12,21,10,2010,19,1,2018,#REF!,,2010-10-21,2018-1-19
167,KYAW NAING & BROTHERS,Sharing,Oo Si(2/10)(17.5.10),23.11.2010,21.2.2018,Jade,120,Kachin State,Sanpe-1,23,11,2010,21,2,2018,#REF!,,2010-11-23,2018-2-21
168,WIN PAI KYAW,Sharing,Oo Si(2/10)(17.5.10),29.12.2010,29.3.2018,Jade,6,Kachin State,Myaukphyu-4,29,12,2010,29,3,2018,#REF!,,2010-12-29,2018-3-29
169,SEIN LITE,Sharing,Oo Si(2/10)(17.5.10),7.10.2010,5.1.2018,Jade,7,Kachin State,Hcoma-1,7,10,2010,5,1,2018,#REF!,,2010-10-7,2018-1-5
170,JADE MINN,Sharing,Oo Si(3/10)(28.9.10),8.11.2010,6.2.2018,Jade,100,Kachin State,Sankhar-2,8,11,2010,6,2,2018,#REF!,,2010-11-8,2018-2-6
171,MOTHER MYANMAR JADE COALESCE,Sharing,Oo Si(3/10)(28.9.10),6.6.2011,5.9.2018,Jade,70,Kachin State,Mawgalon-2,6,6,2011,5,9,2018,#REF!,,2011-6-6,2018-9-5
172,KHAING MYANMAR,Sharing,Oo Si(3/10)(28.9.10),23.6.2011,22.9.2018,Jade,60,Kachin State,Nampjam-4,23,6,2011,22,9,2018,#REF!,,2011-6-23,2018-9-22
173,HTAY AUNG KYAW,Sharing,Oo Si(3/10)(28.9.10),24.2.2011,25.5.2018,Jade,85,Kachin State,Nampjam-5,24,2,2011,25,5,2018,#REF!,,2011-2-24,2018-5-25
174,LINN HTET AUNG,Sharing,Oo Si(3/10)(28.9.10),6.5.2011,5.8.2018,Jade,53,Kachin State,Sai Aung-1,6,5,2011,5,8,2018,#REF!,,2011-5-6,2018-8-5
175,JADE LEADER,Sharing,Oo Si(3/10)(28.9.10),18.11.2010,16.2.2018,Jade,30,Kachin State,Waikhar-14,18,11,2010,16,2,2018,#REF!,,2010-11-18,2018-2-16
176,JADE MINN,Sharing,Oo Si(3/10)(28.9.10),8.11.2010,6.2.2018,Jade,70,Kachin State,Waikhar-15,8,11,2010,6,2,2018,#REF!,,2010-11-8,2018-2-6
177,MOTHER MYANMAR JADE COALESCE,Sharing,Oo Si(3/10)(28.9.10),3.5.2011,2.8.2018,Jade,100,Kachin State,Jankar-5,3,5,2011,2,8,2018,#REF!,,2011-5-3,2018-8-2
178,YADANAR SI,Sharing,Oo Si(3/10)(28.9.10),17.11.2010,15.2.2018,Jade,80,Kachin State,Mawmaung-8,17,11,2010,15,2,2018,#REF!,,2010-11-17,2018-2-15
179,TUN TAUK SA,Sharing,Oo Si(3/10)(28.9.10),11.3.2011,10.6.2018,Jade,11,Kachin State,Mawanlay-2,11,3,2011,10,6,2018,#REF!,,2011-3-11,2018-6-10
180,AYE AYE KHAING,Sharing,Oo Si(3/10)(28.9.10),21.12.2010,21.3.2018,Jade,13,Kachin State,Mawanlay-3,21,12,2010,21,3,2018,#REF!,,2010-12-21,2018-3-21
181,YADANAR SKY,Sharing,Oo Si(3/10)(28.9.10),11.3.2011,10.6.2018,Jade,8,Kachin State,Mawankyi-5,11,3,2011,10,6,2018,#REF!,,2011-3-11,2018-6-10
182,AYE AYE KHAING,Sharing,Oo Si(3/10)(28.9.10),29.11.2010,27.2.2018,Jade,8.05,Kachin State,Mawankyi-6,29,11,2010,27,2,2018,#REF!,,2010-11-29,2018-2-27
183,AYE AYE KHAING,Sharing,Oo Si(3/10)(28.9.10),29.11.2010,27.2.2018,Jade,13,Kachin State,Mawankyi-7,29,11,2010,27,2,2018,#REF!,,2010-11-29,2018-2-27
184,EARLY BRIGHT WHITE,Sharing,Oo Si(3/10)(28.9.10),8.12.2010,8.3.2018,Jade,21,Kachin State,Mawankyi-8,8,12,2010,8,3,2018,#REF!,,2010-12-8,2018-3-8
185,JADE LAND,Sharing,Oo Si(3/10)(28.9.10),8.12.2010,8.3.2018,Jade,75,Kachin State,Jankar-3,8,12,2010,8,3,2018,#REF!,,2010-12-8,2018-3-8
186,NANNOO YADANAR,Sharing,Oo Si(3/10)(28.9.10),6.5.2011,5.8.2018,Jade,68,Kachin State,Jankhap-5,6,5,2011,5,8,2018,#REF!,,2011-5-6,2018-8-5
187,"KACHIN NATIONALS 
DEVELOPMENT & PROGRESS",Sharing,Oo Si(3/10)(28.9.10),19.1.2011,19.4.2018,Jade,10,Kachin State,Thaungcho-6,19,1,2011,19,4,2018,#REF!,,2011-1-19,2018-4-19
188,AGGA YADANAR,Sharing,Oo Si(3/10)(28.9.10),14.3.2011,13.6.2018,Jade,15,Kachin State,Kalarhmaw-2,14,3,2011,13,6,2018,#REF!,,2011-3-14,2018-6-13
189,Morning Star,Sharing,Oo Si(3/10)(28.9.10),29.3.2011,28.6.2018,Jade,6,Kachin State,Mawsisar-14,29,3,2011,28,6,2018,#REF!,,2011-3-29,2018-6-28
190,Comet Green,Sharing,Oo Si(3/10)(28.9.10),5.7.2011,4.10.2018,Jade,17.5,Kachin State,NampJam-6,5,7,2011,4,10,2018,#REF!,,2011-7-5,2018-10-4
191,PYIT YADANAR MON,Sharing,Oo Si(3/10)(28.9.10),10.7.2011,9.10.2018,Jade,17.5,Kachin State,NampJam-7,10,7,2011,9,10,2018,#REF!,,2011-7-10,2018-10-9
192,SAN FAMILY,Sharing,Oo Si(3/10)(28.9.10),3.7.2011,2.10.2018,Jade,27,Kachin State,Inmar-3,3,7,2011,2,10,2018,#REF!,,2011-7-3,2018-10-2
193,JADE POWER,Sharing,Oo Si(3/10)(28.9.10),4.7.2011,3.7.2016,Jade,40,Kachin State,Inmar-16,4,7,2011,3,7,2016,#REF!,,2011-7-4,2016-7-3
194,WINN NAR,Sharing,Oo Si(3/10)(28.9.10),13.9.2011,12.9.2018,Jade,100,Kachin State,Sanpe-2,13,9,2011,12,9,2018,#REF!,,2011-9-13,2018-9-12
195,HOO POE,Sharing,Oo Si(2/11)(19.6.11),11.8.2011,10.11.2018,Jade,10,Kachin State,Jankar-6,11,8,2011,10,11,2018,#REF!,,2011-8-11,2018-11-10
196,KAN PWINT Oo,Sharing,Oo Si(2/11)(19.6.11),29.8.2011,28.11.2018,Jade,13,Kachin State,Sabyitwa-3,29,8,2011,28,11,2018,#REF!,,2011-8-29,2018-11-28
197,KAUNG HTET KHAING,Sharing,Oo Si(2/11)(19.6.11),30.8.2011,29.11.2018,Jade,8.35,Kachin State,Mawsisar-23,30,8,2011,29,11,2018,#REF!,,2011-8-30,2018-11-29
198,Two Horse,Sharing,Oo Si(2/11)(19.6.11),22.9.2011,22.12.2018,Jade,3,Kachin State,Bazanchauk-8,22,9,2011,22,12,2018,#REF!,,2011-9-22,2018-12-22
199,PHYO AUNG MYIN THU,Sharing,Oo Si(2/11)(19.6.11),29.9.2011,29.12.2018,Jade,4,Kachin State,Bazanchauk-9,29,9,2011,29,12,2018,#REF!,,2011-9-29,2018-12-29
200,MYANMAR WIN GATE,Sharing,Oo Si(2/11)(19.6.11),4.10.2011,3.1.2019,Jade,50,Kachin State,Mawgalon-4,4,10,2011,3,1,2019,#REF!,,2011-10-4,2019-1-3
201,THIRI BAK SONE,Sharing,Oo Si(2/11)(19.6.11),4.10.2011,3.1.2019,Jade,50,Kachin State,Mawgalon-5,4,10,2011,3,1,2019,#REF!,,2011-10-4,2019-1-3
202,PWIT HTOO SAN,Sharing,Oo Si(2/11)(19.6.11),24.10.2011,23.10.2016,Jade,20,Kachin State,Waikhar-16,24,10,2011,23,10,2016,#REF!,,2011-10-24,2016-10-23
203,Pyikyaw Aung Htay,Sharing,Oo Si(2/11)(19.6.11),27.1.2012,28.4.2019,Jade,30,Kachin State,Sylo-1,27,1,2012,28,4,2019,#REF!,,2012-1-27,2019-4-28
204,AUNG SU MYAT,Sharing,Oo Si(2/11)(19.6.11),27.1.2012,28.4.2019,Jade,40,Kachin State,Lamaung-1,27,1,2012,28,4,2019,#REF!,,2012-1-27,2019-4-28
205,KAUNG MON YADANAR,Sharing,Oo Si(2/11)(19.6.11),27.1.2012,28.4.2019,Jade,30,Kachin State,Khatar-2,27,1,2012,28,4,2019,#REF!,,2012-1-27,2019-4-28
206,YADANAR SI THIRI,Sharing,Oo Si(2/11)(19.6.11),14.3.2012,13.6.2019,Jade,50,Kachin State,Waikhar-17,14,3,2012,13,6,2019,#REF!,,2012-3-14,2019-6-13
207,Natural Yadanar Myae,Sharing,Oo Si(2/11)(19.6.11),13.6.2012,31.8.2019,Jade,50,Kachin State,Makarpin-1,13,6,2012,31,8,2019,#REF!,,2012-6-13,2019-8-31
208,Aungmyinthe Yadanarmyae,Sharing,Oo Si(2/11)(19.6.11),13.6.2012,31.8.2019,Jade,12,Kachin State,malan-2,13,6,2012,31,8,2019,#REF!,,2012-6-13,2019-8-31
209,MYANMAJADEADEPATI,Sharing,Oo Si(2/11)(19.6.11),23.12.2011,24.3.2019,Jade,12,Kachin State,Kalarmaw-3,23,12,2011,24,3,2019,#REF!,,2011-12-23,2019-3-24
210,MYAT LINN KADAY KYAWE,Sharing,Oo Si(3/11)(25.9.11),30.12.2011,31.3.2019,Jade,36,Kachin State,Waikhar-19,30,12,2011,31,3,2019,#REF!,,2011-12-30,2019-3-31
211,GOLD KING STAR,Sharing,Oo Si(3/11)(25.9.11),30.12.2011,31.3.2019,Jade,50,Kachin State,Jankar-8,30,12,2011,31,3,2019,#REF!,,2011-12-30,2019-3-31
212,GOLD KING STAR,Sharing,Oo Si(3/11)(25.9.11),30.12.2011,31.3.2019,Jade,50,Kachin State,Jankar-9,30,12,2011,31,3,2019,#REF!,,2011-12-30,2019-3-31
213,YONN GEMS STONE,Sharing,Oo Si(3/11)(25.9.11),30.12.2011,31.3.2019,Jade,22,Kachin State,Lamaung-4,30,12,2011,31,3,2019,#REF!,,2011-12-30,2019-3-31
214,GEMS CITY,Sharing,Oo Si(3/11)(25.9.11),31.12.2011,1.4.2019,Jade,50,Kachin State,Jankar-10,31,12,2011,1,4,2019,#REF!,,2011-12-31,2019-4-1
215,Great Star,Sharing,Oo Si(3/11)(25.9.11),1.1.2012,2.4.2019,Jade,50,Kachin State,Garyaryar-1,1,1,2012,2,4,2019,#REF!,,2012-1-1,2019-4-2
216,Great Star,Sharing,Oo Si(3/11)(25.9.11),1.1.2012,2.4.2019,Jade,39,Kachin State,Waikar-21,1,1,2012,2,4,2019,#REF!,,2012-1-1,2019-4-2
217,LM,Sharing,Oo Si(3/11)(25.9.11),2.1.2012,3.4.2019,Jade,50,Kachin State,Sankahtan-11,2,1,2012,3,4,2019,#REF!,,2012-1-2,2019-4-3
218,NGWE SI HEIN,Sharing,Oo Si(3/11)(25.9.11),3.1.2012,2.1.2017,Jade,4,Kachin State,Mawmaung-10,3,1,2012,2,1,2017,#REF!,,2012-1-3,2017-1-2
219,SWE THIHA AUNG,Sharing,Oo Si(3/11)(25.9.11),3.1.2012,4.4.2019,Jade,15,Kachin State,Mawgalon-9,3,1,2012,4,4,2019,#REF!,,2012-1-3,2019-4-4
220,RICH LAND,Sharing,Oo Si(3/11)(25.9.11),10.1.2012,11.4.2019,Jade,8,Kachin State,Kayinchaung-3,10,1,2012,11,4,2019,#REF!,,2012-1-10,2019-4-11
221,MM Three Star,Sharing,Oo Si(3/11)(25.9.11),19.1.2012,20.4.2019,Jade,3.5,Kachin State,Sa pot-1,19,1,2012,20,4,2019,#REF!,,2012-1-19,2019-4-20
222,MM Three Star,Sharing,Oo Si(3/11)(25.9.11),19.1.2012,20.4.2019,Jade,4.5,Kachin State,Mamon-7,19,1,2012,20,4,2019,#REF!,,2012-1-19,2019-4-20
223,Oak Tree,Sharing,Oo Si(3/11)(25.9.11),20.1.2012,21.4.2019,Jade,4,Kachin State,Mawlakin-1,20,1,2012,21,4,2019,#REF!,,2012-1-20,2019-4-21
224,Oak Tree,Sharing,Oo Si(3/11)(25.9.11),20.1.2012,21.4.2019,Jade,1.5,Kachin State,Ba la ka-2,20,1,2012,21,4,2019,#REF!,,2012-1-20,2019-4-21
225,SHWE GAUNG GAUNG,Sharing,Oo Si(3/11)(25.9.11),15.3.2012,14.6.2019,Jade,50,Kachin State,Mawgalon-6,15,3,2012,14,6,2019,#REF!,,2012-3-15,2019-6-14
226,GOLD UNI,Sharing,Oo Si(3/11)(25.9.11),16.3.2012,15.6.2019,Jade,8,Kachin State,Waikar-27,16,3,2012,15,6,2019,#REF!,,2012-3-16,2019-6-15
227,Yadanar Innward,Sharing,Oo Si(3/11)(25.9.11),5.6.2012,31.8.2019,Jade,24.88,Kachin State,Mawankyi-9,5,6,2012,31,8,2019,#REF!,,2012-6-5,2019-8-31
228,AYE AYE KHAING,Sharing,Oo Si(3/11)(25.9.11),5.6.2012,31.8.2019,Jade,26.55,Kachin State,Mawsisar-24,5,6,2012,31,8,2019,#REF!,,2012-6-5,2019-8-31
229,LIAN SHAN,Sharing,Oo Si(6/11)(18.12.11),30.12.2011,31.3.2019,Jade,6.65,Kachin State,Mana-3,30,12,2011,31,3,2019,#REF!,,2011-12-30,2019-3-31
230,SAI TAUNG,Sharing,Oo Si(6/11)(18.12.11),19.1.2012,20.4.2019,Jade,5,Kachin State,Sa pot-2,19,1,2012,20,4,2019,#REF!,,2012-1-19,2019-4-20
231,LAGAYAUNG FAMILY,Sharing,Oo Si(6/11)(18.12.11),24.2.2012,26.5.2019,Jade,5.75,Kachin State,Nampmaw-2,24,2,2012,26,5,2019,#REF!,,2012-2-24,2019-5-26
232,Sea Sun Star,Sharing,Oo Si(6/11)(18.12.11),24.2.2012,26.5.2019,Jade,27,Kachin State,Mawgalon-10,24,2,2012,26,5,2019,#REF!,,2012-2-24,2019-5-26
233,Phyosithu,Sharing,Oo Si(6/11)(18.12.11),15.3.2012,14.6.2019,Jade,3,Kachin State,Mawanlay-4,15,3,2012,14,6,2019,#REF!,,2012-3-15,2019-6-14
234,Phyosithu,Sharing,Oo Si(6/11)(18.12.11),15.3.2012,14.6.2019,Jade,50,Kachin State,Sankahtan-12,15,3,2012,14,6,2019,#REF!,,2012-3-15,2019-6-14
235,Property Mountain,Sharing,Oo Si(6/11)(18.12.11),15.3.2012,14.6.2019,Jade,50,Kachin State,Sankahtan-13,15,3,2012,14,6,2019,#REF!,,2012-3-15,2019-6-14
236,GOLD UNI,Sharing,Oo Si(6/11)(18.12.11),16.3.2012,15.6.2019,Jade,10,Kachin State,Mawlakin-4,16,3,2012,15,6,2019,#REF!,,2012-3-16,2019-6-15
237,Pyitawaisarphyo,Sharing,Oo Si(6/11)(18.12.11),28.3.2012,27.6.2019,Jade,35,Kachin State,Jankhap-7,28,3,2012,27,6,2019,#REF!,,2012-3-28,2019-6-27
238,Shwe Moe Way Aung,Sharing,Oo Si(6/11)(18.12.11),25.4.2012,25.7.2019,Jade,30,Kachin State,Mawlakin-3,25,4,2012,25,7,2019,#REF!,,2012-4-25,2019-7-25
239,Seill Min Yadalar,Sharing,Oo Si(6/11)(18.12.11),27.4.2012,27.7.2019,Jade,50,Kachin State,Waikar-24,27,4,2012,27,7,2019,#REF!,,2012-4-27,2019-7-27
240,Uru Same Yadalar,Sharing,Oo Si(6/11)(18.12.11),27.4.2012,27.7.2019,Jade,50,Kachin State,Waikar-25,27,4,2012,27,7,2019,#REF!,,2012-4-27,2019-7-27
241,That Hame,Sharing,Oo Si(6/11)(18.12.11),4.5.2012,3.8.2019,Jade,19,Kachin State,Waikar-23,4,5,2012,3,8,2019,#REF!,,2012-5-4,2019-8-3
242,Winner Jade Emperor,Sharing,Oo Si(6/11)(18.12.11),13.6.2012,31.8.2019,Jade,35,Kachin State,Makarpin-2,13,6,2012,31,8,2019,#REF!,,2012-6-13,2019-8-31
243,Winner Jade Master,Sharing,Oo Si(6/11)(18.12.11),13.6.2012,31.8.2019,Jade,30,Kachin State,Waikar-22,13,6,2012,31,8,2019,#REF!,,2012-6-13,2019-8-31
244,KAUNG SU AUNG,Sharing,Oo Si(1/12)(23.4.12),18.12.2012,19.3.2019,Jade,4.72,Kachin State,Mana-5,18,12,2012,19,3,2019,#REF!,,2012-12-18,2019-3-19
245,PanMyatnoeYone,Sharing,Oo Si(1/12)(23.4.12),27.2.2012,29.5.2019,Jade,34,Kachin State,Waikar-28,27,2,2012,29,5,2019,#REF!,,2012-2-27,2019-5-29
246,PanMyatnoeYone,Sharing,Oo Si(1/12)(23.4.12),27.2.2012,29.5.2019,Jade,1.42,Kachin State,Mawanlay-5,27,2,2012,29,5,2019,#REF!,,2012-2-27,2019-5-29
247,PanMyatnoeYone,Sharing,Oo Si(1/12)(23.4.12),27.2.2012,29.5.2019,Jade,3.36,Kachin State,Mawankyi-10,27,2,2012,29,5,2019,#REF!,,2012-2-27,2019-5-29
248,AUNG SAW MINN,Sharing,Oo Si(1/12)(23.4.12),29.3.2012,28.6.2019,Jade,1.64,Kachin State,Mawmaung-11,29,3,2012,28,6,2019,#REF!,,2012-3-29,2019-6-28
249,Kan Lin Win ,Sharing,Oo Si(1/12)(23.4.12),24.5.2012,23.8.2019,Jade,1.5,Kachin State,Shayakha-1,24,5,2012,23,8,2019,#REF!,,2012-5-24,2019-8-23
250,Bawga Gone,Sharing,Oo Si(1/12)(23.4.12),12.6.2012,31.8.2019,Jade,6,Kachin State,Waikar-29,12,6,2012,31,8,2019,#REF!,,2012-6-12,2019-8-31
251,Ngwe Kye pwint,Sharing,Oo Si(1/12)(23.4.12),14.6.2012,31.8.2019,Jade,4.5,Kachin State,Mana-6,14,6,2012,31,8,2019,#REF!,,2012-6-14,2019-8-31
252,Man Shwe Thitsar,Sharing,Oo Si(1/12)(23.4.12),18.6.2012,31.8.2019,Jade,23,Kachin State,Namtmapyit-3,18,6,2012,31,8,2019,#REF!,,2012-6-18,2019-8-31
253,Shwe Kyae Min,Sharing,Oo Si(1/12)(23.4.12),13.9.2012,31.8.2019,Jade,15,Kachin State,Janker-11,13,9,2012,31,8,2019,#REF!,,2012-9-13,2019-8-31
254,AUNG SAW MINN,Sharing,Oo Si(1/12)(23.4.12),20.9.2012,31.8.2019,Jade,50,Kachin State,Janker-12,20,9,2012,31,8,2019,#REF!,,2012-9-20,2019-8-31
255,Myintzuther,Sharing,Oo Si(1/12)(23.4.12),22.10.2012,31.8.2019,Jade,50,Kachin State,Waikar-31,22,10,2012,31,8,2019,#REF!,,2012-10-22,2019-8-31
256,Sea Sun Star,Sharing,Oo Si(1/12)(23.4.12),7.11.2012,31.8.2019,Jade,40,Kachin State,Montmukha,7,11,2012,31,8,2019,#REF!,,2012-11-7,2019-8-31
257,JADE Mountain,Sharing,Oo Si(1/12)(23.4.12),22.11.2012,31.8.2019,Jade,3,Kachin State,Pharpyin-3,22,11,2012,31,8,2019,#REF!,,2012-11-22,2019-8-31
258,Sayar San Good Live ,Sharing,Oo Si(1/12)(23.4.12),7.2.2013,31.8.2019,Jade,40,Kachin State,Mawgalon-15,7,2,2013,31,8,2019,#REF!,,2013-2-7,2019-8-31
259,Kanbawza Golden,Sharing,Oo Si(1/12)(23.4.12),7.2.2013,31.8.2019,Jade,23,Kachin State,Mawgalon-12,7,2,2013,31,8,2019,#REF!,,2013-2-7,2019-8-31
260,Yadalar Si,Sharing,Oo Si(1/12)(23.4.12),7.3.2013,31.8.2019,Jade,50,Kachin State,Wakan-1,7,3,2013,31,8,2019,#REF!,,2013-3-7,2019-8-31
261,WAI AUNG KABAR,Sharing,Oo Si(2/13)(18.1.13),20.3.2013,31.8.2019,Jade,0.15,Kachin State,Mana-7,20,3,2013,31,8,2019,#REF!,,2013-3-20,2019-8-31
262,San Mya Yadalar,Sharing,Oo Si(1/12)(23.4.12),28.3.2013,31.8.2019,Jade,8,Kachin State,Malan-3,28,3,2013,31,8,2019,#REF!,,2013-3-28,2019-8-31
263,Bawga Gone,Sharing,Oo Si(2/13)(18.1.13),29.3.2013,31.8.2019,Jade,7,Kachin State,Waikar-32,29,3,2013,31,8,2019,#REF!,,2013-3-29,2019-8-31
264,Sein Phyo,Sharing,Oo Si(1/12)(23.4.12),12.6.2013,31.8.2019,Jade,30,Kachin State,Waikar-30,12,6,2013,31,8,2019,#REF!,,2013-6-12,2019-8-31
265,Kyauk Sein Yaung Chi,Sharing,Oo Si(6/11)(18.12.11),17.6.2013,31.8.2019,Jade,39,Kachin State,Mawgalon-14,17,6,2013,31,8,2019,#REF!,,2013-6-17,2019-8-31
266,Kyauk Sein Yaung Chi,Sharing,Oo Si(6/11)(18.12.11),17.6.2013,31.8.2019,Jade,10,Kachin State,Mawgalon(yae kyi-1),17,6,2013,31,8,2019,Mawgalon,yae kyi-1,2013-6-17,2019-8-31
267,Sein Su Pon,Sharing,Oo Si(1/12)(23.4.12),20.6.2013,31.8.2019,Jade,10,Kachin State,Kaukaw-5,20,6,2013,31,8,2019,#REF!,,2013-6-20,2019-8-31
268,Shawe Kyauk Seinn Yadanar,Sharing,Oo Si(2/13)(18.1.13),8.7.2013,31.8.2019,Jade,7,Kachin State,Taungkawt-2,8,7,2013,31,8,2019,#REF!,,2013-7-8,2019-8-31
269,Shawe Ngwe,Sharing,Oo Si(3/11)(25.9.11),16.8.2013,31.8.2019,Jade,50,Kachin State,Mawgalon-7,16,8,2013,31,8,2019,#REF!,,2013-8-16,2019-8-31
270,Htoo  International,Sharing,Oo Si(3/11)(25.9.11),16.8.2013,31.8.2019,Jade,50,Kachin State,Mawgalon-8,16,8,2013,31,8,2019,#REF!,,2013-8-16,2019-8-31
271,Shwe Wint Htwe,Sharing,Oo Si(2/13)(18.1.13),27.8.2013,31.8.2019,Jade,50,Kachin State,Waikar-33,27,8,2013,31,8,2019,#REF!,,2013-8-27,2019-8-31
272,Tiger Jade,Sharing,Oo Si(2/13)(18.1.13),27.8.2013,31.8.2019,Jade,30,Kachin State,Jankhap-8,27,8,2013,31,8,2019,#REF!,,2013-8-27,2019-8-31
273,Nay Linn & Sons,Sharing,Oo Si(1/12)(23.4.12),28.8.2013,31.8.2019,Jade,23,Kachin State,Mawgalon-13,28,8,2013,31,8,2019,#REF!,,2013-8-28,2019-8-31
274,Htay Paing,Sharing,Oo Si(3/11)(25.9.11),28.8.2013,31.8.2019,Jade,50,Kachin State,Waikar-18,28,8,2013,31,8,2019,#REF!,,2013-8-28,2019-8-31
275,Shing Yin,Sharing,Oo Si(1/12)(23.4.12),29.8.2013,31.8.2019,Jade,2.5,Kachin State,Mawankyi-12,29,8,2013,31,8,2019,#REF!,,2013-8-29,2019-8-31
276,Hein Lin Aung,Sharing,Oo Si(1/12)(23.4.12),2.9.2013,31.8.2019,Jade,50,Kachin State,Mawmaung-12,2,9,2013,31,8,2019,#REF!,,2013-9-2,2019-8-31
277,Shan Yoma Aye Chan Yay,Sharing,Oo Si(1/12)(23.4.12),6.9.2013,31.8.2019,Jade,3,Kachin State,Mawanlay-6,6,9,2013,31,8,2019,#REF!,,2013-9-6,2019-8-31
278,Kaung Swann Htet,Sharing,Oo Si(9/13)(31.12.13),22.1.2014,31.8.2019,Jade,26.71,Kachin State,Warjie-8,22,1,2014,31,8,2019,#REF!,,2014-1-22,2019-8-31
279,Thuya Shwe Yi Aung,Sharing,Oo Si(9/13)(31.12.13),4.2.2014,31.8.2019,Jade,11,Kachin State,Waikar-34,4,2,2014,31,8,2019,#REF!,,2014-2-4,2019-8-31
280,Nilar Lin Lat,Sharing,Oo Si(9/13)(31.12.13),7.3.2014,31.8.2019,Jade,21,Kachin State,Waikar-36,7,3,2014,31,8,2019,#REF!,,2014-3-7,2019-8-31
281,Pwint Phoo Nadi,Sharing,Oo Si(2/10)(17.5.10),20.3.2014,31.8.2019,Jade,119,Kachin State,khatar-1,20,3,2014,31,8,2019,#REF!,,2014-3-20,2019-8-31
282,Ye Lwin Oo,Sharing,Oo Si(2/10)(17.5.10),20.3.2014,31.8.2019,Jade,100,Kachin State,Sankahtan-6,20,3,2014,31,8,2019,#REF!,,2014-3-20,2019-8-31
283,High Group,Sharing,Oo Si(3/10)(28.9.10),20.3.2014,31.8.2019,Jade,75,Kachin State,Mawkyan-1,20,3,2014,31,8,2019,#REF!,,2014-3-20,2019-8-31
284,Myanmar Mighty Star,Sharing,Oo Si(3/10)(28.9.10),20.3.2014,31.8.2019,Jade,21,Kachin State,Namtmapyit-2,20,3,2014,31,8,2019,#REF!,,2014-3-20,2019-8-31
285,MAHAR Jade,Sharing,Oo Si(3/10)(28.9.10),20.3.2014,31.8.2019,Jade,47,Kachin State,Jankhap-6,20,3,2014,31,8,2019,#REF!,,2014-3-20,2019-8-31
286,Green Friend,Sharing,Oo Si(3/10)(28.9.10),20.3.2014,31.8.2019,Jade,100,Kachin State,Sanpha`-3,20,3,2014,31,8,2019,#REF!,,2014-3-20,2019-8-31
287,Myanma Spot Light,Sharing,Oo Si(3/10)(28.9.10),20.3.2014,31.8.2019,Jade,100,Kachin State,Jankar-4,20,3,2014,31,8,2019,#REF!,,2014-3-20,2019-8-31
288,Wint Phoo,Sharing,Oo Si(2/11)(19.6.11),20.3.2014,31.8.2019,Jade,20,Kachin State,Waikar13,20,3,2014,31,8,2019,#REF!,,2014-3-20,2019-8-31
289,Green Friend,Sharing,Oo Si(2/11)(19.6.11),20.3.2014,31.8.2019,Jade,100,Kachin State,Aungsein-1,20,3,2014,31,8,2019,#REF!,,2014-3-20,2019-8-31
290,Warm Brother,Sharing,Oo Si(3/10)(28.9.10),20.3.2014,31.8.2019,Jade,100,Kachin State,Banngo-1,20,3,2014,31,8,2019,#REF!,,2014-3-20,2019-8-31
291,Nature Treasure,Sharing,Oo Si(2/11)(19.6.11),20.3.2014,31.8.2019,Jade,20,Kachin State,Jankar-7,20,3,2014,31,8,2019,#REF!,,2014-3-20,2019-8-31
292,Wint Phoo,Sharing,Oo Si(2/11)(19.6.11),20.3.2014,31.8.2019,Jade,40,Kachin State,Sankhar-3,20,3,2014,31,8,2019,#REF!,,2014-3-20,2019-8-31
293,Khaing Lon,Sharing,Oo Si(6/11)(18.12.11),28.3.2014,31.8.2019,Jade,40,Kachin State,Lamaung-5,28,3,2014,31,8,2019,#REF!,,2014-3-28,2019-8-31
294,TatLu Internation,Sharing,Oo Si(6/11)(18.12.11),28.3.2014,31.8.2019,Jade,35,Kachin State,Mawgalon-11,28,3,2014,31,8,2019,#REF!,,2014-3-28,2019-8-31
295,NayYaung Chi Yadalar Family,Sharing,Oo Si(9/13)(31.12.12),23.5.2014,31.8.2019,Jade,19,Kachin State,Waikar-37,23,5,2014,31,8,2019,#REF!,,2014-5-23,2019-8-31
296,"Yadanar Saing Kaung 
Myat Kyaw",Sharing,Oo Si(6/11)(18.12.11),5.6.2014,31.8.2019,Jade,2.5,Kachin State,Kalamaw-4,5,6,2014,31,8,2019,#REF!,,2014-6-5,2019-8-31
297,"Yadanar Saing Kaung 
Myat Kyaw",Sharing,Oo Si(6/11)(18.12.11),5.6.2014,31.8.2019,Jade,15,Kachin State,Nampmaw-1,5,6,2014,31,8,2019,#REF!,,2014-6-5,2019-8-31
298,"Yadanar Saing Kaung 
Myat Kyaw",Sharing,Oo Si(6/11)(18.12.11),5.6.2014,31.8.2019,Jade,1,Kachin State,Mawlakin-2,5,6,2014,31,8,2019,#REF!,,2014-6-5,2019-8-31
299,Jade King & Queen ,Sharing,Oo Si(6/11)(18.12.11),5.6.2014,31.8.2019,Jade,3,Kachin State,Taungcho-7,5,6,2014,31,8,2019,#REF!,,2014-6-5,2019-8-31
300,Jade King & Queen ,Sharing,Oo Si(6/11)(18.12.11),5.6.2014,31.8.2019,Jade,3,Kachin State,Mana-4,5,6,2014,31,8,2019,#REF!,,2014-6-5,2019-8-31
301,Jade King & Queen ,Sharing,Oo Si(1/12)(23.4.12),5.6.2014,31.8.2019,Jade,37.5,Kachin State,Jankar-13,5,6,2014,31,8,2019,#REF!,,2014-6-5,2019-8-31
302,KYAUK SEIN WIN,Sharing,Oo Si(9/13)(31.12.12),1.7.2014,31.8.2019,Jade,50,Kachin State,Wakar-35,1,7,2014,31,8,2019,#REF!,,2014-7-1,2019-8-31
303,JADE GADAY,Sharing,,25.9.2014,24.9.2019,Jade,5,Kachin State,Lamaung-6,25,9,2014,24,9,2019,#REF!,,2014-9-25,2019-9-24
304,JADE GADAY,Sharing,Oo Si(3/11)(25.9.11),25.9.2014,24.9.2019,Jade,8,Kachin State,Lamaung-3,25,9,2014,24,9,2019,#REF!,,2014-9-25,2019-9-24
305,SHWE HLAN WIN,Sharing,Oo Si(2/13)(18.1.13),29.9.2014,28.9.2019,Jade,1.5,Kachin State,Mana-8,29,9,2014,28,9,2019,#REF!,,2014-9-29,2019-9-28
306,BLUE GOLD JEWELLERY,Sharing,Oo Si(1/14)(10.6.14),2.10.2014,1.10.2019,Jade,30,Kachin State,Nantku-1,2,10,2014,1,10,2019,#REF!,,2014-10-2,2019-10-1
307,BLUE GOLD JEWELLERY,Sharing,Oo Si(1/14)(10.6.14),2.10.2014,1.10.2019,Jade,20,Kachin State,Mawgalon-16,2,10,2014,1,10,2019,#REF!,,2014-10-2,2019-10-1
308,SUT RAIN AUNG,Sharing,Oo Si(1/14)(10.6.14),15.10.2014,14.10.2019,Jade,50,Kachin State,Sankhar-4,15,10,2014,14,10,2019,#REF!,,2014-10-15,2019-10-14
309,LIN MOE,Sharing,Oo Si(1/12)(23.4.12),15.10.2014,14.10.2019,Jade,10,Kachin State,Wakar-26,15,10,2014,14,10,2019,#REF!,,2014-10-15,2019-10-14
310,TIGER JADE,Sharing,Oo Si(1/14)(10.6.14),29.12.2014,28.12.2019,Jade,50,Kachin State,Sankhar,29,12,2014,28,12,2019,#REF!,,2014-12-29,2019-12-28
311,KYAUK SEIN YAUNG CHI,Sharing,Oo Si(1/14)(10.6.14),30.12.2014,29.12.2019,Jade,20,Kachin State,Wakar,30,12,2014,29,12,2019,#REF!,,2014-12-30,2019-12-29
1,Kachin National Development,Private,Oo Si (3/14)(18.12.14),2.1.2015,1.1.2018,Gem,1,Shan State,Lwai Saung htauk(Pha La-35),2,1,2015,1,1,2018,Lwai Saung htauk,Pha La-35,2015-1-2,2018-1-1
2,Kachin National Development,Private,Oo Si(3/10)(28.9.10),5.10.2010,4.1.2016,Jade,1,Kachin State,Mhaw Ga Lone(70),5,10,2010,4,1,2016,Mhaw Ga Lone,70,2010-10-5,2016-1-4
3,Kachin National Development,Private,Oo Si(3/10)(28.9.10),2.11.2010,1.2.2016,Jade,1,Kachin State,Phar Pyin(145),2,11,2010,1,2,2016,Phar Pyin,145,2010-11-2,2016-2-1
4,Kachin National Development,Private,Oo Si(3/10)(28.9.10),2.11.2010,1.2.2016,Jade,1,Kachin State,Mat Lin Chaung(171),2,11,2010,1,2,2016,Mat Lin Chaung,171,2010-11-2,2016-2-1
5,Kachin National Development,Private,Oo Si(1/16)(22.5.16),18.12.2014,17.12.2017,Jade,1,Kachin State,Phar Pyin(157),18,12,2014,17,12,2017,Phar Pyin,157,2014-12-18,2017-12-17
6,Kachin National Development,Private,Oo Si(6/11)(18.12.11),1.12.2011,30.11.2016,Jade,1,Kachin State,Mana(16),1,12,2011,30,11,2016,Mana,16,2011-12-1,2016-11-30
7,Kachin National Development,Private,Oo Si(6/11)(18.12.11),1.12.2011,30.11.2016,Jade,1,Kachin State,Mana(108),1,12,2011,30,11,2016,Mana,108,2011-12-1,2016-11-30
8,Kachin National Development,Private,Oo Si(3/14)(11.12.14),14.1.2015,13.1.2020,Jade,1,Kachin State,Maw La Kin(122),14,1,2015,13,1,2020,Maw La Kin,122,2015-1-14,2020-1-13
9,Kachin National Development,Private,Oo Si(3/14)(11.12.14),14.1.2015,13.1.2020,Jade,1,Kachin State,Maw La Kin(124),14,1,2015,13,1,2020,Maw La Kin,124,2015-1-14,2020-1-13
10,Kachin National Development,Private,Oo Si(3/14)(11.12.14),14.1.2015,13.1.2018,Jade,1,Kachin State,Whay Khar(435),14,1,2015,13,1,2018,Whay Khar,435,2015-1-14,2018-1-13
11,Kachin National Development,Private,Oo Si(3/14)(11.12.14),14.1.2015,13.1.2018,Jade,1,Kachin State,Whay Khar(436),14,1,2015,13,1,2018,Whay Khar,436,2015-1-14,2018-1-13
12,Kachin National Development,Private,Oo Si(3/14)(11.12.14),14.1.2015,13.1.2018,Jade,1,Kachin State,Whay Khar(437),14,1,2015,13,1,2018,Whay Khar,437,2015-1-14,2018-1-13
13,Kachin National Development,Private,Oo Si(3/14)(11.12.14),14.1.2015,13.1.2018,Jade,1,Kachin State,Whay Khar(438),14,1,2015,13,1,2018,Whay Khar,438,2015-1-14,2018-1-13
14,Kachin National Development,Private,Oo Si(3/14)(11.12.14),14.1.2015,13.1.2018,Jade,1,Kachin State,Whay Khar(439),14,1,2015,13,1,2018,Whay Khar,439,2015-1-14,2018-1-13
15,Kachin National Development,Private,Oo Si(3/15)(4.9.15),23.11.2015,22.11.2018,Jade,1,Kachin State,Phar Pyin(90),23,11,2015,22,11,2018,Phar Pyin,90,2015-11-23,2018-11-22
16,Lin Yaung Phyar,Private,Oo Si(3/15)(4.9.15),3.12.2015,2.12.2018,Jade,1,Kachin State,Mat Lin Chaung(17),3,12,2015,2,12,2018,Mat Lin Chaung,17,2015-12-3,2018-12-2
17,Kachin National Development,Private,Oo Si(3/15)(4.9.15),30.12.2015,29.12.2018,Jade,1,Kachin State,Mat Lin Chaung(53),30,12,2015,29,12,2018,Mat Lin Chaung,53,2015-12-30,2018-12-29
18,Kachin National Development,Private,Oo Si(4/15)(18.12.15),2.2.2016,1.2.2019,Jade,1,Kachin State,Mat Lin Chaung(171),2,2,2016,1,2,2019,Mat Lin Chaung,171,2016-2-2,2019-2-1
19,Kachin National Development,Private,Oo Si(4/15)(18.12.15),2.2.2016,1.2.2019,Jade,1,Kachin State,Phar Pyin(145),2,2,2016,1,2,2019,Phar Pyin,145,2016-2-2,2019-2-1
20,Kachin National Development,Private,Oo Si(3/10)(28.9.10),5.10.2010,4.1.2016,Jade,1,Kachin State,Mhaw Ga Lone(70),5,10,2010,4,1,2016,Mhaw Ga Lone,70,2010-10-5,2016-1-4
21,Kachin National Development,Private,Oo Si(1/16)(22.5.16),18.12.2014,17.12.2017,Jade,1,Kachin State,Phar Pyin(157),18,12,2014,17,12,2017,Phar Pyin,157,2014-12-18,2017-12-17
22,Kachin National Development,Private,Oo Si(6/11)(18.12.11),1.12.2011,30.11.2016,Jade,1,Kachin State,Mana(16),1,12,2011,30,11,2016,Mana,16,2011-12-1,2016-11-30
23,Kachin National Development,Private,Oo Si(6/11)(18.12.11),1.12.2011,30.11.2016,Jade,1,Kachin State,Mana(108),1,12,2011,30,11,2016,Mana,108,2011-12-1,2016-11-30
1,Kabar Hein,Private,Kyi Kyat (10.1.12),30.4.2012,29.7.2017,Jade,1,Kachin State,Namachi  Hmaw Thit Phawhtoke(454),30,4,2012,29,7,2017,Namachi  Hmaw Thit Phawhtoke,454,2012-4-30,2017-7-29
2,Kabar Hein,Private,Kyi Kyat (10.1.12),30.4.2012,29.7.2017,Jade,1,Kachin State,Namachi  Hmaw Thit Phawhtoke (460),30,4,2012,29,7,2017,Namachi  Hmaw Thit Phawhtoke ,460,2012-4-30,2017-7-29
3,Kabar Hein,Private,Kyi Kyat (10.1.12),30.4.2012,29.7.2017,Jade,1,Kachin State,Namachi  Hmaw Thit Phawhtoke (461),30,4,2012,29,7,2017,Namachi  Hmaw Thit Phawhtoke ,461,2012-4-30,2017-7-29
4,Kabar Hein,Private,Kyi Kyat (10.1.12),30.4.2012,29.7.2017,Jade,1,Kachin State,Namachi  Hmaw Thit Phawhtoke (466),30,4,2012,29,7,2017,Namachi  Hmaw Thit Phawhtoke ,466,2012-4-30,2017-7-29
5,Kabar Hein,Private,Kyi Kyat (10.1.12),30.4.2012,29.7.2017,Jade,1,Kachin State,Namachi  Hmaw Thit Phawhtoke(467),30,4,2012,29,7,2017,Namachi  Hmaw Thit Phawhtoke,467,2012-4-30,2017-7-29
6,Kabar Hein,Private,Kyi Kyat (10.1.12),30.4.2012,29.7.2017,Jade,1,Kachin State,Namachi  Hmaw Thit Phawhtoke (468),30,4,2012,29,7,2017,Namachi  Hmaw Thit Phawhtoke ,468,2012-4-30,2017-7-29
7,Kabar Hein,Private,Kyi Kyat (10.1.12),30.4.2012,29.7.2017,Jade,1,Kachin State,Namachi  Hmaw Thit Phawhtoke (473),30,4,2012,29,7,2017,Namachi  Hmaw Thit Phawhtoke ,473,2012-4-30,2017-7-29
8,Kabar Hein,Private,Kyi Kyat (10.1.12),30.4.2012,29.7.2017,Jade,1,Kachin State,Namachi  Hmaw Thit Phawhtoke (474),30,4,2012,29,7,2017,Namachi  Hmaw Thit Phawhtoke ,474,2012-4-30,2017-7-29
9,Kabar Hein,Private,Kyi Kyat (10.1.12),30.4.2012,29.7.2017,Jade,1,Kachin State,Namachi  Hmaw Thit Phawhtoke(475),30,4,2012,29,7,2017,Namachi  Hmaw Thit Phawhtoke,475,2012-4-30,2017-7-29
10,Kabar Hein,Private,Kyi Kyat (10.1.12),30.4.2012,29.7.2017,Jade,1,Kachin State,Namachi  Hmaw Thit Phawhtoke(488),30,4,2012,29,7,2017,Namachi  Hmaw Thit Phawhtoke,488,2012-4-30,2017-7-29
11,Kabar Hein,Private,Kyi Kyat (10.1.12),30.4.2012,29.7.2017,Jade,1,Kachin State,Namachi  Hmaw Thit Phawhtoke (489),30,4,2012,29,7,2017,Namachi  Hmaw Thit Phawhtoke ,489,2012-4-30,2017-7-29
12,Kabar Hein,Private,Kyi Kyat (10.1.12),30.4.2012,29.7.2017,Jade,1,Kachin State,Namachi  Hmaw Thit Phawhtoke (502),30,4,2012,29,7,2017,Namachi  Hmaw Thit Phawhtoke ,502,2012-4-30,2017-7-29
13,Kabar Hein,Private,Kyi Kyat (10.1.12),30.4.2012,29.7.2017,Jade,1,Kachin State,Namachi  Hmaw Thit Phawhtoke(503),30,4,2012,29,7,2017,Namachi  Hmaw Thit Phawhtoke,503,2012-4-30,2017-7-29
14,Kabar Hein,Private,Kyi Kyat (10.1.12),30.4.2012,29.7.2017,Jade,1,Kachin State,Namachi  Hmaw Thit Phawhtoke(516),30,4,2012,29,7,2017,Namachi  Hmaw Thit Phawhtoke,516,2012-4-30,2017-7-29
15,Kabar Hein,Private,Kyi Kyat (10.1.12),30.4.2012,29.7.2017,Jade,1,Kachin State,Namachi  Hmaw ThitPhawhtoke(530),30,4,2012,29,7,2017,Namachi  Hmaw ThitPhawhtoke,530,2012-4-30,2017-7-29
16,Kabar Hein,Private,Kyi Kyat (10.1.12),30.4.2012,29.7.2017,Jade,1,Kachin State,Namachi  Hmaw Thit Phawhtoke (544),30,4,2012,29,7,2017,Namachi  Hmaw Thit Phawhtoke ,544,2012-4-30,2017-7-29
17,Kabar Hein,Private,Kyi Kyat (10.1.12),30.4.2012,29.7.2017,Jade,1,Kachin State,Namachi  Hmaw ThitPhawhtoke (640),30,4,2012,29,7,2017,Namachi  Hmaw ThitPhawhtoke ,640,2012-4-30,2017-7-29
18,Kabar Hein,Private,Kyi Kyat (10.1.12),30.4.2012,29.7.2017,Jade,1,Kachin State,Namachi  Hmaw Thit Phawhtoke(641),30,4,2012,29,7,2017,Namachi  Hmaw Thit Phawhtoke,641,2012-4-30,2017-7-29
19,Kabar Hein,Private,Kyi Kyat (10.1.12),30.4.2012,29.7.2017,Jade,1,Kachin State,Namachi  Hmaw Thit Phawhtoke (642),30,4,2012,29,7,2017,Namachi  Hmaw Thit Phawhtoke ,642,2012-4-30,2017-7-29
20,Kabar Hein,Private,Kyi Kyat (10.1.12),30.4.2012,29.7.2017,Jade,1,Kachin State,Namachi  Hmaw Thit Phawhtoke (643),30,4,2012,29,7,2017,Namachi  Hmaw Thit Phawhtoke ,643,2012-4-30,2017-7-29
21,Kabar Hein,Private,Kyi Kyat (10.1.12),30.4.2012,29.7.2017,Jade,1,Kachin State,Namachi  Hmaw Thit Phawhtoke (646),30,4,2012,29,7,2017,Namachi  Hmaw Thit Phawhtoke ,646,2012-4-30,2017-7-29
22,Kabar Hein,Private,Kyi Kyat (10.1.12),30.4.2012,29.7.2017,Jade,1,Kachin State,Namachi  Hmaw Thit Phawhtoke (647),30,4,2012,29,7,2017,Namachi  Hmaw Thit Phawhtoke ,647,2012-4-30,2017-7-29
23,Kabar Hein,Private,Kyi Kyat (10.1.12),30.4.2012,29.7.2017,Jade,1,Kachin State,Namachi  Hmaw Thit Phawhtoke(648),30,4,2012,29,7,2017,Namachi  Hmaw Thit Phawhtoke,648,2012-4-30,2017-7-29
24,Kabar Hein,Private,Kyi Kyat (10.1.12),30.4.2012,29.7.2017,Jade,1,Kachin State,Namachi  Hmaw Thit Phawhtoke(649),30,4,2012,29,7,2017,Namachi  Hmaw Thit Phawhtoke,649,2012-4-30,2017-7-29
25,Kabar Hein,Private,Kyi Kyat (10.1.12),30.4.2012,29.7.2017,Jade,1,Kachin State,Namachi  Hmaw Thit Phawhtoke(652),30,4,2012,29,7,2017,Namachi  Hmaw Thit Phawhtoke,652,2012-4-30,2017-7-29
26,Kabar Hein,Private,Kyi Kyat (10.1.12),30.4.2012,29.7.2017,Jade,1,Kachin State,Namachi  Hmaw Thit Phawhtoke(653),30,4,2012,29,7,2017,Namachi  Hmaw Thit Phawhtoke,653,2012-4-30,2017-7-29
27,Kabar Hein,Private,Kyi Kyat (10.1.12),30.4.2012,29.7.2017,Jade,1,Kachin State,Namachi  Hmaw Thit Phawhtoke (654),30,4,2012,29,7,2017,Namachi  Hmaw Thit Phawhtoke ,654,2012-4-30,2017-7-29
28,Kabar Hein,Private,Kyi Kyat (10.1.12),30.4.2012,29.7.2017,Jade,1,Kachin State,Namachi  Hmaw Thit Phawhtoke (655),30,4,2012,29,7,2017,Namachi  Hmaw Thit Phawhtoke ,655,2012-4-30,2017-7-29
29,Kabar Hein,Private,Kyi Kyat (10.1.12),30.4.2012,29.7.2017,Jade,1,Kachin State,Namachi  Hmaw Thit Phawhtoke (658),30,4,2012,29,7,2017,Namachi  Hmaw Thit Phawhtoke ,658,2012-4-30,2017-7-29
30,Kabar Hein,Private,Kyi Kyat (10.1.12),30.4.2012,29.7.2017,Jade,1,Kachin State,Namachi  Hmaw Thit Phawhtoke (659),30,4,2012,29,7,2017,Namachi  Hmaw Thit Phawhtoke ,659,2012-4-30,2017-7-29
31,Kabar Hein,Private,Kyi Kyat (10.1.12),30.4.2012,29.7.2017,Jade,1,Kachin State,Namachi  Hmaw Thit Phawhtoke (660),30,4,2012,29,7,2017,Namachi  Hmaw Thit Phawhtoke ,660,2012-4-30,2017-7-29
32,Kabar Hein,Private,Kyi Kyat (10.1.12),30.4.2012,29.7.2017,Jade,1,Kachin State,Namachi  Hmaw Thit Phawhtoke (661),30,4,2012,29,7,2017,Namachi  Hmaw Thit Phawhtoke ,661,2012-4-30,2017-7-29
33,Kabar Hein,Private,Kyi Kyat (10.1.12),30.4.2012,29.7.2017,Jade,1,Kachin State,Namachi  Hmaw Thit Phawhtoke (664),30,4,2012,29,7,2017,Namachi  Hmaw Thit Phawhtoke ,664,2012-4-30,2017-7-29
34,Kabar Hein,Private,Kyi Kyat (10.1.12),30.4.2012,29.7.2017,Jade,1,Kachin State,Namachi  Hmaw Thit Phawhtoke(665),30,4,2012,29,7,2017,Namachi  Hmaw Thit Phawhtoke,665,2012-4-30,2017-7-29
35,Kabar Hein,Private,Kyi Kyat (10.1.12),30.4.2012,29.7.2017,Jade,1,Kachin State,Namachi  Hmaw Thit Phawhtoke(666),30,4,2012,29,7,2017,Namachi  Hmaw Thit Phawhtoke,666,2012-4-30,2017-7-29
36,Kabar Hein,Private,Kyi Kyat (10.1.12),30.4.2012,29.7.2017,Jade,1,Kachin State,Namachi  Hmaw Thit Phawhtoke(667),30,4,2012,29,7,2017,Namachi  Hmaw Thit Phawhtoke,667,2012-4-30,2017-7-29
37,Kabar Hein,Private,Kyi Kyat (10.1.12),30.4.2012,29.7.2017,Jade,1,Kachin State,Namachi  Hmaw Thit Phawhtoke(668),30,4,2012,29,7,2017,Namachi  Hmaw Thit Phawhtoke,668,2012-4-30,2017-7-29
38,Kabar Hein,Private,Kyi Kyat (10.1.12),30.4.2012,29.7.2017,Jade,1,Kachin State,Namachi  Hmaw Thit Phawhtoke(669),30,4,2012,29,7,2017,Namachi  Hmaw Thit Phawhtoke,669,2012-4-30,2017-7-29
39,Kabar Hein,Private,Kyi Kyat (10.1.12),30.4.2012,29.7.2017,Jade,1,Kachin State,Namachi  Hmaw Thit Phawhtoke(672),30,4,2012,29,7,2017,Namachi  Hmaw Thit Phawhtoke,672,2012-4-30,2017-7-29
40,Kabar Hein,Private,Kyi Kyat (10.1.12),30.4.2012,29.7.2017,Jade,1,Kachin State,Namachi  Hmaw Thit Phawhtoke(673),30,4,2012,29,7,2017,Namachi  Hmaw Thit Phawhtoke,673,2012-4-30,2017-7-29
41,Kabar Hein,Private,Kyi Kyat (10.1.12),30.4.2012,29.7.2017,Jade,1,Kachin State,Namachi  Hmaw Thit Phawhtoke(674),30,4,2012,29,7,2017,Namachi  Hmaw Thit Phawhtoke,674,2012-4-30,2017-7-29
42,Kabar Hein,Private,Kyi Kyat (10.1.12),30.4.2012,29.7.2017,Jade,1,Kachin State,Namachi  Hmaw Thit Phawhtoke(675),30,4,2012,29,7,2017,Namachi  Hmaw Thit Phawhtoke,675,2012-4-30,2017-7-29
43,Kabar Hein,Private,Kyi Kyat (10.1.12),30.4.2012,29.7.2017,Jade,1,Kachin State,Namachi  Hmaw Thit Phawhtoke(676),30,4,2012,29,7,2017,Namachi  Hmaw Thit Phawhtoke,676,2012-4-30,2017-7-29
44,Kabar Hein,Private,Kyi Kyat (10.1.12),30.4.2012,29.7.2017,Jade,1,Kachin State,Namachi  Hmaw Thit Phawhtoke(677),30,4,2012,29,7,2017,Namachi  Hmaw Thit Phawhtoke,677,2012-4-30,2017-7-29
45,Kabar Hein,Private,Kyi Kyat (10.1.12),30.4.2012,29.7.2017,Jade,1,Kachin State,Namachi  Hmaw Thit Phawhtoke(679),30,4,2012,29,7,2017,Namachi  Hmaw Thit Phawhtoke,679,2012-4-30,2017-7-29
46,Kabar Hein,Private,Kyi Kyat (10.1.12),30.4.2012,29.7.2017,Jade,1,Kachin State,Namachi  Hmaw Thit Phawhtoke(680),30,4,2012,29,7,2017,Namachi  Hmaw Thit Phawhtoke,680,2012-4-30,2017-7-29
47,Kabar Hein,Private,Kyi Kyat (10.1.12),30.4.2012,29.7.2017,Jade,1,Kachin State,Namachi  Hmaw Thit Phawhtoke(681),30,4,2012,29,7,2017,Namachi  Hmaw Thit Phawhtoke,681,2012-4-30,2017-7-29
48,Kabar Hein,Private,Kyi Kyat (10.1.12),30.4.2012,29.7.2017,Jade,1,Kachin State,Namachi  Hmaw Thit Phawhtoke(689),30,4,2012,29,7,2017,Namachi  Hmaw Thit Phawhtoke,689,2012-4-30,2017-7-29
49,Kabar Hein,Private,Kyi Kyat (10.1.12),30.4.2012,29.7.2017,Jade,1,Kachin State,Namachi  Hmaw Thit Phawhtoke(690),30,4,2012,29,7,2017,Namachi  Hmaw Thit Phawhtoke,690,2012-4-30,2017-7-29
50,Kabar Hein,Private,Kyi Kyat (10.1.12),30.4.2012,29.7.2017,Jade,1,Kachin State,Namachi  Hmaw Thit Phawhtoke(698),30,4,2012,29,7,2017,Namachi  Hmaw Thit Phawhtoke,698,2012-4-30,2017-7-29
1,Kabar Tawyin Jade,Private,Oo Si(1/10)(4.2.10),14.7.2010,13.10.2015,Jade,1,Kachin State,Gyan Kar(175),14,7,2010,13,10,2015,Gyan Kar,175,2010-7-14,2015-10-13
2,Kabar Tawyin Jade,Private,Oo Si(1/10)(4.2.10),14.7.2010,13.10.2015,Jade,1,Kachin State,Gyan Kar(176),14,7,2010,13,10,2015,Gyan Kar,176,2010-7-14,2015-10-13
3,Kabar Tawyin Jade,Private,Oo Si(1/10)(4.2.10),14.7.2010,13.10.2015,Jade,1,Kachin State,Gyan Kar(177),14,7,2010,13,10,2015,Gyan Kar,177,2010-7-14,2015-10-13
4,Kabar Tawyin Jade,Private,Oo Si(1/10)(4.2.10),14.7.2010,13.10.2015,Jade,1,Kachin State,Gyan Kar(178),14,7,2010,13,10,2015,Gyan Kar,178,2010-7-14,2015-10-13
5,Kabar Tawyin Jade,Private,Oo Si(1/10)(4.2.10),14.7.2010,13.10.2015,Jade,1,Kachin State,Gyan Kar(181),14,7,2010,13,10,2015,Gyan Kar,181,2010-7-14,2015-10-13
6,Kabar Tawyin Jade,Private,Oo Si(1/10)(4.2.10),14.7.2010,13.10.2015,Jade,1,Kachin State,Ma Kar Pin(147),14,7,2010,13,10,2015,Ma Kar Pin,147,2010-7-14,2015-10-13
7,Kabar Tawyin Jade,Private,Oo Si(1/10)(4.2.10),14.7.2010,13.10.2015,Jade,1,Kachin State,Ma Kar Pin(148),14,7,2010,13,10,2015,Ma Kar Pin,148,2010-7-14,2015-10-13
8,Kabar Tawyin Jade,Private,Oo Si(1/10)(4.2.10),14.7.2010,13.10.2015,Jade,1,Kachin State,Ma Kar Pin(149),14,7,2010,13,10,2015,Ma Kar Pin,149,2010-7-14,2015-10-13
9,Kabar Tawyin Jade,Private,Oo Si(1/10)(4.2.10),14.7.2010,13.10.2015,Jade,1,Kachin State,Ma Kar Pin(150),14,7,2010,13,10,2015,Ma Kar Pin,150,2010-7-14,2015-10-13
1,Kabar Thein Nge,Private,Kyi Kyat (12.11.10),2.11.2011,31.1.2017,Jade,1,Kachin State,Nant Myu Kh Phawhtoke(1),2,11,2011,31,1,2017,Nant Myu Kh Phawhtoke,1,2011-11-2,2017-1-31
2,Kabar Thein Nge,Private,Kyi Kyat (12.11.10),2.11.2011,31.1.2017,Jade,1,Kachin State,Nant Myu Kh Phawhtoke(2),2,11,2011,31,1,2017,Nant Myu Kh Phawhtoke,2,2011-11-2,2017-1-31
3,Kabar Thein Nge,Private,Kyi Kyat (12.11.10),2.11.2011,31.1.2017,Jade,1,Kachin State,Nant Myu Kh Phawhtoke(3),2,11,2011,31,1,2017,Nant Myu Kh Phawhtoke,3,2011-11-2,2017-1-31
4,Kabar Thein Nge,Private,Kyi Kyat (12.11.10),2.11.2011,31.1.2017,Jade,1,Kachin State,Nant Myu Kh Phawhtoke(4),2,11,2011,31,1,2017,Nant Myu Kh Phawhtoke,4,2011-11-2,2017-1-31
5,Kabar Thein Nge,Private,Kyi Kyat (12.11.10),2.11.2011,31.1.2017,Jade,1,Kachin State,Nant Myu Kh Phawhtoke(5),2,11,2011,31,1,2017,Nant Myu Kh Phawhtoke,5,2011-11-2,2017-1-31
6,Kabar Thein Nge,Private,Kyi Kyat (12.11.10),2.11.2011,31.1.2017,Jade,1,Kachin State,Nant Myu Kh Phawhtoke(6),2,11,2011,31,1,2017,Nant Myu Kh Phawhtoke,6,2011-11-2,2017-1-31
7,Kabar Thein Nge,Private,Kyi Kyat (12.11.10),2.11.2011,31.1.2017,Jade,1,Kachin State,Nant Myu Kh Phawhtoke(7),2,11,2011,31,1,2017,Nant Myu Kh Phawhtoke,7,2011-11-2,2017-1-31
8,Kabar Thein Nge,Private,Kyi Kyat (12.11.10),2.11.2011,31.1.2017,Jade,1,Kachin State,Nant Myu Kh Phawhtoke(8),2,11,2011,31,1,2017,Nant Myu Kh Phawhtoke,8,2011-11-2,2017-1-31
9,Kabar Thein Nge,Private,Kyi Kyat (12.11.10),2.11.2011,31.1.2017,Jade,1,Kachin State,Nant Myu Kh Phawhtoke(9),2,11,2011,31,1,2017,Nant Myu Kh Phawhtoke,9,2011-11-2,2017-1-31
10,Kabar Thein Nge,Private,Kyi Kyat (12.11.10),2.11.2011,31.1.2017,Jade,1,Kachin State,Nant Myu Kh Phawhtoke(10),2,11,2011,31,1,2017,Nant Myu Kh Phawhtoke,10,2011-11-2,2017-1-31
11,Kabar Thein Nge,Private,Kyi Kyat (12.11.10),2.11.2011,31.1.2017,Jade,1,Kachin State,Nant Het Phawhtoke(36),2,11,2011,31,1,2017,Nant Het Phawhtoke,36,2011-11-2,2017-1-31
12,Kabar Thein Nge,Private,Kyi Kyat (12.11.10),2.11.2011,31.1.2017,Jade,1,Kachin State,Nant Het Phawhtoke(37),2,11,2011,31,1,2017,Nant Het Phawhtoke,37,2011-11-2,2017-1-31
13,Kabar Thein Nge,Private,Kyi Kyat (12.11.10),2.11.2011,31.1.2017,Jade,1,Kachin State,Nant Het Phawhtoke(38),2,11,2011,31,1,2017,Nant Het Phawhtoke,38,2011-11-2,2017-1-31
14,Kabar Thein Nge,Private,Kyi Kyat (12.11.10),2.11.2011,31.1.2017,Jade,1,Kachin State,Nant Het Phawhtoke(39),2,11,2011,31,1,2017,Nant Het Phawhtoke,39,2011-11-2,2017-1-31
15,Kabar Thein Nge,Private,Kyi Kyat (12.11.10),2.11.2011,31.1.2017,Jade,1,Kachin State,Nant Het Phawhtoke(40),2,11,2011,31,1,2017,Nant Het Phawhtoke,40,2011-11-2,2017-1-31
16,Kabar Thein Nge,Private,Kyi Kyat (12.11.10),2.11.2011,31.1.2017,Jade,1,Kachin State,Nant Het Phawhtoke(41),2,11,2011,31,1,2017,Nant Het Phawhtoke,41,2011-11-2,2017-1-31
17,Kabar Thein Nge,Private,Kyi Kyat (12.11.10),2.11.2011,31.1.2017,Jade,1,Kachin State,Nant Het Phawhtoke(42),2,11,2011,31,1,2017,Nant Het Phawhtoke,42,2011-11-2,2017-1-31
18,Kabar Thein Nge,Private,Kyi Kyat (12.11.10),2.11.2011,31.1.2017,Jade,1,Kachin State,Nant Het Phawhtoke(43),2,11,2011,31,1,2017,Nant Het Phawhtoke,43,2011-11-2,2017-1-31
19,Kabar Thein Nge,Private,Kyi Kyat (12.11.10),2.11.2011,31.1.2017,Jade,1,Kachin State,Nant Het Phawhtoke(44),2,11,2011,31,1,2017,Nant Het Phawhtoke,44,2011-11-2,2017-1-31
20,Kabar Thein Nge,Private,Kyi Kyat (12.11.10),2.11.2011,31.1.2017,Jade,1,Kachin State,Nant Het Phawhtoke(45),2,11,2011,31,1,2017,Nant Het Phawhtoke,45,2011-11-2,2017-1-31
21,Kabar Thein Nge,Private,Kyi Kyat (12.11.10),2.11.2011,31.1.2017,Jade,1,Kachin State,Nant Het Phawhtoke(46),2,11,2011,31,1,2017,Nant Het Phawhtoke,46,2011-11-2,2017-1-31
22,Kabar Thein Nge,Private,Kyi Kyat (12.11.10),2.11.2011,31.1.2017,Jade,1,Kachin State,Nant Het Phawhtoke(47),2,11,2011,31,1,2017,Nant Het Phawhtoke,47,2011-11-2,2017-1-31
23,Kabar Thein Nge,Private,Kyi Kyat (12.11.10),2.11.2011,31.1.2017,Jade,1,Kachin State,Nant Het Phawhtoke(48),2,11,2011,31,1,2017,Nant Het Phawhtoke,48,2011-11-2,2017-1-31
24,Kabar Thein Nge,Private,Kyi Kyat (12.11.10),2.11.2011,31.1.2017,Jade,1,Kachin State,Nant Het Phawhtoke(49),2,11,2011,31,1,2017,Nant Het Phawhtoke,49,2011-11-2,2017-1-31
25,Kabar Thein Nge,Private,Kyi Kyat (12.11.10),2.11.2011,31.1.2017,Jade,1,Kachin State,Nant Het Phawhtoke(50),2,11,2011,31,1,2017,Nant Het Phawhtoke,50,2011-11-2,2017-1-31
26,Kabar Thein Nge,Private,Kyi Kyat (12.11.10),2.11.2011,31.1.2017,Jade,1,Kachin State,Nant Het Phawhtoke(51),2,11,2011,31,1,2017,Nant Het Phawhtoke,51,2011-11-2,2017-1-31
27,Kabar Thein Nge,Private,Kyi Kyat (12.11.10),2.11.2011,31.1.2017,Jade,1,Kachin State,Nant Het Phawhtoke(52),2,11,2011,31,1,2017,Nant Het Phawhtoke,52,2011-11-2,2017-1-31
28,Kabar Thein Nge,Private,Kyi Kyat (12.11.10),2.11.2011,31.1.2017,Jade,1,Kachin State,Nant Het Phawhtoke(53),2,11,2011,31,1,2017,Nant Het Phawhtoke,53,2011-11-2,2017-1-31
29,Kabar Thein Nge,Private,Kyi Kyat (12.11.10),2.11.2011,31.1.2017,Jade,1,Kachin State,Nant Het Phawhtoke(54),2,11,2011,31,1,2017,Nant Het Phawhtoke,54,2011-11-2,2017-1-31
30,Kabar Thein Nge,Private,Kyi Kyat (12.11.10),2.11.2011,31.1.2017,Jade,1,Kachin State,Nant Het Phawhtoke(55),2,11,2011,31,1,2017,Nant Het Phawhtoke,55,2011-11-2,2017-1-31
31,Kabar Thein Nge,Private,Kyi Kyat (12.11.10),2.11.2011,31.1.2017,Jade,1,Kachin State,Nant Het Phawhtoke(56),2,11,2011,31,1,2017,Nant Het Phawhtoke,56,2011-11-2,2017-1-31
32,Kabar Thein Nge,Private,Kyi Kyat (12.11.10),2.11.2011,31.1.2017,Jade,1,Kachin State,Nant Het Phawhtoke(57),2,11,2011,31,1,2017,Nant Het Phawhtoke,57,2011-11-2,2017-1-31
33,Kabar Thein Nge,Private,Kyi Kyat (12.11.10),2.11.2011,31.1.2017,Jade,1,Kachin State,Nant Het Phawhtoke(58),2,11,2011,31,1,2017,Nant Het Phawhtoke,58,2011-11-2,2017-1-31
34,Kabar Thein Nge,Private,Kyi Kyat (12.11.10),2.11.2011,31.1.2017,Jade,1,Kachin State,Maw Lu Phawhtoke(100),2,11,2011,31,1,2017,Maw Lu Phawhtoke,100,2011-11-2,2017-1-31
35,Kabar Thein Nge,Private,Kyi Kyat (12.11.10),2.11.2011,31.1.2017,Jade,1,Kachin State,Maw Lu Phawhtoke(101),2,11,2011,31,1,2017,Maw Lu Phawhtoke,101,2011-11-2,2017-1-31
36,Kabar Thein Nge,Private,Kyi Kyat (12.11.10),2.11.2011,31.1.2017,Jade,1,Kachin State,Maw Lu Phawhtoke(102),2,11,2011,31,1,2017,Maw Lu Phawhtoke,102,2011-11-2,2017-1-31
37,Kabar Thein Nge,Private,Kyi Kyat (12.11.10),2.11.2011,31.1.2017,Jade,1,Kachin State,Maw Lu Phawhtoke(103),2,11,2011,31,1,2017,Maw Lu Phawhtoke,103,2011-11-2,2017-1-31
38,Kabar Thein Nge,Private,Kyi Kyat (12.11.10),2.11.2011,31.1.2017,Jade,1,Kachin State,Maw Lu Phawhtoke(104),2,11,2011,31,1,2017,Maw Lu Phawhtoke,104,2011-11-2,2017-1-31
39,Kabar Thein Nge,Private,Kyi Kyat (12.11.10),2.11.2011,31.1.2017,Jade,1,Kachin State,Maw Lu Phawhtoke(106),2,11,2011,31,1,2017,Maw Lu Phawhtoke,106,2011-11-2,2017-1-31
40,Kabar Thein Nge,Private,Kyi Kyat (12.11.10),2.11.2011,31.1.2017,Jade,1,Kachin State,Maw Lu Phawhtoke(107),2,11,2011,31,1,2017,Maw Lu Phawhtoke,107,2011-11-2,2017-1-31
41,Kabar Thein Nge,Private,Kyi Kyat (12.11.10),2.11.2011,31.1.2017,Jade,1,Kachin State,Maw Lu Phawhtoke(108),2,11,2011,31,1,2017,Maw Lu Phawhtoke,108,2011-11-2,2017-1-31
42,Kabar Thein Nge,Private,Kyi Kyat (12.11.10),2.11.2011,31.1.2017,Jade,1,Kachin State,Maw Lu Phawhtoke(109),2,11,2011,31,1,2017,Maw Lu Phawhtoke,109,2011-11-2,2017-1-31
43,Kabar Thein Nge,Private,Kyi Kyat (12.11.10),2.11.2011,31.1.2017,Jade,1,Kachin State,Maw Lu Phawhtoke(110),2,11,2011,31,1,2017,Maw Lu Phawhtoke,110,2011-11-2,2017-1-31
44,Kabar Thein Nge,Private,Kyi Kyat (12.11.10),2.11.2011,31.1.2017,Jade,1,Kachin State,Maw Lu Phawhtoke(113),2,11,2011,31,1,2017,Maw Lu Phawhtoke,113,2011-11-2,2017-1-31
45,Kabar Thein Nge,Private,Kyi Kyat (12.11.10),2.11.2011,31.1.2017,Jade,1,Kachin State,Maw Lu Phawhtoke(114),2,11,2011,31,1,2017,Maw Lu Phawhtoke,114,2011-11-2,2017-1-31
46,Kabar Thein Nge,Private,Kyi Kyat (12.11.10),2.11.2011,31.1.2017,Jade,1,Kachin State,Maw Lu Phawhtoke(115),2,11,2011,31,1,2017,Maw Lu Phawhtoke,115,2011-11-2,2017-1-31
47,Kabar Thein Nge,Private,Kyi Kyat (12.11.10),2.11.2011,31.1.2017,Jade,1,Kachin State,Maw Lu Phawhtoke(116),2,11,2011,31,1,2017,Maw Lu Phawhtoke,116,2011-11-2,2017-1-31
48,Kabar Thein Nge,Private,Kyi Kyat (12.11.10),2.11.2011,31.1.2017,Jade,1,Kachin State,Maw Lu Phawhtoke(117),2,11,2011,31,1,2017,Maw Lu Phawhtoke,117,2011-11-2,2017-1-31
49,Kabar Thein Nge,Private,Kyi Kyat (12.11.10),2.11.2011,31.1.2017,Jade,1,Kachin State,Maw Lu Phawhtoke(119),2,11,2011,31,1,2017,Maw Lu Phawhtoke,119,2011-11-2,2017-1-31
50,Kabar Thein Nge,Private,Kyi Kyat (12.11.10),2.11.2011,31.1.2017,Jade,1,Kachin State,Maw Lu Phawhtoke(120),2,11,2011,31,1,2017,Maw Lu Phawhtoke,120,2011-11-2,2017-1-31
1,Kayar Htar Ni,Private,Oo Si (4/13)(16.3.13),10.9.2013,9.9.2016,Gem,1,Shan State,Lwai Saung htauk(Ta-12),10,9,2013,9,9,2016,Lwai Saung htauk,Ta-12,2013-9-10,2016-9-9
1,Kalatsix Jade,Private,Oo Si(3/15)(4.9.15),3.12.2015,2.12.2018,Jade,1,Kachin State,Ma Kyan Ka Phaw Htot(556),3,12,2015,2,12,2018,Ma Kyan Ka Phaw Htot,556,2015-12-3,2018-12-2
2,Kalatsix Jade,Private,Oo Si(3/15)(4.9.15),3.12.2015,2.12.2018,Jade,1,Kachin State,Ma Kyan Ka Phaw Htot(557),3,12,2015,2,12,2018,Ma Kyan Ka Phaw Htot,557,2015-12-3,2018-12-2
3,Kalatsix Jade,Private,Oo Si(3/15)(4.9.15),3.12.2015,2.12.2018,Jade,1,Kachin State,Ma Kyan Ka Phaw Htot(558),3,12,2015,2,12,2018,Ma Kyan Ka Phaw Htot,558,2015-12-3,2018-12-2
4,Kalatsix Jade,Private,Oo Si(3/15)(4.9.15),3.12.2015,2.12.2018,Jade,1,Kachin State,Ma Kyan Ka Phaw Htot(559),3,12,2015,2,12,2018,Ma Kyan Ka Phaw Htot,559,2015-12-3,2018-12-2
5,Kalatsix Jade,Private,Oo Si(3/15)(4.9.15),3.12.2015,2.12.2018,Jade,1,Kachin State,Ma Kyan Ka Phaw Htot(560),3,12,2015,2,12,2018,Ma Kyan Ka Phaw Htot,560,2015-12-3,2018-12-2
6,Kalatsix Jade,Private,Oo Si(3/15)(4.9.15),3.12.2015,2.12.2018,Jade,1,Kachin State,Ma Kyan Ka Phaw Htot(561),3,12,2015,2,12,2018,Ma Kyan Ka Phaw Htot,561,2015-12-3,2018-12-2
7,Kalatsix Jade,Private,Oo Si(4/15)(18.12.15),2.1.2016,1.1.2019,Jade,1,Kachin State,Ma Kyan Ka Phaw Htot(562),2,1,2016,1,1,2019,Ma Kyan Ka Phaw Htot,562,2016-1-2,2019-1-1
8,Kalatsix Jade,Private,Oo Si(4/15)(18.12.15),2.1.2016,1.1.2019,Jade,1,Kachin State,Ma Kyan Ka Phaw Htot(563),2,1,2016,1,1,2019,Ma Kyan Ka Phaw Htot,563,2016-1-2,2019-1-1
9,Kalatsix Jade,Private,Oo Si(4/15)(18.12.15),2.1.2016,1.1.2019,Jade,1,Kachin State,Ma Kyan Ka Phaw Htot(564),2,1,2016,1,1,2019,Ma Kyan Ka Phaw Htot,564,2016-1-2,2019-1-1
10,Kalatsix Jade,Private,Oo Si(4/15)(18.12.15),2.1.2016,1.1.2019,Jade,1,Kachin State,Ma Kyan Ka Phaw Htot(565),2,1,2016,1,1,2019,Ma Kyan Ka Phaw Htot,565,2016-1-2,2019-1-1
11,Kalatsix Jade,Private,Oo Si(4/15)(18.12.15),2.1.2016,1.1.2019,Jade,1,Kachin State,Ma Kyan Ka Phaw Htot(566),2,1,2016,1,1,2019,Ma Kyan Ka Phaw Htot,566,2016-1-2,2019-1-1
12,Kalatsix Jade,Private,Oo Si(4/15)(18.12.15),2.1.2016,1.1.2019,Jade,1,Kachin State,Ma Kyan Ka Phaw Htot(567),2,1,2016,1,1,2019,Ma Kyan Ka Phaw Htot,567,2016-1-2,2019-1-1
13,Kalatsix Jade,Private,Oo Si(4/15)(18.12.15),2.1.2016,1.1.2019,Jade,1,Kachin State,Ma Kyan Ka Phaw Htot(568),2,1,2016,1,1,2019,Ma Kyan Ka Phaw Htot,568,2016-1-2,2019-1-1
14,Kalatsix Jade,Private,Oo Si(4/15)(18.12.15),2.1.2016,1.1.2019,Jade,1,Kachin State,Ma Kyan Ka Phaw Htot(569),2,1,2016,1,1,2019,Ma Kyan Ka Phaw Htot,569,2016-1-2,2019-1-1
15,Kalatsix Jade,Private,Oo Si(4/15)(18.12.15),2.1.2016,1.1.2019,Jade,1,Kachin State,Ma Kyan Ka Phaw Htot(570),2,1,2016,1,1,2019,Ma Kyan Ka Phaw Htot,570,2016-1-2,2019-1-1
16,Kalatsix Jade,Private,Oo Si(4/15)(18.12.15),2.1.2016,1.1.2019,Jade,1,Kachin State,Ma Kyan Ka Phaw Htot(571),2,1,2016,1,1,2019,Ma Kyan Ka Phaw Htot,571,2016-1-2,2019-1-1
17,Kalatsix Jade,Private,Oo Si(4/15)(18.12.15),2.1.2016,1.1.2019,Jade,1,Kachin State,Ma Kyan Ka Phaw Htot(572),2,1,2016,1,1,2019,Ma Kyan Ka Phaw Htot,572,2016-1-2,2019-1-1
18,Kalatsix Jade,Private,Oo Si(4/15)(18.12.15),2.1.2016,1.1.2019,Jade,1,Kachin State,Ma Kyan Ka Phaw Htot(573),2,1,2016,1,1,2019,Ma Kyan Ka Phaw Htot,573,2016-1-2,2019-1-1
19,Kalatsix Jade,Private,Oo Si(4/15)(18.12.15),2.1.2016,1.1.2019,Jade,1,Kachin State,Ma Kyan Ka Phaw Htot(574),2,1,2016,1,1,2019,Ma Kyan Ka Phaw Htot,574,2016-1-2,2019-1-1
20,Kalatsix Jade,Private,Oo Si(4/15)(18.12.15),2.1.2016,1.1.2019,Jade,1,Kachin State,Ma Kyan Ka Phaw Htot(575),2,1,2016,1,1,2019,Ma Kyan Ka Phaw Htot,575,2016-1-2,2019-1-1
21,Kalatsix Jade,Private,Oo Si(4/15)(18.12.15),2.1.2016,1.1.2019,Jade,1,Kachin State,Ma Kyan Ka Phaw Htot(576),2,1,2016,1,1,2019,Ma Kyan Ka Phaw Htot,576,2016-1-2,2019-1-1
22,Kalatsix Jade,Private,Oo Si(4/15)(18.12.15),2.1.2016,1.1.2019,Jade,1,Kachin State,Ma Kyan Ka Phaw Htot(577),2,1,2016,1,1,2019,Ma Kyan Ka Phaw Htot,577,2016-1-2,2019-1-1
23,Kalatsix Jade,Private,Oo Si(4/15)(18.12.15),2.1.2016,1.1.2019,Jade,1,Kachin State,Ma Kyan Ka Phaw Htot(578),2,1,2016,1,1,2019,Ma Kyan Ka Phaw Htot,578,2016-1-2,2019-1-1
24,Kalatsix Jade,Private,Oo Si(4/15)(18.12.15),2.1.2016,1.1.2019,Jade,1,Kachin State,Ma Kyan Ka Phaw Htot(579),2,1,2016,1,1,2019,Ma Kyan Ka Phaw Htot,579,2016-1-2,2019-1-1
25,Kalatsix Jade,Private,Oo Si(4/15)(18.12.15),2.1.2016,1.1.2019,Jade,1,Kachin State,Ma Kyan Ka Phaw Htot(580),2,1,2016,1,1,2019,Ma Kyan Ka Phaw Htot,580,2016-1-2,2019-1-1
26,Kalatsix Jade,Private,Oo Si(4/15)(18.12.15),2.1.2016,1.1.2019,Jade,1,Kachin State,Ma Kyan Ka Phaw Htot(581),2,1,2016,1,1,2019,Ma Kyan Ka Phaw Htot,581,2016-1-2,2019-1-1
27,Kalatsix Jade,Private,Oo Si(4/15)(18.12.15),2.1.2016,1.1.2019,Jade,1,Kachin State,Ma Kyan Ka Phaw Htot(582),2,1,2016,1,1,2019,Ma Kyan Ka Phaw Htot,582,2016-1-2,2019-1-1
28,Kalatsix Jade,Private,Oo Si(4/15)(18.12.15),2.1.2016,1.1.2019,Jade,1,Kachin State,Ma Kyan Ka Phaw Htot(583),2,1,2016,1,1,2019,Ma Kyan Ka Phaw Htot,583,2016-1-2,2019-1-1
29,Kalatsix Jade,Private,Oo Si(4/15)(18.12.15),2.1.2016,1.1.2019,Jade,1,Kachin State,Ma Kyan Ka Phaw Htot(584),2,1,2016,1,1,2019,Ma Kyan Ka Phaw Htot,584,2016-1-2,2019-1-1
30,Kalatsix Jade,Private,Oo Si(4/15)(18.12.15),2.1.2016,1.1.2019,Jade,1,Kachin State,Ma Kyan Ka Phaw Htot(585),2,1,2016,1,1,2019,Ma Kyan Ka Phaw Htot,585,2016-1-2,2019-1-1
31,Kalatsix Jade,Private,Oo Si(4/15)(18.12.15),2.1.2016,1.1.2019,Jade,1,Kachin State,Ma Kyan Ka Phaw Htot(586),2,1,2016,1,1,2019,Ma Kyan Ka Phaw Htot,586,2016-1-2,2019-1-1
32,Kalatsix Jade,Private,Oo Si(4/15)(18.12.15),2.1.2016,1.1.2019,Jade,1,Kachin State,Ma Kyan Ka Phaw Htot(587),2,1,2016,1,1,2019,Ma Kyan Ka Phaw Htot,587,2016-1-2,2019-1-1
33,Kalatsix Jade,Private,Oo Si(4/15)(18.12.15),2.1.2016,1.1.2019,Jade,1,Kachin State,Ma Kyan Ka Phaw Htot(588),2,1,2016,1,1,2019,Ma Kyan Ka Phaw Htot,588,2016-1-2,2019-1-1
34,Kalatsix Jade,Private,Oo Si(4/15)(18.12.15),2.1.2016,1.1.2019,Jade,1,Kachin State,Ma Kyan Ka Phaw Htot(589),2,1,2016,1,1,2019,Ma Kyan Ka Phaw Htot,589,2016-1-2,2019-1-1
35,Kalatsix Jade,Private,Oo Si(4/15)(18.12.15),2.1.2016,1.1.2019,Jade,1,Kachin State,Ma Kyan Ka Phaw Htot(590),2,1,2016,1,1,2019,Ma Kyan Ka Phaw Htot,590,2016-1-2,2019-1-1
36,Kalatsix Jade,Private,Oo Si(4/15)(18.12.15),2.1.2016,1.1.2019,Jade,1,Kachin State,Ma Kyan Ka Phaw Htot(591),2,1,2016,1,1,2019,Ma Kyan Ka Phaw Htot,591,2016-1-2,2019-1-1
37,Kalatsix Jade,Private,Oo Si(4/15)(18.12.15),2.1.2016,1.1.2019,Jade,1,Kachin State,Ma Kyan Ka Phaw Htot(592),2,1,2016,1,1,2019,Ma Kyan Ka Phaw Htot,592,2016-1-2,2019-1-1
38,Kalatsix Jade,Private,Oo Si(4/15)(18.12.15),2.1.2016,1.1.2019,Jade,1,Kachin State,Ma Kyan Ka Phaw Htot(593),2,1,2016,1,1,2019,Ma Kyan Ka Phaw Htot,593,2016-1-2,2019-1-1
39,Kalatsix Jade,Private,Oo Si(4/15)(18.12.15),2.1.2016,1.1.2019,Jade,1,Kachin State,Ma Kyan Ka Phaw Htot(594),2,1,2016,1,1,2019,Ma Kyan Ka Phaw Htot,594,2016-1-2,2019-1-1
40,Kalatsix Jade,Private,Oo Si(4/15)(18.12.15),2.1.2016,1.1.2019,Jade,1,Kachin State,Ma Kyan Ka Phaw Htot(595),2,1,2016,1,1,2019,Ma Kyan Ka Phaw Htot,595,2016-1-2,2019-1-1
41,Kalatsix Jade,Private,Oo Si(4/15)(18.12.15),2.1.2016,1.1.2019,Jade,1,Kachin State,Ma Kyan Ka Phaw Htot(596),2,1,2016,1,1,2019,Ma Kyan Ka Phaw Htot,596,2016-1-2,2019-1-1
42,Kalatsix Jade,Private,Oo Si(4/15)(18.12.15),2.1.2016,1.1.2019,Jade,1,Kachin State,Ma Kyan Ka Phaw Htot(597),2,1,2016,1,1,2019,Ma Kyan Ka Phaw Htot,597,2016-1-2,2019-1-1
43,Kalatsix Jade,Private,Oo Si(4/15)(18.12.15),2.1.2016,1.1.2019,Jade,1,Kachin State,Ma Kyan Ka Phaw Htot(598),2,1,2016,1,1,2019,Ma Kyan Ka Phaw Htot,598,2016-1-2,2019-1-1
44,Kalatsix Jade,Private,Oo Si(4/15)(18.12.15),2.1.2016,1.1.2019,Jade,1,Kachin State,Ma Kyan Ka Phaw Htot(599),2,1,2016,1,1,2019,Ma Kyan Ka Phaw Htot,599,2016-1-2,2019-1-1
45,Kalatsix Jade,Private,Oo Si(4/15)(18.12.15),2.1.2016,1.1.2019,Jade,1,Kachin State,Ma Kyan Ka Phaw Htot(600),2,1,2016,1,1,2019,Ma Kyan Ka Phaw Htot,600,2016-1-2,2019-1-1
46,Kalatsix Jade,Private,Oo Si(4/15)(18.12.15),2.1.2016,1.1.2019,Jade,1,Kachin State,Ma Kyan Ka Phaw Htot(601),2,1,2016,1,1,2019,Ma Kyan Ka Phaw Htot,601,2016-1-2,2019-1-1
47,Kalatsix Jade,Private,Oo Si(4/15)(18.12.15),2.1.2016,1.1.2019,Jade,1,Kachin State,Ma Kyan Ka Phaw Htot(602),2,1,2016,1,1,2019,Ma Kyan Ka Phaw Htot,602,2016-1-2,2019-1-1
48,Kalatsix Jade,Private,Oo Si(4/15)(18.12.15),2.1.2016,1.1.2019,Jade,1,Kachin State,Ma Kyan Ka Phaw Htot(603),2,1,2016,1,1,2019,Ma Kyan Ka Phaw Htot,603,2016-1-2,2019-1-1
49,Kalatsix Jade,Private,Oo Si(4/15)(18.12.15),2.1.2016,1.1.2019,Jade,1,Kachin State,Ma Kyan Ka Phaw Htot(604),2,1,2016,1,1,2019,Ma Kyan Ka Phaw Htot,604,2016-1-2,2019-1-1
50,Kalatsix Jade,Private,Oo Si(4/15)(18.12.15),2.1.2016,1.1.2019,Jade,1,Kachin State,Ma Kyan Ka Phaw Htot(605),2,1,2016,1,1,2019,Ma Kyan Ka Phaw Htot,605,2016-1-2,2019-1-1
1,Ka T Kwin,Private,Oo Si(1/11)(14.5.11),11.5.2011,9.8.2016,Jade,1,Kachin State,Sport(195),11,5,2011,9,8,2016,Sport,195,2011-5-11,2016-8-9
2,Ka T Kwin,Private,Oo Si(1/11)(14.5.11),11.5.2011,9.8.2016,Jade,1,Kachin State,Sport(196),11,5,2011,9,8,2016,Sport,196,2011-5-11,2016-8-9
3,Ka T Kwin,Private,Oo Si(1/11)(14.5.11),11.5.2011,9.8.2016,Jade,1,Kachin State,Sport(197),11,5,2011,9,8,2016,Sport,197,2011-5-11,2016-8-9
4,Ka T Kwin,Private,Oo Si(1/11)(14.5.11),11.5.2011,9.8.2016,Jade,1,Kachin State,Sport(198),11,5,2011,9,8,2016,Sport,198,2011-5-11,2016-8-9
5,Ka T Kwin,Private,Oo Si(3/11)(29.5.11),8.9.2011,8.12.2018,Jade,1,Kachin State,Maw One Gyi(198),8,9,2011,8,12,2018,Maw One Gyi,198,2011-9-8,2018-12-8
6,Yadana Sin Thiri,Private,Oo Si(3/15)(4.9.15),17.12.2015,16.12.2018,Jade,1,Kachin State,Ma Mon(190),17,12,2015,16,12,2018,Ma Mon,190,2015-12-17,2018-12-16
7,Yadana Sin Thiri,Private,Oo Si(3/15)(4.9.15),17.12.2015,16.12.2018,Jade,1,Kachin State,Ma Mon(191),17,12,2015,16,12,2018,Ma Mon,191,2015-12-17,2018-12-16
1,Kan Kaung Taw Jade King,Private,Oo Si(3/11)(11.12.14),20.1.2015,19.1.2018,Jade,1,Kachin State,Mar Sar(58),20,1,2015,19,1,2018,Mar Sar,58,2015-1-20,2018-1-19
2,Kan Kaung Thaw Jade King,Private,Kyi Kyat (19.10.10),15.11.2010,14.2.2016,Jade,1,Kachin State,Namachi  Phawhtoke(744),15,11,2010,14,2,2016,Namachi  Phawhtoke,744,2010-11-15,2016-2-14
3,Kan Kaung Thaw Jade King,Private,Kyi Kyat (19.10.10),15.11.2010,14.2.2016,Jade,1,Kachin State,Namachi  Phawhtoke(745),15,11,2010,14,2,2016,Namachi  Phawhtoke,745,2010-11-15,2016-2-14
4,Kan Kaung Thaw Jade King,Private,Kyi Kyat (19.10.10),15.11.2010,14.2.2016,Jade,1,Kachin State,Namachi  Phawhtoke(746),15,11,2010,14,2,2016,Namachi  Phawhtoke,746,2010-11-15,2016-2-14
5,Kan Kaung Thaw Jade King,Private,Kyi Kyat (19.10.10),15.11.2010,14.2.2016,Jade,1,Kachin State,Namachi  Phawhtoke(747),15,11,2010,14,2,2016,Namachi  Phawhtoke,747,2010-11-15,2016-2-14
6,Kan Kaung Thaw Jade King,Private,Kyi Kyat (19.10.10),15.11.2010,14.2.2016,Jade,1,Kachin State,Namachi  Phawhtoke(748),15,11,2010,14,2,2016,Namachi  Phawhtoke,748,2010-11-15,2016-2-14
7,Kan Kaung Thaw Jade King,Private,Kyi Kyat (19.10.10),15.11.2010,14.2.2016,Jade,1,Kachin State,Namachi  Phawhtoke(749),15,11,2010,14,2,2016,Namachi  Phawhtoke,749,2010-11-15,2016-2-14
8,Kan Kaung Thaw Jade King,Private,Kyi Kyat (19.10.10),15.11.2010,14.2.2016,Jade,1,Kachin State,Namachi  Phawhtoke(750),15,11,2010,14,2,2016,Namachi  Phawhtoke,750,2010-11-15,2016-2-14
9,Kan Kaung Thaw Jade King,Private,Kyi Kyat (19.10.10),15.11.2010,14.2.2016,Jade,1,Kachin State,Namachi  Phawhtoke(751),15,11,2010,14,2,2016,Namachi  Phawhtoke,751,2010-11-15,2016-2-14
10,Kan Kaung Thaw Jade King,Private,Kyi Kyat (19.10.10),15.11.2010,14.2.2016,Jade,1,Kachin State,Namachi  Phawhtoke(752),15,11,2010,14,2,2016,Namachi  Phawhtoke,752,2010-11-15,2016-2-14
11,Kan Kaung Thaw Jade King,Private,Kyi Kyat (19.10.10),15.11.2010,14.2.2016,Jade,1,Kachin State,Namachi  Phawhtoke(753),15,11,2010,14,2,2016,Namachi  Phawhtoke,753,2010-11-15,2016-2-14
12,Kan Kaung Thaw Jade King,Private,Kyi Kyat (19.10.10),15.11.2010,14.2.2016,Jade,1,Kachin State,Namachi  Phawhtoke(754),15,11,2010,14,2,2016,Namachi  Phawhtoke,754,2010-11-15,2016-2-14
13,Kan Kaung Thaw Jade King,Private,Kyi Kyat (19.10.10),15.11.2010,14.2.2016,Jade,1,Kachin State,Namachi  Phawhtoke(755),15,11,2010,14,2,2016,Namachi  Phawhtoke,755,2010-11-15,2016-2-14
14,Kan Kaung Thaw Jade King,Private,Kyi Kyat (19.10.10),15.11.2010,14.2.2016,Jade,1,Kachin State,Namachi  Phawhtoke(756),15,11,2010,14,2,2016,Namachi  Phawhtoke,756,2010-11-15,2016-2-14
15,Kan Kaung Thaw Jade King,Private,Kyi Kyat (19.10.10),15.11.2010,14.2.2016,Jade,1,Kachin State,Namachi  Phawhtoke(757),15,11,2010,14,2,2016,Namachi  Phawhtoke,757,2010-11-15,2016-2-14
16,Kan Kaung Thaw Jade King,Private,Kyi Kyat (19.10.10),15.11.2010,14.2.2016,Jade,1,Kachin State,Namachi  Phawhtoke(758),15,11,2010,14,2,2016,Namachi  Phawhtoke,758,2010-11-15,2016-2-14
17,Kan Kaung Thaw Jade King,Private,Kyi Kyat (19.10.10),15.11.2010,14.2.2016,Jade,1,Kachin State,Namachi  Phawhtoke(759),15,11,2010,14,2,2016,Namachi  Phawhtoke,759,2010-11-15,2016-2-14
18,Kan Kaung Thaw Jade King,Private,Kyi Kyat (19.10.10),15.11.2010,14.2.2016,Jade,1,Kachin State,Namachi  Phawhtoke(760),15,11,2010,14,2,2016,Namachi  Phawhtoke,760,2010-11-15,2016-2-14
19,Kan Kaung Thaw Jade King,Private,Kyi Kyat (19.10.10),15.11.2010,14.2.2016,Jade,1,Kachin State,Namachi  Phawhtoke(761),15,11,2010,14,2,2016,Namachi  Phawhtoke,761,2010-11-15,2016-2-14
20,Kan Kaung Thaw Jade King,Private,Kyi Kyat (19.10.10),15.11.2010,14.2.2016,Jade,1,Kachin State,Namachi  Phawhtoke(762),15,11,2010,14,2,2016,Namachi  Phawhtoke,762,2010-11-15,2016-2-14
21,Kan Kaung Thaw Jade King,Private,Kyi Kyat (19.10.10),15.11.2010,14.2.2016,Jade,1,Kachin State,Namachi  Phawhtoke(763),15,11,2010,14,2,2016,Namachi  Phawhtoke,763,2010-11-15,2016-2-14
22,Kan Kaung Thaw Jade King,Private,Kyi Kyat (19.10.10),15.11.2010,14.2.2016,Jade,1,Kachin State,Namachi  Phawhtoke(764),15,11,2010,14,2,2016,Namachi  Phawhtoke,764,2010-11-15,2016-2-14
23,Kan Kaung Thaw Jade King,Private,Kyi Kyat (19.10.10),15.11.2010,14.2.2016,Jade,1,Kachin State,Namachi  Phawhtoke(765),15,11,2010,14,2,2016,Namachi  Phawhtoke,765,2010-11-15,2016-2-14
24,Kan Kaung Thaw Jade King,Private,Kyi Kyat (19.10.10),15.11.2010,14.2.2016,Jade,1,Kachin State,Namachi  Phawhtoke(766),15,11,2010,14,2,2016,Namachi  Phawhtoke,766,2010-11-15,2016-2-14
25,Kan Kaung Thaw Jade King,Private,Kyi Kyat (19.10.10),15.11.2010,14.2.2016,Jade,1,Kachin State,Namachi  Phawhtoke(767),15,11,2010,14,2,2016,Namachi  Phawhtoke,767,2010-11-15,2016-2-14
26,Kan Kaung Thaw Jade King,Private,Kyi Kyat (19.10.10),15.11.2010,14.2.2016,Jade,1,Kachin State,Namachi  Phawhtoke(768),15,11,2010,14,2,2016,Namachi  Phawhtoke,768,2010-11-15,2016-2-14
27,Kan Kaung Thaw Jade King,Private,Kyi Kyat (19.10.10),15.11.2010,14.2.2016,Jade,1,Kachin State,Namachi  Phawhtoke(769),15,11,2010,14,2,2016,Namachi  Phawhtoke,769,2010-11-15,2016-2-14
28,Kan Kaung Thaw Jade King,Private,Kyi Kyat (19.10.10),15.11.2010,14.2.2016,Jade,1,Kachin State,Namachi Phawhtoke(770),15,11,2010,14,2,2016,Namachi Phawhtoke,770,2010-11-15,2016-2-14
29,Kan Kaung Thaw Jade King,Private,Kyi Kyat (19.10.10),15.11.2010,14.2.2016,Jade,1,Kachin State,Namachi  Phawhtoke(771),15,11,2010,14,2,2016,Namachi  Phawhtoke,771,2010-11-15,2016-2-14
30,Kan Kaung Thaw Jade King,Private,Kyi Kyat (19.10.10),15.11.2010,14.2.2016,Jade,1,Kachin State,Namachi  Phawhtoke(772),15,11,2010,14,2,2016,Namachi  Phawhtoke,772,2010-11-15,2016-2-14
31,Kan Kaung Thaw Jade King,Private,Kyi Kyat (19.10.10),15.11.2010,14.2.2016,Jade,1,Kachin State,Namachi  Phawhtoke(773),15,11,2010,14,2,2016,Namachi  Phawhtoke,773,2010-11-15,2016-2-14
32,Kan Kaung Thaw Jade King,Private,Kyi Kyat (19.10.10),15.11.2010,14.2.2016,Jade,1,Kachin State,Namachi  Phawhtoke(774),15,11,2010,14,2,2016,Namachi  Phawhtoke,774,2010-11-15,2016-2-14
33,Kan Kaung Thaw Jade King,Private,Kyi Kyat (19.10.10),15.11.2010,14.2.2016,Jade,1,Kachin State,Namachi  Phawhtoke(775),15,11,2010,14,2,2016,Namachi  Phawhtoke,775,2010-11-15,2016-2-14
34,Kan Kaung Thaw Jade King,Private,Kyi Kyat (19.10.10),15.11.2010,14.2.2016,Jade,1,Kachin State,Namachi  Phawhtoke(776),15,11,2010,14,2,2016,Namachi  Phawhtoke,776,2010-11-15,2016-2-14
35,Kan Kaung Thaw Jade King,Private,Kyi Kyat (19.10.10),15.11.2010,14.2.2016,Jade,1,Kachin State,Namachi  Phawhtoke(777),15,11,2010,14,2,2016,Namachi  Phawhtoke,777,2010-11-15,2016-2-14
36,Kan Kaung Thaw Jade King,Private,Kyi Kyat (19.10.10),15.11.2010,14.2.2016,Jade,1,Kachin State,Namachi  Phawhtoke(778),15,11,2010,14,2,2016,Namachi  Phawhtoke,778,2010-11-15,2016-2-14
37,Kan Kaung Thaw Jade King,Private,Kyi Kyat (19.10.10),15.11.2010,14.2.2016,Jade,1,Kachin State,Namachi  Phawhtoke(779),15,11,2010,14,2,2016,Namachi  Phawhtoke,779,2010-11-15,2016-2-14
38,Kan Kaung Thaw Jade King,Private,Kyi Kyat (19.10.10),15.11.2010,14.2.2016,Jade,1,Kachin State,Namachi  Phawhtoke(780),15,11,2010,14,2,2016,Namachi  Phawhtoke,780,2010-11-15,2016-2-14
39,Kan Kaung Thaw Jade King,Private,Kyi Kyat (19.10.10),15.11.2010,14.2.2016,Jade,1,Kachin State,Namachi  Phawhtoke(781),15,11,2010,14,2,2016,Namachi  Phawhtoke,781,2010-11-15,2016-2-14
40,Kan Kaung Thaw Jade King,Private,Kyi Kyat (19.10.10),15.11.2010,14.2.2016,Jade,1,Kachin State,Namachi  Phawhtoke(782),15,11,2010,14,2,2016,Namachi  Phawhtoke,782,2010-11-15,2016-2-14
41,Kan Kaung Thaw Jade King,Private,Kyi Kyat (19.10.10),15.11.2010,14.2.2016,Jade,1,Kachin State,Namachi  Phawhtoke(783),15,11,2010,14,2,2016,Namachi  Phawhtoke,783,2010-11-15,2016-2-14
42,Kan Kaung Thaw Jade King,Private,Kyi Kyat (19.10.10),15.11.2010,14.2.2016,Jade,1,Kachin State,Namachi  Phawhtoke(784),15,11,2010,14,2,2016,Namachi  Phawhtoke,784,2010-11-15,2016-2-14
1,Kan Kaung Thaw  Jade World,Private,Kyi Kyat (7.6.10),27.7.2010,26.10.2015,Jade,1,Kachin State,Namachi  Phawhtoke(523),27,7,2010,26,10,2015,Namachi  Phawhtoke,523,2010-7-27,2015-10-26
2,Kan Kaung Thaw  Jade World,Private,Kyi Kyat (7.6.10),27.7.2010,26.10.2015,Jade,1,Kachin State,Namachi  Phawhtoke(524),27,7,2010,26,10,2015,Namachi  Phawhtoke,524,2010-7-27,2015-10-26
3,Kan Kaung Thaw  Jade World,Private,Kyi Kyat (7.6.10),27.7.2010,26.10.2015,Jade,1,Kachin State,Namachi  Phawhtoke(525),27,7,2010,26,10,2015,Namachi  Phawhtoke,525,2010-7-27,2015-10-26
4,Kan Kaung Thaw  Jade World,Private,Kyi Kyat (7.6.10),27.7.2010,26.10.2015,Jade,1,Kachin State,Namachi  Phawhtoke(526),27,7,2010,26,10,2015,Namachi  Phawhtoke,526,2010-7-27,2015-10-26
5,Kan Kaung Thaw  Jade World,Private,Kyi Kyat (7.6.10),27.7.2010,26.10.2015,Jade,1,Kachin State,Namachi  Phawhtoke(527),27,7,2010,26,10,2015,Namachi  Phawhtoke,527,2010-7-27,2015-10-26
6,Kan Kaung Thaw  Jade World,Private,Kyi Kyat (7.6.10),27.7.2010,26.10.2015,Jade,1,Kachin State,Namachi  Phawhtoke(528),27,7,2010,26,10,2015,Namachi  Phawhtoke,528,2010-7-27,2015-10-26
7,Kan Kaung Thaw  Jade World,Private,Kyi Kyat (7.6.10),27.7.2010,26.10.2015,Jade,1,Kachin State,Namachi  Phawhtoke(529),27,7,2010,26,10,2015,Namachi  Phawhtoke,529,2010-7-27,2015-10-26
8,Kan Kaung Thaw  Jade World,Private,Kyi Kyat (7.6.10),27.7.2010,26.10.2015,Jade,1,Kachin State,Namachi  Phawhtoke(530),27,7,2010,26,10,2015,Namachi  Phawhtoke,530,2010-7-27,2015-10-26
9,Kan Kaung Thaw  Jade World,Private,Kyi Kyat (7.6.10),27.7.2010,26.10.2015,Jade,1,Kachin State,Namachi  Phawhtoke(531),27,7,2010,26,10,2015,Namachi  Phawhtoke,531,2010-7-27,2015-10-26
10,Kan Kaung Thaw  Jade World,Private,Kyi Kyat (7.6.10),27.7.2010,26.10.2015,Jade,1,Kachin State,Namachi  Phawhtoke(532),27,7,2010,26,10,2015,Namachi  Phawhtoke,532,2010-7-27,2015-10-26
11,Kan Kaung Thaw  Jade World,Private,Kyi Kyat (7.6.10),27.7.2010,26.10.2015,Jade,1,Kachin State,Namachi  Phawhtoke(533),27,7,2010,26,10,2015,Namachi  Phawhtoke,533,2010-7-27,2015-10-26
12,Kan Kaung Thaw  Jade World,Private,Kyi Kyat (7.6.10),27.7.2010,26.10.2015,Jade,1,Kachin State,Namachi  Phawhtoke(534),27,7,2010,26,10,2015,Namachi  Phawhtoke,534,2010-7-27,2015-10-26
13,Kan Kaung Thaw  Jade World,Private,Kyi Kyat (7.6.10),27.7.2010,26.10.2015,Jade,1,Kachin State,Namachi  Phawhtoke(535),27,7,2010,26,10,2015,Namachi  Phawhtoke,535,2010-7-27,2015-10-26
14,Kan Kaung Thaw  Jade World,Private,Kyi Kyat (7.6.10),27.7.2010,26.10.2015,Jade,1,Kachin State,Namachi  Phawhtoke(536),27,7,2010,26,10,2015,Namachi  Phawhtoke,536,2010-7-27,2015-10-26
15,Kan Kaung Thaw  Jade World,Private,Kyi Kyat (7.6.10),27.7.2010,26.10.2015,Jade,1,Kachin State,Namachi  Phawhtoke(537),27,7,2010,26,10,2015,Namachi  Phawhtoke,537,2010-7-27,2015-10-26
16,Kan Kaung Thaw  Jade World,Private,Kyi Kyat (7.6.10),27.7.2010,26.10.2015,Jade,1,Kachin State,Namachi  Phawhtoke(538),27,7,2010,26,10,2015,Namachi  Phawhtoke,538,2010-7-27,2015-10-26
17,Kan Kaung Thaw  Jade World,Private,Kyi Kyat (7.6.10),27.7.2010,26.10.2015,Jade,1,Kachin State,Namachi  Phawhtoke(539),27,7,2010,26,10,2015,Namachi  Phawhtoke,539,2010-7-27,2015-10-26
18,Kan Kaung Thaw  Jade World,Private,Kyi Kyat (7.6.10),27.7.2010,26.10.2015,Jade,1,Kachin State,Namachi  Phawhtoke(540),27,7,2010,26,10,2015,Namachi  Phawhtoke,540,2010-7-27,2015-10-26
19,Kan Kaung Thaw  Jade World,Private,Kyi Kyat (7.6.10),27.7.2010,26.10.2015,Jade,1,Kachin State,Namachi  Phawhtoke(541),27,7,2010,26,10,2015,Namachi  Phawhtoke,541,2010-7-27,2015-10-26
20,Kan Kaung Thaw  Jade World,Private,Kyi Kyat (7.6.10),27.7.2010,26.10.2015,Jade,1,Kachin State,Namachi  Phawhtoke(542),27,7,2010,26,10,2015,Namachi  Phawhtoke,542,2010-7-27,2015-10-26
21,Kan Kaung Thaw  Jade World,Private,Kyi Kyat (7.6.10),27.7.2010,26.10.2015,Jade,1,Kachin State,Namachi  Phawhtoke(543),27,7,2010,26,10,2015,Namachi  Phawhtoke,543,2010-7-27,2015-10-26
22,Kan Kaung Thaw  Jade World,Private,Kyi Kyat (7.6.10),27.7.2010,26.10.2015,Jade,1,Kachin State,Namachi  Phawhtoke(544),27,7,2010,26,10,2015,Namachi  Phawhtoke,544,2010-7-27,2015-10-26
23,Kan Kaung Thaw  Jade World,Private,Kyi Kyat (7.6.10),27.7.2010,26.10.2015,Jade,1,Kachin State,Namachi  Phawhtoke(545),27,7,2010,26,10,2015,Namachi  Phawhtoke,545,2010-7-27,2015-10-26
24,Kan Kaung Thaw  Jade World,Private,Kyi Kyat (7.6.10),27.7.2010,26.10.2015,Jade,1,Kachin State,Namachi  Phawhtoke(546),27,7,2010,26,10,2015,Namachi  Phawhtoke,546,2010-7-27,2015-10-26
25,Kan Kaung Thaw  Jade World,Private,Kyi Kyat (7.6.10),27.7.2010,26.10.2015,Jade,1,Kachin State,Namachi  Phawhtoke(547),27,7,2010,26,10,2015,Namachi  Phawhtoke,547,2010-7-27,2015-10-26
26,Kan Kaung Thaw  Jade World,Private,Kyi Kyat (7.6.10),27.7.2010,26.10.2015,Jade,1,Kachin State,Namachi  Phawhtoke(548),27,7,2010,26,10,2015,Namachi  Phawhtoke,548,2010-7-27,2015-10-26
27,Kan Kaung Thaw  Jade World,Private,Kyi Kyat (7.6.10),27.7.2010,26.10.2015,Jade,1,Kachin State,Namachi  Phawhtoke(549),27,7,2010,26,10,2015,Namachi  Phawhtoke,549,2010-7-27,2015-10-26
28,Kan Kaung Thaw  Jade World,Private,Kyi Kyat (7.6.10),27.7.2010,26.10.2015,Jade,1,Kachin State,Namachi  Phawhtoke(550),27,7,2010,26,10,2015,Namachi  Phawhtoke,550,2010-7-27,2015-10-26
29,Kan Kaung Taw Jade World,Private,(5/09)(4.2.10),10.5.2010,9.8.2015,Jade,1,Kachin State,Nan Sa Lin Chaung Phaw Htot(Pha-198),10,5,2010,9,8,2015,Nan Sa Lin Chaung Phaw Htot,Pha-198,2010-5-10,2015-8-9
1,Kan Kaung Taw (35),Private,Oo Si (2/13)(18.1.13),5.3.2013,4.3.2016,Gem,1,Shan State,Lwai Saung htauk(Pha La-120),5,3,2013,4,3,2016,Lwai Saung htauk,Pha La-120,2013-3-5,2016-3-4
1,Kan Sein Pwint ,Private,Oo Si(2/10)(17.5.10),24.5.2010,23.8.2015,Jade,1,Kachin State,Maw One Lay(96),24,5,2010,23,8,2015,Maw One Lay,96,2010-5-24,2015-8-23
2,Kan Sein Pwint ,Private,Oo Si(2/10)(17.5.10),24.5.2010,23.8.2015,Jade,1,Kachin State,Maw One Lay(97),24,5,2010,23,8,2015,Maw One Lay,97,2010-5-24,2015-8-23
3,Kan Sein Pwint ,Private,Oo Si(2/10)(17.5.10),24.5.2010,23.8.2015,Jade,1,Kachin State,Maw One Lay(98),24,5,2010,23,8,2015,Maw One Lay,98,2010-5-24,2015-8-23
4,Kan Sein Pwint ,Private,Oo Si(3/10)(28.9.10),27.10.2010,26.1.2016,Jade,1,Kachin State,Maw One Lay(131),27,10,2010,26,1,2016,Maw One Lay,131,2010-10-27,2016-1-26
5,Kan Sein Pwint ,Private,Oo Si(3/10)(28.9.10),27.10.2010,26.1.2016,Jade,1,Kachin State,Maw One Lay(132),27,10,2010,26,1,2016,Maw One Lay,132,2010-10-27,2016-1-26
1,Kan Pwint Oo,Private,Oo Si(2/10)(17.5.10),15.5.2010,14.8.2015,Jade,1,Kachin State,Maw Maung(228),15,5,2010,14,8,2015,Maw Maung,228,2010-5-15,2015-8-14
2,Kan Pwint Oo,Private,Oo Si(2/10)(17.5.10),14.5.2010,13.8.2015,Jade,1,Kachin State,Sai Taung(980,14,5,2010,13,8,2015,Sai Taung,980,2010-5-14,2015-8-13
3,Kan Pwint Oo,Private,Oo Si(2/10)(17.5.10),14.5.2010,13.8.2015,Jade,1,Kachin State,Sai Taung(99),14,5,2010,13,8,2015,Sai Taung,99,2010-5-14,2015-8-13
4,Kan Pwint Oo,Private,Oo Si(2/10)(17.5.10),14.5.2010,13.8.2015,Jade,1,Kachin State,Sai Taung(100),14,5,2010,13,8,2015,Sai Taung,100,2010-5-14,2015-8-13
5,Kan Pwint Oo,Private,Oo Si(2/10)(17.5.10),14.5.2010,13.8.2015,Jade,1,Kachin State,Sai Taung(101),14,5,2010,13,8,2015,Sai Taung,101,2010-5-14,2015-8-13
6,Kan Pwint Oo,Private,Oo Si(2/10)(17.5.10),14.5.2010,13.8.2015,Jade,1,Kachin State,Sai Taung(102),14,5,2010,13,8,2015,Sai Taung,102,2010-5-14,2015-8-13
7,Kan Pwint Oo,Private,Oo Si(2/10)(17.5.10),14.5.2010,13.8.2015,Jade,1,Kachin State,Sai Taung(103),14,5,2010,13,8,2015,Sai Taung,103,2010-5-14,2015-8-13
8,Kan Pwint Oo,Private,Oo Si(2/10)(17.5.10),14.5.2010,13.8.2015,Jade,1,Kachin State,Sai Taung(104),14,5,2010,13,8,2015,Sai Taung,104,2010-5-14,2015-8-13
9,Kan Pwint Oo,Private,Oo Si(2/10)(17.5.10),15.5.2010,14.8.2015,Jade,1,Kachin State,Whay Khar Maw Taung(250),15,5,2010,14,8,2015,Whay Khar Maw Taung,250,2010-5-15,2015-8-14
10,Kan Pwint Oo,Private,Oo Si(2/10)(17.5.10),15.5.2010,14.8.2015,Jade,1,Kachin State,Whay Khar Maw Taung(298),15,5,2010,14,8,2015,Whay Khar Maw Taung,298,2010-5-15,2015-8-14
11,Kan Pwint Oo,Private,Oo Si(2/10)(17.5.10),15.5.2010,14.8.2015,Jade,1,Kachin State,Whay Khar Maw Taung(299),15,5,2010,14,8,2015,Whay Khar Maw Taung,299,2010-5-15,2015-8-14
12,Kan Pwint Oo,Private,Oo Si(2/10)(17.5.10),15.5.2010,14.8.2015,Jade,1,Kachin State,Whay Khar Maw Taung(300),15,5,2010,14,8,2015,Whay Khar Maw Taung,300,2010-5-15,2015-8-14
13,Kan Pwint Oo,Private,Oo Si(3/10)(28.9..10),6.9.2010,6.12.2015,Jade,1,Kachin State,Kar Li Chaung(43),6,9,2010,6,12,2015,Kar Li Chaung,43,2010-9-6,2015-12-6
14,Kan Pwint Oo,Private,Oo Si(3/10)(28.9..10),6.9.2010,6.12.2015,Jade,1,Kachin State,Kar Li Chaung(44),6,9,2010,6,12,2015,Kar Li Chaung,44,2010-9-6,2015-12-6
15,Kan Pwint Oo,Private,Oo Si(3/10)(28.9..10),6.9.2010,6.12.2015,Jade,1,Kachin State,Kar Li Chaung(45),6,9,2010,6,12,2015,Kar Li Chaung,45,2010-9-6,2015-12-6
16,Kan Pwint Oo,Private,Oo Si(3/10)(28.9..10),6.9.2010,6.12.2015,Jade,1,Kachin State,Kar Li Chaung(46),6,9,2010,6,12,2015,Kar Li Chaung,46,2010-9-6,2015-12-6
17,Kan Pwint Oo,Private,Oo Si(3/10)(28.9..10),6.9.2010,6.12.2015,Jade,1,Kachin State,Kar Li Chaung(42),6,9,2010,6,12,2015,Kar Li Chaung,42,2010-9-6,2015-12-6
18,Kan Pwint Oo,Private,Oo Si(1/11)(14.5.11),7.7.2011,5.10.2016,Jade,1,Kachin State,Nant Mhaw(133),7,7,2011,5,10,2016,Nant Mhaw,133,2011-7-7,2016-10-5
19,Kan Pwint Oo,Private,Oo Si(1/11)(14.5.11),7.7.2011,5.10.2016,Jade,1,Kachin State,Nant Mhaw(134),7,7,2011,5,10,2016,Nant Mhaw,134,2011-7-7,2016-10-5
20,Kan Pwint Oo,Private,Oo Si(2/09)(2.8.09),30.7.2009,28.10.2016,Jade,1,Kachin State,Sha Yaung Kha(Sai Kyar Bon)(66),30,7,2009,28,10,2016,Sha Yaung Kha (Sai Kyar Bon),66,2009-7-30,2016-10-28
21,Kan Pwint Oo,Private,Oo Si(3/11)(25.9.11),11.11.2011,9.2.2017,Jade,1,Kachin State,Mana(292),11,11,2011,9,2,2017,Mana,292,2011-11-11,2017-2-9
22,Kan Pwint Oo,Private,Oo Si(3/10)(28.9..10),18.11.2010,16.2.2018,Jade,1,Kachin State,Whay Khar(520),18,11,2010,16,2,2018,Whay Khar,520,2010-11-18,2018-2-16
23,Kan Pwint Oo,Private,Oo Si(2/11)(19.6.11),30.8.2011,29.11.2018,Jade,1,Kachin State,Nant Mhaw(227),30,8,2011,29,11,2018,Nant Mhaw,227,2011-8-30,2018-11-29
24,Kan Pwint Oo,Private,Oo Si(3/13)(15.2.13),27.5.2012,26.8.2019,Jade,1,Kachin State,Kar Li Chaung(27),27,5,2012,26,8,2019,Kar Li Chaung,27,2012-5-27,2019-8-26
25,Kan Pwint Oo,Private,Oo Si(3/13)(15.2.13),27.5.2012,26.8.2019,Jade,1,Kachin State,Kar Li Chaung(32),27,5,2012,26,8,2019,Kar Li Chaung,32,2012-5-27,2019-8-26
26,Kan Pwint Oo,Private,Oo Si(3/13)(15.2.13),27.5.2012,26.8.2019,Jade,1,Kachin State,Kar Li Chaung(39),27,5,2012,26,8,2019,Kar Li Chaung,39,2012-5-27,2019-8-26
27,Kan Pwint Oo,Private,Oo Si(3/13)(15.2.13),27.5.2012,25.8.2017,Jade,1,Kachin State,Hlw Sin(1),27,5,2012,25,8,2017,Hlw Sin,1,2012-5-27,2017-8-25
28,Kan Pwint Oo,Private,Oo Si(3/13)(15.2.13),27.5.2012,25.8.2017,Jade,1,Kachin State,Hlw Sin(3),27,5,2012,25,8,2017,Hlw Sin,3,2012-5-27,2017-8-25
29,Kan Pwint Oo,Private,Oo Si(3/13)(15.2.13),27.5.2012,25.8.2017,Jade,1,Kachin State,Hlw Sin(4),27,5,2012,25,8,2017,Hlw Sin,4,2012-5-27,2017-8-25
30,Kan Pwint Oo,Private,Oo Si(3/13)(15.2.13),27.5.2012,25.8.2017,Jade,1,Kachin State,Hlw Sin(6),27,5,2012,25,8,2017,Hlw Sin,6,2012-5-27,2017-8-25
31,Kan Pwint Oo,Private,Oo Si(3/13)(15.2.13),27.5.2012,25.8.2017,Jade,1,Kachin State,Thu Raung(6),27,5,2012,25,8,2017,Thu Raung,6,2012-5-27,2017-8-25
32,Kan Pwint Oo,Private,Oo Si(3/13)(15.2.13),27.5.2012,25.8.2017,Jade,1,Kachin State,Thu Raung(7),27,5,2012,25,8,2017,Thu Raung,7,2012-5-27,2017-8-25
33,Kan Pwint Oo,Private,Oo Si(3/13)(15.2.13),27.5.2012,25.8.2017,Jade,1,Kachin State,Thu Raung(8),27,5,2012,25,8,2017,Thu Raung,8,2012-5-27,2017-8-25
34,Kan Pwint Oo,Private,Oo Si(3/13)(15.2.13),27.5.2012,25.8.2017,Jade,1,Kachin State,Thu Raung(9),27,5,2012,25,8,2017,Thu Raung,9,2012-5-27,2017-8-25
1,Kan Thar Oo,Private,Oo Si(1/10)(4.2.10),25.2.2010,27.5.2015,Jade,1,Kachin State,Thaung Cho(8),25,2,2010,27,5,2015,Thaung Cho,8,2010-2-25,2015-5-27
2,Kan Thar Oo,Private,Oo Si(1/10)(4.2.10),25.2.2010,27.5.2015,Jade,1,Kachin State,Thaung Cho(10),25,2,2010,27,5,2015,Thaung Cho,10,2010-2-25,2015-5-27
3,Kan Thar Oo,Private,Oo Si(2/11)(19.6.11),11.3.2011,9.6.2016,Jade,1,Kachin State,Ba La Kha(101),11,3,2011,9,6,2016,Ba La Kha,101,2011-3-11,2016-6-9
4,Kan Thar Oo,Private,Oo Si2(6/11)(18.12.11),7.10.2011,5.1.2017,Jade,1,Kachin State,Nant Mhaw(250),7,10,2011,5,1,2017,Nant Mhaw,250,2011-10-7,2017-1-5
5,Kan Thar Oo,Private,Oo Si2(6/11)(18.12.11),7.10.2011,5.1.2017,Jade,1,Kachin State,Nant Mhaw(251),7,10,2011,5,1,2017,Nant Mhaw,251,2011-10-7,2017-1-5
6,Kan Thar Oo,Private,Oo Si(2/11)(19.6.11),11.3.2011,10.6.2018,Jade,1,Kachin State,Ba La Kha(99),11,3,2011,10,6,2018,Ba La Kha,99,2011-3-11,2018-6-10
7,Kan Thar Oo,Private,Oo Si(2/11)(19.6.11),11.3.2011,10.6.2018,Jade,1,Kachin State,Ba La Kha(100),11,3,2011,10,6,2018,Ba La Kha,100,2011-3-11,2018-6-10
8,Kan Thar Oo,Private,Kyi Kyat (19.10.10),15.11.2010,14.2.2016,Jade,1,Kachin State,Tha Phan Phawhtoke(29),15,11,2010,14,2,2016,Tha Phan Phawhtoke,29,2010-11-15,2016-2-14
9,Kan Thar Oo,Private,Kyi Kyat (19.10.10),15.11.2010,14.2.2016,Jade,1,Kachin State,Tha Phan Phawhtoke(30),15,11,2010,14,2,2016,Tha Phan Phawhtoke,30,2010-11-15,2016-2-14
10,Kan Thar Oo,Private,Kyi Kyat (19.10.10),15.11.2010,14.2.2016,Jade,1,Kachin State,Tha Phan Phawhtoke(31),15,11,2010,14,2,2016,Tha Phan Phawhtoke,31,2010-11-15,2016-2-14
11,Kan Thar Oo,Private,Kyi Kyat (19.10.10),15.11.2010,14.2.2016,Jade,1,Kachin State,Tha Phan Phawhtoke(32),15,11,2010,14,2,2016,Tha Phan Phawhtoke,32,2010-11-15,2016-2-14
12,Kan Thar Oo,Private,Kyi Kyat (19.10.10),15.11.2010,14.2.2016,Jade,1,Kachin State,Tha Phan Phawhtoke(33),15,11,2010,14,2,2016,Tha Phan Phawhtoke,33,2010-11-15,2016-2-14
13,Kan Thar Oo,Private,Kyi Kyat (19.10.10),15.11.2010,14.2.2016,Jade,1,Kachin State,Tha Phan Phawhtoke(34),15,11,2010,14,2,2016,Tha Phan Phawhtoke,34,2010-11-15,2016-2-14
14,Kan Thar Oo,Private,Kyi Kyat (19.10.10),15.11.2010,14.2.2016,Jade,1,Kachin State,Tha Phan Phawhtoke(35),15,11,2010,14,2,2016,Tha Phan Phawhtoke,35,2010-11-15,2016-2-14
15,Kan Thar Oo,Private,Kyi Kyat (19.10.10),15.11.2010,14.2.2016,Jade,1,Kachin State,Tha Phan Phawhtoke(36),15,11,2010,14,2,2016,Tha Phan Phawhtoke,36,2010-11-15,2016-2-14
16,Kan Thar Oo,Private,Kyi Kyat (19.10.10),15.11.2010,14.2.2016,Jade,1,Kachin State,Tha Phan Phawhtoke(37),15,11,2010,14,2,2016,Tha Phan Phawhtoke,37,2010-11-15,2016-2-14
17,Kan Thar Oo,Private,Kyi Kyat (19.10.10),15.11.2010,14.2.2016,Jade,1,Kachin State,Tha Phan Phawhtoke(38),15,11,2010,14,2,2016,Tha Phan Phawhtoke,38,2010-11-15,2016-2-14
18,Kan Thar Oo,Private,Kyi Kyat (19.10.10),15.11.2010,14.2.2016,Jade,1,Kachin State,Tha Phan Phawhtoke(39),15,11,2010,14,2,2016,Tha Phan Phawhtoke,39,2010-11-15,2016-2-14
19,Kan Thar Oo,Private,Kyi Kyat (19.10.10),15.11.2010,14.2.2016,Jade,1,Kachin State,Tha Phan Phawhtoke(40),15,11,2010,14,2,2016,Tha Phan Phawhtoke,40,2010-11-15,2016-2-14
20,Kan Thar Oo,Private,Kyi Kyat (19.10.10),15.11.2010,14.2.2016,Jade,1,Kachin State,Tha Phan Phawhtoke(41),15,11,2010,14,2,2016,Tha Phan Phawhtoke,41,2010-11-15,2016-2-14
21,Kan Thar Oo,Private,Kyi Kyat (19.10.10),15.11.2010,14.2.2016,Jade,1,Kachin State,Tha Phan Phawhtoke(42),15,11,2010,14,2,2016,Tha Phan Phawhtoke,42,2010-11-15,2016-2-14
22,Kan Thar Oo,Private,Kyi Kyat (19.10.10),15.11.2010,14.2.2016,Jade,1,Kachin State,Tha Phan Phawhtoke(43),15,11,2010,14,2,2016,Tha Phan Phawhtoke,43,2010-11-15,2016-2-14
23,Kan Thar Oo,Private,Kyi Kyat (19.10.10),15.11.2010,14.2.2016,Jade,1,Kachin State,Tha Phan Phawhtoke(44),15,11,2010,14,2,2016,Tha Phan Phawhtoke,44,2010-11-15,2016-2-14
24,Kan Thar Oo,Private,Kyi Kyat (19.10.10),15.11.2010,14.2.2016,Jade,1,Kachin State,Tha Phan Phawhtoke(45),15,11,2010,14,2,2016,Tha Phan Phawhtoke,45,2010-11-15,2016-2-14
25,Kan Thar Oo,Private,Kyi Kyat (19.10.10),15.11.2010,14.2.2016,Jade,1,Kachin State,Tha Phan Phawhtoke(46),15,11,2010,14,2,2016,Tha Phan Phawhtoke,46,2010-11-15,2016-2-14
26,Kan Thar Oo,Private,Kyi Kyat (19.10.10),15.11.2010,14.2.2016,Jade,1,Kachin State,Tha Phan Phawhtoke(47),15,11,2010,14,2,2016,Tha Phan Phawhtoke,47,2010-11-15,2016-2-14
27,Kan Thar Oo,Private,Kyi Kyat (19.10.10),15.11.2010,14.2.2016,Jade,1,Kachin State,Tha Phan Phawhtoke(48),15,11,2010,14,2,2016,Tha Phan Phawhtoke,48,2010-11-15,2016-2-14
28,Kan Thar Oo,Private,Kyi Kyat (19.10.10),15.11.2010,14.2.2016,Jade,1,Kachin State,Tha Phan Phawhtoke(49),15,11,2010,14,2,2016,Tha Phan Phawhtoke,49,2010-11-15,2016-2-14
29,Kan Thar Oo,Private,Kyi Kyat (19.10.10),15.11.2010,14.2.2016,Jade,1,Kachin State,Tha Phan Phawhtoke(50),15,11,2010,14,2,2016,Tha Phan Phawhtoke,50,2010-11-15,2016-2-14
30,Kan Thar Oo,Private,Kyi Kyat (19.10.10),15.11.2010,14.2.2016,Jade,1,Kachin State,Tha Phan Phawhtoke(51),15,11,2010,14,2,2016,Tha Phan Phawhtoke,51,2010-11-15,2016-2-14
31,Kan Thar Oo,Private,Kyi Kyat (19.10.10),15.11.2010,14.2.2016,Jade,1,Kachin State,Tha Phan Phawhtoke(52),15,11,2010,14,2,2016,Tha Phan Phawhtoke,52,2010-11-15,2016-2-14
32,Kan Thar Oo,Private,Kyi Kyat (19.10.10),15.11.2010,14.2.2016,Jade,1,Kachin State,Tha Ret Phawhtoke(28),15,11,2010,14,2,2016,Tha Ret Phawhtoke,28,2010-11-15,2016-2-14
33,Kan Thar Oo,Private,Kyi Kyat (19.10.10),15.11.2010,14.2.2016,Jade,1,Kachin State,Tha Ret Phawhtoke(29),15,11,2010,14,2,2016,Tha Ret Phawhtoke,29,2010-11-15,2016-2-14
34,Kan Thar Oo,Private,Kyi Kyat (19.10.10),15.11.2010,14.2.2016,Jade,1,Kachin State,Tha Ret Phawhtoke(30),15,11,2010,14,2,2016,Tha Ret Phawhtoke,30,2010-11-15,2016-2-14
35,Kan Thar Oo,Private,Kyi Kyat (19.10.10),15.11.2010,14.2.2016,Jade,1,Kachin State,Tha Ret Phawhtoke(31),15,11,2010,14,2,2016,Tha Ret Phawhtoke,31,2010-11-15,2016-2-14
36,Kan Thar Oo,Private,Kyi Kyat (19.10.10),15.11.2010,14.2.2016,Jade,1,Kachin State,Tha Ret Phawhtoke(32),15,11,2010,14,2,2016,Tha Ret Phawhtoke,32,2010-11-15,2016-2-14
37,Kan Thar Oo,Private,Kyi Kyat (19.10.10),15.11.2010,14.2.2016,Jade,1,Kachin State,Tha Ret Phawhtoke(33),15,11,2010,14,2,2016,Tha Ret Phawhtoke,33,2010-11-15,2016-2-14
38,Kan Thar Oo,Private,Kyi Kyat (19.10.10),15.11.2010,14.2.2016,Jade,1,Kachin State,Tha Ret Phawhtoke(34),15,11,2010,14,2,2016,Tha Ret Phawhtoke,34,2010-11-15,2016-2-14
39,Kan Thar Oo,Private,Kyi Kyat (19.10.10),15.11.2010,14.2.2016,Jade,1,Kachin State,Tha Ret Phawhtoke(35),15,11,2010,14,2,2016,Tha Ret Phawhtoke,35,2010-11-15,2016-2-14
40,Kan Thar Oo,Private,Kyi Kyat (19.10.10),15.11.2010,14.2.2016,Jade,1,Kachin State,Tha Ret Phawhtoke(36),15,11,2010,14,2,2016,Tha Ret Phawhtoke,36,2010-11-15,2016-2-14
41,Kan Thar Oo,Private,Kyi Kyat (19.10.10),15.11.2010,14.2.2016,Jade,1,Kachin State,Tha Ret Phawhtoke(37),15,11,2010,14,2,2016,Tha Ret Phawhtoke,37,2010-11-15,2016-2-14
42,Kan Thar Oo,Private,Kyi Kyat (19.10.10),15.11.2010,14.2.2016,Jade,1,Kachin State,Namachi  Phawhtoke(735),15,11,2010,14,2,2016,Namachi  Phawhtoke,735,2010-11-15,2016-2-14
43,Kan Thar Oo,Private,Kyi Kyat (19.10.10),15.11.2010,14.2.2016,Jade,1,Kachin State,Namachi  Phawhtoke(736),15,11,2010,14,2,2016,Namachi  Phawhtoke,736,2010-11-15,2016-2-14
44,Kan Thar Oo,Private,Kyi Kyat (19.10.10),15.11.2010,14.2.2016,Jade,1,Kachin State,Namachi  Phawhtoke(737),15,11,2010,14,2,2016,Namachi  Phawhtoke,737,2010-11-15,2016-2-14
45,Kan Thar Oo,Private,Kyi Kyat (19.10.10),15.11.2010,14.2.2016,Jade,1,Kachin State,Namachi  Phawhtoke(738),15,11,2010,14,2,2016,Namachi  Phawhtoke,738,2010-11-15,2016-2-14
46,Kan Thar Oo,Private,Kyi Kyat (19.10.10),15.11.2010,14.2.2016,Jade,1,Kachin State,Namachi  Phawhtoke(739),15,11,2010,14,2,2016,Namachi  Phawhtoke,739,2010-11-15,2016-2-14
47,Kan Thar Oo,Private,Kyi Kyat (19.10.10),15.11.2010,14.2.2016,Jade,1,Kachin State,Namachi  Phawhtoke(740),15,11,2010,14,2,2016,Namachi  Phawhtoke,740,2010-11-15,2016-2-14
48,Kan Thar Oo,Private,Kyi Kyat (19.10.10),15.11.2010,14.2.2016,Jade,1,Kachin State,Namachi  Phawhtoke(741),15,11,2010,14,2,2016,Namachi  Phawhtoke,741,2010-11-15,2016-2-14
49,Kan Thar Oo,Private,Kyi Kyat (19.10.10),15.11.2010,14.2.2016,Jade,1,Kachin State,Namachi  Phawhtoke(742),15,11,2010,14,2,2016,Namachi  Phawhtoke,742,2010-11-15,2016-2-14
50,Kan Thar Oo,Private,Kyi Kyat (19.10.10),15.11.2010,14.2.2016,Jade,1,Kachin State,Namachi Phawhtoke(743),15,11,2010,14,2,2016,Namachi Phawhtoke,743,2010-11-15,2016-2-14
1,Kan Thar Yar,Private,Kyie Kyat(25.11.11),20.1.2012,20.4.2017,Gem,1,Kachin State,Lwai Saing(1),20,1,2012,20,4,2017,Lwai Saing,1,2012-1-20,2017-4-20
2,Kan Thar Yar,Private,Kyie Kyat(25.11.11),20.1.2012,20.4.2017,Gem,2,Kachin State,Lwai Saing(2),20,1,2012,20,4,2017,Lwai Saing,2,2012-1-20,2017-4-20
3,Kan Thar Yar,Private,Kyie Kyat(25.11.11),20.1.2012,20.4.2017,Gem,3,Kachin State,Lwai Saing(3),20,1,2012,20,4,2017,Lwai Saing,3,2012-1-20,2017-4-20
4,Kan Thar Yar,Private,Kyie Kyat(25.11.11),20.1.2012,20.4.2017,Gem,4,Kachin State,Lwai Saing(4),20,1,2012,20,4,2017,Lwai Saing,4,2012-1-20,2017-4-20
5,Kan Thar Yar,Private,Kyie Kyat(25.11.11),20.1.2012,20.4.2017,Gem,5,Kachin State,Lwai Saing(5),20,1,2012,20,4,2017,Lwai Saing,5,2012-1-20,2017-4-20
6,Kan Thar Yar,Private,Kyie Kyat(25.11.11),20.1.2012,20.4.2017,Gem,6,Kachin State,Lwai Saing(6),20,1,2012,20,4,2017,Lwai Saing,6,2012-1-20,2017-4-20
7,Kan Thar Yar,Private,Kyie Kyat(25.11.11),20.1.2012,20.4.2017,Gem,7,Kachin State,Lwai Saing(7),20,1,2012,20,4,2017,Lwai Saing,7,2012-1-20,2017-4-20
8,Kan Thar Yar,Private,Kyie Kyat(25.11.11),20.1.2012,20.4.2017,Gem,8,Kachin State,Lwai Saing(8),20,1,2012,20,4,2017,Lwai Saing,8,2012-1-20,2017-4-20
9,Kan Thar Yar,Private,Kyie Kyat(25.11.11),20.1.2012,20.4.2017,Gem,9,Kachin State,Lwai Saing(9),20,1,2012,20,4,2017,Lwai Saing,9,2012-1-20,2017-4-20
10,Kan Thar Yar,Private,Kyie Kyat(25.11.11),20.1.2012,20.4.2017,Gem,10,Kachin State,Lwai Saing(10),20,1,2012,20,4,2017,Lwai Saing,10,2012-1-20,2017-4-20
11,Kan Thar Yar,Private,Kyie Kyat(25.11.11),20.1.2012,20.4.2017,Gem,11,Kachin State,Lwai Saing(11),20,1,2012,20,4,2017,Lwai Saing,11,2012-1-20,2017-4-20
12,Kan Thar Yar,Private,Kyie Kyat(25.11.11),20.1.2012,20.4.2017,Gem,12,Kachin State,Lwai Saing(12),20,1,2012,20,4,2017,Lwai Saing,12,2012-1-20,2017-4-20
13,Kan Thar Yar,Private,Oo Si(1/10)(4.2.10),14.2.2010,16.5.2015,Jade,1,Kachin State,Nant San(1),14,2,2010,16,5,2015,Nant San,1,2010-2-14,2015-5-16
14,Kan Thar Yar,Private,Oo Si(1/10)(4.2.10),14.2.2010,16.5.2015,Jade,1,Kachin State,Nant San(2),14,2,2010,16,5,2015,Nant San,2,2010-2-14,2015-5-16
15,Kan Thar Yar,Private,Oo Si(1/10)(4.2.10),14.2.2010,16.5.2015,Jade,1,Kachin State,Nant San(3),14,2,2010,16,5,2015,Nant San,3,2010-2-14,2015-5-16
16,Kan Thar Yar,Private,Oo Si(1/10)(4.2.10),14.2.2010,16.5.2015,Jade,1,Kachin State,Nant San(4),14,2,2010,16,5,2015,Nant San,4,2010-2-14,2015-5-16
17,Kan Thar Yar,Private,Oo Si(1/10)(4.2.10),14.2.2010,16.5.2015,Jade,1,Kachin State,Nant San(5),14,2,2010,16,5,2015,Nant San,5,2010-2-14,2015-5-16
18,Kan Thar Yar,Private,Oo Si(1/10)(4.2.10),28.3.2010,27.6.2015,Jade,1,Kachin State,Sha Yaung Kha(15),28,3,2010,27,6,2015,Sha Yaung Kha,15,2010-3-28,2015-6-27
19,Kan Thar Yar,Private,Oo Si(1/10)(4.2.10),29.3.2010,28.6.2015,Jade,1,Kachin State,Phar Pyin(82),29,3,2010,28,6,2015,Phar Pyin,82,2010-3-29,2015-6-28
20,Kan Thar Yar,Private,Oo Si(1/10)(4.2.10),29.3.2010,28.6.2015,Jade,1,Kachin State,Phar Pyin(107),29,3,2010,28,6,2015,Phar Pyin,107,2010-3-29,2015-6-28
21,Kan Thar Yar,Private,Oo Si(1/10)(4.2.10),29.3.2010,28.6.2015,Jade,1,Kachin State,Mana(25),29,3,2010,28,6,2015,Mana,25,2010-3-29,2015-6-28
22,Kan Thar Yar,Private,Oo Si(1/10)(4.2.10),29.3.2010,28.6.2015,Jade,1,Kachin State,Mana(107),29,3,2010,28,6,2015,Mana,107,2010-3-29,2015-6-28
23,Kan Thar Yar,Private,Oo Si(1/10)(4.2.10),29.3.2010,28.6.2015,Jade,1,Kachin State,Sha Yaung Kha(50),29,3,2010,28,6,2015,Sha Yaung Kha,50,2010-3-29,2015-6-28
24,Kan Thar Yar,Private,Oo Si(1/10)(4.2.10),29.3.2010,28.6.2015,Jade,1,Kachin State,Sha Yaung Kha(78),29,3,2010,28,6,2015,Sha Yaung Kha,78,2010-3-29,2015-6-28
25,Kan Thar Yar,Private,Oo Si(3/10)(28.9.10),24.9.2010,24.12.2015,Jade,1,Kachin State,Lawe Gyaung(7),24,9,2010,24,12,2015,Lawe Gyaung,7,2010-9-24,2015-12-24
26,Kan Thar Yar,Private,Oo Si(3/10)(28.9.10),24.9.2010,24.12.2015,Jade,1,Kachin State,Lawe Gyaung(8),24,9,2010,24,12,2015,Lawe Gyaung,8,2010-9-24,2015-12-24
27,Kan Thar Yar,Private,Oo Si(3/10)(28.9.10),24.9.2010,24.12.2015,Jade,1,Kachin State,Lawe Gyaung(9),24,9,2010,24,12,2015,Lawe Gyaung,9,2010-9-24,2015-12-24
28,Kan Thar Yar,Private,Oo Si(3/10)(28.9.10),24.9.2010,24.12.2015,Jade,1,Kachin State,Lawe Gyaung(10),24,9,2010,24,12,2015,Lawe Gyaung,10,2010-9-24,2015-12-24
29,Kan Thar Yar,Private,Oo Si(3/10)(28.9.10),24.9.2010,24.12.2015,Jade,1,Kachin State,Lawe Gyaung(11),24,9,2010,24,12,2015,Lawe Gyaung,11,2010-9-24,2015-12-24
30,Kan Thar Yar,Private,Oo Si(3/10)(28.9.10),24.9.2010,24.12.2015,Jade,1,Kachin State,Lawe Gyaung(12),24,9,2010,24,12,2015,Lawe Gyaung,12,2010-9-24,2015-12-24
31,Kan Thar Yar,Private,Oo Si(3/10)(28.9.10),24.9.2010,24.12.2015,Jade,1,Kachin State,Lawe Gyaung(13),24,9,2010,24,12,2015,Lawe Gyaung,13,2010-9-24,2015-12-24
32,Kan Thar Yar,Private,Oo Si(3/10)(28.9.10),24.9.2010,24.12.2015,Jade,1,Kachin State,Lawe Gyaung(14),24,9,2010,24,12,2015,Lawe Gyaung,14,2010-9-24,2015-12-24
33,Kan Thar Yar,Private,Oo Si(3/10)(28.9.10),24.9.2010,24.12.2015,Jade,1,Kachin State,Lawe Gyaung(15),24,9,2010,24,12,2015,Lawe Gyaung,15,2010-9-24,2015-12-24
34,Kan Thar Yar,Private,Oo Si(3/10)(28.9.10),24.9.2010,24.12.2015,Jade,1,Kachin State,Lawe Gyaung(16),24,9,2010,24,12,2015,Lawe Gyaung,16,2010-9-24,2015-12-24
35,Kan Thar Yar,Private,Oo Si(3/10)(28.9.10),8.12.2011,8.3.2017,Jade,1,Kachin State,Mana(29),8,12,2011,8,3,2017,Mana,29,2011-12-8,2017-3-8
36,Kan Thar Yar,Private,Oo Si(3/13)(15.2.13),31.5.2013,30.8.2017,Jade,1,Kachin State,Mana(162),31,5,2013,30,8,2017,Mana,162,2013-5-31,2017-8-30
37,Kan Thar Yar,Private,Oo Si(3/13)(15.2.13),6.9.2011,6.12.2018,Jade,1,Kachin State,Mana(176),6,9,2011,6,12,2018,Mana,176,2011-9-6,2018-12-6
1,Kan Thet Htoo,Private,Kyi Kyat (27.8.10),19.10.2010,18.1.2016,Jade,1,Kachin State,Namachi Satkyin Phawhtoke(665),19,10,2010,18,1,2016,Namachi Satkyin Phawhtoke,665,2010-10-19,2016-1-18
2,Kan Thet Htoo,Private,Kyi Kyat (27.8.10),19.10.2010,18.1.2016,Jade,1,Kachin State,Namachi Satkyin Phawhtoke(666),19,10,2010,18,1,2016,Namachi Satkyin Phawhtoke,666,2010-10-19,2016-1-18
1,Kan See Taung Tan,Private,Oo Si(2/11)(19.6.11),1.4.2011,30.6.2016,Jade,1,Kachin State,Sai Taung(72),1,4,2011,30,6,2016,Sai Taung,72,2011-4-1,2016-6-30
2,Kan See Taung Tan,Private,Oo Si(2/11)(19.6.11),23.5.2011,21.8.2016,Jade,1,Kachin State,Taung Kough(27),23,5,2011,21,8,2016,Taung Kough,27,2011-5-23,2016-8-21
3,Kan See Taung Tan,Private,Oo Si(2/11)(19.6.11),23.5.2011,21.8.2016,Jade,1,Kachin State,Taung Kough(28),23,5,2011,21,8,2016,Taung Kough,28,2011-5-23,2016-8-21
4,Kan See Taung Tan,Private,Oo Si(3/13)(15.2.13),8.12.2011,8.3.207,Jade,1,Kachin State,Aung Sein(1),8,12,2011,8,3,207,Aung Sein,1,2011-12-8,207-3-8
1,Kane Jem Sa Tone,Private,Oo Si (2/13)(18.1.13),11.3.2013,10.3.2016,Gem,1,Madalay Division,Pint Ku Taung Gae(20),11,3,2013,10,3,2016,Pint Ku Taung Gae,20,2013-3-11,2016-3-10
2,Kane Jem Sa Tone,Private,Oo Si (2/13)(18.1.13),11.3.2013,10.3.2016,Gem,1,Madalay Division,Pint Ku Taung Ah Shat Chan(Sa-14),11,3,2013,10,3,2016,Pint Ku Taung Ah Shat Chan,Sa-14,2013-3-11,2016-3-10
3,Kane Jem Sa Tone,Private,Oo Si (1/14)(10.6.14),10.8.2014,9.8.2017,Gem,1,Madalay Division,Pann Taw(5),10,8,2014,9,8,2017,Pann Taw,5,2014-8-10,2017-8-9
4,Kane Jem Sa Tone,Private,Oo Si (2/13)(18.1.13),11.3.2013,10.3.2016,Gem,1,Madalay Division,Luu Hta Pyat(8),11,3,2013,10,3,2016,Luu Hta Pyat,8,2013-3-11,2016-3-10
5,Kane Jem Sa Tone,Private,Oo Si (1/14)(10.6.14),27.5.2014,26.5.2017,Gem,1,Madalay Division,Luu Hta Pyat(1),27,5,2014,26,5,2017,Luu Hta Pyat,1,2014-5-27,2017-5-26
6,Kane Jem Sa Tone,Private,Oo Si (1/14)(10.6.14),27.5.2014,26.5.2017,Gem,1,Madalay Division,Luu Hta Pyat(2),27,5,2014,26,5,2017,Luu Hta Pyat,2,2014-5-27,2017-5-26
7,Kane Jem Sa Tone,Private,Oo Si (3/14)(18.12.14),28.3.2015,27.3.2018,Gem,1,Madalay Division,Luu Hta Pyat(3),28,3,2015,27,3,2018,Luu Hta Pyat,3,2015-3-28,2018-3-27
8,Kane Jem Sa Tone,Private,Oo Si (1/14)(10.6.14),27.5.2014,26.5.2017,Gem,1,Madalay Division,Luu Hta Pyat(5),27,5,2014,26,5,2017,Luu Hta Pyat,5,2014-5-27,2017-5-26
9,Kane Jem Sa Tone,Private,Oo Si (3/14)(18.12.14),28.3.2015,27.3.2018,Gem,1,Madalay Division,Luu Hta Pyat(6),28,3,2015,27,3,2018,Luu Hta Pyat,6,2015-3-28,2018-3-27
10,Kane Jem Sa Tone,Private,Oo Si (3/14)(18.12.14),28.3.2015,27.3.2018,Gem,1,Madalay Division,Luu Hta Pyat(7),28,3,2015,27,3,2018,Luu Hta Pyat,7,2015-3-28,2018-3-27
11,Kane Jem Sa Tone,Private,Oo Si (1/15)(26.3.15),1.6.2015,31.5.2018,Gem,1,Shan State,Lwai Saung htauk(La-16),1,6,2015,31,5,2018,Lwai Saung htauk,La-16,2015-6-1,2018-5-31
12,Kane Jem Sa Tone,Private,Oo Si (4/13)(16.3.13),5.12.2011,4.12.2015,Gem,1,Shan State,Lwai Saung htauk(La-17),5,12,2011,4,12,2015,Lwai Saung htauk,La-17,2011-12-5,2015-12-4
13,Kane Jem Sa Tone,Private,Oo Si (7/13)(25.10.13),3.12.2013,2.12.2016,Gem,1,Shan State,Lwai Saung htauk(La-24),3,12,2013,2,12,2016,Lwai Saung htauk,La-24,2013-12-3,2016-12-2
14,Kane Jem Sa Tone,Private,Oo Si (8/13)(22.11.13),7.3.2014,6.3.2017,Gem,1,Shan State,Lwai Saung htauk(La-28),7,3,2014,6,3,2017,Lwai Saung htauk,La-28,2014-3-7,2017-3-6
15,Kane Jem Sa Tone,Private,Oo Si (2/13)(18.1.13),5.12.2011,4.12.2014,Gem,1,Shan State,Lwai Saung htauk(La-5),5,12,2011,4,12,2014,Lwai Saung htauk,La-5,2011-12-5,2014-12-4
16,Kane Jem Sa Tone,Private,Oo Si (2/13)(18.1.13),11.3.2013,10.3.2016,Gem,1,Shan State,Lwai Saung htauk(La-6),11,3,2013,10,3,2016,Lwai Saung htauk,La-6,2013-3-11,2016-3-10
17,Kane Jem Sa Tone,Private,Oo Si (1/14)(10.6.14),14.6.2014,13.6.2017,Gem,1,Shan State,Lwai Saung htauk(Pha La-132),14,6,2014,13,6,2017,Lwai Saung htauk,Pha La-132,2014-6-14,2017-6-13
18,Kane Jem Sa Tone,Private,Oo Si (1/14)(10.6.14),31.7.2014,30.7.2017,Gem,1,Shan State,Lwai Saung htauk(Pha La-180),31,7,2014,30,7,2017,Lwai Saung htauk,Pha La-180,2014-7-31,2017-7-30
19,Kane Jem Sa Tone,Private,Oo Si (4/13)(16.3.13),19.8.2013,18.8.2016,Gem,1,Shan State,Lwai Saung htauk(Pha La-228),19,8,2013,18,8,2016,Lwai Saung htauk,Pha La-228,2013-8-19,2016-8-18
20,Kane Jem Sa Tone,Private,Oo Si (2/13)(18.1.13),27.5.2012,26.5.2015,Gem,1,Shan State,Lwai Saung htauk(Pha La-240),27,5,2012,26,5,2015,Lwai Saung htauk,Pha La-240,2012-5-27,2015-5-26
21,Kane Jem Sa Tone,Private,Oo Si (4/13)(16.3.13),19.8.2014,18.8.2017,Gem,1,Shan State,Lwai Saung htauk(Pha La-289),19,8,2014,18,8,2017,Lwai Saung htauk,Pha La-289,2014-8-19,2017-8-18
22,Kane Jem Sa Tone,Private,Oo Si (2/13)(18.1.13),27.5.2012,26.5.2015,Gem,1,Shan State,Lwai Saung htauk(Pha La-327),27,5,2012,26,5,2015,Lwai Saung htauk,Pha La-327,2012-5-27,2015-5-26
23,Kane Jem Sa Tone,Private,Oo Si (4/13)(16.3.13),13.3.2013,12.3.2016,Gem,1,Shan State,Lwai Saung htauk(Pha La-338),13,3,2013,12,3,2016,Lwai Saung htauk,Pha La-338,2013-3-13,2016-3-12
24,Kane Jem Sa Tone,Private,Oo Si (1/14)(10.6.14),3.9.2014,2.9.2017,Gem,1,Shan State,Lwai Saung htauk(Pha La-50),3,9,2014,2,9,2017,Lwai Saung htauk,Pha La-50,2014-9-3,2017-9-2
25,Kane Jem Sa Tone,Private,Oo Si (7/13)(25.10.13),3.1.2013,2.1.2016,Gem,1,Shan State,Lwai Saung htauk(Pha La-540),3,1,2013,2,1,2016,Lwai Saung htauk,Pha La-540,2013-1-3,2016-1-2
26,Kane Jem Sa Tone,Private,Oo Si (1/14)(10.6.14),3.9.2014,2.9.2017,Gem,1,Shan State,Lwai Saung htauk(Pha La-55),3,9,2014,2,9,2017,Lwai Saung htauk,Pha La-55,2014-9-3,2017-9-2
27,Kane Jem Sa Tone,Private,Oo Si (7/13)(25.10.13),3.1.2013,2.1.2016,Gem,1,Shan State,Lwai Saung htauk(Pha La-588),3,1,2013,2,1,2016,Lwai Saung htauk,Pha La-588,2013-1-3,2016-1-2
28,Kane Jem Sa Tone,Private,Kyie Kyat(13/13(12.12.13),27.12.2013,26.12.2016,Gem,1,Shan State,Lwai Saung htauk(Pha La-674),27,12,2013,26,12,2016,Lwai Saung htauk,Pha La-674,2013-12-27,2016-12-26
29,Kane Jem Sa Tone,Private,Oo Si (7/13)(25.10.13),3.12.2013,2.12.2016,Gem,1,Shan State,Lwai Saung htauk(Pha La-89),3,12,2013,2,12,2016,Lwai Saung htauk,Pha La-89,2013-12-3,2016-12-2
30,Kane Jem Sa Tone,Private,Oo Si (7/13)(25.10.13),15.12.2013,14.12.2016,Gem,1,Shan State,Lwai Saung htauk(Pha La-92),15,12,2013,14,12,2016,Lwai Saung htauk,Pha La-92,2013-12-15,2016-12-14
31,Kane Jem Sa Tone,Private,Oo Si (7/13)(25.10.13),3.1.2013,2.1.2016,Gem,1,Shan State,Lwai Saung htauk(Pha La-93),3,1,2013,2,1,2016,Lwai Saung htauk,Pha La-93,2013-1-3,2016-1-2
32,Kane Jem Sa Tone,Private,Oo Si (5/13)(23.8.13),29.4.2013,28.4.2016,Gem,1,Shan State,Sai Hlan(Pha-175),29,4,2013,28,4,2016,Sai Hlan,Pha-175,2013-4-29,2016-4-28
33,Kane Jem Sa Tone,Private,Oo Si (1/14)(10.6.14),10.8.2014,9.8.2017,Gem,1,Shan State,Sai Hlan(Pha-176),10,8,2014,9,8,2017,Sai Hlan,Pha-176,2014-8-10,2017-8-9
34,Kane Jem Sa Tone,Private,Oo Si (2/13)(18.1.13),5.3.2013,4.3.2016,Gem,1,Shan State,Sai Hlan(Sha-6),5,3,2013,4,3,2016,Sai Hlan,Sha-6,2013-3-5,2016-3-4
35,Kane Jem Sa Tone,Private,Kyi Kyat (10.1.12),14.4.2012,13.7.2017,Jade,1,Kachin State,Sa Khaw Phawhtoke(85),14,4,2012,13,7,2017,Sa Khaw Phawhtoke,85,2012-4-14,2017-7-13
36,Kane Jem Sa Tone,Private,Kyi Kyat (10.1.12),14.4.2012,13.7.2017,Jade,1,Kachin State,Sa Khaw Phawhtoke(86),14,4,2012,13,7,2017,Sa Khaw Phawhtoke,86,2012-4-14,2017-7-13
37,Kane Jem Sa Tone,Private,Kyi Kyat (10.1.12),14.4.2012,13.7.2017,Jade,1,Kachin State,Sa Khaw Phawhtoke(87),14,4,2012,13,7,2017,Sa Khaw Phawhtoke,87,2012-4-14,2017-7-13
38,Kane Jem Sa Tone,Private,Kyi Kyat (27.8.10),7.10.2010,6.1.2016,Jade,1,Kachin State,Sa Khaw Phawhtoke(69),7,10,2010,6,1,2016,Sa Khaw Phawhtoke,69,2010-10-7,2016-1-6
39,Kane Jem Sa Tone,Private,Kyi Kyat (27.8.10),7.10.2010,6.1.2016,Jade,1,Kachin State,Sa Khaw Phawhtoke(70),7,10,2010,6,1,2016,Sa Khaw Phawhtoke,70,2010-10-7,2016-1-6
40,Kane Jem Sa Tone,Private,Kyi Kyat (27.8.10),7.10.2010,6.1.2016,Jade,1,Kachin State,Sa Khaw Phawhtoke(71),7,10,2010,6,1,2016,Sa Khaw Phawhtoke,71,2010-10-7,2016-1-6
41,Kane Jem Sa Tone,Private,Kyi Kyat (27.8.10),7.10.2010,6.1.2016,Jade,1,Kachin State,Sa Khaw Phawhtoke(72),7,10,2010,6,1,2016,Sa Khaw Phawhtoke,72,2010-10-7,2016-1-6
42,Kane Jem Sa Tone,Private,Kyi Kyat (27.8.10),7.10.2010,6.1.2016,Jade,1,Kachin State,Sa Khaw Phawhtoke(73),7,10,2010,6,1,2016,Sa Khaw Phawhtoke,73,2010-10-7,2016-1-6
43,Kane Jem Sa Tone,Private,Kyi Kyat (27.8.10),7.10.2010,6.1.2016,Jade,1,Kachin State,Sa Khaw Phawhtoke(74),7,10,2010,6,1,2016,Sa Khaw Phawhtoke,74,2010-10-7,2016-1-6
44,Kane Jem Sa Tone,Private,Kyi Kyat (27.8.10),7.10.2010,6.1.2016,Jade,1,Kachin State,Sa Khaw Phawhtoke(75),7,10,2010,6,1,2016,Sa Khaw Phawhtoke,75,2010-10-7,2016-1-6
45,Kane Jem Sa Tone,Private,Kyi Kyat (27.8.10),7.10.2010,6.1.2016,Jade,1,Kachin State,Sa Khaw Phawhtoke(76),7,10,2010,6,1,2016,Sa Khaw Phawhtoke,76,2010-10-7,2016-1-6
46,Kane Jem Sa Tone,Private,Kyi Kyat (27.8.10),7.10.2010,6.1.2016,Jade,1,Kachin State,Sa Khaw Phawhtoke(77),7,10,2010,6,1,2016,Sa Khaw Phawhtoke,77,2010-10-7,2016-1-6
47,Kane Jem Sa Tone,Private,Kyi Kyat (19.10.10),6.12.2010,6.3.2016,Jade,1,Kachin State,Sa Khaw Phawhtoke(78),6,12,2010,6,3,2016,Sa Khaw Phawhtoke,78,2010-12-6,2016-3-6
48,Kane Jem Sa Tone,Private,Kyi Kyat (19.10.10),6.12.2010,6.3.2016,Jade,1,Kachin State,Sa Khaw Phawhtoke(79),6,12,2010,6,3,2016,Sa Khaw Phawhtoke,79,2010-12-6,2016-3-6
49,Kane Jem Sa Tone,Private,Kyi Kyat (19.10.10),6.12.2010,6.3.2016,Jade,1,Kachin State,Sa Khaw Phawhtoke(80),6,12,2010,6,3,2016,Sa Khaw Phawhtoke,80,2010-12-6,2016-3-6
50,Kane Jem Sa Tone,Private,Kyi Kyat (19.10.10),6.12.2010,6.3.2016,Jade,1,Kachin State,Sa Khaw Phawhtoke(81),6,12,2010,6,3,2016,Sa Khaw Phawhtoke,81,2010-12-6,2016-3-6
51,Kane Jem Sa Tone,Private,Kyi Kyat (19.10.10),6.12.2010,6.3.2016,Jade,1,Kachin State,Sa Khaw Phawhtoke(82),6,12,2010,6,3,2016,Sa Khaw Phawhtoke,82,2010-12-6,2016-3-6
1,Kon Kot,Private,Oo Si(1/10)(4.2.10),16.2.201,18.5.2015,Jade,1,Kachin State,Sai Kyar Bon(7),16,2,201,18,5,2015,Sai Kyar Bon,7,201-2-16,2015-5-18
1,Kan Par Ni,Private,Oo Si(6/11)(18.12.11),20.2.2012,21.5.2017,Jade,1,Kachin State,Whay Lone(45),20,2,2012,21,5,2017,Whay Lone,45,2012-2-20,2017-5-21
2,Kan Par Ni,Private,Oo Si(6/11)(18.12.11),20.2.2012,21.5.2017,Jade,1,Kachin State,Whay Lone(46),20,2,2012,21,5,2017,Whay Lone,46,2012-2-20,2017-5-21
3,Kan Par Ni,Private,Oo Si(6/11)(18.12.11),20.2.2012,21.5.2017,Jade,1,Kachin State,Whay Lone(47),20,2,2012,21,5,2017,Whay Lone,47,2012-2-20,2017-5-21
4,Kan Par Ni,Private,Oo Si(6/11)(18.12.11),20.2.2012,21.5.2017,Jade,1,Kachin State,Whay Lone(48),20,2,2012,21,5,2017,Whay Lone,48,2012-2-20,2017-5-21
5,Kan Par Ni,Private,Oo Si(6/11)(18.12.11),20.2.2012,21.5.2017,Jade,1,Kachin State,Whay Lone(49),20,2,2012,21,5,2017,Whay Lone,49,2012-2-20,2017-5-21
6,Kan Par Ni,Private,Oo Si(6/11)(18.12.11),20.2.2012,21.5.2017,Jade,1,Kachin State,Whay Lone(50),20,2,2012,21,5,2017,Whay Lone,50,2012-2-20,2017-5-21
7,Kan Par Ni,Private,Oo Si(6/11)(18.12.11),20.2.2012,21.5.2017,Jade,1,Kachin State,Whay Lone(51),20,2,2012,21,5,2017,Whay Lone,51,2012-2-20,2017-5-21
8,Kan Par Ni,Private,Oo Si(6/11)(18.12.11),20.2.2012,21.5.2017,Jade,1,Kachin State,Whay Lone(52),20,2,2012,21,5,2017,Whay Lone,52,2012-2-20,2017-5-21
9,Kan Par Ni,Private,Oo Si(6/11)(18.12.11),20.2.2012,21.5.2017,Jade,1,Kachin State,Whay Lone(53),20,2,2012,21,5,2017,Whay Lone,53,2012-2-20,2017-5-21
10,Kan Par Ni,Private,Oo Si(6/11)(18.12.11),20.2.2012,21.5.2017,Jade,1,Kachin State,Whay Lone(54),20,2,2012,21,5,2017,Whay Lone,54,2012-2-20,2017-5-21
11,Kan Par Ni,Private,Oo Si(6/11)(18.12.11),20.2.2012,21.5.2017,Jade,1,Kachin State,Whay Lone(55),20,2,2012,21,5,2017,Whay Lone,55,2012-2-20,2017-5-21
12,Kan Par Ni,Private,Oo Si(6/11)(18.12.11),20.2.2012,21.5.2017,Jade,1,Kachin State,Whay Lone(56),20,2,2012,21,5,2017,Whay Lone,56,2012-2-20,2017-5-21
13,Kan Par Ni,Private,Oo Si(6/11)(18.12.11),20.2.2012,21.5.2017,Jade,1,Kachin State,Whay Lone(57),20,2,2012,21,5,2017,Whay Lone,57,2012-2-20,2017-5-21
14,Kan Par Ni,Private,Oo Si(6/11)(18.12.11),20.2.2012,21.5.2017,Jade,1,Kachin State,Whay Lone(58),20,2,2012,21,5,2017,Whay Lone,58,2012-2-20,2017-5-21
15,Kan Par Ni,Private,Oo Si(6/11)(18.12.11),20.2.2012,21.5.2017,Jade,1,Kachin State,Whay Lone(59),20,2,2012,21,5,2017,Whay Lone,59,2012-2-20,2017-5-21
16,Kan Par Ni,Private,Oo Si(6/11)(18.12.11),20.2.2012,21.5.2017,Jade,1,Kachin State,Whay Lone(60),20,2,2012,21,5,2017,Whay Lone,60,2012-2-20,2017-5-21
17,Kan Par Ni,Private,Oo Si(6/11)(18.12.11),20.2.2012,21.5.2017,Jade,1,Kachin State,Whay Lone(61),20,2,2012,21,5,2017,Whay Lone,61,2012-2-20,2017-5-21
18,Kan Par Ni,Private,Oo Si(6/11)(18.12.11),20.2.2012,21.5.2017,Jade,1,Kachin State,Whay Lone(62),20,2,2012,21,5,2017,Whay Lone,62,2012-2-20,2017-5-21
19,Kan Par Ni,Private,Oo Si(6/11)(18.12.11),20.2.2012,21.5.2017,Jade,1,Kachin State,Whay Lone(63),20,2,2012,21,5,2017,Whay Lone,63,2012-2-20,2017-5-21
20,Kan Par Ni,Private,Oo Si(6/11)(18.12.11),20.2.2012,21.5.2017,Jade,1,Kachin State,Whay Lone(64),20,2,2012,21,5,2017,Whay Lone,64,2012-2-20,2017-5-21
21,Kan Par Ni,Private,Oo Si(4/15)(18.12.15),22.5.2012,20.8.2017,Jade,1,Kachin State,Mat Lin Chaung(28),22,5,2012,20,8,2017,Mat Lin Chaung,28,2012-5-22,2017-8-20
22,Kan Par Ni,Private,Oo Si(4/15)(18.12.15),31.5.2013,31.8.2017,Jade,1,Kachin State,Ma Mon(189),31,5,2013,31,8,2017,Ma Mon,189,2013-5-31,2017-8-31
23,Kan Par Ni,Private,Oo Si(3/14)(11.12.14),2.4.2015,1.4.2020,Jade,1,Kachin State,Maw La Kin(204),2,4,2015,1,4,2020,Maw La Kin,204,2015-4-2,2020-4-1
24,Kan Par Ni,Private,Oo Si(3/14)(11.12.14),2.4.2015,1.4.2020,Jade,1,Kachin State,Maw La Kin(205),2,4,2015,1,4,2020,Maw La Kin,205,2015-4-2,2020-4-1
1,Koe Kant Yone Phone,Private,Oo Si(6/11)(18.12.11),24.9.2011,23.12.2016,Jade,1,Kachin State,Sha Yaung Kha(98),24,9,2011,23,12,2016,Sha Yaung Kha,98,2011-9-24,2016-12-23
2,Koe Kant Yone Phone,Private,Oo Si(3/13)(15.2.13),6.6.2012,5.9.2019,Jade,1,Kachin State,Ba La Kha(236),6,6,2012,5,9,2019,Ba La Kha,236,2012-6-6,2019-9-5
3,Koe Kant Yone Phone,Private,Oo Si(3/14)(11.12.14),26.2.2015,25.2.2018,Jade,1,Kachin State,Sha Yaung Kha(79),26,2,2015,25,2,2018,Sha Yaung Kha,79,2015-2-26,2018-2-25
1,Tiger Jade,Private,Oo Si (2/13)(18.1.13),13.3.2013,31.8.2017,Gem,1,Kachin State,Ma Naw(12),13,3,2013,31,8,2017,Ma Naw,12,2013-3-13,2017-8-31
2,Tiger Jade,Private,Oo Si (2/13)(18.1.13),13.3.2014,31.8.2018,Gem,1,Kachin State,Ma Naw(13),13,3,2014,31,8,2018,Ma Naw,13,2014-3-13,2018-8-31
1,Big Lion,Private,Kyi Kyat (5/12)(6.7.12),31.7.2012,31.8.2017,Jade,1,Kachin State,Khai See Phawhtoke(680),31,7,2012,31,8,2017,Khai See Phawhtoke,680,2012-7-31,2017-8-31
2,Big Lion,Private,Kyi Kyat (5/12)(6.7.12),31.7.2012,31.8.2017,Jade,1,Kachin State,Khai See Phawhtoke(681),31,7,2012,31,8,2017,Khai See Phawhtoke,681,2012-7-31,2017-8-31
3,Big Lion,Private,Kyi Kyat (5/12)(6.7.12),31.7.2012,31.8.2017,Jade,1,Kachin State,Khai See Phawhtoke(682),31,7,2012,31,8,2017,Khai See Phawhtoke,682,2012-7-31,2017-8-31
4,Big Lion,Private,Kyi Kyat (5/12)(6.7.12),31.7.2012,31.8.2017,Jade,1,Kachin State,Khai See Phawhtoke(683),31,7,2012,31,8,2017,Khai See Phawhtoke,683,2012-7-31,2017-8-31
5,Big Lion,Private,Kyi Kyat (5/12)(6.7.12),31.7.2012,31.8.2017,Jade,1,Kachin State,Khai See Phawhtoke(684),31,7,2012,31,8,2017,Khai See Phawhtoke,684,2012-7-31,2017-8-31
6,Big Lion,Private,Kyi Kyat (5/12)(6.7.12),31.7.2012,31.8.2017,Jade,1,Kachin State,Khai See Phawhtoke(685),31,7,2012,31,8,2017,Khai See Phawhtoke,685,2012-7-31,2017-8-31
7,Big Lion,Private,Kyi Kyat (5/12)(6.7.12),31.7.2012,31.8.2017,Jade,1,Kachin State,Khai See Phawhtoke(686),31,7,2012,31,8,2017,Khai See Phawhtoke,686,2012-7-31,2017-8-31
8,Big Lion,Private,Kyi Kyat (5/12)(6.7.12),31.7.2012,31.8.2017,Jade,1,Kachin State,Khai See Phawhtoke(687),31,7,2012,31,8,2017,Khai See Phawhtoke,687,2012-7-31,2017-8-31
9,Big Lion,Private,Kyi Kyat (5/12)(6.7.12),31.7.2012,31.8.2017,Jade,1,Kachin State,Khai See Phawhtoke(688),31,7,2012,31,8,2017,Khai See Phawhtoke,688,2012-7-31,2017-8-31
10,Big Lion,Private,Kyi Kyat (5/12)(6.7.12),31.7.2012,31.8.2017,Jade,1,Kachin State,Khai See Phawhtoke(689),31,7,2012,31,8,2017,Khai See Phawhtoke,689,2012-7-31,2017-8-31
11,Big Lion,Private,Kyi Kyat (5/12)(6.7.12),31.7.2012,31.8.2017,Jade,1,Kachin State,Khai See Phawhtoke(690),31,7,2012,31,8,2017,Khai See Phawhtoke,690,2012-7-31,2017-8-31
12,Big Lion,Private,Kyi Kyat (5/12)(6.7.12),31.7.2012,31.8.2017,Jade,1,Kachin State,Khai See Phawhtoke(691),31,7,2012,31,8,2017,Khai See Phawhtoke,691,2012-7-31,2017-8-31
13,Big Lion,Private,Kyi Kyat (5/12)(6.7.12),31.7.2012,31.8.2017,Jade,1,Kachin State,Khai See Phawhtoke(692),31,7,2012,31,8,2017,Khai See Phawhtoke,692,2012-7-31,2017-8-31
14,Big Lion,Private,Kyi Kyat (5/12)(6.7.12),31.7.2012,31.8.2017,Jade,1,Kachin State,Khai See Phawhtoke(693),31,7,2012,31,8,2017,Khai See Phawhtoke,693,2012-7-31,2017-8-31
15,Big Lion,Private,Kyi Kyat (5/12)(6.7.12),31.7.2012,31.8.2017,Jade,1,Kachin State,Khai See Phawhtoke(694),31,7,2012,31,8,2017,Khai See Phawhtoke,694,2012-7-31,2017-8-31
16,Big Lion,Private,Kyi Kyat (5/12)(6.7.12),31.7.2012,31.8.2017,Jade,1,Kachin State,Khai See Phawhtoke(695),31,7,2012,31,8,2017,Khai See Phawhtoke,695,2012-7-31,2017-8-31
17,Big Lion,Private,Kyi Kyat (5/12)(6.7.12),31.7.2012,31.8.2017,Jade,1,Kachin State,Khai See Phawhtoke(696),31,7,2012,31,8,2017,Khai See Phawhtoke,696,2012-7-31,2017-8-31
18,Big Lion,Private,Kyi Kyat (5/12)(6.7.12),31.7.2012,31.8.2017,Jade,1,Kachin State,Khai See Phawhtoke(697),31,7,2012,31,8,2017,Khai See Phawhtoke,697,2012-7-31,2017-8-31
19,Big Lion,Private,Kyi Kyat (5/12)(6.7.12),31.7.2012,31.8.2017,Jade,1,Kachin State,Khai See Phawhtoke(698),31,7,2012,31,8,2017,Khai See Phawhtoke,698,2012-7-31,2017-8-31
20,Big Lion,Private,Kyi Kyat (5/12)(6.7.12),31.7.2012,31.8.2017,Jade,1,Kachin State,Khai See Phawhtoke(699),31,7,2012,31,8,2017,Khai See Phawhtoke,699,2012-7-31,2017-8-31
21,Big Lion,Private,Kyi Kyat (5/12)(6.7.12),31.7.2012,31.8.2017,Jade,1,Kachin State,Khai See Phawhtoke(700),31,7,2012,31,8,2017,Khai See Phawhtoke,700,2012-7-31,2017-8-31
22,Big Lion,Private,Kyi Kyat (5/12)(6.7.12),31.7.2012,31.8.2017,Jade,1,Kachin State,Khai See Phawhtoke(701),31,7,2012,31,8,2017,Khai See Phawhtoke,701,2012-7-31,2017-8-31
23,Big Lion,Private,Kyi Kyat (5/12)(6.7.12),31.7.2012,31.8.2017,Jade,1,Kachin State,Khai See Phawhtoke(702),31,7,2012,31,8,2017,Khai See Phawhtoke,702,2012-7-31,2017-8-31
24,Big Lion,Private,Kyi Kyat (5/12)(6.7.12),31.7.2012,31.8.2017,Jade,1,Kachin State,Khai See Phawhtoke(703),31,7,2012,31,8,2017,Khai See Phawhtoke,703,2012-7-31,2017-8-31
25,Big Lion,Private,Kyi Kyat (5/12)(6.7.12),31.7.2012,31.8.2017,Jade,1,Kachin State,Khai See Phawhtoke(704),31,7,2012,31,8,2017,Khai See Phawhtoke,704,2012-7-31,2017-8-31
26,Big Lion,Private,Kyi Kyat (5/12)(6.7.12),31.7.2012,31.8.2017,Jade,1,Kachin State,Khai See Phawhtoke(705),31,7,2012,31,8,2017,Khai See Phawhtoke,705,2012-7-31,2017-8-31
27,Big Lion,Private,Kyi Kyat (5/12)(6.7.12),31.7.2012,31.8.2017,Jade,1,Kachin State,Khai See Phawhtoke(706),31,7,2012,31,8,2017,Khai See Phawhtoke,706,2012-7-31,2017-8-31
28,Big Lion,Private,Kyi Kyat (5/12)(6.7.12),31.7.2012,31.8.2017,Jade,1,Kachin State,Khai See Phawhtoke(707),31,7,2012,31,8,2017,Khai See Phawhtoke,707,2012-7-31,2017-8-31
29,Big Lion,Private,Kyi Kyat (5/12)(6.7.12),31.7.2012,31.8.2017,Jade,1,Kachin State,Khai See Phawhtoke(708),31,7,2012,31,8,2017,Khai See Phawhtoke,708,2012-7-31,2017-8-31
30,Big Lion,Private,Kyi Kyat (5/12)(6.7.12),31.7.2012,31.8.2017,Jade,1,Kachin State,Khai See Phawhtoke(709),31,7,2012,31,8,2017,Khai See Phawhtoke,709,2012-7-31,2017-8-31
31,Big Lion,Private,Kyi Kyat (5/12)(6.7.12),31.7.2012,31.8.2017,Jade,1,Kachin State,Khai See Phawhtoke(710),31,7,2012,31,8,2017,Khai See Phawhtoke,710,2012-7-31,2017-8-31
32,Big Lion,Private,Kyi Kyat (5/12)(6.7.12),31.7.2012,31.8.2017,Jade,1,Kachin State,Khai See Phawhtoke(711),31,7,2012,31,8,2017,Khai See Phawhtoke,711,2012-7-31,2017-8-31
33,Big Lion,Private,Kyi Kyat (5/12)(6.7.12),31.7.2012,31.8.2017,Jade,1,Kachin State,Khai See Phawhtoke(712),31,7,2012,31,8,2017,Khai See Phawhtoke,712,2012-7-31,2017-8-31
34,Big Lion,Private,Kyi Kyat (5/12)(6.7.12),31.7.2012,31.8.2017,Jade,1,Kachin State,Khai See Phawhtoke(713),31,7,2012,31,8,2017,Khai See Phawhtoke,713,2012-7-31,2017-8-31
35,Big Lion,Private,Kyi Kyat (5/12)(6.7.12),31.7.2012,31.8.2017,Jade,1,Kachin State,Khai See Phawhtoke(714),31,7,2012,31,8,2017,Khai See Phawhtoke,714,2012-7-31,2017-8-31
36,Big Lion,Private,Kyi Kyat (5/12)(6.7.12),31.7.2012,31.8.2017,Jade,1,Kachin State,Khai See Phawhtoke(715),31,7,2012,31,8,2017,Khai See Phawhtoke,715,2012-7-31,2017-8-31
37,Big Lion,Private,Kyi Kyat (5/12)(6.7.12),31.7.2012,31.8.2017,Jade,1,Kachin State,Khai See Phawhtoke(716),31,7,2012,31,8,2017,Khai See Phawhtoke,716,2012-7-31,2017-8-31
38,Big Lion,Private,Kyi Kyat (5/12)(6.7.12),31.7.2012,31.8.2017,Jade,1,Kachin State,Khai See Phawhtoke(717),31,7,2012,31,8,2017,Khai See Phawhtoke,717,2012-7-31,2017-8-31
39,Big Lion,Private,Kyi Kyat (5/12)(6.7.12),31.7.2012,31.8.2017,Jade,1,Kachin State,Khai See Phawhtoke(718),31,7,2012,31,8,2017,Khai See Phawhtoke,718,2012-7-31,2017-8-31
40,Big Lion,Private,Kyi Kyat (5/12)(6.7.12),31.7.2012,31.8.2017,Jade,1,Kachin State,Khai See Phawhtoke(719),31,7,2012,31,8,2017,Khai See Phawhtoke,719,2012-7-31,2017-8-31
41,Big Lion,Private,Kyi Kyat (5/12)(6.7.12),31.7.2012,31.8.2017,Jade,1,Kachin State,Khai See Phawhtoke(720),31,7,2012,31,8,2017,Khai See Phawhtoke,720,2012-7-31,2017-8-31
42,Big Lion,Private,Kyi Kyat (5/12)(6.7.12),31.7.2012,31.8.2017,Jade,1,Kachin State,Khai See Phawhtoke(721),31,7,2012,31,8,2017,Khai See Phawhtoke,721,2012-7-31,2017-8-31
43,Big Lion,Private,Kyi Kyat (5/12)(6.7.12),31.7.2012,31.8.2017,Jade,1,Kachin State,Khai See Phawhtoke(722),31,7,2012,31,8,2017,Khai See Phawhtoke,722,2012-7-31,2017-8-31
44,Big Lion,Private,Kyi Kyat (5/12)(6.7.12),31.7.2012,31.8.2017,Jade,1,Kachin State,Khai See Phawhtoke(723),31,7,2012,31,8,2017,Khai See Phawhtoke,723,2012-7-31,2017-8-31
45,Big Lion,Private,Kyi Kyat (5/12)(6.7.12),31.7.2012,31.8.2017,Jade,1,Kachin State,Khai See Phawhtoke(724),31,7,2012,31,8,2017,Khai See Phawhtoke,724,2012-7-31,2017-8-31
46,Big Lion,Private,Kyi Kyat (5/12)(6.7.12),31.7.2012,31.8.2017,Jade,1,Kachin State,Khai See Phawhtoke(725),31,7,2012,31,8,2017,Khai See Phawhtoke,725,2012-7-31,2017-8-31
47,Big Lion,Private,Kyi Kyat (5/12)(6.7.12),31.7.2012,31.8.2017,Jade,1,Kachin State,Khai See Phawhtoke(726),31,7,2012,31,8,2017,Khai See Phawhtoke,726,2012-7-31,2017-8-31
48,Big Lion,Private,Kyi Kyat (5/12)(6.7.12),31.7.2012,31.8.2017,Jade,1,Kachin State,Khai See Phawhtoke(727),31,7,2012,31,8,2017,Khai See Phawhtoke,727,2012-7-31,2017-8-31
49,Big Lion,Private,Kyi Kyat (5/12)(6.7.12),31.7.2012,31.8.2017,Jade,1,Kachin State,Khai See Phawhtoke(728),31,7,2012,31,8,2017,Khai See Phawhtoke,728,2012-7-31,2017-8-31
50,Big Lion,Private,Kyi Kyat (5/12)(6.7.12),31.7.2012,31.8.2017,Jade,1,Kachin State,Khai See Phawhtoke(729),31,7,2012,31,8,2017,Khai See Phawhtoke,729,2012-7-31,2017-8-31
1,Kyoe Kyar Arrman,Private,Kyi Kyat (19.10.10),2.2.2011,3.5.2016,Jade,1,Kachin State,Kaung yo Phawhtoke(438),2,2,2011,3,5,2016,Kaung yo Phawhtoke,438,2011-2-2,2016-5-3
2,Kyoe Kyar Arrman,Private,Kyi Kyat (19.10.10),2.2.2011,3.5.2016,Jade,1,Kachin State,Kaung yo Phawhtoke(439),2,2,2011,3,5,2016,Kaung yo Phawhtoke,439,2011-2-2,2016-5-3
3,Kyoe Kyar Arrman,Private,Kyi Kyat (19.10.10),2.2.2011,3.5.2016,Jade,1,Kachin State,Kaung yo Phawhtoke(442),2,2,2011,3,5,2016,Kaung yo Phawhtoke,442,2011-2-2,2016-5-3
4,Kyoe Kyar Arrman,Private,Kyi Kyat (19.10.10),2.3.2011,31.5.2016,Jade,1,Kachin State,Kaung yo Phawhtoke(443),2,3,2011,31,5,2016,Kaung yo Phawhtoke,443,2011-3-2,2016-5-31
5,Kyoe Kyar Arrman,Private,Kyi Kyat (19.10.10),2.3.2011,31.5.2016,Jade,1,Kachin State,Kaung yo Phawhtoke(444),2,3,2011,31,5,2016,Kaung yo Phawhtoke,444,2011-3-2,2016-5-31
6,Kyoe Kyar Arrman,Private,Kyi Kyat (19.10.10),2.3.2011,31.5.2016,Jade,1,Kachin State,Kaung yo Phawhtoke(445),2,3,2011,31,5,2016,Kaung yo Phawhtoke,445,2011-3-2,2016-5-31
7,Kyoe Kyar Arrman,Private,Kyi Kyat (19.10.10),2.3.2011,31.5.2016,Jade,1,Kachin State,Kaung yo Phawhtoke(446),2,3,2011,31,5,2016,Kaung yo Phawhtoke,446,2011-3-2,2016-5-31
8,Kyoe Kyar Arrman,Private,Kyi Kyat (19.10.10),2.3.2011,31.5.2016,Jade,1,Kachin State,Kaung yo Phawhtoke(447),2,3,2011,31,5,2016,Kaung yo Phawhtoke,447,2011-3-2,2016-5-31
9,Kyoe Kyar Arrman,Private,Kyi Kyat (19.10.10),2.3.2011,31.5.2016,Jade,1,Kachin State,Kaung yo Phawhtoke(448),2,3,2011,31,5,2016,Kaung yo Phawhtoke,448,2011-3-2,2016-5-31
10,Kyoe Kyar Arrman,Private,Kyi Kyat (19.10.10),2.3.2011,31.5.2016,Jade,1,Kachin State,Kaung yo Phawhtoke(449),2,3,2011,31,5,2016,Kaung yo Phawhtoke,449,2011-3-2,2016-5-31
11,Kyoe Kyar Arrman,Private,Kyi Kyat (19.10.10),2.3.2011,31.5.2016,Jade,1,Kachin State,Kaung yo Phawhtoke(458),2,3,2011,31,5,2016,Kaung yo Phawhtoke,458,2011-3-2,2016-5-31
12,Kyoe Kyar Arrman,Private,Kyi Kyat (19.10.10),2.3.2011,31.5.2016,Jade,1,Kachin State,Kaung yo Phawhtoke(459),2,3,2011,31,5,2016,Kaung yo Phawhtoke,459,2011-3-2,2016-5-31
13,Kyoe Kyar Arrman,Private,Kyi Kyat (19.10.10),2.3.2011,31.5.2016,Jade,1,Kachin State,Kaung yo Phawhtoke(460),2,3,2011,31,5,2016,Kaung yo Phawhtoke,460,2011-3-2,2016-5-31
14,Kyoe Kyar Arrman,Private,Kyi Kyat (19.10.10),2.3.2011,31.5.2016,Jade,1,Kachin State,Kaung yo Phawhtoke(461),2,3,2011,31,5,2016,Kaung yo Phawhtoke,461,2011-3-2,2016-5-31
15,Kyoe Kyar Arrman,Private,Kyi Kyat (19.10.10),2.8.2011,31.10.2016,Jade,1,Kachin State,Kaung yo Phawhtoke(470),2,8,2011,31,10,2016,Kaung yo Phawhtoke,470,2011-8-2,2016-10-31
16,Kyoe Kyar Arrman,Private,Kyi Kyat (19.10.10),2.8.2011,31.10.2016,Jade,1,Kachin State,Kaung yo Phawhtoke(471),2,8,2011,31,10,2016,Kaung yo Phawhtoke,471,2011-8-2,2016-10-31
17,Kyoe Kyar Arrman,Private,Kyi Kyat (19.10.10),2.8.2011,31.10.2016,Jade,1,Kachin State,Kaung yo Phawhtoke(472),2,8,2011,31,10,2016,Kaung yo Phawhtoke,472,2011-8-2,2016-10-31
18,Kyoe Kyar Arrman,Private,Kyi Kyat (19.10.10),2.8.2011,31.10.2016,Jade,1,Kachin State,Kaung yo Phawhtoke(473),2,8,2011,31,10,2016,Kaung yo Phawhtoke,473,2011-8-2,2016-10-31
19,Kyoe Kyar Arrman,Private,Kyi Kyat (19.10.10),2.8.2011,31.10.2016,Jade,1,Kachin State,Kaung yo Phawhtoke(474),2,8,2011,31,10,2016,Kaung yo Phawhtoke,474,2011-8-2,2016-10-31
20,Kyoe Kyar Arrman,Private,Kyi Kyat (19.10.10),2.8.2011,31.10.2016,Jade,1,Kachin State,Kaung yo Phawhtoke(483),2,8,2011,31,10,2016,Kaung yo Phawhtoke,483,2011-8-2,2016-10-31
21,Kyoe Kyar Arrman,Private,Kyi Kyat (19.10.10),2.8.2011,31.10.2016,Jade,1,Kachin State,Kaung yo Phawhtoke(484),2,8,2011,31,10,2016,Kaung yo Phawhtoke,484,2011-8-2,2016-10-31
22,Kyoe Kyar Arrman,Private,Kyi Kyat (19.10.10),2.8.2011,31.10.2016,Jade,1,Kachin State,Kaung yo Phawhtoke(485),2,8,2011,31,10,2016,Kaung yo Phawhtoke,485,2011-8-2,2016-10-31
23,Kyoe Kyar Arrman,Private,Kyi Kyat (19.10.10),2.8.2011,31.10.2016,Jade,1,Kachin State,Kaung yo Phawhtoke(486),2,8,2011,31,10,2016,Kaung yo Phawhtoke,486,2011-8-2,2016-10-31
24,Kyoe Kyar Arrman,Private,Kyi Kyat (19.10.10),2.8.2011,31.10.2016,Jade,1,Kachin State,Kaung yo Phawhtoke(487),2,8,2011,31,10,2016,Kaung yo Phawhtoke,487,2011-8-2,2016-10-31
25,Kyoe Kyar Arrman,Private,Kyi Kyat (19.10.10),2.8.2011,31.10.2016,Jade,1,Kachin State,Kaung yo Phawhtoke(491),2,8,2011,31,10,2016,Kaung yo Phawhtoke,491,2011-8-2,2016-10-31
26,Kyoe Kyar Arrman,Private,Kyi Kyat (19.10.10),2.8.2011,31.10.2016,Jade,1,Kachin State,Kaung yo Phawhtoke(492),2,8,2011,31,10,2016,Kaung yo Phawhtoke,492,2011-8-2,2016-10-31
27,Kyoe Kyar Arrman,Private,Kyi Kyat (19.10.10),2.8.2011,31.10.2016,Jade,1,Kachin State,Kaung yo Phawhtoke(493),2,8,2011,31,10,2016,Kaung yo Phawhtoke,493,2011-8-2,2016-10-31
28,Kyoe Kyar Arrman,Private,Kyi Kyat (19.10.10),2.8.2011,31.10.2016,Jade,1,Kachin State,Kaung yo Phawhtoke(494),2,8,2011,31,10,2016,Kaung yo Phawhtoke,494,2011-8-2,2016-10-31
29,Kyoe Kyar Arrman,Private,Kyi Kyat (19.10.10),2.8.2011,31.10.2016,Jade,1,Kachin State,Kaung yo Phawhtoke(495),2,8,2011,31,10,2016,Kaung yo Phawhtoke,495,2011-8-2,2016-10-31
30,Kyoe Kyar Arrman,Private,Kyi Kyat (19.10.10),2.10.2011,31.12.2016,Jade,1,Kachin State,Kaung yo Phawhtoke(440),2,10,2011,31,12,2016,Kaung yo Phawhtoke,440,2011-10-2,2016-12-31
31,Kyoe Kyar Arrman,Private,Kyi Kyat (19.10.10),2.10.2011,31.12.2016,Jade,1,Kachin State,Kaung yo Phawhtoke(441),2,10,2011,31,12,2016,Kaung yo Phawhtoke,441,2011-10-2,2016-12-31
32,Kyoe Kyar Arrman,Private,Kyi Kyat (19.10.10),2.10.2011,31.12.2016,Jade,1,Kachin State,Kaung yo Phawhtoke(450),2,10,2011,31,12,2016,Kaung yo Phawhtoke,450,2011-10-2,2016-12-31
33,Kyoe Kyar Arrman,Private,Kyi Kyat (19.10.10),2.10.2011,31.12.2016,Jade,1,Kachin State,Kaung yo Phawhtoke(451),2,10,2011,31,12,2016,Kaung yo Phawhtoke,451,2011-10-2,2016-12-31
34,Kyoe Kyar Arrman,Private,Kyi Kyat (19.10.10),2.10.2011,31.12.2016,Jade,1,Kachin State,Kaung yo Phawhtoke(462),2,10,2011,31,12,2016,Kaung yo Phawhtoke,462,2011-10-2,2016-12-31
35,Kyoe Kyar Arrman,Private,Kyi Kyat (19.10.10),2.10.2011,31.12.2016,Jade,1,Kachin State,Kaung yo Phawhtoke(463),2,10,2011,31,12,2016,Kaung yo Phawhtoke,463,2011-10-2,2016-12-31
36,Kyoe Kyar Arrman,Private,Kyi Kyat (19.10.10),2.10.2011,31.12.2016,Jade,1,Kachin State,Kaung yo Phawhtoke(464),2,10,2011,31,12,2016,Kaung yo Phawhtoke,464,2011-10-2,2016-12-31
37,Kyoe Kyar Arrman,Private,Kyi Kyat (19.10.10),2.10.2011,31.12.2016,Jade,1,Kachin State,Kaung yo Phawhtoke(475),2,10,2011,31,12,2016,Kaung yo Phawhtoke,475,2011-10-2,2016-12-31
38,Kyoe Kyar Arrman,Private,Kyi Kyat (19.10.10),2.10.2011,31.12.2016,Jade,1,Kachin State,Kaung yo Phawhtoke(476),2,10,2011,31,12,2016,Kaung yo Phawhtoke,476,2011-10-2,2016-12-31
39,Kyoe Kyar Arrman,Private,Kyi Kyat (19.10.10),2.10.2011,31.12.2016,Jade,1,Kachin State,Kaung yo Phawhtoke(477),2,10,2011,31,12,2016,Kaung yo Phawhtoke,477,2011-10-2,2016-12-31
40,Kyoe Kyar Arrman,Private,Kyi Kyat (19.10.10),2.10.2011,31.12.2016,Jade,1,Kachin State,Kaung yo Phawhtoke(488),2,10,2011,31,12,2016,Kaung yo Phawhtoke,488,2011-10-2,2016-12-31
41,Kyoe Kyar Arrman,Private,Kyi Kyat (19.10.10),2.10.2011,31.12.2016,Jade,1,Kachin State,Kaung yo Phawhtoke(489),2,10,2011,31,12,2016,Kaung yo Phawhtoke,489,2011-10-2,2016-12-31
42,Kyoe Kyar Arrman,Private,Kyi Kyat (19.10.10),2.10.2011,31.12.2016,Jade,1,Kachin State,Kaung yo Phawhtoke(490),2,10,2011,31,12,2016,Kaung yo Phawhtoke,490,2011-10-2,2016-12-31
43,Kyoe Kyar Arrman,Private,Kyi Kyat (19.10.10),2.10.2011,31.12.2016,Jade,1,Kachin State,Kaung yo Phawhtoke(496),2,10,2011,31,12,2016,Kaung yo Phawhtoke,496,2011-10-2,2016-12-31
44,Kyoe Kyar Arrman,Private,Kyi Kyat (19.10.10),2.10.2011,31.12.2016,Jade,1,Kachin State,Kaung yo Phawhtoke(497),2,10,2011,31,12,2016,Kaung yo Phawhtoke,497,2011-10-2,2016-12-31
45,Kyoe Kyar Arrman,Private,Kyi Kyat (19.10.10),2.10.2011,31.12.2016,Jade,1,Kachin State,Kaung yo Phawhtoke(498),2,10,2011,31,12,2016,Kaung yo Phawhtoke,498,2011-10-2,2016-12-31
46,Kyoe Kyar Arrman,Private,Kyi Kyat (19.10.10),2.10.2011,31.12.2016,Jade,1,Kachin State,Kaung yo Phawhtoke(499),2,10,2011,31,12,2016,Kaung yo Phawhtoke,499,2011-10-2,2016-12-31
47,Kyoe Kyar Arrman,Private,Kyi Kyat (19.10.10),2.10.2011,31.12.2016,Jade,1,Kachin State,Kaung yo Phawhtoke(500),2,10,2011,31,12,2016,Kaung yo Phawhtoke,500,2011-10-2,2016-12-31
48,Kyoe Kyar Arrman,Private,Kyi Kyat (19.10.10),2.10.2011,31.12.2016,Jade,1,Kachin State,Kaung yo Phawhtoke(501),2,10,2011,31,12,2016,Kaung yo Phawhtoke,501,2011-10-2,2016-12-31
49,Kyoe Kyar Arrman,Private,Kyi Kyat (19.10.10),2.10.2011,31.12.2016,Jade,1,Kachin State,Kaung yo Phawhtoke(502),2,10,2011,31,12,2016,Kaung yo Phawhtoke,502,2011-10-2,2016-12-31
50,Kyoe Kyar Arrman,Private,Kyi Kyat (19.10.10),2.10.2011,31.12.2016,Jade,1,Kachin State,Kaung yo Phawhtoke(503),2,10,2011,31,12,2016,Kaung yo Phawhtoke,503,2011-10-2,2016-12-31
1,Kyi,Private,Oo Si(4/11)(3.11.11),9.1.2012,9.4.2017,Jade,1,Kachin State,Khuat Khaw(55),9,1,2012,9,4,2017,Khuat Khaw,55,2012-1-9,2017-4-9
2,Kyi,Private,Oo Si(4/11)(3.11.11),9.1.2012,9.4.2017,Jade,1,Kachin State,Khuat Khaw(56),9,1,2012,9,4,2017,Khuat Khaw,56,2012-1-9,2017-4-9
3,Kyi,Private,Oo Si(4/11)(3.11.11),9.1.2012,9.4.2017,Jade,1,Kachin State,Khuat Khaw(57),9,1,2012,9,4,2017,Khuat Khaw,57,2012-1-9,2017-4-9
4,Kyi,Private,Oo Si(3/10)(28.9.10),9.10.2010,8.1.2016,Jade,1,Kachin State,Dan Tin Kyi (8),9,10,2010,8,1,2016,Dan Tin Kyi ,8,2010-10-9,2016-1-8
5,Kyi,Private,Oo Si(3/10)(28.9.10),9.10.2010,8.1.2016,Jade,1,Kachin State,Dan Tin Kyi Phaw Htot(12),9,10,2010,8,1,2016,Dan Tin Kyi Phaw Htot,12,2010-10-9,2016-1-8
1,Kyi Wai Yan,Private,Oo Si(3/13)(15.2.13),31.5.2013,2.10.2017,Jade,1,Kachin State,Maw One Lay(49),31,5,2013,2,10,2017,Maw One Lay,49,2013-5-31,2017-10-2
2,Kyi Wai Yan,Private,Oo Si(3/13)(15.2.13),31.5.2013,31.8.2017,Jade,1,Kachin State,Mhaw Si Sar(353),31,5,2013,31,8,2017,Mhaw Si Sar,353,2013-5-31,2017-8-31
3,Kyi Wai Yan,Private,Oo Si(3/13)(15.2.13),31.5.2013,31.8.2017,Jade,1,Kachin State,Mhaw Si Sar(354),31,5,2013,31,8,2017,Mhaw Si Sar,354,2013-5-31,2017-8-31
4,Kyi Wai Yan,Private,Oo Si(3/13)(15.2.13),31.5.2013,31.8.2017,Jade,1,Kachin State,Whay Khar Mhawthit Kone(543),31,5,2013,31,8,2017,Whay Khar Mhawthit Kone,543,2013-5-31,2017-8-31
5,Kyi Wai Yan,Private,Oo Si(3/13)(15.2.13),31.5.2013,31.8.2017,Jade,1,Kachin State,Whay Khar Mhawthit Kone(545),31,5,2013,31,8,2017,Whay Khar Mhawthit Kone,545,2013-5-31,2017-8-31
6,Kyi Wai Yan,Private,Oo Si(3/13)(15.2.13),31.5.2013,31.8.2017,Jade,1,Kachin State,Whay Khar Mhawthit Kone(547),31,5,2013,31,8,2017,Whay Khar Mhawthit Kone,547,2013-5-31,2017-8-31
7,Kyi Wai Yan,Private,Oo Si(3/13)(15.2.13),31.5.2013,31.8.2017,Jade,1,Kachin State,Whay Khar Mhawthit Kone(549),31,5,2013,31,8,2017,Whay Khar Mhawthit Kone,549,2013-5-31,2017-8-31
8,Kyi Wai Yan,Private,Oo Si(3/13)(15.2.13),31.5.2013,31.8.2017,Jade,1,Kachin State,Whay Khar Mhawthit Kone(551),31,5,2013,31,8,2017,Whay Khar Mhawthit Kone,551,2013-5-31,2017-8-31
9,Kyi Wai Yan,Private,Oo Si(3/13)(15.2.13),31.5.2013,24.11.2017,Jade,1,Kachin State,Maw Maung(172),31,5,2013,24,11,2017,Maw Maung,172,2013-5-31,2017-11-24
10,Kyi Wai Yan,Private,Oo Si(3/13)(15.2.13),31.5.2013,31.8.2017,Jade,1,Kachin State,Nan Sa Lin Chaung(145),31,5,2013,31,8,2017,Nan Sa Lin Chaung,145,2013-5-31,2017-8-31
11,Kyi Wai Yan,Private,Oo Si(3/13)(15.2.13),31.5.2013,31.8.2017,Jade,1,Kachin State,Nan Sa Lin Chaung(146),31,5,2013,31,8,2017,Nan Sa Lin Chaung,146,2013-5-31,2017-8-31
12,Kyi Wai Yan,Private,Oo Si(3/13)(15.2.13),31.5.2013,31.8.2017,Jade,1,Kachin State,Nan Sa Lin Chaung(147),31,5,2013,31,8,2017,Nan Sa Lin Chaung,147,2013-5-31,2017-8-31
13,Kyi Wai Yan,Private,Oo Si(3/13)(15.2.13),31.5.2013,31.8.2017,Jade,1,Kachin State,Nan Sa Lin Chaung(157),31,5,2013,31,8,2017,Nan Sa Lin Chaung,157,2013-5-31,2017-8-31
14,Kyi Wai Yan,Private,Oo Si(3/13)(15.2.13),31.5.2013,31.8.2017,Jade,1,Kachin State,Nan Sa Lin Chaung(158),31,5,2013,31,8,2017,Nan Sa Lin Chaung,158,2013-5-31,2017-8-31
15,Kyi Wai Yan,Private,Oo Si(3/13)(15.2.13),31.5.2013,31.8.2017,Jade,1,Kachin State,Nan Sa Lin Chaung(159),31,5,2013,31,8,2017,Nan Sa Lin Chaung,159,2013-5-31,2017-8-31
16,Kyi Wai Yan,Private,Oo Si(3/13)(15.2.13),31.5.2013,25.9.2017,Jade,1,Kachin State,Nan Sa Lin Chaung(323),31,5,2013,25,9,2017,Nan Sa Lin Chaung,323,2013-5-31,2017-9-25
17,Kyi Wai Yan,Private,Oo Si(3/13)(15.2.13),31.5.2013,25.9.2017,Jade,1,Kachin State,Nan Sa Lin Chaung(325),31,5,2013,25,9,2017,Nan Sa Lin Chaung,325,2013-5-31,2017-9-25
18,Kyi Wai Yan,Private,Oo Si(3/13)(15.2.13),31.5.2013,25.9.2017,Jade,1,Kachin State,Nan Sa Lin Chaung(327),31,5,2013,25,9,2017,Nan Sa Lin Chaung,327,2013-5-31,2017-9-25
19,Kyi Wai Yan,Private,Oo Si(3/13)(15.2.13),31.5.2013,25.9.2017,Jade,1,Kachin State,Nan Sa Lin Chaung(329),31,5,2013,25,9,2017,Nan Sa Lin Chaung,329,2013-5-31,2017-9-25
20,Kyi Wai Yan,Private,Oo Si(3/13)(15.2.13),31.5.2013,25.9.2017,Jade,1,Kachin State,Nan Sa Lin Chaung(331),31,5,2013,25,9,2017,Nan Sa Lin Chaung,331,2013-5-31,2017-9-25
1,Kyi L Sein,Private,Oo Si(1/10)(4.2.10),30.3.2010,29.6.2015,Jade,1,Kachin State,Khuat Khaw(423),30,3,2010,29,6,2015,Khuat Khaw,423,2010-3-30,2015-6-29
2,Kyi L Sein,Private,Oo Si(1/10)(4.2.10),30.3.2010,29.6.2015,Jade,1,Kachin State,Khuat Khaw(522),30,3,2010,29,6,2015,Khuat Khaw,522,2010-3-30,2015-6-29
3,Kyi L Sein,Private,Oo Si(1/10)(4.2.10),30.3.2010,29.6.2015,Jade,1,Kachin State,Ma Kar Pin(225),30,3,2010,29,6,2015,Ma Kar Pin,225,2010-3-30,2015-6-29
4,Kyi L Sein,Private,Oo Si(1/10)(4.2.10),30.3.2010,29.6.2015,Jade,1,Kachin State,Ma Kar Pin(252),30,3,2010,29,6,2015,Ma Kar Pin,252,2010-3-30,2015-6-29
5,Kyi L Sein,Private,Oo Si(1/10)(4.2.10),30.3.2010,29.6.2015,Jade,1,Kachin State,Ma Kar Pin(324),30,3,2010,29,6,2015,Ma Kar Pin,324,2010-3-30,2015-6-29
6,Kyi L Sein,Private,Oo Si(2/10)(17.5.10),30.7.2010,2.10.2015,Jade,1,Kachin State,Sai Kyar Bon(6),30,7,2010,2,10,2015,Sai Kyar Bon,6,2010-7-30,2015-10-2
7,Kyi L Sein,Private,Oo Si(4/11)(3.11.11),6.1.2012,6.4.2017,Jade,1,Kachin State,Maw Maung(38),6,1,2012,6,4,2017,Maw Maung,38,2012-1-6,2017-4-6
8,Kyi L Sein,Private,Oo Si(4/11)(3.11.11),6.1.2012,6.4.2017,Jade,1,Kachin State,Maw Maung(41),6,1,2012,6,4,2017,Maw Maung,41,2012-1-6,2017-4-6
9,Kyi L Sein,Private,Oo Si(5/11)(16.11.11),20.1.2012,21.4.2019,Jade,1,Kachin State,Maw Maung(87),20,1,2012,21,4,2019,Maw Maung,87,2012-1-20,2019-4-21
10,Kyi L Sein,Private,Oo Si(5/11)(16.11.11),20.1.2012,21.4.2019,Jade,1,Kachin State,Maw Maung(88),20,1,2012,21,4,2019,Maw Maung,88,2012-1-20,2019-4-21
11,Kyi L Sein,Private,Oo Si(5/11)(16.11.11),20.1.2012,21.4.2019,Jade,1,Kachin State,Maw Maung(100),20,1,2012,21,4,2019,Maw Maung,100,2012-1-20,2019-4-21
1,Kyay Ta Khon Sein,Private,Oo Si(1/10)(4.2.10),31.3.2010,30.6.2015,Jade,1,Kachin State,Ka Lar Mhaw(69),31,3,2010,30,6,2015,Ka Lar Mhaw,69,2010-3-31,2015-6-30
2,Kyay Ta Khon Sein,Private,Kyi Kyat (12.11.10),22.12.2010,22.3.2016,Jade,1,Kachin State,Thret Phawhtoke(38),22,12,2010,22,3,2016,Thret Phawhtoke,38,2010-12-22,2016-3-22
3,Kyay Ta Khon Sein,Private,Kyi Kyat (12.11.10),22.12.2010,22.3.2016,Jade,1,Kachin State,Thret Phawhtoke(39),22,12,2010,22,3,2016,Thret Phawhtoke,39,2010-12-22,2016-3-22
4,Kyay Ta Khon Sein,Private,Kyi Kyat (12.11.10),22.12.2010,22.3.2016,Jade,1,Kachin State,Thret Phawhtoke(40),22,12,2010,22,3,2016,Thret Phawhtoke,40,2010-12-22,2016-3-22
5,Kyay Ta Khon Sein,Private,Kyi Kyat (12.11.10),22.12.2010,22.3.2016,Jade,1,Kachin State,Thret Phawhtoke(41),22,12,2010,22,3,2016,Thret Phawhtoke,41,2010-12-22,2016-3-22
6,Kyay Ta Khon Sein,Private,Kyi Kyat (12.11.10),22.12.2010,22.3.2016,Jade,1,Kachin State,Thret Phawhtoke(42),22,12,2010,22,3,2016,Thret Phawhtoke,42,2010-12-22,2016-3-22
7,Kyay Ta Khon Sein,Private,Kyi Kyat (12.11.10),22.12.2010,22.3.2016,Jade,1,Kachin State,Thret Phawhtoke(43),22,12,2010,22,3,2016,Thret Phawhtoke,43,2010-12-22,2016-3-22
8,Kyay Ta Khon Sein,Private,Kyi Kyat (12.11.10),22.12.2010,22.3.2016,Jade,1,Kachin State,Thret Phawhtoke(44),22,12,2010,22,3,2016,Thret Phawhtoke,44,2010-12-22,2016-3-22
9,Kyay Ta Khon Sein,Private,Kyi Kyat (12.11.10),22.12.2010,22.3.2016,Jade,1,Kachin State,Thret Phawhtoke(45),22,12,2010,22,3,2016,Thret Phawhtoke,45,2010-12-22,2016-3-22
10,Kyay Ta Khon Sein,Private,Kyi Kyat (12.11.10),22.12.2010,22.3.2016,Jade,1,Kachin State,Thret Phawhtoke(46),22,12,2010,22,3,2016,Thret Phawhtoke,46,2010-12-22,2016-3-22
11,Kyay Ta Khon Sein,Private,Kyi Kyat (12.11.10),22.12.2010,22.3.2016,Jade,1,Kachin State,Thret Phawhtoke(47),22,12,2010,22,3,2016,Thret Phawhtoke,47,2010-12-22,2016-3-22
12,Kyay Ta Khon Sein,Private,Kyi Kyat (12.11.10),22.12.2010,22.3.2016,Jade,1,Kachin State,Thret Phawhtoke(48),22,12,2010,22,3,2016,Thret Phawhtoke,48,2010-12-22,2016-3-22
13,Kyay Ta Khon Sein,Private,Kyi Kyat (12.11.10),22.12.2010,22.3.2016,Jade,1,Kachin State,Thret Phawhtoke(49),22,12,2010,22,3,2016,Thret Phawhtoke,49,2010-12-22,2016-3-22
14,Kyay Ta Khon Sein,Private,Kyi Kyat (12.11.10),22.12.2010,22.3.2016,Jade,1,Kachin State,Thret Phawhtoke(50),22,12,2010,22,3,2016,Thret Phawhtoke,50,2010-12-22,2016-3-22
15,Kyay Ta Khon Sein,Private,Kyi Kyat (12.11.10),22.12.2010,22.3.2016,Jade,1,Kachin State,Thret Phawhtoke(51),22,12,2010,22,3,2016,Thret Phawhtoke,51,2010-12-22,2016-3-22
16,Kyay Ta Khon Sein,Private,Kyi Kyat (12.11.10),22.12.2010,22.3.2016,Jade,1,Kachin State,Thret Phawhtoke(52),22,12,2010,22,3,2016,Thret Phawhtoke,52,2010-12-22,2016-3-22
17,Kyay Ta Khon Sein,Private,Kyi Kyat (12.11.10),22.12.2010,22.3.2016,Jade,1,Kachin State,Thret Phawhtoke(53),22,12,2010,22,3,2016,Thret Phawhtoke,53,2010-12-22,2016-3-22
18,Kyay Ta Khon Sein,Private,Kyi Kyat (12.11.10),22.12.2010,22.3.2016,Jade,1,Kachin State,Thret Phawhtoke(54),22,12,2010,22,3,2016,Thret Phawhtoke,54,2010-12-22,2016-3-22
19,Kyay Ta Khon Sein,Private,Kyi Kyat (12.11.10),22.12.2010,22.3.2016,Jade,1,Kachin State,Thret Phawhtoke(55),22,12,2010,22,3,2016,Thret Phawhtoke,55,2010-12-22,2016-3-22
20,Kyay Ta Khon Sein,Private,Kyi Kyat (12.11.10),22.12.2010,22.3.2016,Jade,1,Kachin State,Thret Phawhtoke(56),22,12,2010,22,3,2016,Thret Phawhtoke,56,2010-12-22,2016-3-22
21,Kyay Ta Khon Sein,Private,Kyi Kyat (12.11.10),22.12.2010,22.3.2016,Jade,1,Kachin State,Thret Phawhtoke(57),22,12,2010,22,3,2016,Thret Phawhtoke,57,2010-12-22,2016-3-22
22,Kyay Ta Khon Sein,Private,Kyi Kyat (12.11.10),22.12.2010,22.3.2016,Jade,1,Kachin State,Thret Phawhtoke(58),22,12,2010,22,3,2016,Thret Phawhtoke,58,2010-12-22,2016-3-22
23,Kyay Ta Khon Sein,Private,Kyi Kyat (12.11.10),22.12.2010,22.3.2016,Jade,1,Kachin State,Thret Phawhtoke(59),22,12,2010,22,3,2016,Thret Phawhtoke,59,2010-12-22,2016-3-22
24,Kyay Ta Khon Sein,Private,Kyi Kyat (12.11.10),22.12.2010,22.3.2016,Jade,1,Kachin State,Thret Phawhtoke(60),22,12,2010,22,3,2016,Thret Phawhtoke,60,2010-12-22,2016-3-22
25,Kyay Ta Khon Sein,Private,Kyi Kyat (12.11.10),22.12.2010,22.3.2016,Jade,1,Kachin State,Thret Phawhtoke(66),22,12,2010,22,3,2016,Thret Phawhtoke,66,2010-12-22,2016-3-22
26,Kyay Ta Khon Sein,Private,Kyi Kyat (12.11.10),22.12.2010,22.3.2016,Jade,1,Kachin State,Thret Phawhtoke(67),22,12,2010,22,3,2016,Thret Phawhtoke,67,2010-12-22,2016-3-22
27,Kyay Ta Khon Sein,Private,Kyi Kyat (25.2.11),31.3.2011,29.6.2016,Jade,1,Kachin State,Thret Phawhtoke(86),31,3,2011,29,6,2016,Thret Phawhtoke,86,2011-3-31,2016-6-29
28,Kyay Ta Khon Sein,Private,Kyi Kyat (25.2.11),31.3.2011,29.6.2016,Jade,1,Kachin State,Thret Phawhtoke(87),31,3,2011,29,6,2016,Thret Phawhtoke,87,2011-3-31,2016-6-29
29,Kyay Ta Khon Sein,Private,Kyi Kyat (25.2.11),31.3.2011,29.6.2016,Jade,1,Kachin State,Thret Phawhtoke(88),31,3,2011,29,6,2016,Thret Phawhtoke,88,2011-3-31,2016-6-29
30,Kyay Ta Khon Sein,Private,Kyi Kyat (25.2.11),31.3.2011,29.6.2016,Jade,1,Kachin State,Thret Phawhtoke(89),31,3,2011,29,6,2016,Thret Phawhtoke,89,2011-3-31,2016-6-29
31,Kyay Ta Khon Sein,Private,Kyi Kyat (25.2.11),31.3.2011,29.6.2016,Jade,1,Kachin State,Thret Phawhtoke(90),31,3,2011,29,6,2016,Thret Phawhtoke,90,2011-3-31,2016-6-29
32,Kyay Ta Khon Sein,Private,Kyi Kyat (25.2.11),31.3.2011,29.6.2016,Jade,1,Kachin State,Thret Phawhtoke(91),31,3,2011,29,6,2016,Thret Phawhtoke,91,2011-3-31,2016-6-29
33,Kyay Ta Khon Sein,Private,Kyi Kyat (25.2.11),31.3.2011,29.6.2016,Jade,1,Kachin State,Thret Phawhtoke(92),31,3,2011,29,6,2016,Thret Phawhtoke,92,2011-3-31,2016-6-29
34,Kyay Ta Khon Sein,Private,Kyi Kyat (25.2.11),31.3.2011,29.6.2016,Jade,1,Kachin State,Thret Phawhtoke(93),31,3,2011,29,6,2016,Thret Phawhtoke,93,2011-3-31,2016-6-29
35,Kyay Ta Khon Sein,Private,Kyi Kyat (25.2.11),31.3.2011,29.6.2016,Jade,1,Kachin State,Thret Phawhtoke(94),31,3,2011,29,6,2016,Thret Phawhtoke,94,2011-3-31,2016-6-29
36,Kyay Ta Khon Sein,Private,Kyi Kyat (25.2.11),31.3.2011,29.6.2016,Jade,1,Kachin State,Thret Phawhtoke(95),31,3,2011,29,6,2016,Thret Phawhtoke,95,2011-3-31,2016-6-29
1,Kyay Sin 67,Private,Oo Si(2/08)(15.3.08),3.3.2008,2.6.2015,Jade,1,Kachin State,Phar Pyin(147),3,3,2008,2,6,2015,Phar Pyin,147,2008-3-3,2015-6-2
2,Kyay Sin 67,Private,Oo Si(2/08)(15.3.08),3.3.2008,2.6.2015,Jade,1,Kachin State,Phar Pyin(148),3,3,2008,2,6,2015,Phar Pyin,148,2008-3-3,2015-6-2
3,Kyay Sin 67,Private,Oo Si(2/08)(15.3.08),3.3.2008,2.6.2015,Jade,1,Kachin State,Phar Pyin(149),3,3,2008,2,6,2015,Phar Pyin,149,2008-3-3,2015-6-2
4,Kyay Sin 67,Private,Oo Si(2/10)(17.5.10),28.5.2010,27.8.2015,Jade,1,Kachin State,Sha Yaung Kha(285),28,5,2010,27,8,2015,Sha Yaung Kha,285,2010-5-28,2015-8-27
5,Kyay Sin 67,Private,Oo Si(2/10)(17.5.10),28.5.2010,27.8.2015,Jade,1,Kachin State,Sha Yaung Kha(286),28,5,2010,27,8,2015,Sha Yaung Kha,286,2010-5-28,2015-8-27
6,Kyay Sin 67,Private,Oo Si(2/10)(17.5.10),28.5.2010,27.8.2015,Jade,1,Kachin State,Sha Yaung Kha(287),28,5,2010,27,8,2015,Sha Yaung Kha,287,2010-5-28,2015-8-27
7,Kyay Sin 67,Private,Oo Si(2/10)(17.5.10),28.5.2010,27.8.2015,Jade,1,Kachin State,Sha Yaung Kha(288),28,5,2010,27,8,2015,Sha Yaung Kha,288,2010-5-28,2015-8-27
8,Kyay Sin 67,Private,Oo Si(2/10)(17.5.10),28.5.2010,27.8.2015,Jade,1,Kachin State,Sha Yaung Kha(289),28,5,2010,27,8,2015,Sha Yaung Kha,289,2010-5-28,2015-8-27
9,Kyay Sin 67,Private,Oo Si(2/10)(17.5.10),28.5.2010,27.8.2015,Jade,1,Kachin State,Sha Yaung Kha(290),28,5,2010,27,8,2015,Sha Yaung Kha,290,2010-5-28,2015-8-27
10,Kyay Sin 67,Private,Oo Si(2/10)(17.5.10),28.5.2010,27.8.2015,Jade,1,Kachin State,Sha Yaung Kha(291),28,5,2010,27,8,2015,Sha Yaung Kha,291,2010-5-28,2015-8-27
11,Kyay Sin 67,Private,Oo Si(2/10)(17.5.10),28.5.2010,27.8.2015,Jade,1,Kachin State,Sha Yaung Kha(292),28,5,2010,27,8,2015,Sha Yaung Kha,292,2010-5-28,2015-8-27
12,Kyay Sin 67,Private,Oo Si(2/10)(17.5.10),28.5.2010,27.8.2015,Jade,1,Kachin State,Sha Yaung Kha(293),28,5,2010,27,8,2015,Sha Yaung Kha,293,2010-5-28,2015-8-27
13,Kyay Sin 67,Private,Oo Si(3/13)(15.2.13),31.5.2013,31.8.2017,Jade,1,Kachin State,Maw One Gyi(166),31,5,2013,31,8,2017,Maw One Gyi,166,2013-5-31,2017-8-31
14,Kyay Sin 67,Private,Oo Si(3/13)(15.2.13),31.5.2013,31.8.2017,Jade,1,Kachin State,Maw One Gyi(167),31,5,2013,31,8,2017,Maw One Gyi,167,2013-5-31,2017-8-31
15,Kyay Sin 67,Private,Oo Si(3/14)(11.12.14),30.8.2015,29.8.2018,Jade,1,Kachin State,Phar Pyin(80),30,8,2015,29,8,2018,Phar Pyin,80,2015-8-30,2018-8-29
16,Kyay Sin 67,Private,Kyi Kyat (1.12.09),16.2.2010,18.5.2015,Jade,1,Kachin State,Ph Lat Khaung Phawhtoke(4),16,2,2010,18,5,2015,Ph Lat Khaung Phawhtoke,4,2010-2-16,2015-5-18
17,Kyay Sin 67,Private,Kyi Kyat (1.12.09),16.2.2010,18.5.2015,Jade,1,Kachin State,Walar  Phawhtoke(55),16,2,2010,18,5,2015,Walar  Phawhtoke,55,2010-2-16,2015-5-18
1,Kyay Sin Phyu,Private,Oo Si(3/10)(28.9.10),5.10.2010,4.1.2016,Jade,1,Kachin State,Maw Maung(133),5,10,2010,4,1,2016,Maw Maung,133,2010-10-5,2016-1-4
2,Kyay Sin Phyu,Private,Oo Si(3/10)(28.9.10),16.8.2010,15.11.2015,Jade,1,Kachin State,Maw Maung(59),16,8,2010,15,11,2015,Maw Maung,59,2010-8-16,2015-11-15
3,Kyay Sin Phyu,Private,Oo Si(1/11)(14.5.11),17.1.2011,17.4.2016,Jade,1,Kachin State,Maw One Gyi(139),17,1,2011,17,4,2016,Maw One Gyi,139,2011-1-17,2016-4-17
4,Kyay Sin Phyu,Private,Oo Si(1/11)(14.5.11),17.1.2011,17.4.2016,Jade,1,Kachin State,Maw One Gyi(142),17,1,2011,17,4,2016,Maw One Gyi,142,2011-1-17,2016-4-17
5,Kyay Sin Phyu,Private,Oo Si(1/11)(14.5.11),17.1.2011,17.4.2016,Jade,1,Kachin State,Maw One Gyi(143),17,1,2011,17,4,2016,Maw One Gyi,143,2011-1-17,2016-4-17
6,Kyay Sin Phyu,Private,Oo Si(2/11)(19.6.11),9.4.2011,8.7.2016,Jade,1,Kachin State,Sha Yaung Kha(196),9,4,2011,8,7,2016,Sha Yaung Kha,196,2011-4-9,2016-7-8
7,Kyay Sin Phyu,Private,Oo Si(2/11)(19.6.11),9.4.2011,8.7.2016,Jade,1,Kachin State,Sha Yaung Kha(197),9,4,2011,8,7,2016,Sha Yaung Kha,197,2011-4-9,2016-7-8
8,Kyay Sin Phyu,Private,Oo Si(2/11)(19.6.11),9.4.2011,8.7.2016,Jade,1,Kachin State,Sha Yaung Kha(198),9,4,2011,8,7,2016,Sha Yaung Kha,198,2011-4-9,2016-7-8
9,Kyay Sin Phyu,Private,Oo Si(2/11)(19.6.11),9.4.2011,8.7.2016,Jade,1,Kachin State,Sha Yaung Kha(199),9,4,2011,8,7,2016,Sha Yaung Kha,199,2011-4-9,2016-7-8
10,Kyay Sin Phyu,Private,Oo Si(2/11)(19.6.11),9.4.2011,8.7.2016,Jade,1,Kachin State,Sha Yaung Kha(200),9,4,2011,8,7,2016,Sha Yaung Kha,200,2011-4-9,2016-7-8
11,Kyay Sin Phyu,Private,Oo Si(2/11)(19.6.11),9.4.2011,8.7.2016,Jade,1,Kachin State,Sha Yaung Kha(201),9,4,2011,8,7,2016,Sha Yaung Kha,201,2011-4-9,2016-7-8
12,Kyay Sin Phyu,Private,Oo Si(2/10)(17.5.10),25.3.2010,23.6.2017,Jade,1,Kachin State,Maw One Lay(236),25,3,2010,23,6,2017,Maw One Lay,236,2010-3-25,2017-6-23
13,Kyay Sin Phyu,Private,Oo Si(2/10)(17.5.10),9.4.2010,8.7.2017,Jade,1,Kachin State,Maw One Lay(238),9,4,2010,8,7,2017,Maw One Lay,238,2010-4-9,2017-7-8
14,Kyay Sin Phyu,Private,Oo Si(2/11)(19.6.11),7.4.2011,7.7.2018,Jade,1,Kachin State,Maw One Gyi(73),7,4,2011,7,7,2018,Maw One Gyi,73,2011-4-7,2018-7-7
15,Kyay Sin Phyu,Private,Oo Si(2/11)(19.6.11),9..4.2011,9.7.2018,Jade,1,Kachin State,Maw One Gyi(112),9,4,2011,9,7,2018,Maw One Gyi,112,2011-4-9,2018-7-9
16,Kyay Sin Phyu,Private,Oo Si(6/11)(18.12.11),23.9.2011,23.12.2018,Jade,1,Kachin State,Maw Maung(98),23,9,2011,23,12,2018,Maw Maung,98,2011-9-23,2018-12-23
17,Kyay Sin Phyu,Private,Oo Si(6/11)(18.12.11),23.9.2011,23.12.2018,Jade,1,Kachin State,Maw Maung(99),23,9,2011,23,12,2018,Maw Maung,99,2011-9-23,2018-12-23
18,Kyay Sin Phyu,Private,Oo Si(6/11)(18.12.11),26.9.2011,26.12.2018,Jade,1,Kachin State,Maw One Gyi(42),26,9,2011,26,12,2018,Maw One Gyi,42,2011-9-26,2018-12-26
19,Kyay Sin Phyu,Private,Oo Si(6/11)(18.12.11),26.9.2011,26.12.2018,Jade,1,Kachin State,Maw One Gyi(54),26,9,2011,26,12,2018,Maw One Gyi,54,2011-9-26,2018-12-26
20,Kyay Sin Phyu,Private,Oo Si(6/11)(18.12.11),26.9.2011,26.12.2018,Jade,1,Kachin State,Maw One Gyi(75),26,9,2011,26,12,2018,Maw One Gyi,75,2011-9-26,2018-12-26
21,Kyay Sin Phyu,Private,Oo Si(6/11)(18.12.11),26.9.2011,26.12.2018,Jade,1,Kachin State,Maw One Gyi(76),26,9,2011,26,12,2018,Maw One Gyi,76,2011-9-26,2018-12-26
22,Kyay Sin Phyu,Private,Oo Si(6/11)(18.12.11),26.9.2011,26.12.2018,Jade,1,Kachin State,Maw One Gyi(109),26,9,2011,26,12,2018,Maw One Gyi,109,2011-9-26,2018-12-26
23,Kyay Sin Phyu,Private,Oo Si(6/11)(18.12.11),26.9.2011,26.12.2018,Jade,1,Kachin State,Maw One Lay(105),26,9,2011,26,12,2018,Maw One Lay,105,2011-9-26,2018-12-26
24,Kyay Sin Phyu,Private,Oo Si(6/11)(18.12.11),26.9.2011,26.12.2018,Jade,1,Kachin State,Sha Yaung Kha(170),26,9,2011,26,12,2018,Sha Yaung Kha,170,2011-9-26,2018-12-26
25,Kyay Sin Phyu,Private,Oo Si(6/11)(18.12.11),26.9.2011,26.12.2018,Jade,1,Kachin State,Sha Yaung Kha(205),26,9,2011,26,12,2018,Sha Yaung Kha,205,2011-9-26,2018-12-26
26,Kyay Sin Phyu,Private,Oo Si(2/11)(19.6.11),9.4.2011,8.7.2016,Jade,1,Kachin State,Sha Yaung Kha(197),9,4,2011,8,7,2016,Sha Yaung Kha,197,2011-4-9,2016-7-8
1,Kyay Sin Aung Kabar,Private,Oo Si(1/10)(4.2.10),23.8.201,22.11.2015,Jade,1,Kachin State,Ma Kar Pin(155),23,8,201,22,11,2015,Ma Kar Pin,155,201-8-23,2015-11-22
1,Kyay Sin La Min,Private,Oo Si (1/14)(10.6.14),10.7.2014,9.7.2017,Gem,1,Madalay Division,Pan Lin Ye Hnyi Inn Hell Lan(22),10,7,2014,9,7,2017,Pan Lin Ye Hnyi Inn Hell Lan,22,2014-7-10,2017-7-9
1,Kyay Sin Lin,Private,Oo Si(3/10)(28.9.10),10.10.2010,9.1.2016,Jade,1,Kachin State,Gyan Kar(15),10,10,2010,9,1,2016,Gyan Kar,15,2010-10-10,2016-1-9
1,Kyay Lin,Private,Oo Si(1/10)(4.2.10),27.2.2010,29.5.2015,Jade,1,Kachin State,Mhaw Si Sar(153),27,2,2010,29,5,2015,Mhaw Si Sar,153,2010-2-27,2015-5-29
2,Kyay Lin,Private,Oo Si(1/10)(4.2.10),27.2.2010,29.5.2015,Jade,1,Kachin State,Mhaw Si Sar(154),27,2,2010,29,5,2015,Mhaw Si Sar,154,2010-2-27,2015-5-29
3,Kyay Lin,Private,Oo Si(1/10)(4.2.10),27.2.2010,29.5.2015,Jade,1,Kachin State,Sha Yaung Kha(139),27,2,2010,29,5,2015,Sha Yaung Kha,139,2010-2-27,2015-5-29
4,Kyay Lin,Private,Oo Si(1/10)(4.2.10),27.2.2010,29.5.2015,Jade,1,Kachin State,Sha Yaung Kha(140),27,2,2010,29,5,2015,Sha Yaung Kha,140,2010-2-27,2015-5-29
5,Kyay Lin,Private,Oo Si(3/08)(1.11.08),13.6.2008,12.9.2015,Jade,1,Kachin State,Phar Pyin(144),13,6,2008,12,9,2015,Phar Pyin,144,2008-6-13,2015-9-12
6,Kyay Lin,Private,Oo Si(4/11)(3.11.11),13.6.2011,11.9.2016,Jade,1,Kachin State,Myauk Phyu(97),13,6,2011,11,9,2016,Myauk Phyu,97,2011-6-13,2016-9-11
7,Kyay Lin,Private,Oo Si(4/11)(3.11.11),5.9.2011,4.12.2016,Jade,1,Kachin State,Myauk Phyu(29),5,9,2011,4,12,2016,Myauk Phyu,29,2011-9-5,2016-12-4
8,Kyay Lin,Private,Oo Si(3/13)(15.2.13),17.1.2012,17.4.2017,Jade,1,Kachin State,Ba La Kha(148),17,1,2012,17,4,2017,Ba La Kha,148,2012-1-17,2017-4-17
9,Kyay Lin,Private,Oo Si(3/13)(15.2.13),28.9.2012,28.12.2017,Jade,1,Kachin State,Ba La Kha(229),28,9,2012,28,12,2017,Ba La Kha,229,2012-9-28,2017-12-28
10,Kyay Lin,Private,Oo Si(3/13)(15.2.13),28.9.2012,28.12.2017,Jade,1,Kachin State,Ba La Kha(230),28,9,2012,28,12,2017,Ba La Kha,230,2012-9-28,2017-12-28
11,Kyay Lin,Private,Oo Si(3/13)(15.2.13),28.9.2012,28.12.2017,Jade,1,Kachin State,Ba La Kha(231),28,9,2012,28,12,2017,Ba La Kha,231,2012-9-28,2017-12-28
12,Kyay Lin,Private,Oo Si(4/11)(3.11.11),13.6.2011,12.9.2018,Jade,1,Kachin State,Maw One Gyi(197),13,6,2011,12,9,2018,Maw One Gyi,197,2011-6-13,2018-9-12
13,Kyay Lin,Private,Oo Si(4/11)(3.11.11),13.6.2011,12.9.2018,Jade,1,Kachin State,Maw One Gyi(199),13,6,2011,12,9,2018,Maw One Gyi,199,2011-6-13,2018-9-12
14,Kyay Lin,Private,Oo Si(4/11)(3.11.11),13.6.2011,12.9.2018,Jade,1,Kachin State,Maw One Gyi(200),13,6,2011,12,9,2018,Maw One Gyi,200,2011-6-13,2018-9-12
15,Kyay Lin,Private,Kyi Kyat (29.12.09),27.1.2010,28.4.2015,Jade,1,Kachin State,Namachi  Phawhtoke(176),27,1,2010,28,4,2015,Namachi  Phawhtoke,176,2010-1-27,2015-4-28
16,Kyay Lin,Private,Kyi Kyat (29.12.09),27.1.2010,28.4.2015,Jade,1,Kachin State,Namachi  Phawhtoke(177),27,1,2010,28,4,2015,Namachi  Phawhtoke,177,2010-1-27,2015-4-28
17,Kyay Lin,Private,Kyi Kyat (29.12.09),27.1.2010,28.4.2015,Jade,1,Kachin State,Namachi  Phawhtoke(178),27,1,2010,28,4,2015,Namachi  Phawhtoke,178,2010-1-27,2015-4-28
18,Kyay Lin,Private,Kyi Kyat (29.12.09),27.1.2010,28.4.2015,Jade,1,Kachin State,Namachi  Phawhtoke(179),27,1,2010,28,4,2015,Namachi  Phawhtoke,179,2010-1-27,2015-4-28
19,Kyay Lin,Private,Kyi Kyat (29.12.09),27.1.2010,28.4.2015,Jade,1,Kachin State,Namachi  Phawhtoke(180),27,1,2010,28,4,2015,Namachi  Phawhtoke,180,2010-1-27,2015-4-28
20,Kyay Lin,Private,Kyi Kyat (29.12.09),27.1.2010,28.4.2015,Jade,1,Kachin State,Namachi  Phawhtoke(181),27,1,2010,28,4,2015,Namachi  Phawhtoke,181,2010-1-27,2015-4-28
21,Kyay Lin,Private,Kyi Kyat (29.12.09),27.1.2010,28.4.2015,Jade,1,Kachin State,Namachi Satkyin Phawhtoke(182),27,1,2010,28,4,2015,Namachi Satkyin Phawhtoke,182,2010-1-27,2015-4-28
22,Kyay Lin,Private,Kyi Kyat (29.12.09),27.1.2010,28.4.2015,Jade,1,Kachin State,Namachi Satkyin Phawhtoke(183),27,1,2010,28,4,2015,Namachi Satkyin Phawhtoke,183,2010-1-27,2015-4-28
23,Kyay Lin,Private,Kyi Kyat (29.12.09),27.1.2010,28.4.2015,Jade,1,Kachin State,Namachi Satkyin Phawhtoke(184),27,1,2010,28,4,2015,Namachi Satkyin Phawhtoke,184,2010-1-27,2015-4-28
24,Kyay Lin,Private,Kyi Kyat (29.12.09),27.1.2010,28.4.2015,Jade,1,Kachin State,Namachi  Hmaw Thit  Phawhtoke(175),27,1,2010,28,4,2015,Namachi  Hmaw Thit  Phawhtoke,175,2010-1-27,2015-4-28
25,Kyay Lin,Private,Kyi Kyat (29.12.09),27.1.2010,28.4.2015,Jade,1,Kachin State,Namachi  Hmaw Thit  Phawhtoke(176),27,1,2010,28,4,2015,Namachi  Hmaw Thit  Phawhtoke,176,2010-1-27,2015-4-28
26,Kyay Lin,Private,Kyi Kyat (29.12.09),27.1.2010,28.4.2015,Jade,1,Kachin State,Namachi  Hmaw Thit  Phawhtoke(177),27,1,2010,28,4,2015,Namachi  Hmaw Thit  Phawhtoke,177,2010-1-27,2015-4-28
27,Kyay Lin,Private,Kyi Kyat (29.12.09),27.1.2010,28.4.2015,Jade,1,Kachin State,Namachi  Hmaw Thit  Phawhtoke(178),27,1,2010,28,4,2015,Namachi  Hmaw Thit  Phawhtoke,178,2010-1-27,2015-4-28
28,Kyay Lin,Private,Kyi Kyat (29.12.09),27.1.2010,28.4.2015,Jade,1,Kachin State,Namachi  Hmaw Thit  Phawhtoke(179),27,1,2010,28,4,2015,Namachi  Hmaw Thit  Phawhtoke,179,2010-1-27,2015-4-28
29,Kyay Lin,Private,Kyi Kyat (29.12.09),27.1.2010,28.4.2015,Jade,1,Kachin State,Namachi  Hmaw Thit  Phawhtoke(180),27,1,2010,28,4,2015,Namachi  Hmaw Thit  Phawhtoke,180,2010-1-27,2015-4-28
30,Kyay Lin,Private,Kyi Kyat (29.12.09),27.1.2010,28.4.2015,Jade,1,Kachin State,Namachi  Hmaw Thit  Phawhtoke(181),27,1,2010,28,4,2015,Namachi  Hmaw Thit  Phawhtoke,181,2010-1-27,2015-4-28
31,Kyay Lin,Private,Kyi Kyat (29.12.09),27.1.2010,28.4.2015,Jade,1,Kachin State,Namachi  Hmaw Thit  Phawhtoke(182),27,1,2010,28,4,2015,Namachi  Hmaw Thit  Phawhtoke,182,2010-1-27,2015-4-28
32,Kyay Lin,Private,Kyi Kyat (29.12.09),27.1.2010,28.4.2015,Jade,1,Kachin State,Namachi  Hmaw Thit  Phawhtoke(183),27,1,2010,28,4,2015,Namachi  Hmaw Thit  Phawhtoke,183,2010-1-27,2015-4-28
33,Kyay Lin,Private,Kyi Kyat (29.12.09),27.1.2010,28.4.2015,Jade,1,Kachin State,Namachi  Hmaw Thit  Phawhtoke(184),27,1,2010,28,4,2015,Namachi  Hmaw Thit  Phawhtoke,184,2010-1-27,2015-4-28
34,Kyay Lin,Private,Kyi Kyat (29.12.09),27.1.2010,28.4.2015,Jade,1,Kachin State,Namachi  Hmaw Thit  Phawhtoke(185),27,1,2010,28,4,2015,Namachi  Hmaw Thit  Phawhtoke,185,2010-1-27,2015-4-28
35,Kyay Lin,Private,Kyi Kyat (29.12.09),27.1.2010,28.4.2015,Jade,1,Kachin State,Namachi  Hmaw Thit  Phawhtoke(186),27,1,2010,28,4,2015,Namachi  Hmaw Thit  Phawhtoke,186,2010-1-27,2015-4-28
36,Kyay Lin,Private,Kyi Kyat (29.12.09),27.1.2010,28.4.2015,Jade,1,Kachin State,Namachi  Hmaw Thit  Phawhtoke(187),27,1,2010,28,4,2015,Namachi  Hmaw Thit  Phawhtoke,187,2010-1-27,2015-4-28
37,Kyay Lin,Private,Kyi Kyat (29.12.09),27.1.2010,28.4.2015,Jade,1,Kachin State,Namachi  Hmaw Thit  Phawhtoke(188),27,1,2010,28,4,2015,Namachi  Hmaw Thit  Phawhtoke,188,2010-1-27,2015-4-28
38,Kyay Lin,Private,Kyi Kyat (12.11.10),7.12.2010,7.3.2016,Jade,1,Kachin State,Kalay Phawhtoke(119),7,12,2010,7,3,2016,Kalay Phawhtoke,119,2010-12-7,2016-3-7
39,Kyay Lin,Private,Kyi Kyat (12.11.10),7.12.2010,7.3.2016,Jade,1,Kachin State,Kalay Phawhtoke(120),7,12,2010,7,3,2016,Kalay Phawhtoke,120,2010-12-7,2016-3-7
40,Kyay Lin,Private,Kyi Kyat (12.11.10),7.12.2010,7.3.2016,Jade,1,Kachin State,Kalay Phawhtoke(121),7,12,2010,7,3,2016,Kalay Phawhtoke,121,2010-12-7,2016-3-7
41,Kyay Lin,Private,Kyi Kyat (12.11.10),7.12.2010,7.3.2016,Jade,1,Kachin State,Kalay Phawhtoke(122),7,12,2010,7,3,2016,Kalay Phawhtoke,122,2010-12-7,2016-3-7
42,Kyay Lin,Private,Kyi Kyat (12.11.10),7.12.2010,7.3.2016,Jade,1,Kachin State,Kalay Phawhtoke(123),7,12,2010,7,3,2016,Kalay Phawhtoke,123,2010-12-7,2016-3-7
43,Kyay Lin,Private,Kyi Kyat (12.11.10),7.12.2010,7.3.2016,Jade,1,Kachin State,Kalay Phawhtoke(124),7,12,2010,7,3,2016,Kalay Phawhtoke,124,2010-12-7,2016-3-7
44,Kyay Lin,Private,Kyi Kyat (12.11.10),7.12.2010,7.3.2016,Jade,1,Kachin State,Kalay Phawhtoke(125),7,12,2010,7,3,2016,Kalay Phawhtoke,125,2010-12-7,2016-3-7
45,Kyay Lin,Private,Kyi Kyat (12.11.10),7.12.2010,7.3.2016,Jade,1,Kachin State,Kalay Phawhtoke(126),7,12,2010,7,3,2016,Kalay Phawhtoke,126,2010-12-7,2016-3-7
46,Kyay Lin,Private,Kyi Kyat (12.11.10),7.12.2010,7.3.2016,Jade,1,Kachin State,Kalay Phawhtoke(127),7,12,2010,7,3,2016,Kalay Phawhtoke,127,2010-12-7,2016-3-7
47,Kyay Lin,Private,Kyi Kyat (12.11.10),7.12.2010,7.3.2016,Jade,1,Kachin State,Kalay Phawhtoke(128),7,12,2010,7,3,2016,Kalay Phawhtoke,128,2010-12-7,2016-3-7
48,Kyay Lin,Private,Kyi Kyat (12.11.10),7.12.2010,7.3.2016,Jade,1,Kachin State,Kalay Phawhtoke(129),7,12,2010,7,3,2016,Kalay Phawhtoke,129,2010-12-7,2016-3-7
49,Kyay Lin,Private,Kyi Kyat (12.11.10),7.12.2010,7.3.2016,Jade,1,Kachin State,Kalay Phawhtoke(130),7,12,2010,7,3,2016,Kalay Phawhtoke,130,2010-12-7,2016-3-7
50,Kyay Lin,Private,Kyi Kyat (12.11.10),7.12.2010,7.3.2016,Jade,1,Kachin State,Kalay Phawhtoke(131),7,12,2010,7,3,2016,Kalay Phawhtoke,131,2010-12-7,2016-3-7
51,Kyay Lin,Private,Kyi Kyat (12.11.10),7.12.2010,7.3.2016,Jade,1,Kachin State,Kalay Phawhtoke(132),7,12,2010,7,3,2016,Kalay Phawhtoke,132,2010-12-7,2016-3-7
52,Kyay Lin,Private,Kyi Kyat (12.11.10),7.12.2010,7.3.2016,Jade,1,Kachin State,Kalay Phawhtoke(133),7,12,2010,7,3,2016,Kalay Phawhtoke,133,2010-12-7,2016-3-7
53,Kyay Lin,Private,Kyi Kyat (12.11.10),7.12.2010,7.3.2016,Jade,1,Kachin State,Kalay Phawhtoke(134),7,12,2010,7,3,2016,Kalay Phawhtoke,134,2010-12-7,2016-3-7
54,Kyay Lin,Private,Kyi Kyat (12.11.10),7.12.2010,7.3.2016,Jade,1,Kachin State,Kalay Phawhtoke(135),7,12,2010,7,3,2016,Kalay Phawhtoke,135,2010-12-7,2016-3-7
55,Kyay Lin,Private,Kyi Kyat (12.11.10),7.12.2010,7.3.2016,Jade,1,Kachin State,Kalay Phawhtoke(136),7,12,2010,7,3,2016,Kalay Phawhtoke,136,2010-12-7,2016-3-7
56,Kyay Lin,Private,Kyi Kyat (12.11.10),7.12.2010,7.3.2016,Jade,1,Kachin State,Kalay Phawhtoke(137),7,12,2010,7,3,2016,Kalay Phawhtoke,137,2010-12-7,2016-3-7
57,Kyay Lin,Private,Kyi Kyat (12.11.10),7.12.2010,7.3.2016,Jade,1,Kachin State,Kalay Phawhtoke(138),7,12,2010,7,3,2016,Kalay Phawhtoke,138,2010-12-7,2016-3-7
58,Kyay Lin,Private,Kyi Kyat (12.11.10),7.12.2010,7.3.2016,Jade,1,Kachin State,Dan Tin Lay Phawhtoke(44),7,12,2010,7,3,2016,Dan Tin Lay Phawhtoke,44,2010-12-7,2016-3-7
59,Kyay Lin,Private,Kyi Kyat (12.11.10),7.12.2010,7.3.2016,Jade,1,Kachin State,Dan Tin Lay Phawhtoke(45),7,12,2010,7,3,2016,Dan Tin Lay Phawhtoke,45,2010-12-7,2016-3-7
60,Kyay Lin,Private,Kyi Kyat (12.11.10),7.12.2010,7.3.2016,Jade,1,Kachin State,Dan Tin Lay Phawhtoke(46),7,12,2010,7,3,2016,Dan Tin Lay Phawhtoke,46,2010-12-7,2016-3-7
61,Kyay Lin,Private,Kyi Kyat (12.11.10),7.12.2010,7.3.2016,Jade,1,Kachin State,Dan Tin Lay Phawhtoke(47),7,12,2010,7,3,2016,Dan Tin Lay Phawhtoke,47,2010-12-7,2016-3-7
62,Kyay Lin,Private,Kyi Kyat (12.11.10),7.12.2010,7.3.2016,Jade,1,Kachin State,Dan Tin Lay Phawhtoke(48),7,12,2010,7,3,2016,Dan Tin Lay Phawhtoke,48,2010-12-7,2016-3-7
63,Kyay Lin,Private,Kyi Kyat (12.11.10),7.12.2010,7.3.2016,Jade,1,Kachin State,Dan Tin Lay Phawhtoke(49),7,12,2010,7,3,2016,Dan Tin Lay Phawhtoke,49,2010-12-7,2016-3-7
64,Kyay Lin,Private,Oo Si(3/13)(15.2.13),17.6.2012,15.9.2017,Jade,1,Kachin State,Htont Taung Hmaw Thit (6),17,6,2012,15,9,2017,Htont Taung Hmaw Thit ,6,2012-6-17,2017-9-15
65,Kyay Lin,Private,Oo Si(3/13)(15.2.13),17.6.2012,15.9.2017,Jade,1,Kachin State,Htont Taung Hmaw Thit (7),17,6,2012,15,9,2017,Htont Taung Hmaw Thit ,7,2012-6-17,2017-9-15
66,Kyay Lin,Private,Oo Si(3/13)(15.2.13),17.6.2012,15.9.2017,Jade,1,Kachin State,Htont Taung Hmaw Thit (8),17,6,2012,15,9,2017,Htont Taung Hmaw Thit ,8,2012-6-17,2017-9-15
67,Kyay Lin,Private,Oo Si(3/13)(15.2.13),17.6.2012,15.9.2017,Jade,1,Kachin State,Htont Taung Hmaw Thit (9),17,6,2012,15,9,2017,Htont Taung Hmaw Thit ,9,2012-6-17,2017-9-15
68,Kyay Lin,Private,Oo Si(3/13)(15.2.13),17.6.2012,15.9.2017,Jade,1,Kachin State,Htont Taung Hmaw Thit (10),17,6,2012,15,9,2017,Htont Taung Hmaw Thit ,10,2012-6-17,2017-9-15
69,Kyay Lin,Private,Oo Si(3/13)(15.2.13),17.6.2012,15.9.2017,Jade,1,Kachin State,Htont Taung Hmaw Thit (11),17,6,2012,15,9,2017,Htont Taung Hmaw Thit ,11,2012-6-17,2017-9-15
70,Kyay Lin,Private,Oo Si(3/13)(15.2.13),17.6.2012,15.9.2017,Jade,1,Kachin State,Htont Taung Hmaw Thit (12),17,6,2012,15,9,2017,Htont Taung Hmaw Thit ,12,2012-6-17,2017-9-15
1,Kyay Lay Sinn,Private,Oo Si (8/13)(22.11.13),1.4.2014,31.3.2017,Gem,1,Madalay Division,Chaung Kyie Center Village(29),1,4,2014,31,3,2017,Chaung Kyie Center Village,29,2014-4-1,2017-3-31
2,Kyay Lay Sinn,Private,Oo Si (1/14)(10.6.14),27.6.2014,26.6.2017,Gem,1,Madalay Division,Chaung Kyie Center Village(16),27,6,2014,26,6,2017,Chaung Kyie Center Village,16,2014-6-27,2017-6-26
1,Kyay Tar Yar,Private,Oo Si(1/10)(4.2.10),31.3.2010,30.6.2015,Jade,1,Kachin State,Ka Lar Mhaw(69),31,3,2010,30,6,2015,Ka Lar Mhaw,69,2010-3-31,2015-6-30
1,Kyawe Wa Taw Naing Ng Jade Group,Private,Oo Si(1/10)(4.2.10),4.5.2010,3.8.2015,Jade,1,Kachin State,Khauk Khaw(403),4,5,2010,3,8,2015,Khauk Khaw,403,2010-5-4,2015-8-3
2,Kyawe Wa Taw Naing Ng Jade Group,Private,Oo Si(1/10)(4.2.10),4.5.2010,3.8.2015,Jade,1,Kachin State,Khauk Khaw(409),4,5,2010,3,8,2015,Khauk Khaw,409,2010-5-4,2015-8-3
3,Kyawe Wa Taw Naing Ng Jade Group,Private,Oo Si(1/11)(19.6.11),15.8.2011,13.11.2016,Jade,1,Kachin State,Ka Day(96),15,8,2011,13,11,2016,Ka Day,96,2011-8-15,2016-11-13
4,Kyawe Wa Taw Naing Ng Jade Group,Private,Oo Si(1/11)(19.6.11),15.8.2011,13.11.2016,Jade,1,Kachin State,War Kyale(121),15,8,2011,13,11,2016,War Kyale,121,2011-8-15,2016-11-13
5,Kyawe Wa Taw Naing Ng Jade Group,Private,Oo Si(3/13)(15.2.13),22.12.2011,22.3.2017,Jade,1,Kachin State,Ngo Pin(110),22,12,2011,22,3,2017,Ngo Pin,110,2011-12-22,2017-3-22
6,Kyawe Wa Taw Naing Ng Jade Group,Private,Oo Si(3/13)(15.2.13),22.12.2011,22.3.2017,Jade,1,Kachin State,Mamon(33),22,12,2011,22,3,2017,Mamon,33,2011-12-22,2017-3-22
7,Kyawe Wa Taw Naing Ng Jade Group,Private,Oo Si(3/14)(11.12.14),17.1.2015,16.1.2018,Jade,1,Kachin State,Maw La Kin(212),17,1,2015,16,1,2018,Maw La Kin,212,2015-1-17,2018-1-16
8,Kyawe Wa Thaw Naing Ng Jade Group,Private,Kyi Kyat (12.11.10),22.12.2010,22.3.2016,Jade,1,Kachin State,War Par  Phawhtoke(47),22,12,2010,22,3,2016,War Par  Phawhtoke,47,2010-12-22,2016-3-22
9,Kyawe Wa Thaw Naing Ng Jade Group,Private,Kyi Kyat (12.11.10),22.12.2010,22.3.2016,Jade,1,Kachin State,War Par  Phawhtoke(48),22,12,2010,22,3,2016,War Par  Phawhtoke,48,2010-12-22,2016-3-22
10,Kyawe Wa Thaw Naing Ng Jade Group,Private,Kyi Kyat (12.11.10),22.12.2010,22.3.2016,Jade,1,Kachin State,War Par  Phawhtoke(49),22,12,2010,22,3,2016,War Par  Phawhtoke,49,2010-12-22,2016-3-22
11,Kyawe Wa Thaw Naing Ng Jade Group,Private,Kyi Kyat (12.11.10),22.12.2010,22.3.2016,Jade,1,Kachin State,War Par  Phawhtoke(50),22,12,2010,22,3,2016,War Par  Phawhtoke,50,2010-12-22,2016-3-22
12,Kyawe Wa Thaw Naing Ng Jade Group,Private,Kyi Kyat (12.11.10),22.12.2010,22.3.2016,Jade,1,Kachin State,War Par  Phawhtoke(51),22,12,2010,22,3,2016,War Par  Phawhtoke,51,2010-12-22,2016-3-22
13,Kyawe Wa Thaw Naing Ng Jade Group,Private,Kyi Kyat (12.11.10),22.12.2010,22.3.2016,Jade,1,Kachin State,War Par  Phawhtoke(52),22,12,2010,22,3,2016,War Par  Phawhtoke,52,2010-12-22,2016-3-22
14,Kyawe Wa Thaw Naing Ng Jade Group,Private,Kyi Kyat (12.11.10),22.12.2010,22.3.2016,Jade,1,Kachin State,War Par  Phawhtoke(53),22,12,2010,22,3,2016,War Par  Phawhtoke,53,2010-12-22,2016-3-22
15,Kyawe Wa Thaw Naing Ng Jade Group,Private,Kyi Kyat (12.11.10),22.12.2010,22.3.2016,Jade,1,Kachin State,War Par  Phawhtoke(54),22,12,2010,22,3,2016,War Par  Phawhtoke,54,2010-12-22,2016-3-22
16,Kyawe Wa Thaw Naing Ng Jade Group,Private,Kyi Kyat (12.11.10),22.12.2010,22.3.2016,Jade,1,Kachin State,War Par  Phawhtoke(55),22,12,2010,22,3,2016,War Par  Phawhtoke,55,2010-12-22,2016-3-22
1,K J Family,Private,Oo Si (1/14)(10.6.14),23.7.2014,22.7.2017,Gem,1,Madalay Division,Baw Lone Kyie Ye Cente( c ),23,7,2014,22,7,2017,Baw Lone Kyie Ye Cente, c ,2014-7-23,2017-7-22
2,K J Family,Private,Oo Si (1/14)(10.6.14),25.7.2014,24.7.2017,Gem,1,Madalay Division,Baw Mar Ah Sha Pyat(Pha Hta-44),25,7,2014,24,7,2017,Baw Mar Ah Sha Pyat,Pha Hta-44,2014-7-25,2017-7-24
1,Kyaut Shin Myint Myat,Private,Oo Si(6/11)(18.12.11),19.1.2012,19.4.2017,Jade,1,Kachin State,Thaung Cho(15),19,1,2012,19,4,2017,Thaung Cho,15,2012-1-19,2017-4-19
2,Kyaut Shin Myint Myat,Private,Oo Si(6/11)(18.12.11),19.1.2012,19.4.2017,Jade,1,Kachin State,Mat Lin Chaung(163),19,1,2012,19,4,2017,Mat Lin Chaung,163,2012-1-19,2017-4-19
3,Kyaut Shin Myint Myat,Private,Oo Si(6/11)(18.12.11),19.1.2012,19.4.2017,Jade,1,Kachin State,Whay Khar(1002),19,1,2012,19,4,2017,Whay Khar,1002,2012-1-19,2017-4-19
4,Kyaut Shin Myint Myat,Private,Oo Si(6/11)(18.12.11),19.1.2012,19.4.2017,Jade,1,Kachin State,Whay Khar(1003),19,1,2012,19,4,2017,Whay Khar,1003,2012-1-19,2017-4-19
5,Kyaut Shin Myint Myat,Private,Oo Si(6/11)(18.12.11),19.1.2012,19.4.2017,Jade,1,Kachin State,Whay Khar(1013),19,1,2012,19,4,2017,Whay Khar,1013,2012-1-19,2017-4-19
6,Kyaut Shin Myint Myat,Private,Oo Si(6/11)(18.12.11),19.1.2012,19.4.2017,Jade,1,Kachin State,Whay Khar(1014),19,1,2012,19,4,2017,Whay Khar,1014,2012-1-19,2017-4-19
7,Kyaut Shin Myint Myat,Private,Oo Si(6/11)(18.12.11),19.1.2012,19.4.2017,Jade,1,Kachin State,Whay Khar(1028),19,1,2012,19,4,2017,Whay Khar,1028,2012-1-19,2017-4-19
8,Kyaut Shin Myint Myat,Private,Oo Si(6/11)(18.12.11),19.1.2012,19.4.2017,Jade,1,Kachin State,Whay Khar(1029),19,1,2012,19,4,2017,Whay Khar,1029,2012-1-19,2017-4-19
9,Kyaut Shin Myint Myat,Private,Oo Si(6/11)(18.12.11),19.1.2012,19.4.2017,Jade,1,Kachin State,Whay Khar(1030),19,1,2012,19,4,2017,Whay Khar,1030,2012-1-19,2017-4-19
10,Kyaut Shin Myint Myat,Private,Oo Si(6/11)(18.12.11),19.1.2012,19.4.2017,Jade,1,Kachin State,Whay Khar(1039),19,1,2012,19,4,2017,Whay Khar,1039,2012-1-19,2017-4-19
11,Kyaut Shin Myint Myat,Private,Oo Si(6/11)(18.12.11),19.1.2012,19.4.2017,Jade,1,Kachin State,Whay Khar(1040),19,1,2012,19,4,2017,Whay Khar,1040,2012-1-19,2017-4-19
12,Kyaut Shin Myint Myat,Private,Oo Si(6/11)(18.12.11),19.1.2012,19.4.2017,Jade,1,Kachin State,Whay Khar(1045),19,1,2012,19,4,2017,Whay Khar,1045,2012-1-19,2017-4-19
13,Kyaut Shin Myint Myat,Private,Oo Si(6/11)(18.12.11),19.1.2012,19.4.2017,Jade,1,Kachin State,Whay Khar(1046),19,1,2012,19,4,2017,Whay Khar,1046,2012-1-19,2017-4-19
14,Kyaut Shin Myint Myat,Private,Oo Si(6/11)(18.12.11),19.1.2012,19.4.2017,Jade,1,Kachin State,Whay Khar(1052),19,1,2012,19,4,2017,Whay Khar,1052,2012-1-19,2017-4-19
15,Kyaut Shin Myint Myat,Private,Oo Si(6/11)(18.12.11),19.1.2012,19.4.2017,Jade,1,Kachin State,Whay Khar(1053),19,1,2012,19,4,2017,Whay Khar,1053,2012-1-19,2017-4-19
1,Kyaw Za Bu,Private,Oo Si (7/13)(25.10.13),12.12.2013,11.12.2016,Gem,1,Madalay Division,Pint Ku Taung Gae(Pha Hta Sa-21),12,12,2013,11,12,2016,Pint Ku Taung Gae,Pha Hta Sa-21,2013-12-12,2016-12-11
1,Kyaw Star,Private,Oo Si (1/15)(26.3.15),4.6.2015,3.6.2018,Gem,1,Madalay Division,Win Hta Yan(2),4,6,2015,3,6,2018,Win Hta Yan,2,2015-6-4,2018-6-3
1,Kyaw Soe Lwin,Private,Oo Si (2/13)(18.1.13),14.2.2013,13.2.2016,Gem,1,Madalay Division,Kyauk Pya That Man Thau Pin(2),14,2,2013,13,2,2016,Kyauk Pya That Man Thau Pin,2,2013-2-14,2016-2-13
2,Kyaw Soe Lwin,Private,Oo Si (2/13)(18.1.13),14.2.2013,13.2.2016,Gem,1,Madalay Division,Kyauk Pya That Man Thau Pin(3),14,2,2013,13,2,2016,Kyauk Pya That Man Thau Pin,3,2013-2-14,2016-2-13
1,Kyaw Zayar Myat,Private,Oo Si (1/14)(10.6.14),3.8.2014,2.8.2017,Gem,1,Madalay Division,Wann Bee Inn(19),3,8,2014,2,8,2017,Wann Bee Inn,19,2014-8-3,2017-8-2
2,Kyaw Zayar Myat,Private,Oo Si (1/14)(10.6.14),3.8.2014,2.8.2017,Gem,1,Madalay Division,Wann Bee Inn(20),3,8,2014,2,8,2017,Wann Bee Inn,20,2014-8-3,2017-8-2
1,Kyaw Zaw Lin Yadanar,Private,Oo Si(3/14)(11.12.14),6.2.2015,5.2.2018,Jade,1,Kachin State,Thaung Cho(40),6,2,2015,5,2,2018,Thaung Cho,40,2015-2-6,2018-2-5
2,Kyaw Zaw Lin Yadanar,Private,Oo Si(3/14)(11.12.14),31.3.2015,30.3.2020,Jade,1,Kachin State,Mana(164),31,3,2015,30,3,2020,Mana,164,2015-3-31,2020-3-30
3,Kyaw Zaw Lin Yadanar,Private,Oo Si(3/14)(11.12.14),20.2.2015,19.2.2020,Jade,1,Kachin State,Maw La Kin(126),20,2,2015,19,2,2020,Maw La Kin,126,2015-2-20,2020-2-19
4,Kyaw Zaw Lin Yadanar,Private,Oo Si(3/14)(11.12.14),20.2.2015,19.2.2020,Jade,1,Kachin State,Maw La Kin(130),20,2,2015,19,2,2020,Maw La Kin,130,2015-2-20,2020-2-19
1,Kyaw Win Tun Yadanar,Private,Oo Si (2/13)(18.1.13),8.3.2012,7.3.2015,Gem,1,Madalay Division,Baw Ba Dan(14),8,3,2012,7,3,2015,Baw Ba Dan,14,2012-3-8,2015-3-7
1,Kyaw Thet Aung,Private,Oo Si(2/08)(15.3.08),30.4.2008,30.7.2015,Jade,1,Kachin State,Taung Kaugh(112),30,4,2008,30,7,2015,Taung Kaugh,112,2008-4-30,2015-7-30
2,Kyaw Thet Aung,Private,Oo Si(2/08)(15.3.08),22.7.2009,20.10.2016,Jade,1,Kachin State,Taung Kaugh(113),22,7,2009,20,10,2016,Taung Kaugh,113,2009-7-22,2016-10-20
3,Kyaw Thet Aung,Private,Oo Si(2/08)(15.3.08),22.7.2009,20.10.2016,Jade,1,Kachin State,Sa Bawe(30),22,7,2009,20,10,2016,Sa Bawe,30,2009-7-22,2016-10-20
4,Kyaw Thet Aung,Private,Oo Si(3/14)(11.12.14),2.3.2015,1.3.2020,Jade,1,Kachin State,Ma La Kin(196),2,3,2015,1,3,2020,Ma La Kin,196,2015-3-2,2020-3-1
1,Kyaw Hole Family,Private,Oo Si (1/14)(10.6.14),29.8.2014,28.8.2017,Gem,1,Madalay Division,Ka Paing(Pha Hta-3),29,8,2014,28,8,2017,Ka Paing,Pha Hta-3,2014-8-29,2017-8-28
2,Kyaw Hole Family,Private,Oo Si (1/14)(10.6.14),4.8.2014,3.8.2017,Gem,1,Madalay Division,Sa Khan Kyie(Sa-10),4,8,2014,3,8,2017,Sa Khan Kyie,Sa-10,2014-8-4,2017-8-3
1,Kyaw Naing & Brothers,Private,Oo Si(2/08)(15.3.08),19.3.2008,18.6.2015,Jade,1,Kachin State,Ma La Kin(31),19,3,2008,18,6,2015,Ma La Kin,31,2008-3-19,2015-6-18
2,Kyaw Naing & Brothers,Private,Oo Si(1/09)(5.4.09),2.4.2010,2.7.2015,Jade,1,Kachin State,Mhaw Si Sar(120),2,4,2010,2,7,2015,Mhaw Si Sar,120,2010-4-2,2015-7-2
3,Kyaw Naing & Brothers,Private,Oo Si(2/11)(19.6.11),6.2.2011,7.5.2016,Jade,1,Kachin State,Mhaw Si Sar(300),6,2,2011,7,5,2016,Mhaw Si Sar,300,2011-2-6,2016-5-7
4,Kyaw Naing & Brothers,Private,Oo Si(2/11)(19.6.11),19.3.2011,17.6.2016,Jade,1,Kachin State,Ka lar Mhaw(50),19,3,2011,17,6,2016,Ka lar Mhaw,50,2011-3-19,2016-6-17
5,Kyaw Naing & Brothers,Private,Oo Si(2/11)(19.6.11),19.3.2011,17.6.2016,Jade,1,Kachin State,Ka lar Mhaw(51),19,3,2011,17,6,2016,Ka lar Mhaw,51,2011-3-19,2016-6-17
6,Kyaw Naing & Brothers Gems,Private,Oo Si (3/10)(28.9.10),8.10.2010,7.1.2016,Jade,1,Kachin State,Namachi (14),8,10,2010,7,1,2016,Namachi ,14,2010-10-8,2016-1-7
7,Kyaw Naing & Brothers Gems,Private,Kyi Kyat (19.10.10),22.11.2010,21.2.2016,Jade,1,Kachin State,Namachi Satkyin Phawhtoke(886),22,11,2010,21,2,2016,Namachi Satkyin Phawhtoke,886,2010-11-22,2016-2-21
8,Kyaw Naing & Brothers Gems,Private,Kyi Kyat (19.10.10),22.11.2011,21.2.2017,Jade,2,Kachin State,Namachi Satkyin Phawhtoke(887),22,11,2011,21,2,2017,Namachi Satkyin Phawhtoke,887,2011-11-22,2017-2-21
9,Kyaw Naing & Brothers Gems,Private,Kyi Kyat (19.10.10),22.11.2010,21.2.2016,Jade,1,Kachin State,Namachi Satkyin Phawhtoke(888),22,11,2010,21,2,2016,Namachi Satkyin Phawhtoke,888,2010-11-22,2016-2-21
10,Kyaw Naing & Brothers Gems,Private,Kyi Kyat (19.10.10),22.11.2010,21.2.2016,Jade,1,Kachin State,Namachi Satkyin Phawhtoke(889),22,11,2010,21,2,2016,Namachi Satkyin Phawhtoke,889,2010-11-22,2016-2-21
11,Kyaw Naing & Brothers Gems,Private,Kyi Kyat (19.10.10),22.11.2010,21.2.2016,Jade,1,Kachin State,Namachi Satkyin Phawhtoke(890),22,11,2010,21,2,2016,Namachi Satkyin Phawhtoke,890,2010-11-22,2016-2-21
12,Kyaw Naing & Brothers Gems,Private,Kyi Kyat (19.10.10),22.11.2010,21.2.2016,Jade,1,Kachin State,Namachi Satkyin Phawhtoke(891),22,11,2010,21,2,2016,Namachi Satkyin Phawhtoke,891,2010-11-22,2016-2-21
13,Kyaw Naing & Brothers Gems,Private,Kyi Kyat (19.10.10),22.11.2010,21.2.2016,Jade,1,Kachin State,Namachi Satkyin Phawhtoke(892),22,11,2010,21,2,2016,Namachi Satkyin Phawhtoke,892,2010-11-22,2016-2-21
14,Kyaw Naing & Brothers Gems,Private,Kyi Kyat (19.10.10),22.11.2010,21.2.2016,Jade,1,Kachin State,Namachi Satkyin Phawhtoke(893),22,11,2010,21,2,2016,Namachi Satkyin Phawhtoke,893,2010-11-22,2016-2-21
15,Kyaw Naing & Brothers Gems,Private,Kyi Kyat (19.10.10),22.11.2010,21.2.2016,Jade,1,Kachin State,Namachi Satkyin Phawhtoke(894),22,11,2010,21,2,2016,Namachi Satkyin Phawhtoke,894,2010-11-22,2016-2-21
16,Kyaw Naing & Brothers Gems,Private,Kyi Kyat (19.10.10),22.11.2010,21.2.2016,Jade,1,Kachin State,Namachi Satkyin Phawhtoke(895),22,11,2010,21,2,2016,Namachi Satkyin Phawhtoke,895,2010-11-22,2016-2-21
17,Kyaw Naing & Brothers Gems,Private,Kyi Kyat (19.10.10),22.11.2010,21.2.2016,Jade,1,Kachin State,Namachi Satkyin Phawhtoke(896),22,11,2010,21,2,2016,Namachi Satkyin Phawhtoke,896,2010-11-22,2016-2-21
18,Kyaw Naing & Brothers Gems,Private,Kyi Kyat (19.10.10),22.11.2010,21.2.2016,Jade,1,Kachin State,Namachi Satkyin Phawhtoke(897),22,11,2010,21,2,2016,Namachi Satkyin Phawhtoke,897,2010-11-22,2016-2-21
19,Kyaw Naing & Brothers Gems,Private,Kyi Kyat (19.10.10),22.11.2010,21.2.2016,Jade,1,Kachin State,Namachi Satkyin Phawhtoke(916),22,11,2010,21,2,2016,Namachi Satkyin Phawhtoke,916,2010-11-22,2016-2-21
20,Kyaw Naing & Brothers Gems,Private,Kyi Kyat (19.10.10),22.11.2010,21.2.2016,Jade,1,Kachin State,Namachi Satkyin Phawhtoke(919),22,11,2010,21,2,2016,Namachi Satkyin Phawhtoke,919,2010-11-22,2016-2-21
21,Kyaw Naing & Brothers Gems,Private,Kyi Kyat (19.10.10),22.11.2010,21.2.2016,Jade,1,Kachin State,Namachi Satkyin Phawhtoke(921),22,11,2010,21,2,2016,Namachi Satkyin Phawhtoke,921,2010-11-22,2016-2-21
22,Kyaw Naing & Brothers Gems,Private,Oo Si (2/10)(17.5.10),27.6.2010,26.9.2015,Jade,1,Kachin State,Taung Sein Lay (11),27,6,2010,26,9,2015,Taung Sein Lay ,11,2010-6-27,2015-9-26
23,Kyaw Naing & Brothers Gems,Private,Oo Si (2/10)(17.5.10),27.6.2010,26.9.2015,Jade,1,Kachin State,Taung Sein Lay (16),27,6,2010,26,9,2015,Taung Sein Lay ,16,2010-6-27,2015-9-26
24,Kyaw Naing & Brothers Gems,Private,Kyi Kyat (29.12.09),8.4.2010,8.7.2015,Jade,1,Kachin State,Namachi Satkyin Phawhtoke(195),8,4,2010,8,7,2015,Namachi Satkyin Phawhtoke,195,2010-4-8,2015-7-8
25,Kyaw Naing & Brothers Gems,Private,Kyi Kyat (29.12.09),8.4.2010,8.7.2015,Jade,1,Kachin State,Namachi Satkyin Phawhtoke(196),8,4,2010,8,7,2015,Namachi Satkyin Phawhtoke,196,2010-4-8,2015-7-8
26,Kyaw Naing & Brothers Gems,Private,Kyi Kyat (29.12.09),8.4.2010,8.7.2015,Jade,1,Kachin State,Namachi Satkyin Phawhtoke(197),8,4,2010,8,7,2015,Namachi Satkyin Phawhtoke,197,2010-4-8,2015-7-8
27,Kyaw Naing & Brothers Gems,Private,Kyi Kyat (29.12.09),8.4.2010,8.7.2015,Jade,1,Kachin State,Namachi Satkyin Phawhtoke(198),8,4,2010,8,7,2015,Namachi Satkyin Phawhtoke,198,2010-4-8,2015-7-8
28,Kyaw Naing & Brothers Gems,Private,Kyi Kyat (29.12.09),8.4.2010,8.7.2015,Jade,1,Kachin State,Namachi Satkyin Phawhtoke(199),8,4,2010,8,7,2015,Namachi Satkyin Phawhtoke,199,2010-4-8,2015-7-8
29,Kyaw Naing & Brothers Gems,Private,Kyi Kyat (29.12.09),8.4.2010,8.7.2015,Jade,1,Kachin State,Namachi Satkyin Phawhtoke(200),8,4,2010,8,7,2015,Namachi Satkyin Phawhtoke,200,2010-4-8,2015-7-8
30,Kyaw Naing & Brothers Gems,Private,Kyi Kyat (12.11.10),10.1.2011,10.4.2016,Jade,1,Kachin State,Taung Sein Lay Phawhtoke(65),10,1,2011,10,4,2016,Taung Sein Lay Phawhtoke,65,2011-1-10,2016-4-10
31,Kyaw Naing & Brothers Gems,Private,Kyi Kyat (12.11.10),10.1.2011,10.4.2016,Jade,1,Kachin State,Taung Sein Lay Phawhtoke(66),10,1,2011,10,4,2016,Taung Sein Lay Phawhtoke,66,2011-1-10,2016-4-10
32,Kyaw Naing & Brothers Gems,Private,Kyi Kyat (12.11.10),10.1.2011,10.4.2016,Jade,1,Kachin State,Taung Sein Lay Phawhtoke(122),10,1,2011,10,4,2016,Taung Sein Lay Phawhtoke,122,2011-1-10,2016-4-10
33,Kyaw Naing & Brothers Gems,Private,Kyi Kyat (12.11.10),10.1.2011,10.4.2016,Jade,1,Kachin State,Taung Sein Lay Phawhtoke(123),10,1,2011,10,4,2016,Taung Sein Lay Phawhtoke,123,2011-1-10,2016-4-10
34,Kyaw Naing & Brothers Gems,Private,Kyi Kyat (12.11.10),10.1.2011,10.4.2016,Jade,1,Kachin State,Auk Hmaw Thit  Phawhtoke(73),10,1,2011,10,4,2016,Auk Hmaw Thit  Phawhtoke,73,2011-1-10,2016-4-10
35,Kyaw Naing & Brothers Gems,Private,Kyi Kyat (12.11.10),10.1.2011,10.4.2016,Jade,1,Kachin State,Auk Hmaw Thit  Phawhtoke(74),10,1,2011,10,4,2016,Auk Hmaw Thit  Phawhtoke,74,2011-1-10,2016-4-10
36,Kyaw Naing & Brothers Gems,Private,Kyi Kyat (12.11.10),10.1.2011,10.4.2016,Jade,1,Kachin State,Auk Hmaw Thit  Phawhtoke(75),10,1,2011,10,4,2016,Auk Hmaw Thit  Phawhtoke,75,2011-1-10,2016-4-10
37,Kyaw Naing & Brothers Gems,Private,Kyi Kyat (12.11.10),10.1.2011,10.4.2016,Jade,1,Kachin State,AukHmaw Thit  Phawhtoke(76),10,1,2011,10,4,2016,AukHmaw Thit  Phawhtoke,76,2011-1-10,2016-4-10
38,Kyaw Naing & Brothers Gems,Private,Kyi Kyat (12.11.10),10.1.2011,10.4.2016,Jade,1,Kachin State,Auk Hmaw Thit  Phawhtoke(77),10,1,2011,10,4,2016,Auk Hmaw Thit  Phawhtoke,77,2011-1-10,2016-4-10
39,Kyaw Naing & Brothers Gems,Private,Kyi Kyat (12.11.10),10.1.2011,10.4.2016,Jade,1,Kachin State,Auk Hmaw Thit  Phawhtoke(78),10,1,2011,10,4,2016,Auk Hmaw Thit  Phawhtoke,78,2011-1-10,2016-4-10
40,Kyaw Naing & Brothers Gems,Private,Kyi Kyat (12.11.10),10.1.2011,10.4.2016,Jade,1,Kachin State,Auk Hmaw Thit  Phawhtoke(79),10,1,2011,10,4,2016,Auk Hmaw Thit  Phawhtoke,79,2011-1-10,2016-4-10
41,Kyaw Naing & Brothers Gems,Private,Kyi Kyat (12.11.10),10.1.2011,10.4.2016,Jade,1,Kachin State,AukHmaw Thit  Phawhtoke(80),10,1,2011,10,4,2016,AukHmaw Thit  Phawhtoke,80,2011-1-10,2016-4-10
42,Kyaw Naing & Brothers Gems,Private,Kyi Kyat (12.11.10),10.1.2011,10.4.2016,Jade,1,Kachin State,Auk Hmaw Thit  Phawhtoke(81),10,1,2011,10,4,2016,Auk Hmaw Thit  Phawhtoke,81,2011-1-10,2016-4-10
43,Kyaw Naing & Brothers Gems,Private,Kyi Kyat (12.11.10),10.1.2011,10.4.2016,Jade,1,Kachin State,AukHmaw Thit  Phawhtoke(82),10,1,2011,10,4,2016,AukHmaw Thit  Phawhtoke,82,2011-1-10,2016-4-10
44,Kyaw Naing & Brothers Gems,Private,Kyi Kyat (12.11.10),10.1.2011,10.4.2016,Jade,1,Kachin State,Auk Hmaw Thit  Phawhtoke(83),10,1,2011,10,4,2016,Auk Hmaw Thit  Phawhtoke,83,2011-1-10,2016-4-10
45,Kyaw Naing & Brothers Gems,Private,Kyi Kyat (19.10.10),10.12.2010,10.3.2016,Jade,1,Kachin State,Namachi Phawhtoke(927),10,12,2010,10,3,2016,Namachi Phawhtoke,927,2010-12-10,2016-3-10
46,Kyaw Naing & Brothers Gems,Private,Kyi Kyat (19.10.10),10.12.2010,10.3.2016,Jade,1,Kachin State,Auk Hmaw Thit  Phawhtoke(69),10,12,2010,10,3,2016,Auk Hmaw Thit  Phawhtoke,69,2010-12-10,2016-3-10
47,Kyaw Naing & Brothers Gems,Private,Kyi Kyat (12.11.10),10.1.2011,10.4.2016,Jade,1,Kachin State,Auk Hmaw Thit  Phawhtoke(84),10,1,2011,10,4,2016,Auk Hmaw Thit  Phawhtoke,84,2011-1-10,2016-4-10
48,Kyaw Naing & Brothers Gems,Private,Kyi Kyat (12.11.10),10.1.2011,10.4.2016,Jade,1,Kachin State,Auk Hmaw Thit  Phawhtoke(85),10,1,2011,10,4,2016,Auk Hmaw Thit  Phawhtoke,85,2011-1-10,2016-4-10
49,Kyaw Naing & Brothers Gems,Private,Kyi Kyat (12.11.10),10.1.2011,10.4.2016,Jade,1,Kachin State,AukHmaw Thit  Phawhtoke(86),10,1,2011,10,4,2016,AukHmaw Thit  Phawhtoke,86,2011-1-10,2016-4-10
50,Kyaw Naing & Brothers Gems,Private,Kyi Kyat (12.11.10),10.1.2011,10.4.2016,Jade,1,Kachin State,Auk Hmaw Thit  Phawhtoke(87),10,1,2011,10,4,2016,Auk Hmaw Thit  Phawhtoke,87,2011-1-10,2016-4-10
51,Kyaw Naing & Brothers Gems,Private,Kyi Kyat (12.11.10),10.1.2011,10.4.2016,Jade,1,Kachin State,AukHmaw Thit  Phawhtoke(89),10,1,2011,10,4,2016,AukHmaw Thit  Phawhtoke,89,2011-1-10,2016-4-10
52,Kyaw Naing & Brothers Gems,Private,Kyi Kyat (12.11.10),10.1.2011,10.4.2016,Jade,1,Kachin State,Auk Hmaw Thit  Phawhtoke(91),10,1,2011,10,4,2016,Auk Hmaw Thit  Phawhtoke,91,2011-1-10,2016-4-10
53,Kyaw Naing & Brothers Gems,Private,Kyi Kyat (12.11.10),10.1.2011,10.4.2016,Jade,1,Kachin State,Auk Hmaw Thit  Phawhtoke(92),10,1,2011,10,4,2016,Auk Hmaw Thit  Phawhtoke,92,2011-1-10,2016-4-10
54,Kyaw Naing & Brothers Gems,Private,Kyi Kyat (12.11.10),10.1.2011,10.4.2016,Jade,1,Kachin State,Auk Hmaw Thit  Phawhtoke(93),10,1,2011,10,4,2016,Auk Hmaw Thit  Phawhtoke,93,2011-1-10,2016-4-10
55,Kyaw Naing & Brothers Gems,Private,Kyi Kyat (12.11.10),10.1.2011,10.4.2016,Jade,1,Kachin State,Auk Hmaw Thit  Phawhtoke(94),10,1,2011,10,4,2016,Auk Hmaw Thit  Phawhtoke,94,2011-1-10,2016-4-10
56,Kyaw Naing & Brothers Gems,Private,Kyi Kyat (12.11.10),10.1.2011,10.4.2016,Jade,1,Kachin State,Auk Hmaw Thit  Phawhtoke(95),10,1,2011,10,4,2016,Auk Hmaw Thit  Phawhtoke,95,2011-1-10,2016-4-10
57,Kyaw Naing & Brothers Gems,Private,Kyi Kyat (12.11.10),10.1.2011,10.4.2016,Jade,1,Kachin State,Auk Hmaw Thit  Phawhtoke(96),10,1,2011,10,4,2016,Auk Hmaw Thit  Phawhtoke,96,2011-1-10,2016-4-10
58,Kyaw Naing & Brothers Gems,Private,Kyi Kyat (12.11.10),10.1.2011,10.4.2016,Jade,1,Kachin State,Auk Hmaw Thit  Phawhtoke(97),10,1,2011,10,4,2016,Auk Hmaw Thit  Phawhtoke,97,2011-1-10,2016-4-10
59,Kyaw Naing & Brothers Gems,Private,Kyi Kyat (12.11.10),10.1.2011,10.4.2016,Jade,1,Kachin State,Auk Hmaw Thit  Phawhtoke(124),10,1,2011,10,4,2016,Auk Hmaw Thit  Phawhtoke,124,2011-1-10,2016-4-10
60,Kyaw Naing & Brothers Gems,Private,Kyi Kyat (12.11.10),10.1.2011,10.4.2016,Jade,1,Kachin State,Auk Hmaw Thit  Phawhtoke(125),10,1,2011,10,4,2016,Auk Hmaw Thit  Phawhtoke,125,2011-1-10,2016-4-10
61,Kyaw Naing & Brothers Gems,Private,Kyi Kyat (12.11.10),10.1.2011,10.4.2016,Jade,1,Kachin State,AukHmaw Thit  Phawhtoke(126),10,1,2011,10,4,2016,AukHmaw Thit  Phawhtoke,126,2011-1-10,2016-4-10
62,Kyaw Naing & Brothers Gems,Private,Kyi Kyat (12.11.10),10.1.2011,10.4.2016,Jade,1,Kachin State,Taung Sein Lay Phawhtoke(100),10,1,2011,10,4,2016,Taung Sein Lay Phawhtoke,100,2011-1-10,2016-4-10
63,Kyaw Naing & Brothers Gems,Private,Kyi Kyat (12.11.10),10.1.2011,10.4.2016,Jade,1,Kachin State,Dan Tin Lay Phawhtoke(16),10,1,2011,10,4,2016,Dan Tin Lay Phawhtoke,16,2011-1-10,2016-4-10
64,Kyaw Naing & Brothers Gems,Private,Kyi Kyat (12.11.10),10.1.2011,10.4.2016,Jade,1,Kachin State,Dan Tin Lay Phawhtoke(17),10,1,2011,10,4,2016,Dan Tin Lay Phawhtoke,17,2011-1-10,2016-4-10
65,Kyaw Naing & Brothers Gems,Private,Kyi Kyat (12.11.10),10.1.2011,10.4.2016,Jade,1,Kachin State,Dan Tin Lay Phawhtoke(18),10,1,2011,10,4,2016,Dan Tin Lay Phawhtoke,18,2011-1-10,2016-4-10
66,Kyaw Naing & Brothers Gems,Private,Kyi Kyat (12.11.10),10.1.2011,10.4.2016,Jade,1,Kachin State,Dan Tin Lay Phawhtoke(19),10,1,2011,10,4,2016,Dan Tin Lay Phawhtoke,19,2011-1-10,2016-4-10
67,Kyaw Naing & Brothers Gems,Private,Kyi Kyat (12.11.10),10.1.2011,10.4.2016,Jade,1,Kachin State,Dan Tin Lay Phawhtoke(20),10,1,2011,10,4,2016,Dan Tin Lay Phawhtoke,20,2011-1-10,2016-4-10
68,Kyaw Naing & Brothers Gems,Private,Kyi Kyat (12.11.10),10.1.2011,10.4.2016,Jade,1,Kachin State,Dan Tin Lay Phawhtoke(21),10,1,2011,10,4,2016,Dan Tin Lay Phawhtoke,21,2011-1-10,2016-4-10
69,Kyaw Naing & Brothers Gems,Private,Kyi Kyat (12.11.10),10.1.2011,10.4.2016,Jade,1,Kachin State,Dan Tin Lay Phawhtoke(23),10,1,2011,10,4,2016,Dan Tin Lay Phawhtoke,23,2011-1-10,2016-4-10
70,Kyaw Naing & Brothers Gems,Private,Kyi Kyat (12.11.10),10.1.2011,10.4.2016,Jade,1,Kachin State,Dan Tin Lay Phawhtoke(25),10,1,2011,10,4,2016,Dan Tin Lay Phawhtoke,25,2011-1-10,2016-4-10
71,Kyaw Naing & Brothers Gems,Private,Kyi Kyat (12.11.10),10.1.2011,10.4.2016,Jade,1,Kachin State,Dan Tin Lay Phawhtoke(27),10,1,2011,10,4,2016,Dan Tin Lay Phawhtoke,27,2011-1-10,2016-4-10
72,Kyaw Naing & Brothers Gems,Private,Kyi Kyat (12.11.10),10.1.2011,10.4.2016,Jade,1,Kachin State,Dan Tin Lay Phawhtoke(29),10,1,2011,10,4,2016,Dan Tin Lay Phawhtoke,29,2011-1-10,2016-4-10
73,Kyaw Naing & Brothers Gems,Private,Kyi Kyat (12.11.10),10.1.2011,10.4.2016,Jade,1,Kachin State,Dan Tin Lay Phawhtoke(30),10,1,2011,10,4,2016,Dan Tin Lay Phawhtoke,30,2011-1-10,2016-4-10
74,Kyaw Naing & Brothers Gems,Private,Kyi Kyat (12.11.10),10.1.2011,10.4.2016,Jade,1,Kachin State,Dan Tin Lay Phawhtoke(31),10,1,2011,10,4,2016,Dan Tin Lay Phawhtoke,31,2011-1-10,2016-4-10
75,Kyaw Naing & Brothers Gems,Private,Kyi Kyat (12.11.10),10.1.2011,10.4.2016,Jade,1,Kachin State,Dan Tin Lay Phawhtoke(32),10,1,2011,10,4,2016,Dan Tin Lay Phawhtoke,32,2011-1-10,2016-4-10
76,Kyaw Naing & Brothers Gems,Private,Kyi Kyat (12.11.10),10.1.2011,10.4.2016,Jade,1,Kachin State,Dan Tin Lay Phawhtoke(33),10,1,2011,10,4,2016,Dan Tin Lay Phawhtoke,33,2011-1-10,2016-4-10
77,Kyaw Naing & Brothers Gems,Private,Kyi Kyat (12.11.10),10.1.2011,10.4.2016,Jade,1,Kachin State,Dan Tin Lay Phawhtoke(34),10,1,2011,10,4,2016,Dan Tin Lay Phawhtoke,34,2011-1-10,2016-4-10
78,Kyaw Naing & Brothers Gems,Private,Kyi Kyat (12.11.10),10.1.2011,10.4.2016,Jade,1,Kachin State,Dan Tin Lay Phawhtoke(35),10,1,2011,10,4,2016,Dan Tin Lay Phawhtoke,35,2011-1-10,2016-4-10
79,Kyaw Naing & Brothers Gems,Private,Kyi Kyat (12.11.10),10.1.2011,10.4.2016,Jade,1,Kachin State,AukHmaw Thit  Phawhtoke(154),10,1,2011,10,4,2016,AukHmaw Thit  Phawhtoke,154,2011-1-10,2016-4-10
80,Kyaw Naing & Brothers Gems,Private,Kyi Kyat (12.11.10),10.1.2011,10.4.2016,Jade,1,Kachin State,AukHmaw Thit  Phawhtoke(155),10,1,2011,10,4,2016,AukHmaw Thit  Phawhtoke,155,2011-1-10,2016-4-10
81,Kyaw Naing & Brothers Gems,Private,Kyi Kyat (12.11.10),10.1.2011,10.4.2016,Jade,1,Kachin State,Auk Hmaw Thit  Phawhtoke(156),10,1,2011,10,4,2016,Auk Hmaw Thit  Phawhtoke,156,2011-1-10,2016-4-10
82,Kyaw Naing & Brothers Gems,Private,Kyi Kyat (12.11.10),10.1.2011,10.4.2016,Jade,1,Kachin State,Auk Hmaw Thit  Phawhtoke(157),10,1,2011,10,4,2016,Auk Hmaw Thit  Phawhtoke,157,2011-1-10,2016-4-10
83,Kyaw Naing & Brothers Gems,Private,Kyi Kyat (12.11.10),10.1.2011,10.4.2016,Jade,1,Kachin State,Auk Hmaw Thit  Phawhtoke(158),10,1,2011,10,4,2016,Auk Hmaw Thit  Phawhtoke,158,2011-1-10,2016-4-10
84,Kyaw Naing & Brothers Gems,Private,Kyi Kyat (12.11.10),10.1.2011,10.4.2016,Jade,1,Kachin State,AukHmaw Thit  Phawhtoke(159),10,1,2011,10,4,2016,AukHmaw Thit  Phawhtoke,159,2011-1-10,2016-4-10
85,Kyaw Naing & Brothers Gems,Private,Kyi Kyat (12.11.10),10.1.2011,10.4.2016,Jade,1,Kachin State,AukHmaw Thit  Phawhtoke(160),10,1,2011,10,4,2016,AukHmaw Thit  Phawhtoke,160,2011-1-10,2016-4-10
86,Kyaw Naing & Brothers Gems,Private,Kyi Kyat (12.11.10),10.1.2011,10.4.2016,Jade,1,Kachin State,Auk Hmaw Thit  Phawhtoke(161),10,1,2011,10,4,2016,Auk Hmaw Thit  Phawhtoke,161,2011-1-10,2016-4-10
87,Kyaw Naing & Brothers Gems,Private,Kyi Kyat (12.11.10),10.1.2011,10.4.2016,Jade,1,Kachin State,Auk Hmaw Thit  Phawhtoke(162),10,1,2011,10,4,2016,Auk Hmaw Thit  Phawhtoke,162,2011-1-10,2016-4-10
88,Kyaw Naing & Brothers Gems,Private,Kyi Kyat (12.11.10),10.1.2011,10.4.2016,Jade,1,Kachin State,Auk Hmaw Thit Phawhtoke(163),10,1,2011,10,4,2016,Auk Hmaw Thit Phawhtoke,163,2011-1-10,2016-4-10
89,Kyaw Naing & Brothers Gems,Private,Kyi Kyat (12.11.10),10.1.2011,10.4.2016,Jade,1,Kachin State,Auk Hmaw Thit  Phawhtoke(164),10,1,2011,10,4,2016,Auk Hmaw Thit  Phawhtoke,164,2011-1-10,2016-4-10
90,Kyaw Naing & Brothers Gems,Private,Kyi Kyat (12.11.10),10.1.2011,10.4.2016,Jade,1,Kachin State,AukHmaw Thit  Phawhtoke(165),10,1,2011,10,4,2016,AukHmaw Thit  Phawhtoke,165,2011-1-10,2016-4-10
91,Kyaw Naing & Brothers Gems,Private,Kyi Kyat (12.11.10),10.1.2011,10.4.2016,Jade,1,Kachin State,Auk Hmaw Thit  Phawhtoke(166),10,1,2011,10,4,2016,Auk Hmaw Thit  Phawhtoke,166,2011-1-10,2016-4-10
92,Kyaw Naing & Brothers Gems,Private,Kyi Kyat (12.11.10),10.1.2011,10.4.2016,Jade,1,Kachin State,Auk Hmaw Thit  Phawhtoke(167),10,1,2011,10,4,2016,Auk Hmaw Thit  Phawhtoke,167,2011-1-10,2016-4-10
93,Kyaw Naing & Brothers Gems,Private,Kyi Kyat (12.11.10),10.1.2011,10.4.2016,Jade,1,Kachin State,Auk Hmaw Thit  Phawhtoke(168),10,1,2011,10,4,2016,Auk Hmaw Thit  Phawhtoke,168,2011-1-10,2016-4-10
94,Kyaw Naing & Brothers Gems,Private,Kyi Kyat (12.11.10),10.1.2011,10.4.2016,Jade,1,Kachin State,Auk Hmaw Thit  Phawhtoke(169),10,1,2011,10,4,2016,Auk Hmaw Thit  Phawhtoke,169,2011-1-10,2016-4-10
95,Kyaw Naing & Brothers Gems,Private,Kyi Kyat (12.11.10),10.1.2011,10.4.2016,Jade,1,Kachin State,Auk Hmaw Thit  Phawhtoke(170),10,1,2011,10,4,2016,Auk Hmaw Thit  Phawhtoke,170,2011-1-10,2016-4-10
96,Kyaw Naing & Brothers Gems,Private,Kyi Kyat (12.11.10),10.1.2011,10.4.2016,Jade,1,Kachin State,Auk Hmaw Thit  Phawhtoke(171),10,1,2011,10,4,2016,Auk Hmaw Thit  Phawhtoke,171,2011-1-10,2016-4-10
97,Kyaw Naing & Brothers Gems,Private,Kyi Kyat (12.11.10),10.1.2011,10.4.2016,Jade,1,Kachin State,Auk Hmaw Thit  Phawhtoke(172),10,1,2011,10,4,2016,Auk Hmaw Thit  Phawhtoke,172,2011-1-10,2016-4-10
98,Kyaw Naing & Brothers Gems,Private,Kyi Kyat (12.11.10),10.1.2011,10.4.2016,Jade,1,Kachin State,AukHmaw Thit  Phawhtoke(173),10,1,2011,10,4,2016,AukHmaw Thit  Phawhtoke,173,2011-1-10,2016-4-10
99,Kyaw Naing & Brothers Gems,Private,Kyi Kyat (12.11.10),10.1.2011,10.4.2016,Jade,1,Kachin State,Thu Htay  Phawhtoke(15),10,1,2011,10,4,2016,Thu Htay  Phawhtoke,15,2011-1-10,2016-4-10
100,Kyaw Naing & Brothers Gems,Private,Kyi Kyat (12.11.10),10.1.2011,10.4.2016,Jade,1,Kachin State,Thu Htay  Phawhtoke(16),10,1,2011,10,4,2016,Thu Htay  Phawhtoke,16,2011-1-10,2016-4-10
101,Kyaw Naing & Brothers Gems,Private,Kyi Kyat (12.11.10),10.1.2011,10.4.2016,Jade,1,Kachin State,Thu Htay  Phawhtoke(17),10,1,2011,10,4,2016,Thu Htay  Phawhtoke,17,2011-1-10,2016-4-10
102,Kyaw Naing & Brothers Gems,Private,Kyi Kyat (12.11.10),10.1.2011,10.4.2016,Jade,1,Kachin State,Thu Htay  Phawhtoke(18),10,1,2011,10,4,2016,Thu Htay  Phawhtoke,18,2011-1-10,2016-4-10
103,Kyaw Naing & Brothers Gems,Private,Kyi Kyat (12.11.10),10.1.2011,10.4.2016,Jade,1,Kachin State,Thu Htay  Phawhtoke(19),10,1,2011,10,4,2016,Thu Htay  Phawhtoke,19,2011-1-10,2016-4-10
104,Kyaw Naing & Brothers Gems,Private,Kyi Kyat (12.11.10),10.1.2011,10.4.2016,Jade,1,Kachin State,Thu Htay  Phawhtoke(20),10,1,2011,10,4,2016,Thu Htay  Phawhtoke,20,2011-1-10,2016-4-10
105,Kyaw Naing & Brothers Gems,Private,Kyi Kyat (12.11.10),10.1.2011,10.4.2016,Jade,1,Kachin State,Thu Htay  Phawhtoke(21),10,1,2011,10,4,2016,Thu Htay  Phawhtoke,21,2011-1-10,2016-4-10
106,Kyaw Naing & Brothers Gems,Private,Kyi Kyat (12.11.10),10.1.2011,10.4.2016,Jade,1,Kachin State,Thu Htay  Phawhtoke(22),10,1,2011,10,4,2016,Thu Htay  Phawhtoke,22,2011-1-10,2016-4-10
107,Kyaw Naing & Brothers Gems,Private,Kyi Kyat (25.2.11),30.3.2011,28.6.2016,Jade,1,Kachin State,Taung Sein Lay Phawhtoke(128),30,3,2011,28,6,2016,Taung Sein Lay Phawhtoke,128,2011-3-30,2016-6-28
108,Kyaw Naing & Brothers Gems,Private,Kyi Kyat (25.2.11),30.3.2011,28.6.2016,Jade,1,Kachin State,Taung Sein Lay Phawhtoke(129),30,3,2011,28,6,2016,Taung Sein Lay Phawhtoke,129,2011-3-30,2016-6-28
109,Kyaw Naing & Brothers Gems,Private,Kyi Kyat (8.2.11),30.3.2011,28.6.2016,Jade,1,Kachin State,AukHmaw Thit  Phawhtoke(192),30,3,2011,28,6,2016,AukHmaw Thit  Phawhtoke,192,2011-3-30,2016-6-28
110,Kyaw Naing & Brothers Gems,Private,Kyi Kyat (8.2.11),30.3.2011,28.6.2016,Jade,1,Kachin State,Auk Hmaw Thit  Phawhtoke(193),30,3,2011,28,6,2016,Auk Hmaw Thit  Phawhtoke,193,2011-3-30,2016-6-28
111,Kyaw Naing & Brothers Gems,Private,Kyi Kyat (25.2.11),30.3.2011,28.6.2016,Jade,1,Kachin State,AukHmaw Thit  Phawhtoke(200),30,3,2011,28,6,2016,AukHmaw Thit  Phawhtoke,200,2011-3-30,2016-6-28
112,Kyaw Naing & Brothers Gems,Private,Kyi Kyat (25.2.11),30.3.2011,28.6.2016,Jade,1,Kachin State,Auk Hmaw Thit  Phawhtoke(202),30,3,2011,28,6,2016,Auk Hmaw Thit  Phawhtoke,202,2011-3-30,2016-6-28
113,Kyaw Naing & Brothers Gems,Private,Kyi Kyat (25.2.11),30.3.2011,28.6.2016,Jade,1,Kachin State,Auk Hmaw Thit  Phawhtoke(203),30,3,2011,28,6,2016,Auk Hmaw Thit  Phawhtoke,203,2011-3-30,2016-6-28
114,Kyaw Naing & Brothers Gems,Private,Kyi Kyat (25.2.11),30.3.2011,28.6.2016,Jade,1,Kachin State,Auk Hmaw Thit  Phawhtoke(204),30,3,2011,28,6,2016,Auk Hmaw Thit  Phawhtoke,204,2011-3-30,2016-6-28
115,Kyaw Naing & Brothers Gems,Private,Kyi Kyat (25.2.11),30.3.2011,28.6.2016,Jade,1,Kachin State,Auk Hmaw Thit  Phawhtoke(205),30,3,2011,28,6,2016,Auk Hmaw Thit  Phawhtoke,205,2011-3-30,2016-6-28
116,Kyaw Naing & Brothers Gems,Private,Kyi Kyat (25.2.11),30.3.2011,28.6.2016,Jade,1,Kachin State,AukHmaw Thit  Phawhtoke(206),30,3,2011,28,6,2016,AukHmaw Thit  Phawhtoke,206,2011-3-30,2016-6-28
117,Kyaw Naing & Brothers Gems,Private,Kyi Kyat (25.2.11),30.3.2011,28.6.2016,Jade,1,Kachin State,Auk Hmaw Thit  Phawhtoke(207),30,3,2011,28,6,2016,Auk Hmaw Thit  Phawhtoke,207,2011-3-30,2016-6-28
118,Kyaw Naing & Brothers Gems,Private,Kyi Kyat (25.2.11),30.3.2011,28.6.2016,Jade,1,Kachin State,Auk Hmaw Thit  Phawhtoke(208),30,3,2011,28,6,2016,Auk Hmaw Thit  Phawhtoke,208,2011-3-30,2016-6-28
119,Kyaw Naing & Brothers Gems,Private,Oo Si (2/11)(19.6.11),23.5.2011,21.8.2016,Jade,1,Kachin State,Namachi Phawhtoke(10),23,5,2011,21,8,2016,Namachi Phawhtoke,10,2011-5-23,2016-8-21
120,Kyaw Naing & Brothers Gems,Private,Oo Si (2/11)(19.6.11),6.2.2011,7.5.2016,Jade,1,Kachin State,Khun Sine(4),6,2,2011,7,5,2016,Khun Sine,4,2011-2-6,2016-5-7
121,Kyaw Naing & Brothers Gems,Private,Oo Si (2/11)(19.6.11),6.2.2011,7.5.2016,Jade,1,Kachin State,Khun Sine(5),6,2,2011,7,5,2016,Khun Sine,5,2011-2-6,2016-5-7
122,Kyaw Naing & Brothers Gems,Private,Oo Si (2/11)(19.6.11),6.2.2011,7.5.2016,Jade,1,Kachin State,Khun Sine(6),6,2,2011,7,5,2016,Khun Sine,6,2011-2-6,2016-5-7
123,Kyaw Naing & Brothers Gems,Private,Oo Si (2/11)(19.6.11),6.2.2011,7.5.2016,Jade,1,Kachin State,Khun Sine(7),6,2,2011,7,5,2016,Khun Sine,7,2011-2-6,2016-5-7
124,Kyaw Naing & Brothers Gems,Private,Oo Si (2/11)(19.6.11),6.2.2011,7.5.2016,Jade,1,Kachin State,Namachi Phawhtoke(9),6,2,2011,7,5,2016,Namachi Phawhtoke,9,2011-2-6,2016-5-7
125,Kyaw Naing & Brothers Gems,Private,Oo Si (2/11)(19.6.11),6.2.2011,7.5.2016,Jade,1,Kachin State,Namachi(123),6,2,2011,7,5,2016,Namachi,123,2011-2-6,2016-5-7
126,Kyaw Naing & Brothers Gems,Private,Oo Si (2/11)(19.6.11),6.2.2011,7.5.2016,Jade,1,Kachin State,Namachi(124),6,2,2011,7,5,2016,Namachi,124,2011-2-6,2016-5-7
127,Kyaw Naing & Brothers Gems,Private,Oo Si (2/11)(19.6.11),6.2.2011,7.5.2016,Jade,1,Kachin State,Namachi(125),6,2,2011,7,5,2016,Namachi,125,2011-2-6,2016-5-7
128,Kyaw Naing & Brothers Gems,Private,Oo Si (2/11)(19.6.11),6.2.2011,7.5.2016,Jade,1,Kachin State,Namachi(126),6,2,2011,7,5,2016,Namachi,126,2011-2-6,2016-5-7
129,Kyaw Naing & Brothers Gems,Private,Oo Si (2/11)(19.6.11),6.2.2011,7.5.2016,Jade,1,Kachin State,Auk Hmaw Thit (7),6,2,2011,7,5,2016,Auk Hmaw Thit ,7,2011-2-6,2016-5-7
130,Kyaw Naing & Brothers Gems,Private,Oo Si (6/11)(18.12.11),3.9.2011,2.12.2016,Jade,1,Kachin State,Namachi(2),3,9,2011,2,12,2016,Namachi,2,2011-9-3,2016-12-2
131,Kyaw Naing & Brothers Gems,Private,Oo Si (3/13)(15.2.13),21.2.2012,22.5.2017,Jade,1,Kachin State,Namachi(1),21,2,2012,22,5,2017,Namachi,1,2012-2-21,2017-5-22
132,Kyaw Naing & Brothers Gems,Private,Oo Si (3/14)(11.12.14),17.2.2015,16.2.2018,Jade,1,Kachin State,Taung Sein Lay Phawhtoke(38),17,2,2015,16,2,2018,Taung Sein Lay Phawhtoke,38,2015-2-17,2018-2-16
133,Kyaw Naing & Brothers Gems,Private,Oo Si (3/14)(11.12.14),17.2.2015,16.2.2018,Jade,1,Kachin State,Taung Sein Lay Phawhtoke(39),17,2,2015,16,2,2018,Taung Sein Lay Phawhtoke,39,2015-2-17,2018-2-16
134,Kyaw Naing & Brothers Gems,Private,Oo Si (3/14)(11.12.14),17.2.2015,16.2.2018,Jade,1,Kachin State,Taung Sein Lay Phawhtoke(40),17,2,2015,16,2,2018,Taung Sein Lay Phawhtoke,40,2015-2-17,2018-2-16
135,Kyaw Naing & Brothers Gems,Private,Oo Si (3/14)(11.12.14),17.2.2015,16.2.2018,Jade,1,Kachin State,Taung Sein Lay Phawhtoke(41),17,2,2015,16,2,2018,Taung Sein Lay Phawhtoke,41,2015-2-17,2018-2-16
136,Kyaw Naing & Brothers Gems,Private,Oo Si (3/14)(11.12.14),10.3..2015,9.3.2018,Jade,1,Kachin State,Dan Tin Kyi Phawhtoke(13),10,3,2015,9,3,2018,Dan Tin Kyi Phawhtoke,13,2015-3-10,2018-3-9
137,Kyaw Naing & Brothers Gems,Private,Oo Si (3/14)(11.12.14),21.1.2015,20.1.2018,Jade,1,Kachin State,Shwe Nyaung Pin Phawhtoke(1),21,1,2015,20,1,2018,Shwe Nyaung Pin Phawhtoke,1,2015-1-21,2018-1-20
138,Kyaw Naing & Brothers Gems,Private,Oo Si (3/14)(11.12.14),21.1.2015,20.1.2018,Jade,1,Kachin State,Shwe Nyaung Pin Phawhtoke(2),21,1,2015,20,1,2018,Shwe Nyaung Pin Phawhtoke,2,2015-1-21,2018-1-20
139,Kyaw Naing & Brothers Gems,Private,Oo Si (3/14)(11.12.14),21.1.2015,20.1.2018,Jade,1,Kachin State,Shwe Nyaung  Pin Phawhtoke(3),21,1,2015,20,1,2018,Shwe Nyaung  Pin Phawhtoke,3,2015-1-21,2018-1-20
140,Kyaw Naing & Brothers Gems,Private,Oo Si (3/14)(11.12.14),21.1.2015,20.1.2018,Jade,1,Kachin State,ShweNyaung  Pin Phawhtoke(4),21,1,2015,20,1,2018,ShweNyaung  Pin Phawhtoke,4,2015-1-21,2018-1-20
141,Kyaw Naing & Brothers Gems,Private,Oo Si (3/14)(11.12.14),21.1.2015,20.1.2018,Jade,1,Kachin State,Shwe Nyaung  Pin Phawhtoke(5),21,1,2015,20,1,2018,Shwe Nyaung  Pin Phawhtoke,5,2015-1-21,2018-1-20
142,Kyaw Naing & Brothers Gems,Private,Oo Si (3/14)(11.12.14),21.1.2015,20.1.2018,Jade,1,Kachin State,Shwe Nyaung  Pin Phawhtoke(6),21,1,2015,20,1,2018,Shwe Nyaung  Pin Phawhtoke,6,2015-1-21,2018-1-20
143,Kyaw Naing & Brothers Gems,Private,Oo Si (3/14)(11.12.14),21.1.2015,20.1.2018,Jade,1,Kachin State,Shwe Nyaung  Pin Phawhtoke(7),21,1,2015,20,1,2018,Shwe Nyaung  Pin Phawhtoke,7,2015-1-21,2018-1-20
144,Kyaw Naing & Brothers Gems,Private,Oo Si (3/14)(11.12.14),21.1.2015,20.1.2018,Jade,1,Kachin State,Shwe Nyaung Pin Phawhtoke(8),21,1,2015,20,1,2018,Shwe Nyaung Pin Phawhtoke,8,2015-1-21,2018-1-20
145,Kyaw Naing & Brothers Gems,Private,Oo Si (3/14)(11.12.14),21.1.2015,20.1.2018,Jade,1,Kachin State,Shwe Nyaung Pin Phawhtoke(9),21,1,2015,20,1,2018,Shwe Nyaung Pin Phawhtoke,9,2015-1-21,2018-1-20
146,Kyaw Naing & Brothers Gems,Private,Oo Si (3/14)(11.12.14),16.2.2015,15.2.2018,Jade,1,Kachin State,Thu Htay  Phawhtoke(1),16,2,2015,15,2,2018,Thu Htay  Phawhtoke,1,2015-2-16,2018-2-15
147,Kyaw Naing & Brothers Gems,Private,Oo Si (3/14)(11.12.14),16.2.2015,15.2.2018,Jade,1,Kachin State,Thu Htay  Phawhtoke(2),16,2,2015,15,2,2018,Thu Htay  Phawhtoke,2,2015-2-16,2018-2-15
148,Kyaw Naing & Brothers Gems,Private,Oo Si (3/14)(11.12.14),16.2.2015,15.2.2018,Jade,1,Kachin State,Thu Htay  Phawhtoke(3),16,2,2015,15,2,2018,Thu Htay  Phawhtoke,3,2015-2-16,2018-2-15
149,Kyaw Naing & Brothers Gems,Private,Oo Si (3/14)(11.12.14),16.2.2015,15.2.2018,Jade,1,Kachin State,Thu Htay  Phawhtoke(4),16,2,2015,15,2,2018,Thu Htay  Phawhtoke,4,2015-2-16,2018-2-15
150,Kyaw Naing & Brothers Gems,Private,Oo Si (3/14)(11.12.14),16.2.2015,15.2.2018,Jade,1,Kachin State,Thu Htay  Phawhtoke(5),16,2,2015,15,2,2018,Thu Htay  Phawhtoke,5,2015-2-16,2018-2-15
151,Kyaw Naing & Brothers Gems,Private,Oo Si (3/14)(11.12.14),16.2.2015,15.2.2018,Jade,1,Kachin State,Thu Htay  Phawhtoke6),16,2,2015,15,2,2018,#REF!,,2015-2-16,2018-2-15
152,Kyaw Naing & Brothers Gems,Private,Oo Si (3/14)(11.12.14),16.2.2015,15.2.2018,Jade,1,Kachin State,Thu Htay  Phawhtoke(7),16,2,2015,15,2,2018,Thu Htay  Phawhtoke,7,2015-2-16,2018-2-15
153,Kyaw Naing & Brothers Gems,Private,Oo Si (3/14)(11.12.14),16.2.2015,15.2.2018,Jade,1,Kachin State,Thu Htay  Phawhtoke(8),16,2,2015,15,2,2018,Thu Htay  Phawhtoke,8,2015-2-16,2018-2-15
154,Kyaw Naing & Brothers Gems,Private,Oo Si (3/14)(11.12.14),16.2.2015,15.2.2018,Jade,1,Kachin State,Thu Htay  Phawhtoke(9),16,2,2015,15,2,2018,Thu Htay  Phawhtoke,9,2015-2-16,2018-2-15
155,Kyaw Naing & Brothers Gems,Private,Oo Si (3/14)(11.12.14),17.2.2015,16.2.2018,Jade,1,Kachin State,Auk Hmaw Thit Phawhtoke(10),17,2,2015,16,2,2018,Auk Hmaw Thit Phawhtoke,10,2015-2-17,2018-2-16
156,Kyaw Naing & Brothers Gems,Private,Oo Si (3/14)(11.12.14),17.2.2015,16.2.2018,Jade,1,Kachin State,Auk  Hmaw Thit  Phawhtoke(11),17,2,2015,16,2,2018,Auk  Hmaw Thit  Phawhtoke,11,2015-2-17,2018-2-16
157,Kyaw Naing & Brothers Gems,Private,Oo Si (3/14)(11.12.14),17.2.2015,16.2.2018,Jade,1,Kachin State,Auk Hmaw Thit  Phawhtoke(12),17,2,2015,16,2,2018,Auk Hmaw Thit  Phawhtoke,12,2015-2-17,2018-2-16
158,Kyaw Naing & Brothers Gems,Private,Oo Si (3/14)(11.12.14),17.2.2015,16.2.2018,Jade,1,Kachin State,Auk  Hmaw Thit  Phawhtoke(13),17,2,2015,16,2,2018,Auk  Hmaw Thit  Phawhtoke,13,2015-2-17,2018-2-16
159,Kyaw Naing & Brothers Gems,Private,Oo Si (3/14)(11.12.14),17.2.2015,16.2.2018,Jade,1,Kachin State,Auk  Hmaw Thit  Phawhtoke(14),17,2,2015,16,2,2018,Auk  Hmaw Thit  Phawhtoke,14,2015-2-17,2018-2-16
160,Kyaw Naing & Brothers Gems,Private,Oo Si (3/14)(11.12.14),16.2.2015,15.2.2018,Jade,1,Kachin State,Auk  Hmaw Thit  Phawhtoke(15),16,2,2015,15,2,2018,Auk  Hmaw Thit  Phawhtoke,15,2015-2-16,2018-2-15
161,Kyaw Naing & Brothers Gems,Private,Oo Si (3/14)(11.12.14),16.2.2015,15.2.2018,Jade,1,Kachin State,Auk  Hmaw Thit  Phawhtoke16),16,2,2015,15,2,2018,#REF!,,2015-2-16,2018-2-15
162,Kyaw Naing & Brothers Gems,Private,Oo Si (3/14)(11.12.14),16.2.2015,15.2.2018,Jade,1,Kachin State,Auk  Hmaw Thit  Phawhtoke(17),16,2,2015,15,2,2018,Auk  Hmaw Thit  Phawhtoke,17,2015-2-16,2018-2-15
163,Kyaw Naing & Brothers Gems,Private,Oo Si (3/14)(11.12.14),16.2.2015,15.2.2018,Jade,1,Kachin State,Auk  Hmaw Thit  Phawhtoke(18),16,2,2015,15,2,2018,Auk  Hmaw Thit  Phawhtoke,18,2015-2-16,2018-2-15
164,Kyaw Naing & Brothers Gems,Private,Oo Si (3/14)(11.12.14),16.2.2015,15.2.2018,Jade,1,Kachin State,Auk  Hmaw Thit  Phawhtoke(19),16,2,2015,15,2,2018,Auk  Hmaw Thit  Phawhtoke,19,2015-2-16,2018-2-15
165,Kyaw Naing & Brothers Gems,Private,Oo Si (3/14)(11.12.14),16.2.2015,15.2.2018,Jade,1,Kachin State,Auk  Hmaw Thit  Phawhtoke(20),16,2,2015,15,2,2018,Auk  Hmaw Thit  Phawhtoke,20,2015-2-16,2018-2-15
166,Kyaw Naing & Brothers Gems,Private,Oo Si (3/14)(11.12.14),16.2.2015,15.2.2018,Jade,1,Kachin State,Auk Hmaw Thit  Phawhtoke(21),16,2,2015,15,2,2018,Auk Hmaw Thit  Phawhtoke,21,2015-2-16,2018-2-15
167,Kyaw Naing & Brothers Gems,Private,Oo Si (3/14)(11.12.14),16.2.2015,15.2.2018,Jade,1,Kachin State,Auk Hmaw Thit  Phawhtoke(22),16,2,2015,15,2,2018,Auk Hmaw Thit  Phawhtoke,22,2015-2-16,2018-2-15
168,Kyaw Naing & Brothers Gems,Private,Oo Si (3/14)(11.12.14),16.2.2015,15.2.2018,Jade,1,Kachin State,Auk Hmaw Thit  Phawhtoke(23),16,2,2015,15,2,2018,Auk Hmaw Thit  Phawhtoke,23,2015-2-16,2018-2-15
169,Kyaw Naing & Brothers Gems,Private,Oo Si (3/14)(11.12.14),16.2.2015,15.2.2018,Jade,1,Kachin State,Auk  Hmaw Thit Phawhtoke(24),16,2,2015,15,2,2018,Auk  Hmaw Thit Phawhtoke,24,2015-2-16,2018-2-15
170,Kyaw Naing & Brothers Gems,Private,Oo Si (3/14)(11.12.14),16.2.2015,15.2.2018,Jade,1,Kachin State,Auk Hmaw Thit  Phawhtoke(25),16,2,2015,15,2,2018,Auk Hmaw Thit  Phawhtoke,25,2015-2-16,2018-2-15
171,Kyaw Naing & Brothers Gems,Private,Oo Si (1/15)(26.3.15),23.4.2015,22.4.2018,Jade,1,Kachin State,Dan Tin Kyi Phawhtoke(18),23,4,2015,22,4,2018,Dan Tin Kyi Phawhtoke,18,2015-4-23,2018-4-22
172,Kyaw Naing & Brothers Gems,Private,Oo Si (1/15)(26.3.15),23.4.2015,22.4.2018,Jade,1,Kachin State,Mya Thida Phawhtoke(38),23,4,2015,22,4,2018,Mya Thida Phawhtoke,38,2015-4-23,2018-4-22
173,Kyaw Naing & Brothers Gems,Private,Kyi Kyat (27.8.10),14.10.2010,13.1.2016,Jade,1,Kachin State,Khun Sine Phawhtoke(69),14,10,2010,13,1,2016,Khun Sine Phawhtoke,69,2010-10-14,2016-1-13
174,Kyaw Naing & Brothers Gems,Private,Kyi Kyat (27.8.10),14.10.2010,13.1.2016,Jade,1,Kachin State,Khun Sine Phawhtoke(70),14,10,2010,13,1,2016,Khun Sine Phawhtoke,70,2010-10-14,2016-1-13
175,Kyaw Naing & Brothers Gems,Private,Kyi Kyat (27.8.10),14.10.2010,13.1.2016,Jade,1,Kachin State,Khun Sine Phawhtoke(73),14,10,2010,13,1,2016,Khun Sine Phawhtoke,73,2010-10-14,2016-1-13
176,Kyaw Naing & Brothers Gems,Private,Kyi Kyat (27.8.10),14.10.2010,13.1.2016,Jade,1,Kachin State,Khun Sine Phawhtoke(76),14,10,2010,13,1,2016,Khun Sine Phawhtoke,76,2010-10-14,2016-1-13
177,Kyaw Naing & Brothers Gems,Private,Kyi Kyat (27.8.10),14.10.2010,13.1.2016,Jade,1,Kachin State,Khun Sine Phawhtoket(79),14,10,2010,13,1,2016,Khun Sine Phawhtoket,79,2010-10-14,2016-1-13
178,Kyaw Naing & Brothers Gems,Private,Kyi Kyat (27.8.10),14.10.2010,13.1.2016,Jade,1,Kachin State,Khun Sine Phawhtoke(81),14,10,2010,13,1,2016,Khun Sine Phawhtoke,81,2010-10-14,2016-1-13
179,Kyaw Naing & Brothers Gems,Private,Kyi Kyat (27.8.10),14.10.2010,13.1.2016,Jade,1,Kachin State,Khun Sine Phawhtoke(90),14,10,2010,13,1,2016,Khun Sine Phawhtoke,90,2010-10-14,2016-1-13
180,Kyaw Naing & Brothers Gems,Private,Kyi Kyat (27.8.10),14.10.2010,13.1.2016,Jade,1,Kachin State,Khun Sine Phawhtoke(92),14,10,2010,13,1,2016,Khun Sine Phawhtoke,92,2010-10-14,2016-1-13
181,Kyaw Naing & Brothers Gems,Private,Kyi Kyat (27.8.10),14.10.2010,13.1.2016,Jade,1,Kachin State,Khun Sine Phawhtoke(94),14,10,2010,13,1,2016,Khun Sine Phawhtoke,94,2010-10-14,2016-1-13
182,Kyaw Naing & Brothers Gems,Private,Kyi Kyat (27.8.10),14.10.2010,13.1.2016,Jade,1,Kachin State,Khun Sine Phawhtoke(96),14,10,2010,13,1,2016,Khun Sine Phawhtoke,96,2010-10-14,2016-1-13
183,Kyaw Naing & Brothers Gems,Private,Kyi Kyat (19.10.10),10.12.2010,10.3.2016,Jade,1,Kachin State,Mya Thida Phawhtoke(51),10,12,2010,10,3,2016,Mya Thida Phawhtoke,51,2010-12-10,2016-3-10
184,Kyaw Naing & Brothers Gems,Private,Kyi Kyat (19.10.10),10.12.2010,10.3.2016,Jade,1,Kachin State,Auk Hmaw Thit  Phawhtoke(67),10,12,2010,10,3,2016,Auk Hmaw Thit  Phawhtoke,67,2010-12-10,2016-3-10
185,Kyaw Naing & Brothers Gems,Private,Kyi Kyat (19.10.10),10.12.2010,10.3.2016,Jade,1,Kachin State,Auk Hmaw Thit  Phawhtoke(68),10,12,2010,10,3,2016,Auk Hmaw Thit  Phawhtoke,68,2010-12-10,2016-3-10
186,Kyaw Naing & Brothers Gems,Private,Kyi Kyat (19.10.10),10.12.2010,10.3.2016,Jade,1,Kachin State,Auk Hmaw Thit  Phawhtoke(70),10,12,2010,10,3,2016,Auk Hmaw Thit  Phawhtoke,70,2010-12-10,2016-3-10
187,Kyaw Naing & Brothers Gems,Private,Kyi Kyat (19.10.10),10.12.2010,10.3.2016,Jade,1,Kachin State,AukHmaw Thit  Phawhtoke(71),10,12,2010,10,3,2016,AukHmaw Thit  Phawhtoke,71,2010-12-10,2016-3-10
188,Kyaw Naing & Brothers Gems,Private,Kyi Kyat (19.10.10),10.12.2010,10.3.2016,Jade,1,Kachin State,Auk Hmaw Thit  Phawhtoke(72),10,12,2010,10,3,2016,Auk Hmaw Thit  Phawhtoke,72,2010-12-10,2016-3-10
1,Kyaw Hwar Naing ,Private,Oo Si(3/14)(11.12.14),13.1.2015,12.1.2018,Jade,1,Kachin State,Mhaw Ga Lone(285),13,1,2015,12,1,2018,Mhaw Ga Lone,285,2015-1-13,2018-1-12
1,Kyaw Thisar,Private,Oo Si (1/10)(4.2.10),31.3.2010,30.6.2015,Gem,1,Kachin State,La Kha(37),31,3,2010,30,6,2015,La Kha,37,2010-3-31,2015-6-30
2,Kyaw Thisar,Private,Oo Si (1/10)(4.2.10),31.3.2010,30.6.2015,Gem,1,Kachin State,La Kha(38),31,3,2010,30,6,2015,La Kha,38,2010-3-31,2015-6-30
3,Kyaw Thisar,Private,Oo Si(2/11)(19.6.11),21.7.2011,19.10.2016,Jade,1,Kachin State,Maw One Gyi(245),21,7,2011,19,10,2016,Maw One Gyi,245,2011-7-21,2016-10-19
4,Kyaw Thisar,Private,Oo Si(2/11)(19.6.11),21.7.2011,19.10.2016,Jade,1,Kachin State,Maw One Gyi(246),21,7,2011,19,10,2016,Maw One Gyi,246,2011-7-21,2016-10-19
5,Kyaw Thisar,Private,Oo Si(2/11)(19.6.11),21.7.2011,19.10.2016,Jade,1,Kachin State,Maw One Gyi(247),21,7,2011,19,10,2016,Maw One Gyi,247,2011-7-21,2016-10-19
6,Kyaw Thisar,Private,Oo Si(2/11)(19.6.11),21.7.2011,19.10.2016,Jade,1,Kachin State,Maw One Gyi(248),21,7,2011,19,10,2016,Maw One Gyi,248,2011-7-21,2016-10-19
1,Kone Yar Thi Star,Private,Kyi Kyat(4/12)(1.6.12),20.3.2012,18.6.2017,Jade,1,Kachin State,Maw One Lay(195),20,3,2012,18,6,2017,Maw One Lay,195,2012-3-20,2017-6-18
2,Kone Yar Thi Star,Private,Kyi Kyat(4/12)(1.6.12),20.3.2012,18.6.2017,Jade,1,Kachin State,Maw One Lay(196),20,3,2012,18,6,2017,Maw One Lay,196,2012-3-20,2017-6-18
3,Kone Yar Thi Star,Private,Kyi Kyat(4/12)(1.6.12),20.3.2012,18.6.2017,Jade,1,Kachin State,Maw One Lay(197),20,3,2012,18,6,2017,Maw One Lay,197,2012-3-20,2017-6-18
4,Kone Yar Thi Star,Private,Kyi Kyat(4/12)(1.6.12),20.3.2012,18.6.2017,Jade,1,Kachin State,Maw One Lay(198),20,3,2012,18,6,2017,Maw One Lay,198,2012-3-20,2017-6-18
5,Kone Yar Thi Star,Private,Kyi Kyat(4/12)(1.6.12),20.3.2012,18.6.2017,Jade,1,Kachin State,Maw One Lay(199),20,3,2012,18,6,2017,Maw One Lay,199,2012-3-20,2017-6-18
6,Kone Yar Thi Star,Private,Kyi Kyat(4/12)(1.6.12),20.3.2012,18.6.2017,Jade,1,Kachin State,Maw One Lay(200),20,3,2012,18,6,2017,Maw One Lay,200,2012-3-20,2017-6-18
7,Kone Yar Thi Star,Private,Kyi Kyat(4/12)(1.6.12),20.3.2012,18.6.2017,Jade,1,Kachin State,Maw One Lay(201),20,3,2012,18,6,2017,Maw One Lay,201,2012-3-20,2017-6-18
8,Kone Yar Thi Star,Private,Kyi Kyat(4/12)(1.6.12),20.3.2012,18.6.2017,Jade,1,Kachin State,Maw One Lay(202),20,3,2012,18,6,2017,Maw One Lay,202,2012-3-20,2017-6-18
9,Kone Yar Thi Star,Private,Kyi Kyat(4/12)(1.6.12),20.3.2012,18.6.2017,Jade,1,Kachin State,Maw One Lay(203),20,3,2012,18,6,2017,Maw One Lay,203,2012-3-20,2017-6-18
10,Kone Yar Thi Star,Private,Kyi Kyat(4/12)(1.6.12),20.3.2012,18.6.2017,Jade,1,Kachin State,Maw One Lay(204),20,3,2012,18,6,2017,Maw One Lay,204,2012-3-20,2017-6-18
11,Kone Yar Thi Star,Private,Kyi Kyat(4/12)(1.6.12),20.3.2012,18.6.2017,Jade,1,Kachin State,Maw One Lay(205),20,3,2012,18,6,2017,Maw One Lay,205,2012-3-20,2017-6-18
12,Kone Yar Thi Star,Private,Kyi Kyat(4/12)(1.6.12),20.3.2012,18.6.2017,Jade,1,Kachin State,Maw One Lay(206),20,3,2012,18,6,2017,Maw One Lay,206,2012-3-20,2017-6-18
13,Kone Yar Thi Star,Private,Kyi Kyat(4/12)(1.6.12),20.3.2012,18.6.2017,Jade,1,Kachin State,Maw One Lay(207),20,3,2012,18,6,2017,Maw One Lay,207,2012-3-20,2017-6-18
14,Kone Yar Thi Star,Private,Kyi Kyat(4/12)(1.6.12),20.3.2012,18.6.2017,Jade,1,Kachin State,Maw One Lay(208),20,3,2012,18,6,2017,Maw One Lay,208,2012-3-20,2017-6-18
15,Kone Yar Thi Star,Private,Kyi Kyat(4/12)(1.6.12),20.3.2012,18.6.2017,Jade,1,Kachin State,Maw One Lay(209),20,3,2012,18,6,2017,Maw One Lay,209,2012-3-20,2017-6-18
16,Kone Yar Thi Star,Private,Kyi Kyat(4/12)(1.6.12),20.3.2012,18.6.2017,Jade,1,Kachin State,Maw One Lay(210),20,3,2012,18,6,2017,Maw One Lay,210,2012-3-20,2017-6-18
17,Kone Yar Thi Star,Private,Kyi Kyat(4/12)(1.6.12),20.3.2012,18.6.2017,Jade,1,Kachin State,Maw One Lay(211),20,3,2012,18,6,2017,Maw One Lay,211,2012-3-20,2017-6-18
18,Kone Yar Thi Star,Private,Kyi Kyat(4/12)(1.6.12),20.3.2012,18.6.2017,Jade,1,Kachin State,Maw One Lay(212),20,3,2012,18,6,2017,Maw One Lay,212,2012-3-20,2017-6-18
19,Kone Yar Thi Star,Private,Kyi Kyat(4/12)(1.6.12),20.3.2012,18.6.2017,Jade,1,Kachin State,Maw One Lay(2130,20,3,2012,18,6,2017,Maw One Lay,2130,2012-3-20,2017-6-18
20,Kone Yar Thi Star,Private,Kyi Kyat(4/12)(1.6.12),20.3.2012,18.6.2017,Jade,1,Kachin State,Maw One Lay(2140,20,3,2012,18,6,2017,Maw One Lay,2140,2012-3-20,2017-6-18
21,Kone Yar Thi Star,Private,Kyi Kyat(4/12)(1.6.12),20.3.2012,18.6.2017,Jade,1,Kachin State,Maw One Lay(215),20,3,2012,18,6,2017,Maw One Lay,215,2012-3-20,2017-6-18
22,Kone Yar Thi Star,Private,Kyi Kyat(4/12)(1.6.12),20.3.2012,18.6.2017,Jade,1,Kachin State,Maw One Lay(216),20,3,2012,18,6,2017,Maw One Lay,216,2012-3-20,2017-6-18
23,Kone Yar Thi Star,Private,Kyi Kyat(4/12)(1.6.12),20.3.2012,18.6.2017,Jade,1,Kachin State,Maw One Lay(217),20,3,2012,18,6,2017,Maw One Lay,217,2012-3-20,2017-6-18
24,Kone Yar Thi Star,Private,Kyi Kyat(4/12)(1.6.12),20.3.2012,18.6.2017,Jade,1,Kachin State,Maw One Lay(218),20,3,2012,18,6,2017,Maw One Lay,218,2012-3-20,2017-6-18
25,Kone Yar Thi Star,Private,Kyi Kyat(4/12)(1.6.12),20.3.2012,18.6.2017,Jade,1,Kachin State,Maw One Lay(219),20,3,2012,18,6,2017,Maw One Lay,219,2012-3-20,2017-6-18
26,Kone Yar Thi Star,Private,Kyi Kyat(4/12)(1.6.12),20.3.2012,18.6.2017,Jade,1,Kachin State,Maw One Lay(220),20,3,2012,18,6,2017,Maw One Lay,220,2012-3-20,2017-6-18
27,Kone Yar Thi Star,Private,Kyi Kyat(4/12)(1.6.12),20.3.2012,18.6.2017,Jade,1,Kachin State,Maw One Lay(221),20,3,2012,18,6,2017,Maw One Lay,221,2012-3-20,2017-6-18
28,Kone Yar Thi Star,Private,Kyi Kyat(4/12)(1.6.12),20.3.2012,18.6.2017,Jade,1,Kachin State,Maw One Lay(222),20,3,2012,18,6,2017,Maw One Lay,222,2012-3-20,2017-6-18
29,Kone Yar Thi Star,Private,Kyi Kyat(4/12)(1.6.12),20.3.2012,18.6.2017,Jade,1,Kachin State,Maw One Lay(223),20,3,2012,18,6,2017,Maw One Lay,223,2012-3-20,2017-6-18
30,Kone Yar Thi Star,Private,Kyi Kyat(4/12)(1.6.12),20.3.2012,18.6.2017,Jade,1,Kachin State,Maw One Lay(224),20,3,2012,18,6,2017,Maw One Lay,224,2012-3-20,2017-6-18
31,Kone Yar Thi Star,Private,Kyi Kyat(4/12)(1.6.12),20.3.2012,18.6.2017,Jade,1,Kachin State,Maw One Lay(225),20,3,2012,18,6,2017,Maw One Lay,225,2012-3-20,2017-6-18
32,Kone Yar Thi Star,Private,Kyi Kyat(4/12)(1.6.12),20.3.2012,18.6.2017,Jade,1,Kachin State,Maw One Lay(226),20,3,2012,18,6,2017,Maw One Lay,226,2012-3-20,2017-6-18
33,Kone Yar Thi Star,Private,Kyi Kyat(4/12)(1.6.12),20.3.2012,18.6.2017,Jade,1,Kachin State,Maw One Lay(227),20,3,2012,18,6,2017,Maw One Lay,227,2012-3-20,2017-6-18
34,Kone Yar Thi Star,Private,Kyi Kyat(4/12)(1.6.12),20.3.2012,18.6.2017,Jade,1,Kachin State,Maw One Lay(228),20,3,2012,18,6,2017,Maw One Lay,228,2012-3-20,2017-6-18
35,Kone Yar Thi Star,Private,Kyi Kyat(4/12)(1.6.12),20.3.2012,18.6.2017,Jade,1,Kachin State,Maw One Lay(229),20,3,2012,18,6,2017,Maw One Lay,229,2012-3-20,2017-6-18
36,Kone Yar Thi Star,Private,Kyi Kyat(4/12)(1.6.12),20.3.2012,18.6.2017,Jade,1,Kachin State,Maw One Lay(230),20,3,2012,18,6,2017,Maw One Lay,230,2012-3-20,2017-6-18
37,Kone Yar Thi Star,Private,Kyi Kyat(4/12)(1.6.12),20.3.2012,18.6.2017,Jade,1,Kachin State,Maw One Lay(231),20,3,2012,18,6,2017,Maw One Lay,231,2012-3-20,2017-6-18
1,Da Na Theidh Star,Private,Oo Si (2/13)(18.1.13),8.3.2013,7.3.2016,Gem,1,Madalay Division,Tha Phan Pin Kyi Taung(Pha Hta-42),8,3,2013,7,3,2016,Tha Phan Pin Kyi Taung,Pha Hta-42,2013-3-8,2016-3-7
2,Da Na Theidh Star,Private,Kyie Kyat(6/12)(15.8.12),10.10.2013,9.10.2016,Gem,1,Madalay Division,Baw Day(1),10,10,2013,9,10,2016,Baw Day,1,2013-10-10,2016-10-9
3,Da Na Theidh Star,Private,Kyie Kyat(6/12)(15.8.12),10.10.2013,9.10.2016,Gem,1,Madalay Division,Baw Day(2),10,10,2013,9,10,2016,Baw Day,2,2013-10-10,2016-10-9
4,Da Na Theidh Star,Private,Kyie Kyat(6/12)(15.8.12),10.10.2013,9.10.2016,Gem,1,Madalay Division,Baw Day(3),10,10,2013,9,10,2016,Baw Day,3,2013-10-10,2016-10-9
5,Da Na Theidh Star,Private,Kyie Kyat(6/12)(15.8.12),10.10.2013,9.10.2016,Gem,1,Madalay Division,Baw Day(4),10,10,2013,9,10,2016,Baw Day,4,2013-10-10,2016-10-9
6,Da Na Theidh Star,Private,Kyie Kyat(6/12)(15.8.12),10.10.2013,9.10.2016,Gem,1,Madalay Division,Baw Day(5),10,10,2013,9,10,2016,Baw Day,5,2013-10-10,2016-10-9
7,Da Na Theidh Star,Private,Kyie Kyat(6/12)(15.8.12),10.10.2013,9.10.2016,Gem,1,Madalay Division,Baw Day(6),10,10,2013,9,10,2016,Baw Day,6,2013-10-10,2016-10-9
8,Da Na Theidh Star,Private,Kyie Kyat(6/12)(15.8.12),10.10.2013,9.10.2016,Gem,1,Madalay Division,Baw Day(7),10,10,2013,9,10,2016,Baw Day,7,2013-10-10,2016-10-9
9,Da Na Theidh Star,Private,Kyie Kyat(6/12)(15.8.12),10.10.2013,9.10.2016,Gem,1,Madalay Division,Baw Day(8),10,10,2013,9,10,2016,Baw Day,8,2013-10-10,2016-10-9
10,Da Na Theidh Star,Private,Kyie Kyat(6/12)(15.8.12),10.10.2013,9.10.2016,Gem,1,Madalay Division,Baw Day(9),10,10,2013,9,10,2016,Baw Day,9,2013-10-10,2016-10-9
11,Da Na Theidh Star,Private,Kyie Kyat(6/12)(15.8.12),10.10.2013,9.10.2016,Gem,1,Madalay Division,Baw Day(10),10,10,2013,9,10,2016,Baw Day,10,2013-10-10,2016-10-9
12,Da Na Theidh Star,Private,Kyie Kyat(6/12)(15.8.12),10.10.2013,9.10.2016,Gem,1,Madalay Division,Moe Houst(1),10,10,2013,9,10,2016,Moe Houst,1,2013-10-10,2016-10-9
13,Da Na Theidh Star,Private,Kyie Kyat(6/12)(15.8.12),10.10.2013,9.10.2016,Gem,1,Madalay Division,Moe Houst(2),10,10,2013,9,10,2016,Moe Houst,2,2013-10-10,2016-10-9
14,Da Na Theidh Star,Private,Kyie Kyat(6/12)(15.8.12),10.10.2013,9.10.2016,Gem,1,Madalay Division,Moe Houst(3),10,10,2013,9,10,2016,Moe Houst,3,2013-10-10,2016-10-9
15,Da Na Theidh Star,Private,Kyie Kyat(6/12)(15.8.12),10.10.2013,9.10.2016,Gem,1,Madalay Division,Moe Houst(4),10,10,2013,9,10,2016,Moe Houst,4,2013-10-10,2016-10-9
16,Da Na Theidh Star,Private,Kyie Kyat(6/12)(15.8.12),10.10.2013,9.10.2016,Gem,1,Madalay Division,Moe Houst(5),10,10,2013,9,10,2016,Moe Houst,5,2013-10-10,2016-10-9
17,Da Na Theidh Star,Private,Kyie Kyat(6/12)(15.8.12),10.10.2013,9.10.2016,Gem,1,Madalay Division,Moe Houst(6),10,10,2013,9,10,2016,Moe Houst,6,2013-10-10,2016-10-9
18,Da Na Theidh Star,Private,Kyie Kyat(6/12)(15.8.12),10.10.2013,9.10.2016,Gem,1,Madalay Division,Moe Houst(7),10,10,2013,9,10,2016,Moe Houst,7,2013-10-10,2016-10-9
19,Da Na Theidh Star,Private,Kyie Kyat(6/12)(15.8.12),10.10.2013,9.10.2016,Gem,1,Madalay Division,Moe Houst(8),10,10,2013,9,10,2016,Moe Houst,8,2013-10-10,2016-10-9
20,Da Na Theidh Star,Private,Kyie Kyat(6/12)(15.8.12),10.10.2013,9.10.2016,Gem,1,Madalay Division,Moe Houst(9),10,10,2013,9,10,2016,Moe Houst,9,2013-10-10,2016-10-9
21,Da Na Theidh Star,Private,Kyie Kyat(6/12)(15.8.12),10.10.2013,9.10.2016,Gem,1,Madalay Division,Moe Houst(10),10,10,2013,9,10,2016,Moe Houst,10,2013-10-10,2016-10-9
22,Da Na Theidh Star,Private,Kyie Kyat(6/12)(15.8.12),10.10.2013,9.10.2016,Gem,1,Madalay Division,Moe Houst(11),10,10,2013,9,10,2016,Moe Houst,11,2013-10-10,2016-10-9
23,Da Na Theidh Star,Private,Kyie Kyat(6/12)(15.8.12),10.10.2013,9.10.2016,Gem,1,Madalay Division,Moe Houst(12),10,10,2013,9,10,2016,Moe Houst,12,2013-10-10,2016-10-9
24,Da Na Theidh Star,Private,Kyie Kyat(6/12)(15.8.12),10.10.2013,9.10.2016,Gem,1,Madalay Division,Moe Houst(13),10,10,2013,9,10,2016,Moe Houst,13,2013-10-10,2016-10-9
25,Da Na Theidh Star,Private,Kyie Kyat(6/12)(15.8.12),10.10.2013,9.10.2016,Gem,1,Madalay Division,Moe Houst(14),10,10,2013,9,10,2016,Moe Houst,14,2013-10-10,2016-10-9
26,Da Na Theidh Star,Private,Kyie Kyat(6/12)(15.8.12),10.10.2013,9.10.2016,Gem,1,Madalay Division,Moe Houst(15),10,10,2013,9,10,2016,Moe Houst,15,2013-10-10,2016-10-9
27,Da Na Theidh Star,Private,Oo Si (6/13)(20.9.13),31.10.2013,30.10.2016,Gem,1,Madalay Division,Tha Phan Pin Kyi Taung(Pha Hta-70),31,10,2013,30,10,2016,Tha Phan Pin Kyi Taung,Pha Hta-70,2013-10-31,2016-10-30
28,Da Na Theidh Star,Private,Oo Si (6/13)(20.9.13),31.10.2013,30.10.2016,Gem,1,Madalay Division,Tha Phan Pin Kyi Taung(Pha Hta-71),31,10,2013,30,10,2016,Tha Phan Pin Kyi Taung,Pha Hta-71,2013-10-31,2016-10-30
29,Da Na Theidh Star,Private,Kyie Kyat(3/14)(26.3.14),8.4.2014,7.4.2017,Gem,1,Madalay Division,Yee Pu Tha Phan Pin Kyar(37),8,4,2014,7,4,2017,Yee Pu Tha Phan Pin Kyar,37,2014-4-8,2017-4-7
30,Da Na Theidh Star,Private,Kyie Kyat(3/14)(26.3.14),8.4.2014,7.4.2017,Gem,1,Madalay Division,Yee Pu Tha Phan Pin Kyar(38),8,4,2014,7,4,2017,Yee Pu Tha Phan Pin Kyar,38,2014-4-8,2017-4-7
31,Da Na Theidh Star,Private,Kyie Kyat(3/14)(26.3.14),8.4.2014,7.4.2017,Gem,1,Madalay Division,Yee Pu Tha Phan Pin Kyar(39),8,4,2014,7,4,2017,Yee Pu Tha Phan Pin Kyar,39,2014-4-8,2017-4-7
32,Da Na Theidh Star,Private,Kyie Kyat(3/14)(26.3.14),8.4.2014,7.4.2017,Gem,1,Madalay Division,Yee Pu Tha Phan Pin Kyar(40),8,4,2014,7,4,2017,Yee Pu Tha Phan Pin Kyar,40,2014-4-8,2017-4-7
33,Da Na Theidh Star,Private,Kyie Kyat(3/14)(26.3.14),8.4.2014,7.4.2017,Gem,1,Madalay Division,Yee Pu Tha Phan Pin Kyar(41),8,4,2014,7,4,2017,Yee Pu Tha Phan Pin Kyar,41,2014-4-8,2017-4-7
34,Da Na Theidh Star,Private,Kyie Kyat(3/14)(26.3.14),8.4.2014,7.4.2017,Gem,1,Madalay Division,Yee Pu Tha Phan Pin Kyar(42),8,4,2014,7,4,2017,Yee Pu Tha Phan Pin Kyar,42,2014-4-8,2017-4-7
35,Da Na Theidh Star,Private,Kyie Kyat(3/14)(26.3.14),8.4.2014,7.4.2017,Gem,1,Madalay Division,Yee Pu Tha Phan Pin Kyar(43),8,4,2014,7,4,2017,Yee Pu Tha Phan Pin Kyar,43,2014-4-8,2017-4-7
36,Da Na Theidh Star,Private,Kyie Kyat(3/14)(26.3.14),8.4.2014,7.4.2017,Gem,1,Madalay Division,Yee Pu Tha Phan Pin Kyar(44),8,4,2014,7,4,2017,Yee Pu Tha Phan Pin Kyar,44,2014-4-8,2017-4-7
37,Da Na Theidh Star,Private,Kyie Kyat(3/14)(26.3.14),8.4.2014,7.4.2017,Gem,1,Madalay Division,Yee Pu Tha Phan Pin Kyar(45),8,4,2014,7,4,2017,Yee Pu Tha Phan Pin Kyar,45,2014-4-8,2017-4-7
38,Da Na Theidh Star,Private,Kyie Kyat(3/14)(26.3.14),8.4.2014,7.4.2017,Gem,1,Madalay Division,Yee Pu Tha Phan Pin Kyar(46),8,4,2014,7,4,2017,Yee Pu Tha Phan Pin Kyar,46,2014-4-8,2017-4-7
1,Myanmar  ruby interprise,Private,Oo Si (1/12)23.4.12),15.5.2012,14.5.2015,Gem,1,Madalay Division,Tha Phan Kyi Taung(10),15,5,2012,14,5,2015,Tha Phan Kyi Taung,10,2012-5-15,2015-5-14
2,Myanmar  ruby interprise,Private,Oo Si (1/12)23.4.12),15.5.2012,14.5.2015,Gem,1,Madalay Division,Tha Phan Kyi Taung(11),15,5,2012,14,5,2015,Tha Phan Kyi Taung,11,2012-5-15,2015-5-14
3,Myanmar  ruby interprise,Private,Kyie Kyat(4/12)(),29.4.2013,28.4.2015,Gem,1,Madalay Division,Sone Taw Myaing(6),29,4,2013,28,4,2015,Sone Taw Myaing,6,2013-4-29,2015-4-28
4,Myanmar  ruby interprise,Private,Kyie Kyat(4/12)(),29.4.2013,28.4.2015,Gem,1,Madalay Division,Sone Taw Myaing(7),29,4,2013,28,4,2015,Sone Taw Myaing,7,2013-4-29,2015-4-28
5,Myanmar  ruby interprise,Private,Kyie Kyat(4/12)(),29.4.2013,28.4.2015,Gem,1,Madalay Division,Sone Taw Myaing(8),29,4,2013,28,4,2015,Sone Taw Myaing,8,2013-4-29,2015-4-28
6,Myanmar  ruby interprise,Private,Oo Si (5/13)(28.3.13),5.5.2013,4.5.2016,Gem,1,Madalay Division,Sit Ten(Pha Hta-7),5,5,2013,4,5,2016,Sit Ten,Pha Hta-7,2013-5-5,2016-5-4
7,Myanmar  ruby interprise,Private,Oo Si (5/13)(28.3.13),5.5.2013,4.5.2016,Gem,1,Madalay Division,Sit Ten(Pha Hta-8),5,5,2013,4,5,2016,Sit Ten,Pha Hta-8,2013-5-5,2016-5-4
8,Myanmar  ruby interprise,Private,Oo Si (5/13)(28.3.13),5.5.2013,4.5.2016,Gem,1,Madalay Division,Sit Ten(Pha Hta-9),5,5,2013,4,5,2016,Sit Ten,Pha Hta-9,2013-5-5,2016-5-4
9,Myanmar  ruby interprise,Private,Oo Si (5/13)(28.3.13),5.5.2013,4.5.2016,Gem,1,Madalay Division,Sit Ten(Pha Hta-10),5,5,2013,4,5,2016,Sit Ten,Pha Hta-10,2013-5-5,2016-5-4
10,Myanmar  ruby interprise,Private,Oo Si (6/13)(20.9.13),18.9.2013,17.9.2016,Gem,1,Madalay Division,Sit Ten(Pha Hta-1),18,9,2013,17,9,2016,Sit Ten,Pha Hta-1,2013-9-18,2016-9-17
11,Myanmar  ruby interprise,Private,Oo Si (6/13)(20.9.13),18.9.2013,17.9.2016,Gem,1,Madalay Division,Sit Ten(Pha Hta-2),18,9,2013,17,9,2016,Sit Ten,Pha Hta-2,2013-9-18,2016-9-17
12,Myanmar  ruby interprise,Private,Oo Si (6/13)(20.9.13),28.7.2013,27.7.2016,Gem,1,Madalay Division,Shwe Taing Shwe Guu(1),28,7,2013,27,7,2016,Shwe Taing Shwe Guu,1,2013-7-28,2016-7-27
13,Myanmar  ruby interprise,Private,Oo Si (6/13)(20.9.13),28.7.2013,27.7.2016,Gem,1,Madalay Division,Shwe Taing Shwe Guu(2),28,7,2013,27,7,2016,Shwe Taing Shwe Guu,2,2013-7-28,2016-7-27
14,Myanmar  ruby interprise,Private,Oo Si (6/13)(20.9.13),28.7.2013,27.7.2016,Gem,1,Madalay Division,Shwe Taing Shwe Guu(3),28,7,2013,27,7,2016,Shwe Taing Shwe Guu,3,2013-7-28,2016-7-27
15,Myanmar  ruby interprise,Private,Oo Si (6/13)(20.9.13),28.7.2013,27.7.2016,Gem,1,Madalay Division,Shwe Taing Shwe Guu(4),28,7,2013,27,7,2016,Shwe Taing Shwe Guu,4,2013-7-28,2016-7-27
16,Myanmar  ruby interprise,Private,Oo Si (6/13)(20.9.13),28.7.2013,27.7.2016,Gem,1,Madalay Division,Shwe Taing Shwe Guu(5),28,7,2013,27,7,2016,Shwe Taing Shwe Guu,5,2013-7-28,2016-7-27
17,Myanmar  ruby interprise,Private,Oo Si (1/14)(10.6.14),24.5.2014,23.5.2017,Gem,1,Madalay Division,Pan Lin Paung Gaung(Pha Hta-23),24,5,2014,23,5,2017,Pan Lin Paung Gaung,Pha Hta-23,2014-5-24,2017-5-23
18,Myanmar  ruby interprise,Private,Oo Si (1/14)(10.6.14),24.5.2014,23.5.2017,Gem,1,Madalay Division,Pan Lin Paung Gaung(Pha Hta-24),24,5,2014,23,5,2017,Pan Lin Paung Gaung,Pha Hta-24,2014-5-24,2017-5-23
19,Myanmar  ruby interprise,Private,Oo Si (1/14)(10.6.14),24.5.2014,23.5.2017,Gem,1,Madalay Division,Pan Lin Paung Gaung(Pha Hta-25),24,5,2014,23,5,2017,Pan Lin Paung Gaung,Pha Hta-25,2014-5-24,2017-5-23
20,Myanmar  ruby interprise,Private,Oo Si (1/14)(10.6.14),24.5.2014,23.5.2017,Gem,1,Madalay Division,Pan Lin Paung Gaung(Pha Hta-26),24,5,2014,23,5,2017,Pan Lin Paung Gaung,Pha Hta-26,2014-5-24,2017-5-23
21,Myanmar  ruby interprise,Private,Oo Si (1/14)(10.6.14),24.5.2014,23.5.2017,Gem,1,Madalay Division,Pan Lin Paung Gaung(Pha Hta-27),24,5,2014,23,5,2017,Pan Lin Paung Gaung,Pha Hta-27,2014-5-24,2017-5-23
22,Myanmar  ruby interprise,Private,Oo Si (1/14)(10.6.14),29.4.2014,28.4.2017,Gem,1,Madalay Division,Pan Lin Inn Chouk(70),29,4,2014,28,4,2017,Pan Lin Inn Chouk,70,2014-4-29,2017-4-28
23,Myanmar  ruby interprise,Private,Oo Si (1/14)(10.6.14),29.4.2014,28.4.2017,Gem,1,Madalay Division,Pan Lin Inn Chouk(71),29,4,2014,28,4,2017,Pan Lin Inn Chouk,71,2014-4-29,2017-4-28
24,Myanmar  ruby interprise,Private,Oo Si (1/14)(10.6.14),29.4.2014,28.4.2017,Gem,1,Madalay Division,Pan Lin Inn Chouk(72),29,4,2014,28,4,2017,Pan Lin Inn Chouk,72,2014-4-29,2017-4-28
25,Myanmar  ruby interprise,Private,Oo Si (1/14)(10.6.14),29.4.2014,28.4.2017,Gem,1,Madalay Division,Pan Lin Inn Chouk(73),29,4,2014,28,4,2017,Pan Lin Inn Chouk,73,2014-4-29,2017-4-28
26,Myanmar  ruby interprise,Private,Oo Si (1/14)(10.6.14),29.4.2014,28.4.2017,Gem,1,Madalay Division,Pan Lin Inn Chouk(75),29,4,2014,28,4,2017,Pan Lin Inn Chouk,75,2014-4-29,2017-4-28
27,Myanmar  ruby interprise,Private,Oo Si (1/14)(10.6.14),29.4.2014,28.4.2017,Gem,1,Madalay Division,Pan Lin Inn Chouk(76),29,4,2014,28,4,2017,Pan Lin Inn Chouk,76,2014-4-29,2017-4-28
28,Myanmar  ruby interprise,Private,Oo Si (1/14)(10.6.14),29.4.2014,28.4.2017,Gem,1,Madalay Division,Pan Lin Inn Chouk(78),29,4,2014,28,4,2017,Pan Lin Inn Chouk,78,2014-4-29,2017-4-28
29,Myanmar  ruby interprise,Private,Oo Si (1/14)(10.6.14),29.4.2014,28.4.2017,Gem,1,Madalay Division,Pan Lin Inn Chouk(79),29,4,2014,28,4,2017,Pan Lin Inn Chouk,79,2014-4-29,2017-4-28
30,Myanmar  ruby interprise,Private,Oo Si (1/14)(10.6.14),29.4.2014,28.4.2017,Gem,1,Madalay Division,Pan Lin Inn Chouk(80),29,4,2014,28,4,2017,Pan Lin Inn Chouk,80,2014-4-29,2017-4-28
31,Myanmar  ruby interprise,Private,Oo Si (1/14)(10.6.14),29.4.2014,28.4.2017,Gem,1,Madalay Division,Pan Lin Inn Chouk(81),29,4,2014,28,4,2017,Pan Lin Inn Chouk,81,2014-4-29,2017-4-28
32,Myanmar  ruby interprise,Private,Oo Si (1/14)(10.6.14),29.4.2014,28.4.2017,Gem,1,Madalay Division,Pan Lin Inn Chouk(82),29,4,2014,28,4,2017,Pan Lin Inn Chouk,82,2014-4-29,2017-4-28
33,Myanmar  ruby interprise,Private,Oo Si (1/14)(10.6.14),29.4.2014,28.4.2017,Gem,1,Madalay Division,Pan Lin Inn Chouk(83),29,4,2014,28,4,2017,Pan Lin Inn Chouk,83,2014-4-29,2017-4-28
34,Myanmar  ruby interprise,Private,Oo Si (1/14)(10.6.14),29.4.2014,28.4.2017,Gem,1,Madalay Division,Pan Lin Inn Chouk(89),29,4,2014,28,4,2017,Pan Lin Inn Chouk,89,2014-4-29,2017-4-28
35,Myanmar  ruby interprise,Private,Oo Si (1/14)(10.6.14),29.4.2014,28.4.2017,Gem,1,Madalay Division,Pan Lin Inn Chouk(90),29,4,2014,28,4,2017,Pan Lin Inn Chouk,90,2014-4-29,2017-4-28
36,Myanmar  ruby interprise,Private,Oo Si (1/14)(10.6.14),29.4.2014,28.4.2017,Gem,1,Madalay Division,Pan Lin Inn Chouk(91),29,4,2014,28,4,2017,Pan Lin Inn Chouk,91,2014-4-29,2017-4-28
37,Myanmar  ruby interprise,Private,Oo Si (1/14)(10.6.14),29.4.2014,28.4.2017,Gem,1,Madalay Division,Pan Lin Inn Chouk(101),29,4,2014,28,4,2017,Pan Lin Inn Chouk,101,2014-4-29,2017-4-28
38,Myanmar  ruby interprise,Private,Oo Si (1/14)(10.6.14),29.4.2014,28.4.2017,Gem,1,Madalay Division,Pan Lin Inn Chouk(106),29,4,2014,28,4,2017,Pan Lin Inn Chouk,106,2014-4-29,2017-4-28
39,Myanmar  ruby interprise,Private,Oo Si (1/14)(10.6.14),29.4.2014,28.4.2017,Gem,1,Madalay Division,Pan Lin Inn Chouk(107),29,4,2014,28,4,2017,Pan Lin Inn Chouk,107,2014-4-29,2017-4-28
40,Myanmar  ruby interprise,Private,Oo Si (1/14)(10.6.14),29.4.2014,28.4.2017,Gem,1,Madalay Division,Pan Lin Inn Chouk(108),29,4,2014,28,4,2017,Pan Lin Inn Chouk,108,2014-4-29,2017-4-28
41,Myanmar  ruby interprise,Private,Oo Si (1/14)(10.6.14),29.4.2014,28.4.2017,Gem,1,Madalay Division,Pan Lin Inn Chouk(109),29,4,2014,28,4,2017,Pan Lin Inn Chouk,109,2014-4-29,2017-4-28
42,Myanmar  ruby interprise,Private,Oo Si (1/14)(10.6.14),29.4.2014,28.4.2017,Gem,1,Madalay Division,Pan Lin Inn Chouk(111),29,4,2014,28,4,2017,Pan Lin Inn Chouk,111,2014-4-29,2017-4-28
43,Myanmar  ruby interprise,Private,Oo Si (1/14)(10.6.14),29.4.2014,28.4.2017,Gem,1,Madalay Division,Pan Lin Inn Chouk(112),29,4,2014,28,4,2017,Pan Lin Inn Chouk,112,2014-4-29,2017-4-28
44,Myanmar  ruby interprise,Private,Oo Si (1/14)(10.6.14),29.4.2014,28.4.2017,Gem,1,Madalay Division,Pan Lin Inn Chouk(113),29,4,2014,28,4,2017,Pan Lin Inn Chouk,113,2014-4-29,2017-4-28
45,Myanmar  ruby interprise,Private,Oo Si (1/14)(10.6.14),29.4.2014,28.4.2017,Gem,1,Madalay Division,Pan Lin Inn Chouk(114),29,4,2014,28,4,2017,Pan Lin Inn Chouk,114,2014-4-29,2017-4-28
46,Myanmar  ruby interprise,Private,Oo Si (1/14)(10.6.14),29.4.2014,28.4.2017,Gem,1,Madalay Division,Pan Lin Inn Chouk(115),29,4,2014,28,4,2017,Pan Lin Inn Chouk,115,2014-4-29,2017-4-28
47,Myanmar  ruby interprise,Private,Oo Si (1/14)(10.6.14),29.4.2014,28.4.2017,Gem,1,Madalay Division,Pan Lin Inn Chouk(117),29,4,2014,28,4,2017,Pan Lin Inn Chouk,117,2014-4-29,2017-4-28
48,Myanmar  ruby interprise,Private,Oo Si (1/14)(10.6.14),29.4.2014,28.4.2017,Gem,1,Madalay Division,Pan Lin Inn Chouk(118),29,4,2014,28,4,2017,Pan Lin Inn Chouk,118,2014-4-29,2017-4-28
49,Myanmar  ruby interprise,Private,Oo Si (1/14)(10.6.14),29.4.2014,28.4.2017,Gem,1,Madalay Division,Pan Lin Inn Chouk(123),29,4,2014,28,4,2017,Pan Lin Inn Chouk,123,2014-4-29,2017-4-28
50,Myanmar  ruby interprise,Private,Oo Si (1/14)(10.6.14),29.4.2014,28.4.2017,Gem,1,Madalay Division,Pan Lin Inn Chouk(124),29,4,2014,28,4,2017,Pan Lin Inn Chouk,124,2014-4-29,2017-4-28
51,Myanmar  ruby interprise,Private,Oo Si (1/14)(10.6.14),29.4.2014,28.4.2017,Gem,1,Madalay Division,Pan Lin Inn Chouk(125),29,4,2014,28,4,2017,Pan Lin Inn Chouk,125,2014-4-29,2017-4-28
52,Myanmar  ruby interprise,Private,Oo Si (1/14)(10.6.14),29.4.2014,28.4.2017,Gem,1,Madalay Division,Pan Lin Inn Chouk(126),29,4,2014,28,4,2017,Pan Lin Inn Chouk,126,2014-4-29,2017-4-28
53,Myanmar  ruby interprise,Private,Oo Si (1/14)(10.6.14),29.4.2014,28.4.2017,Gem,1,Madalay Division,Pan Lin Inn Chouk(129),29,4,2014,28,4,2017,Pan Lin Inn Chouk,129,2014-4-29,2017-4-28
54,Myanmar  ruby interprise,Private,Oo Si (1/14)(10.6.14),29.4.2014,28.4.2017,Gem,1,Madalay Division,Pan Lin Inn Chouk(130),29,4,2014,28,4,2017,Pan Lin Inn Chouk,130,2014-4-29,2017-4-28
55,Myanmar  ruby interprise,Private,Oo Si (1/14)(10.6.14),29.4.2014,28.4.2017,Gem,1,Madalay Division,Pan Lin Inn Chouk(131),29,4,2014,28,4,2017,Pan Lin Inn Chouk,131,2014-4-29,2017-4-28
56,Myanmar  ruby interprise,Private,Oo Si (1/14)(10.6.14),29.4.2014,28.4.2017,Gem,1,Madalay Division,Pan Lin Inn Chouk(148),29,4,2014,28,4,2017,Pan Lin Inn Chouk,148,2014-4-29,2017-4-28
57,Myanmar  ruby interprise,Private,Oo Si (1/14)(10.6.14),23.7.2014,22.7.2017,Gem,1,Madalay Division,King(31),23,7,2014,22,7,2017,King,31,2014-7-23,2017-7-22
58,Myanmar  ruby interprise,Private,Oo Si (1/14)(10.6.14),23.7.2014,22.7.2017,Gem,1,Madalay Division,King(32),23,7,2014,22,7,2017,King,32,2014-7-23,2017-7-22
59,Myanmar  ruby interprise,Private,Oo Si (2/14)(30.10.14),2.12.2014,1.12.2017,Gem,1,Madalay Division,King(20),2,12,2014,1,12,2017,King,20,2014-12-2,2017-12-1
60,Myanmar  ruby interprise,Private,Oo Si (2/14)(30.10.14),2.12.2014,1.12.2017,Gem,1,Madalay Division,King(21),2,12,2014,1,12,2017,King,21,2014-12-2,2017-12-1
61,Myanmar  ruby interprise,Private,Oo Si (2/14)(30.10.14),2.12.2014,1.12.2017,Gem,1,Madalay Division,King(22),2,12,2014,1,12,2017,King,22,2014-12-2,2017-12-1
62,Myanmar  ruby interprise,Private,Oo Si (2/14)(30.10.14),2.12.2014,1.12.2017,Gem,1,Madalay Division,King(23),2,12,2014,1,12,2017,King,23,2014-12-2,2017-12-1
63,Myanmar  ruby interprise,Private,Oo Si (2/14)(30.10.14),2.12.2014,1.12.2017,Gem,1,Madalay Division,King(24),2,12,2014,1,12,2017,King,24,2014-12-2,2017-12-1
64,Myanmar  ruby interprise,Private,Oo Si (2/14)(30.10.14),2.12.2014,1.12.2017,Gem,1,Madalay Division,King(25),2,12,2014,1,12,2017,King,25,2014-12-2,2017-12-1
65,Myanmar  ruby interprise,Private,Oo Si (2/14)(30.10.14),2.12.2014,1.12.2017,Gem,1,Madalay Division,King(28),2,12,2014,1,12,2017,King,28,2014-12-2,2017-12-1
66,Myanmar  ruby interprise,Private,Oo Si (2/14)(30.10.14),2.12.2014,1.12.2017,Gem,1,Madalay Division,King(29),2,12,2014,1,12,2017,King,29,2014-12-2,2017-12-1
67,Myanmar  ruby interprise,Private,Oo Si (2/14)(30.10.14),23.12.2014,22.12.2017,Gem,1,Madalay Division,Le Oo Le Taw(21),23,12,2014,22,12,2017,Le Oo Le Taw,21,2014-12-23,2017-12-22
68,Myanmar  ruby interprise,Private,Oo Si (2/14)(30.10.14),23.12.2014,22.12.2017,Gem,1,Madalay Division,Le Oo Le Taw(22),23,12,2014,22,12,2017,Le Oo Le Taw,22,2014-12-23,2017-12-22
69,Myanmar  ruby interprise,Private,Oo Si (2/14)(30.10.14),23.12.2014,22.12.2017,Gem,1,Madalay Division,Le Oo Le Taw(23),23,12,2014,22,12,2017,Le Oo Le Taw,23,2014-12-23,2017-12-22
70,Myanmar  ruby interprise,Private,Oo Si (2/14)(30.10.14),18.11.2014,17.11.2017,Gem,1,Madalay Division,Pyaung Pyin Sinn They Chak(5),18,11,2014,17,11,2017,Pyaung Pyin Sinn They Chak,5,2014-11-18,2017-11-17
71,Myanmar  ruby interprise,Private,Oo Si (2/14)(30.10.14),18.11.2014,17.11.2017,Gem,1,Madalay Division,Pyaung Pyin Sinn They Chak(6),18,11,2014,17,11,2017,Pyaung Pyin Sinn They Chak,6,2014-11-18,2017-11-17
72,Myanmar  ruby interprise,Private,Oo Si (2/14)(30.10.14),18.11.2014,17.11.2017,Gem,1,Madalay Division,Pyaung Pyin Sinn They Chak(7),18,11,2014,17,11,2017,Pyaung Pyin Sinn They Chak,7,2014-11-18,2017-11-17
73,Myanmar  ruby interprise,Private,Oo Si (2/14)(30.10.14),18.11.2014,17.11.2017,Gem,1,Madalay Division,Pyaung Pyin Sinn They Chak(8),18,11,2014,17,11,2017,Pyaung Pyin Sinn They Chak,8,2014-11-18,2017-11-17
74,Myanmar  ruby interprise,Private,Oo Si (2/14)(30.10.14),18.11.2014,17.11.2017,Gem,1,Madalay Division,Pyaung Pyin Sinn They Chak(9),18,11,2014,17,11,2017,Pyaung Pyin Sinn They Chak,9,2014-11-18,2017-11-17
75,Myanmar  ruby interprise,Private,Oo Si (2/14)(30.10.14),18.11.2014,17.11.2017,Gem,1,Madalay Division,Pyaung Pyin Sinn They Chak(10),18,11,2014,17,11,2017,Pyaung Pyin Sinn They Chak,10,2014-11-18,2017-11-17
76,Myanmar  ruby interprise,Private,Oo Si (2/14)(30.10.14),18.11.2014,17.11.2017,Gem,1,Madalay Division,Pyaung Pyin Sinn They Chak(14),18,11,2014,17,11,2017,Pyaung Pyin Sinn They Chak,14,2014-11-18,2017-11-17
77,Myanmar  ruby interprise,Private,Oo Si (2/14)(30.10.14),18.11.2014,17.11.2017,Gem,1,Madalay Division,Pyaung Pyin Sinn They Chak(15),18,11,2014,17,11,2017,Pyaung Pyin Sinn They Chak,15,2014-11-18,2017-11-17
78,Myanmar  ruby interprise,Private,Oo Si (2/14)(30.10.14),18.11.2014,17.11.2017,Gem,1,Madalay Division,Pyaung Pyin Sinn They Chak(16),18,11,2014,17,11,2017,Pyaung Pyin Sinn They Chak,16,2014-11-18,2017-11-17
79,Myanmar  ruby interprise,Private,Oo Si (2/14)(30.10.14),18.11.2014,17.11.2017,Gem,1,Madalay Division,Pyaung Pyin Sinn They Chak(23),18,11,2014,17,11,2017,Pyaung Pyin Sinn They Chak,23,2014-11-18,2017-11-17
80,Myanmar  ruby interprise,Private,Oo Si (2/14)(30.10.14),18.11.2014,17.11.2017,Gem,1,Madalay Division,Pyaung Pyin Sinn They Chak(24),18,11,2014,17,11,2017,Pyaung Pyin Sinn They Chak,24,2014-11-18,2017-11-17
81,Myanmar  ruby interprise,Private,Oo Si (2/14)(30.10.14),18.11.2014,17.11.2017,Gem,1,Madalay Division,Pyaung Pyin Sinn They Chak(25),18,11,2014,17,11,2017,Pyaung Pyin Sinn They Chak,25,2014-11-18,2017-11-17
82,Myanmar  ruby interprise,Private,Oo Si (2/14)(30.10.14),18.11.2014,17.11.2017,Gem,1,Madalay Division,Pyaung Pyin Sinn They Chak(26),18,11,2014,17,11,2017,Pyaung Pyin Sinn They Chak,26,2014-11-18,2017-11-17
83,Myanmar  ruby interprise,Private,Oo Si (2/14)(30.10.14),18.11.2014,17.11.2017,Gem,1,Madalay Division,Your Thar Ah Chauk Taw(5),18,11,2014,17,11,2017,Your Thar Ah Chauk Taw,5,2014-11-18,2017-11-17
84,Myanmar  ruby interprise,Private,Oo Si (2/14)(30.10.14),18.11.2014,17.11.2017,Gem,1,Madalay Division,Your Thar Ah Chauk Taw(6),18,11,2014,17,11,2017,Your Thar Ah Chauk Taw,6,2014-11-18,2017-11-17
85,Myanmar  ruby interprise,Private,Oo Si (2/14)(30.10.14),18.11.2014,17.11.2017,Gem,1,Madalay Division,Your Thar Ah Chauk Taw(7),18,11,2014,17,11,2017,Your Thar Ah Chauk Taw,7,2014-11-18,2017-11-17
86,Myanmar  ruby interprise,Private,Oo Si (2/14)(30.10.14),18.11.2014,17.11.2017,Gem,1,Madalay Division,Your Thar Ah Chauk Taw(8),18,11,2014,17,11,2017,Your Thar Ah Chauk Taw,8,2014-11-18,2017-11-17
87,Myanmar  ruby interprise,Private,Oo Si (2/14)(30.10.14),18.11.2014,17.11.2017,Gem,1,Madalay Division,Your Thar Ah Chauk Taw(9),18,11,2014,17,11,2017,Your Thar Ah Chauk Taw,9,2014-11-18,2017-11-17
88,Myanmar  ruby interprise,Private,Oo Si (2/14)(30.10.14),18.11.2014,17.11.2017,Gem,1,Madalay Division,Your Thar Ah Chauk Taw(10),18,11,2014,17,11,2017,Your Thar Ah Chauk Taw,10,2014-11-18,2017-11-17
89,Myanmar  ruby interprise,Private,Oo Si (2/14)(30.10.14),18.11.2014,17.11.2017,Gem,1,Madalay Division,Your Thar Ah Chauk Taw(11),18,11,2014,17,11,2017,Your Thar Ah Chauk Taw,11,2014-11-18,2017-11-17
90,Myanmar  ruby interprise,Private,Oo Si (2/14)(30.10.14),4.12.2014,3.12.2017,Gem,1,Madalay Division,Pan Lin Inn Chouk(193),4,12,2014,3,12,2017,Pan Lin Inn Chouk,193,2014-12-4,2017-12-3
91,Myanmar  ruby interprise,Private,Oo Si (2/14)(30.10.14),4.12.2014,3.12.2017,Gem,1,Madalay Division,Pan Lin Inn Chouk(194),4,12,2014,3,12,2017,Pan Lin Inn Chouk,194,2014-12-4,2017-12-3
92,Myanmar  ruby interprise,Private,Oo Si (3/14)(18.12.14),10.3.2015,9.3.2018,Gem,1,Madalay Division,Kyauk Pya That(Pha Hta-46),10,3,2015,9,3,2018,Kyauk Pya That,Pha Hta-46,2015-3-10,2018-3-9
93,Myanmar  ruby interprise,Private,Oo Si (3/14)(18.12.14),10.3.2015,9.3.2018,Gem,1,Madalay Division,Kyauk Pya That(Pha Hta-47),10,3,2015,9,3,2018,Kyauk Pya That,Pha Hta-47,2015-3-10,2018-3-9
94,Myanmar  ruby interprise,Private,Oo Si (3/14)(18.12.14),10.3.2015,9.3.2018,Gem,1,Madalay Division,Kyauk Pya That(Pha Hta-48),10,3,2015,9,3,2018,Kyauk Pya That,Pha Hta-48,2015-3-10,2018-3-9
95,Myanmar  ruby interprise,Private,Oo Si (3/14)(18.12.14),10.3.2015,9.3.2018,Gem,1,Madalay Division,Kyauk Pya That(Pha Hta-49),10,3,2015,9,3,2018,Kyauk Pya That,Pha Hta-49,2015-3-10,2018-3-9
96,Myanmar  ruby interprise,Private,Oo Si (3/14)(18.12.14),10.3.2015,9.3.2018,Gem,1,Madalay Division,Kyauk Pya That(Pha Hta-50),10,3,2015,9,3,2018,Kyauk Pya That,Pha Hta-50,2015-3-10,2018-3-9
97,Myanmar  ruby interprise,Private,Oo Si (3/14)(18.12.14),21.1.2015,20.1.2018,Gem,1,Madalay Division,Pyaung Pyin Sinn They Chak(11),21,1,2015,20,1,2018,Pyaung Pyin Sinn They Chak,11,2015-1-21,2018-1-20
98,Myanmar  ruby interprise,Private,Oo Si (3/14)(18.12.14),21.1.2015,20.1.2018,Gem,1,Madalay Division,Pyaung Pyin Sinn They Chak(12),21,1,2015,20,1,2018,Pyaung Pyin Sinn They Chak,12,2015-1-21,2018-1-20
99,Myanmar  ruby interprise,Private,Oo Si (3/14)(18.12.14),21.1.2015,20.1.2018,Gem,1,Madalay Division,Pyaung Pyin Sinn They Chak(13),21,1,2015,20,1,2018,Pyaung Pyin Sinn They Chak,13,2015-1-21,2018-1-20
100,Myanmar  ruby interprise,Private,Oo Si (3/14)(18.12.14),21.1.2015,20.1.2018,Gem,1,Madalay Division,Pyaung Pyin Sinn They Chak(17),21,1,2015,20,1,2018,Pyaung Pyin Sinn They Chak,17,2015-1-21,2018-1-20
101,Myanmar  ruby interprise,Private,Oo Si (3/14)(18.12.14),21.1.2015,20.1.2018,Gem,1,Madalay Division,Pyaung Pyin Sinn They Chak(18),21,1,2015,20,1,2018,Pyaung Pyin Sinn They Chak,18,2015-1-21,2018-1-20
102,Myanmar  ruby interprise,Private,Oo Si (3/14)(18.12.14),21.1.2015,20.1.2018,Gem,1,Madalay Division,Pyaung Pyin Sinn They Chak(19),21,1,2015,20,1,2018,Pyaung Pyin Sinn They Chak,19,2015-1-21,2018-1-20
103,Myanmar  ruby interprise,Private,Oo Si (3/14)(18.12.14),21.1.2015,20.1.2018,Gem,1,Madalay Division,Pyaung Pyin Sinn They Chak(20),21,1,2015,20,1,2018,Pyaung Pyin Sinn They Chak,20,2015-1-21,2018-1-20
104,Myanmar  ruby interprise,Private,Oo Si (3/14)(18.12.14),21.1.2015,20.1.2018,Gem,1,Madalay Division,Pyaung Pyin Sinn They Chak(21),21,1,2015,20,1,2018,Pyaung Pyin Sinn They Chak,21,2015-1-21,2018-1-20
105,Myanmar  ruby interprise,Private,Oo Si (3/14)(18.12.14),21.1.2015,20.1.2018,Gem,1,Madalay Division,Pyaung Pyin Sinn They Chak(22),21,1,2015,20,1,2018,Pyaung Pyin Sinn They Chak,22,2015-1-21,2018-1-20
106,Myanmar  ruby interprise,Private,Oo Si (1/15)(26.3.15),21.5.2015,20.5.2018,Gem,1,Madalay Division,Pan Lin Inn Chouk(42),21,5,2015,20,5,2018,Pan Lin Inn Chouk,42,2015-5-21,2018-5-20
107,Myanmar  ruby interprise,Private,Oo Si (1/15)(26.3.15),21.5.2015,20.5.2018,Gem,1,Madalay Division,Pan Lin Inn Chouk(44),21,5,2015,20,5,2018,Pan Lin Inn Chouk,44,2015-5-21,2018-5-20
108,Myanmar  ruby interprise,Private,Oo Si (1/15)(26.3.15),29.4.2015,28.4.2018,Gem,1,Madalay Division,Pan Lin Inn Chouk(133),29,4,2015,28,4,2018,Pan Lin Inn Chouk,133,2015-4-29,2018-4-28
109,Myanmar  ruby interprise,Private,Oo Si (1/15)(26.3.15),29.4.2015,28.4.2018,Gem,1,Madalay Division,Pan Lin Inn Chouk(134),29,4,2015,28,4,2018,Pan Lin Inn Chouk,134,2015-4-29,2018-4-28
110,Myanmar  ruby interprise,Private,Oo Si (1/15)(26.3.15),29.4.2015,28.4.2018,Gem,1,Madalay Division,Pan Lin Inn Chouk(135),29,4,2015,28,4,2018,Pan Lin Inn Chouk,135,2015-4-29,2018-4-28
111,Myanmar  ruby interprise,Private,Oo Si (1/15)(26.3.15),29.4.2015,28.4.2018,Gem,1,Madalay Division,Pan Lin Inn Chouk(146),29,4,2015,28,4,2018,Pan Lin Inn Chouk,146,2015-4-29,2018-4-28
112,Myanmar  ruby interprise,Private,Oo Si (1/15)(26.3.15),29.4.2015,28.4.2018,Gem,1,Madalay Division,Pan Lin Inn Chouk(153),29,4,2015,28,4,2018,Pan Lin Inn Chouk,153,2015-4-29,2018-4-28
113,Myanmar  ruby interprise,Private,Oo Si (2/15)(5.6.15),7.7.2015,6.7.2018,Gem,1,Madalay Division,Kyauk Pya That Ka Day Ka Dar(Pha Hta Sa-27),7,7,2015,6,7,2018,Kyauk Pya That Ka Day Ka Dar,Pha Hta Sa-27,2015-7-7,2018-7-6
114,Myanmar  ruby interprise,Private,Oo Si (2/15)(5.6.15),7.7.2015,6.7.2018,Gem,1,Madalay Division,Kyauk Pya That Ka Day Ka Dar(Pha Hta Sa-33),7,7,2015,6,7,2018,Kyauk Pya That Ka Day Ka Dar,Pha Hta Sa-33,2015-7-7,2018-7-6
115,Myanmar  ruby interprise,Private,Oo Si (2/15)(5.6.15),7.7.2015,6.7.2018,Gem,1,Madalay Division,Kyauk Pya That Ka Day Ka Dar(Pha Hta Sa-35),7,7,2015,6,7,2018,Kyauk Pya That Ka Day Ka Dar,Pha Hta Sa-35,2015-7-7,2018-7-6
116,Myanmar  ruby interprise,Private,Oo Si (2/15)(5.6.15),7.7.2015,6.7.2018,Gem,1,Madalay Division,Kyauk Pya That Ka Day Ka Dar(Pha Hta Sa-36),7,7,2015,6,7,2018,Kyauk Pya That Ka Day Ka Dar,Pha Hta Sa-36,2015-7-7,2018-7-6
117,Myanmar  ruby interprise,Private,Oo Si (2/15)(5.6.15),7.7.2015,6.7.2018,Gem,1,Madalay Division,Kyauk Pya That Pha Lan Pin Nguk(Pha Hta Ta-20),7,7,2015,6,7,2018,Kyauk Pya That Pha Lan Pin Nguk,Pha Hta Ta-20,2015-7-7,2018-7-6
118,Myanmar  ruby interprise,Private,Oo Si (2/15)(5.6.15),18.8.2015,17.8.2018,Gem,1,Madalay Division,Pan Show(Pha Hta-1 A),18,8,2015,17,8,2018,Pan Show,Pha Hta-1 A,2015-8-18,2018-8-17
119,Myanmar  ruby interprise,Private,Oo Si (2/15)(5.6.15),18.8.2015,17.8.2018,Gem,1,Madalay Division,Pan Show(Pha Hta-1 B),18,8,2015,17,8,2018,Pan Show,Pha Hta-1 B,2015-8-18,2018-8-17
120,Myanmar  ruby interprise,Private,Oo Si (2/15)(5.6.15),18.8.2015,17.8.2018,Gem,1,Madalay Division,Pan Show(Pha Hta-1 C),18,8,2015,17,8,2018,Pan Show,Pha Hta-1 C,2015-8-18,2018-8-17
121,Myanmar  ruby interprise,Private,Oo Si (2/15)(5.6.15),18.8.2015,17.8.2018,Gem,1,Madalay Division,Pan Show(Pha Hta-1 D),18,8,2015,17,8,2018,Pan Show,Pha Hta-1 D,2015-8-18,2018-8-17
122,Myanmar  ruby interprise,Private,Oo Si (2/15)(5.6.15),18.8.2015,17.8.2018,Gem,1,Madalay Division,Pan Show(Pha Hta-1 E),18,8,2015,17,8,2018,Pan Show,Pha Hta-1 E,2015-8-18,2018-8-17
123,Myanmar  ruby interprise,Private,Oo Si (2/15)(5.6.15),18.8.2015,17.8.2018,Gem,1,Madalay Division,Pan Show(Pha Hta-1 F),18,8,2015,17,8,2018,Pan Show,Pha Hta-1 F,2015-8-18,2018-8-17
124,Myanmar  ruby interprise,Private,Oo Si (2/15)(5.6.15),18.8.2015,17.8.2018,Gem,1,Madalay Division,Pan Show(Pha Hta-1 G),18,8,2015,17,8,2018,Pan Show,Pha Hta-1 G,2015-8-18,2018-8-17
125,Myanmar  ruby interprise,Private,Oo Si (2/15)(5.6.15),18.8.2015,17.8.2018,Gem,1,Madalay Division,Pan Show(Pha Hta-1 H),18,8,2015,17,8,2018,Pan Show,Pha Hta-1 H,2015-8-18,2018-8-17
126,Myanmar  ruby interprise,Private,Oo Si (2/15)(5.6.15),7.7.2015,6.7.2018,Gem,1,Madalay Division,Pan Lin Pyaung Gaung(Pha Hta Sa-2),7,7,2015,6,7,2018,Pan Lin Pyaung Gaung,Pha Hta Sa-2,2015-7-7,2018-7-6
127,Myanmar  ruby interprise,Private,Oo Si (2/15)(5.6.15),7.7.2015,6.7.2018,Gem,1,Madalay Division,Pan Lin Pyaung Gaung(Pha Hta Sa-3),7,7,2015,6,7,2018,Pan Lin Pyaung Gaung,Pha Hta Sa-3,2015-7-7,2018-7-6
128,Myanmar  ruby interprise,Private,Oo Si (2/15)(5.6.15),7.7.2015,6.7.2018,Gem,1,Madalay Division,Pan Lin Pyaung Gaung(Pha Hta Sa-4),7,7,2015,6,7,2018,Pan Lin Pyaung Gaung,Pha Hta Sa-4,2015-7-7,2018-7-6
129,Myanmar  ruby interprise,Private,Oo Si (2/15)(5.6.15),7.7.2015,6.7.2018,Gem,1,Madalay Division,Shwe Taing Shwe Guu(Pha Hta Sa-5),7,7,2015,6,7,2018,Shwe Taing Shwe Guu,Pha Hta Sa-5,2015-7-7,2018-7-6
130,Myanmar  ruby interprise,Private,Oo Si (2/15)(5.6.15),7.7.2015,6.7.2018,Gem,1,Madalay Division,Shwe Taing Shwe Guu(Pha Hta Sa-6),7,7,2015,6,7,2018,Shwe Taing Shwe Guu,Pha Hta Sa-6,2015-7-7,2018-7-6
131,Myanmar  ruby interprise,Private,Oo Si (2/15)(5.6.15),23.8.2015,22.8.2018,Gem,1,Madalay Division,Lin Yaung Chi(Pha Hta-1 A),23,8,2015,22,8,2018,Lin Yaung Chi,Pha Hta-1 A,2015-8-23,2018-8-22
132,Myanmar  ruby interprise,Private,Oo Si (2/15)(5.6.15),23.8.2015,22.8.2018,Gem,1,Madalay Division,Lin Yaung Chi(Pha Hta-1 B),23,8,2015,22,8,2018,Lin Yaung Chi,Pha Hta-1 B,2015-8-23,2018-8-22
133,Myanmar  ruby interprise,Private,Oo Si (2/15)(5.6.15),23.8.2015,22.8.2018,Gem,1,Madalay Division,Lin Yaung Chi(Pha Hta-1 C),23,8,2015,22,8,2018,Lin Yaung Chi,Pha Hta-1 C,2015-8-23,2018-8-22
134,Myanmar  ruby interprise,Private,Oo Si (2/15)(5.6.15),23.8.2015,22.8.2018,Gem,1,Madalay Division,Lin Yaung Chi(Pha Hta-1 D),23,8,2015,22,8,2018,Lin Yaung Chi,Pha Hta-1 D,2015-8-23,2018-8-22
135,Myanmar  ruby interprise,Private,Oo Si (2/15)(5.6.15),23.8.2015,22.8.2018,Gem,1,Madalay Division,Lin Yaung Chi(Pha Hta-1 E),23,8,2015,22,8,2018,Lin Yaung Chi,Pha Hta-1 E,2015-8-23,2018-8-22
136,Myanmar  ruby interprise,Private,Oo Si (2/15)(5.6.15),23.8.2015,22.8.2018,Gem,1,Madalay Division,Lin Yaung Chi(Pha Hta-1 F),23,8,2015,22,8,2018,Lin Yaung Chi,Pha Hta-1 F,2015-8-23,2018-8-22
137,Myanmar  ruby interprise,Private,Oo Si (2/15)(5.6.15),23.8.2015,22.8.2018,Gem,1,Madalay Division,Lin Yaung Chi(Pha Hta-1 G),23,8,2015,22,8,2018,Lin Yaung Chi,Pha Hta-1 G,2015-8-23,2018-8-22
138,Myanmar  ruby interprise,Private,Oo Si (2/15)(5.6.15),23.8.2015,22.8.2018,Gem,1,Madalay Division,Lin Yaung Chi(Pha Hta-1 H),23,8,2015,22,8,2018,Lin Yaung Chi,Pha Hta-1 H,2015-8-23,2018-8-22
139,Myanmar  ruby interprise,Private,Oo Si (2/15)(5.6.15),23.8.2015,22.8.2018,Gem,1,Madalay Division,Lin Yaung Chi(Pha Hta-1 I),23,8,2015,22,8,2018,Lin Yaung Chi,Pha Hta-1 I,2015-8-23,2018-8-22
140,Myanmar  ruby interprise,Private,Oo Si (2/15)(5.6.15),23.8.2015,22.8.2018,Gem,1,Madalay Division,Lin Yaung Chi(Pha Hta-1 J),23,8,2015,22,8,2018,Lin Yaung Chi,Pha Hta-1 J,2015-8-23,2018-8-22
141,Myanmar  ruby interprise,Private,Oo Si (2/15)(5.6.15),23.8.2015,22.8.2018,Gem,1,Madalay Division,Lin Yaung Chi(Pha Hta-1 K),23,8,2015,22,8,2018,Lin Yaung Chi,Pha Hta-1 K,2015-8-23,2018-8-22
142,Myanmar  ruby interprise,Private,Kyie Kyat(4/12)(1.6.12),21.3.2013,20.3.2016,Gem,1,Shan State,Lwai Saung htauk(Ta-79),21,3,2013,20,3,2016,Lwai Saung htauk,Ta-79,2013-3-21,2016-3-20
143,Myanmar  ruby interprise,Private,Kyie Kyat(4/12)(1.6.12),21.3.2013,20.3.2016,Gem,1,Shan State,Lwai Saung htauk(Ta-80),21,3,2013,20,3,2016,Lwai Saung htauk,Ta-80,2013-3-21,2016-3-20
144,Myanmar  ruby interprise,Private,Kyie Kyat(4/12)(1.6.12),21.3.2013,20.3.2016,Gem,1,Shan State,Lwai Saung htauk(Ta-81),21,3,2013,20,3,2016,Lwai Saung htauk,Ta-81,2013-3-21,2016-3-20
145,Myanmar  ruby interprise,Private,Oo Si (2/13)(18.1.13),8.7.2012,7.7.2015,Gem,1,Shan State,Lwai Saung htauk(Pha La-245),8,7,2012,7,7,2015,Lwai Saung htauk,Pha La-245,2012-7-8,2015-7-7
146,Myanmar  ruby interprise,Private,Oo Si (2/13)(18.1.13),8.7.2012,7.7.2015,Gem,1,Shan State,Lwai Saung htauk(Pha La-246),8,7,2012,7,7,2015,Lwai Saung htauk,Pha La-246,2012-7-8,2015-7-7
147,Myanmar  ruby interprise,Private,Oo Si (2/13)(18.1.13),8.7.2012,7.7.2015,Gem,1,Shan State,Lwai Saung htauk(Pha La-247),8,7,2012,7,7,2015,Lwai Saung htauk,Pha La-247,2012-7-8,2015-7-7
148,Myanmar  ruby interprise,Private,Oo Si (2/13)(18.1.13),8.7.2012,7.7.2015,Gem,1,Shan State,Lwai Saung htauk(Pha La-248),8,7,2012,7,7,2015,Lwai Saung htauk,Pha La-248,2012-7-8,2015-7-7
149,Myanmar  ruby interprise,Private,Oo Si (2/13)(18.1.13),3.9.2012,2.9.2015,Gem,1,Shan State,Lwai Saung htauk(Pha La-361),3,9,2012,2,9,2015,Lwai Saung htauk,Pha La-361,2012-9-3,2015-9-2
150,Myanmar  ruby interprise,Private,Oo Si (2/13)(18.1.13),3.9.2012,2.9.2015,Gem,1,Shan State,Lwai Saung htauk(Pha La-362),3,9,2012,2,9,2015,Lwai Saung htauk,Pha La-362,2012-9-3,2015-9-2
151,Myanmar  ruby interprise,Private,Oo Si (1/14)(10.6.14),14.7.2014,13.7.2017,Gem,1,Shan State,Lwai Saung htauk(Ta-39),14,7,2014,13,7,2017,Lwai Saung htauk,Ta-39,2014-7-14,2017-7-13
152,Myanmar  ruby interprise,Private,Oo Si (1/14)(10.6.14),14.7.2014,13.7.2017,Gem,1,Shan State,Lwai Saung htauk(Ta-40),14,7,2014,13,7,2017,Lwai Saung htauk,Ta-40,2014-7-14,2017-7-13
153,Myanmar  ruby interprise,Private,Oo Si (1/14)(10.6.14),14.7.2014,13.7.2017,Gem,1,Shan State,Lwai Saung htauk(Ta-41),14,7,2014,13,7,2017,Lwai Saung htauk,Ta-41,2014-7-14,2017-7-13
154,Myanmar  ruby interprise,Private,Oo Si (1/14)(10.6.14),14.7.2014,13.7.2017,Gem,1,Shan State,Lwai Saung htauk(Ta-42),14,7,2014,13,7,2017,Lwai Saung htauk,Ta-42,2014-7-14,2017-7-13
155,Myanmar  ruby interprise,Private,Oo Si (1/14)(10.6.14),14.7.2014,13.7.2017,Gem,1,Shan State,Lwai Saung htauk(Ta-43),14,7,2014,13,7,2017,Lwai Saung htauk,Ta-43,2014-7-14,2017-7-13
156,Myanmar  ruby interprise,Private,Oo Si (1/14)(10.6.14),14.7.2014,13.7.2017,Gem,1,Shan State,Lwai Saung htauk(Ta-44),14,7,2014,13,7,2017,Lwai Saung htauk,Ta-44,2014-7-14,2017-7-13
157,Myanmar  ruby interprise,Private,Oo Si (1/14)(10.6.14),14.7.2014,13.7.2017,Gem,1,Shan State,Lwai Saung htauk(Ta-45),14,7,2014,13,7,2017,Lwai Saung htauk,Ta-45,2014-7-14,2017-7-13
158,Myanmar  ruby interprise,Private,Oo Si (1/14)(10.6.14),14.7.2014,13.7.2017,Gem,1,Shan State,Lwai Saung htauk(Ta-46),14,7,2014,13,7,2017,Lwai Saung htauk,Ta-46,2014-7-14,2017-7-13
159,Myanmar  ruby interprise,Private,Oo Si (1/14)(10.6.14),14.7.2014,13.7.2017,Gem,1,Shan State,Lwai Saung htauk(Ta-47),14,7,2014,13,7,2017,Lwai Saung htauk,Ta-47,2014-7-14,2017-7-13
160,Myanmar  ruby interprise,Private,Oo Si (1/14)(10.6.14),14.7.2014,13.7.2017,Gem,1,Shan State,Lwai Saung htauk(Ta-48),14,7,2014,13,7,2017,Lwai Saung htauk,Ta-48,2014-7-14,2017-7-13
161,Myanmar  ruby interprise,Private,Oo Si (1/14)(10.6.14),14.7.2014,13.7.2017,Gem,1,Shan State,Lwai Saung htauk(Ta-49),14,7,2014,13,7,2017,Lwai Saung htauk,Ta-49,2014-7-14,2017-7-13
162,Myanmar  ruby interprise,Private,Oo Si (1/14)(10.6.14),14.7.2014,13.7.2017,Gem,1,Shan State,Lwai Saung htauk(Ta-50),14,7,2014,13,7,2017,Lwai Saung htauk,Ta-50,2014-7-14,2017-7-13
163,Myanmar  ruby interprise,Private,Oo Si (1/14)(10.6.14),14.7.2014,13.7.2017,Gem,1,Shan State,Lwai Saung htauk(Ta-51),14,7,2014,13,7,2017,Lwai Saung htauk,Ta-51,2014-7-14,2017-7-13
164,Myanmar  ruby interprise,Private,Oo Si (1/14)(10.6.14),12.7.2014,11.7.2017,Gem,1,Shan State,Lwai Saung htauk(Pha La-15),12,7,2014,11,7,2017,Lwai Saung htauk,Pha La-15,2014-7-12,2017-7-11
165,Myanmar  ruby interprise,Private,Oo Si (1/14)(10.6.14),12.7.2014,11.7.2017,Gem,1,Shan State,Lwai Saung htauk(Pha La-16),12,7,2014,11,7,2017,Lwai Saung htauk,Pha La-16,2014-7-12,2017-7-11
166,Myanmar  ruby interprise,Private,Oo Si (1/14)(10.6.14),12.7.2014,11.7.2017,Gem,1,Shan State,Lwai Saung htauk(Pha La-19),12,7,2014,11,7,2017,Lwai Saung htauk,Pha La-19,2014-7-12,2017-7-11
167,Myanmar  ruby interprise,Private,Oo Si (1/14)(10.6.14),12.7.2014,11.7.2017,Gem,1,Shan State,Lwai Saung htauk(Pha La-23),12,7,2014,11,7,2017,Lwai Saung htauk,Pha La-23,2014-7-12,2017-7-11
168,Myanmar  ruby interprise,Private,Oo Si (1/14)(10.6.14),12.7.2014,11.7.2017,Gem,1,Shan State,Lwai Saung htauk(Pha La-24),12,7,2014,11,7,2017,Lwai Saung htauk,Pha La-24,2014-7-12,2017-7-11
169,Myanmar  ruby interprise,Private,Oo Si (1/14)(10.6.14),14.7.2014,13.7.2017,Gem,1,Shan State,Lwai Saung htauk(Ta-62),14,7,2014,13,7,2017,Lwai Saung htauk,Ta-62,2014-7-14,2017-7-13
170,Myanmar  ruby interprise,Private,Oo Si (1/14)(10.6.14),14.7.2014,13.7.2017,Gem,1,Shan State,Lwai Saung htauk(Ta-66),14,7,2014,13,7,2017,Lwai Saung htauk,Ta-66,2014-7-14,2017-7-13
171,Myanmar  ruby interprise,Private,Oo Si (1/14)(10.6.14),12.7.2014,11.7.2017,Gem,1,Shan State,Sai Hlan(Sha-74),12,7,2014,11,7,2017,Sai Hlan,Sha-74,2014-7-12,2017-7-11
172,Myanmar  ruby interprise,Private,Oo Si (2/14)(30.10.14),4.11.2014,3.11.2017,Gem,1,Shan State,Lwai Saung htauk(Pha La-14),4,11,2014,3,11,2017,Lwai Saung htauk,Pha La-14,2014-11-4,2017-11-3
173,Myanmar  ruby interprise,Private,Oo Si (2/14)(30.10.14),4.11.2014,3.11.2017,Gem,1,Shan State,Lwai Saung htauk(Pha La-18),4,11,2014,3,11,2017,Lwai Saung htauk,Pha La-18,2014-11-4,2017-11-3
174,Myanmar  ruby interprise,Private,Oo Si (2/14)(30.10.14),4.11.2014,3.11.2017,Gem,1,Shan State,Lwai Saung htauk(Pha La-20),4,11,2014,3,11,2017,Lwai Saung htauk,Pha La-20,2014-11-4,2017-11-3
175,Myanmar  ruby interprise,Private,Oo Si (2/14)(30.10.14),4.11.2014,3.11.2017,Gem,1,Shan State,Lwai Saung htauk(Pha La-157),4,11,2014,3,11,2017,Lwai Saung htauk,Pha La-157,2014-11-4,2017-11-3
176,Myanmar  ruby interprise,Private,Oo Si (2/14)(30.10.14),4.11.2014,3.11.2017,Gem,1,Shan State,Lwai Saung htauk(Pha La-158),4,11,2014,3,11,2017,Lwai Saung htauk,Pha La-158,2014-11-4,2017-11-3
177,Myanmar  ruby interprise,Private,Oo Si (2/14)(30.10.14),4.11.2014,3.11.2017,Gem,1,Shan State,Lwai Saung htauk(Pha La-159),4,11,2014,3,11,2017,Lwai Saung htauk,Pha La-159,2014-11-4,2017-11-3
178,Myanmar  ruby interprise,Private,Oo Si (2/14)(30.10.14),4.11.2014,3.11.2017,Gem,1,Shan State,Lwai Saung htauk(Pha La-160),4,11,2014,3,11,2017,Lwai Saung htauk,Pha La-160,2014-11-4,2017-11-3
179,Myanmar  ruby interprise,Private,Oo Si (2/14)(30.10.14),23.11.2014,22.11.2017,Gem,1,Shan State,Lwai Saung htauk(Pha La-244),23,11,2014,22,11,2017,Lwai Saung htauk,Pha La-244,2014-11-23,2017-11-22
180,Myanmar  ruby interprise,Private,Oo Si (2/14)(30.10.14),8.11.2014,7.11.2017,Gem,1,Shan State,Lwai Saung htauk(Pha La-252),8,11,2014,7,11,2017,Lwai Saung htauk,Pha La-252,2014-11-8,2017-11-7
181,Myanmar  ruby interprise,Private,Oo Si (2/14)(30.10.14),8.11.2014,7.11.2017,Gem,1,Shan State,Lwai Saung htauk(Pha La-259),8,11,2014,7,11,2017,Lwai Saung htauk,Pha La-259,2014-11-8,2017-11-7
182,Myanmar  ruby interprise,Private,Oo Si (2/14)(30.10.14),8.11.2014,7.11.2017,Gem,1,Shan State,Lwai Saung htauk(Pha La-260),8,11,2014,7,11,2017,Lwai Saung htauk,Pha La-260,2014-11-8,2017-11-7
183,Myanmar  ruby interprise,Private,Oo Si (2/14)(30.10.14),8.11.2014,7.11.2017,Gem,1,Shan State,Lwai Saung htauk(Pha La-262),8,11,2014,7,11,2017,Lwai Saung htauk,Pha La-262,2014-11-8,2017-11-7
184,Myanmar  ruby interprise,Private,Oo Si (2/14)(30.10.14),18.11.2014,17.11.2017,Gem,1,Shan State,Lwai Saung htauk(Ta-55),18,11,2014,17,11,2017,Lwai Saung htauk,Ta-55,2014-11-18,2017-11-17
1,Myanmar  imperial jade,Private,Oo Si(3/10)(28.9.10),27.10.2010,26.1.2016,Jade,1,Kachin State,Taw Mhaw(104),27,10,2010,26,1,2016,Taw Mhaw,104,2010-10-27,2016-1-26
2,Myanmar  imperial jade,Private,Oo Si(3/10)(28.9.10),27.10.2010,26.1.2016,Jade,1,Kachin State,Taw Mhaw(105),27,10,2010,26,1,2016,Taw Mhaw,105,2010-10-27,2016-1-26
3,Myanmar  imperial jade,Private,Oo Si(3/10)(28.9.10),27.10.2010,26.1.2016,Jade,1,Kachin State,Taw Mhaw(106),27,10,2010,26,1,2016,Taw Mhaw,106,2010-10-27,2016-1-26
4,Myanmar  imperial jade,Private,Oo Si(3/10)(28.9.10),27.10.2010,26.1.2016,Jade,1,Kachin State,Taw Mhaw(107),27,10,2010,26,1,2016,Taw Mhaw,107,2010-10-27,2016-1-26
5,Myanmar  imperial jade,Private,Oo Si(3/10)(28.9.10),27.10.2010,26.1.2016,Jade,1,Kachin State,Taw Mhaw(108),27,10,2010,26,1,2016,Taw Mhaw,108,2010-10-27,2016-1-26
6,Myanmar  imperial jade,Private,Oo Si(3/10)(28.9.10),27.10.2010,26.1.2016,Jade,1,Kachin State,Taw Mhaw(109),27,10,2010,26,1,2016,Taw Mhaw,109,2010-10-27,2016-1-26
7,Myanmar  imperial jade,Private,Oo Si(3/10)(28.9.10),27.10.2010,26.1.2016,Jade,1,Kachin State,Taw Mhaw(110),27,10,2010,26,1,2016,Taw Mhaw,110,2010-10-27,2016-1-26
8,Myanmar  imperial jade,Private,Oo Si(3/10)(28.9.10),27.10.2010,26.1.2016,Jade,1,Kachin State,Taw Mhaw(111),27,10,2010,26,1,2016,Taw Mhaw,111,2010-10-27,2016-1-26
9,Myanmar  imperial jade,Private,Oo Si(3/10)(28.9.10),27.10.2010,26.1.2016,Jade,1,Kachin State,Taw Mhaw(112),27,10,2010,26,1,2016,Taw Mhaw,112,2010-10-27,2016-1-26
10,Myanmar  imperial jade,Private,Oo Si(3/10)(28.9.10),27.10.2010,26.1.2016,Jade,1,Kachin State,Taw Mhaw(113),27,10,2010,26,1,2016,Taw Mhaw,113,2010-10-27,2016-1-26
11,Myanmar  imperial jade,Private,Oo Si(3/10)(28.9.10),27.10.2010,26.1.2016,Jade,1,Kachin State,Taw Mhaw(114),27,10,2010,26,1,2016,Taw Mhaw,114,2010-10-27,2016-1-26
12,Myanmar  imperial jade,Private,Oo Si(3/10)(28.9.10),27.10.2010,26.1.2016,Jade,1,Kachin State,Taw Mhaw(115),27,10,2010,26,1,2016,Taw Mhaw,115,2010-10-27,2016-1-26
13,Myanmar  imperial jade,Private,Oo Si(3/10)(28.9.10),27.10.2010,26.1.2016,Jade,1,Kachin State,Taw Mhaw(116),27,10,2010,26,1,2016,Taw Mhaw,116,2010-10-27,2016-1-26
14,Myanmar  imperial jade,Private,Oo Si(3/10)(28.9.10),27.10.2010,26.1.2016,Jade,1,Kachin State,Taw Mhaw(117),27,10,2010,26,1,2016,Taw Mhaw,117,2010-10-27,2016-1-26
15,Myanmar  imperial jade,Private,Oo Si(3/10)(28.9.10),27.10.2010,26.1.2016,Jade,1,Kachin State,Taw Mhaw(118),27,10,2010,26,1,2016,Taw Mhaw,118,2010-10-27,2016-1-26
16,Myanmar  imperial jade,Private,Oo Si(3/10)(28.9.10),27.10.2010,26.1.2016,Jade,1,Kachin State,Taw Mhaw(119),27,10,2010,26,1,2016,Taw Mhaw,119,2010-10-27,2016-1-26
17,Myanmar  imperial jade,Private,Oo Si(3/10)(28.9.10),27.10.2010,26.1.2016,Jade,1,Kachin State,Taw Mhaw(120),27,10,2010,26,1,2016,Taw Mhaw,120,2010-10-27,2016-1-26
18,Myanmar  imperial jade,Private,Oo Si(3/10)(28.9.10),27.10.2010,26.1.2016,Jade,1,Kachin State,Taw Mhaw(121),27,10,2010,26,1,2016,Taw Mhaw,121,2010-10-27,2016-1-26
19,Myanmar  imperial jade,Private,Oo Si(3/10)(28.9.10),27.10.2010,26.1.2016,Jade,1,Kachin State,Taw Mhaw(122),27,10,2010,26,1,2016,Taw Mhaw,122,2010-10-27,2016-1-26
20,Myanmar  imperial jade,Private,Oo Si(3/10)(28.9.10),27.10.2010,26.1.2016,Jade,1,Kachin State,Taw Mhaw(123),27,10,2010,26,1,2016,Taw Mhaw,123,2010-10-27,2016-1-26
21,Myanmar  imperial jade,Private,Oo Si(3/10)(28.9.10),27.10.2010,26.1.2016,Jade,1,Kachin State,Taw Mhaw(124),27,10,2010,26,1,2016,Taw Mhaw,124,2010-10-27,2016-1-26
22,Myanmar  imperial jade,Private,Oo Si(3/10)(28.9.10),27.10.2010,26.1.2016,Jade,1,Kachin State,Taw Mhaw(125),27,10,2010,26,1,2016,Taw Mhaw,125,2010-10-27,2016-1-26
23,Myanmar  imperial jade,Private,Oo Si(3/10)(28.9.10),27.10.2010,26.1.2016,Jade,1,Kachin State,Taw Mhaw(126),27,10,2010,26,1,2016,Taw Mhaw,126,2010-10-27,2016-1-26
24,Myanmar  imperial jade,Private,Oo Si(3/10)(28.9.10),27.10.2010,26.1.2016,Jade,1,Kachin State,Taw Mhaw(127),27,10,2010,26,1,2016,Taw Mhaw,127,2010-10-27,2016-1-26
25,Myanmar  imperial jade,Private,Oo Si(3/10)(28.9.10),27.10.2010,26.1.2016,Jade,1,Kachin State,Taw Mhaw(128),27,10,2010,26,1,2016,Taw Mhaw,128,2010-10-27,2016-1-26
26,Myanmar  imperial jade,Private,Oo Si(3/10)(28.9.10),27.10.2010,26.1.2016,Jade,1,Kachin State,Taw Mhaw(129),27,10,2010,26,1,2016,Taw Mhaw,129,2010-10-27,2016-1-26
27,Myanmar  imperial jade,Private,Oo Si(3/10)(28.9.10),27.10.2010,26.1.2016,Jade,1,Kachin State,Taw Mhaw(130),27,10,2010,26,1,2016,Taw Mhaw,130,2010-10-27,2016-1-26
28,Myanmar  imperial jade,Private,Oo Si(3/10)(28.9.10),27.10.2010,26.1.2016,Jade,1,Kachin State,Taw Mhaw(131),27,10,2010,26,1,2016,Taw Mhaw,131,2010-10-27,2016-1-26
29,Myanmar  imperial jade,Private,Oo Si(3/10)(28.9.10),27.10.2010,26.1.2016,Jade,1,Kachin State,Taw Mhaw(132),27,10,2010,26,1,2016,Taw Mhaw,132,2010-10-27,2016-1-26
30,Myanmar  imperial jade,Private,Oo Si(3/10)(28.9.10),27.10.2010,26.1.2016,Jade,1,Kachin State,Taw Mhaw(133),27,10,2010,26,1,2016,Taw Mhaw,133,2010-10-27,2016-1-26
31,Myanmar  imperial jade,Private,Oo Si(3/10)(28.9.10),27.10.2010,26.1.2016,Jade,1,Kachin State,Taw Mhaw(134),27,10,2010,26,1,2016,Taw Mhaw,134,2010-10-27,2016-1-26
32,Myanmar  imperial jade,Private,Oo Si(3/10)(28.9.10),27.10.2010,26.1.2016,Jade,1,Kachin State,Taw Mhaw(135),27,10,2010,26,1,2016,Taw Mhaw,135,2010-10-27,2016-1-26
33,Myanmar  imperial jade,Private,Oo Si(3/10)(28.9.10),27.10.2010,26.1.2016,Jade,1,Kachin State,Taw Mhaw(136),27,10,2010,26,1,2016,Taw Mhaw,136,2010-10-27,2016-1-26
34,Myanmar  imperial jade,Private,Oo Si(3/10)(28.9.10),27.10.2010,26.1.2016,Jade,1,Kachin State,Taw Mhaw(137),27,10,2010,26,1,2016,Taw Mhaw,137,2010-10-27,2016-1-26
35,Myanmar  imperial jade,Private,Oo Si(3/10)(28.9.10),27.10.2010,26.1.2016,Jade,1,Kachin State,Taw Mhaw(138),27,10,2010,26,1,2016,Taw Mhaw,138,2010-10-27,2016-1-26
36,Myanmar  imperial jade,Private,Oo Si(3/10)(28.9.10),27.10.2010,26.1.2016,Jade,1,Kachin State,Taw Mhaw(139),27,10,2010,26,1,2016,Taw Mhaw,139,2010-10-27,2016-1-26
37,Myanmar  imperial jade,Private,Oo Si(3/10)(28.9.10),27.10.2010,26.1.2016,Jade,1,Kachin State,Taw Mhaw(140),27,10,2010,26,1,2016,Taw Mhaw,140,2010-10-27,2016-1-26
38,Myanmar  imperial jade,Private,Oo Si(3/10)(28.9.10),27.10.2010,26.1.2016,Jade,1,Kachin State,Taw Mhaw(141),27,10,2010,26,1,2016,Taw Mhaw,141,2010-10-27,2016-1-26
39,Myanmar  imperial jade,Private,Oo Si(3/10)(28.9.10),27.10.2010,26.1.2016,Jade,1,Kachin State,Taw Mhaw(142),27,10,2010,26,1,2016,Taw Mhaw,142,2010-10-27,2016-1-26
40,Myanmar  imperial jade,Private,Oo Si(3/10)(28.9.10),27.10.2010,26.1.2016,Jade,1,Kachin State,Taw Mhaw(143),27,10,2010,26,1,2016,Taw Mhaw,143,2010-10-27,2016-1-26
41,Myanmar  imperial jade,Private,Oo Si(3/10)(28.9.10),27.10.2010,26.1.2016,Jade,1,Kachin State,Taw Mhaw(144),27,10,2010,26,1,2016,Taw Mhaw,144,2010-10-27,2016-1-26
42,Myanmar  imperial jade,Private,Oo Si(3/10)(28.9.10),27.10.2010,26.1.2016,Jade,1,Kachin State,Taw Mhaw(145),27,10,2010,26,1,2016,Taw Mhaw,145,2010-10-27,2016-1-26
43,Myanmar  imperial jade,Private,Oo Si(3/10)(28.9.10),27.10.2010,26.1.2016,Jade,1,Kachin State,Taw Mhaw(146),27,10,2010,26,1,2016,Taw Mhaw,146,2010-10-27,2016-1-26
44,Myanmar  imperial jade,Private,Oo Si(3/10)(28.9.10),27.10.2010,26.1.2016,Jade,1,Kachin State,Taw Mhaw(147),27,10,2010,26,1,2016,Taw Mhaw,147,2010-10-27,2016-1-26
45,Myanmar  imperial jade,Private,Oo Si(3/10)(28.9.10),27.10.2010,26.1.2016,Jade,1,Kachin State,Taw Mhaw(148),27,10,2010,26,1,2016,Taw Mhaw,148,2010-10-27,2016-1-26
46,Myanmar  imperial jade,Private,Oo Si(3/10)(28.9.10),27.10.2010,26.1.2016,Jade,1,Kachin State,Taw Mhaw(149),27,10,2010,26,1,2016,Taw Mhaw,149,2010-10-27,2016-1-26
47,Myanmar  imperial jade,Private,Oo Si(3/10)(28.9.10),27.10.2010,26.1.2016,Jade,1,Kachin State,Taw Mhaw(150),27,10,2010,26,1,2016,Taw Mhaw,150,2010-10-27,2016-1-26
48,Myanmar  imperial jade,Private,Oo Si(3/10)(28.9.10),27.10.2010,26.1.2016,Jade,1,Kachin State,Taw Mhaw(151),27,10,2010,26,1,2016,Taw Mhaw,151,2010-10-27,2016-1-26
49,Myanmar  imperial jade,Private,Oo Si(3/10)(28.9.10),27.10.2010,26.1.2016,Jade,1,Kachin State,Taw Mhaw(152),27,10,2010,26,1,2016,Taw Mhaw,152,2010-10-27,2016-1-26
50,Myanmar  imperial jade,Private,Oo Si(3/10)(28.9.10),27.10.2010,26.1.2016,Jade,1,Kachin State,Taw Mhaw(153),27,10,2010,26,1,2016,Taw Mhaw,153,2010-10-27,2016-1-26
51,Myanmar  imperial jade,Private,Oo Si(3/10)(28.9.10),27.10.2010,26.1.2016,Jade,1,Kachin State,Taw Mhaw(154),27,10,2010,26,1,2016,Taw Mhaw,154,2010-10-27,2016-1-26
52,Myanmar  imperial jade,Private,Oo Si(3/10)(28.9.10),27.10.2010,26.1.2016,Jade,1,Kachin State,Taw Mhaw(155),27,10,2010,26,1,2016,Taw Mhaw,155,2010-10-27,2016-1-26
53,Myanmar  imperial jade,Private,Oo Si(3/10)(28.9.10),27.10.2010,26.1.2016,Jade,1,Kachin State,Taw Mhaw(156),27,10,2010,26,1,2016,Taw Mhaw,156,2010-10-27,2016-1-26
54,Myanmar  imperial jade,Private,Oo Si(3/10)(28.9.10),27.10.2010,26.1.2016,Jade,1,Kachin State,Taw Mhaw(157),27,10,2010,26,1,2016,Taw Mhaw,157,2010-10-27,2016-1-26
55,Myanmar  imperial jade,Private,Oo Si(3/10)(28.9.10),27.10.2010,26.1.2016,Jade,1,Kachin State,Taw Mhaw(158),27,10,2010,26,1,2016,Taw Mhaw,158,2010-10-27,2016-1-26
56,Myanmar  imperial jade,Private,Oo Si(3/10)(28.9.10),27.10.2010,26.1.2016,Jade,1,Kachin State,Taw Mhaw(159),27,10,2010,26,1,2016,Taw Mhaw,159,2010-10-27,2016-1-26
57,Myanmar  imperial jade,Private,Oo Si(3/10)(28.9.10),27.10.2010,26.1.2016,Jade,1,Kachin State,Taw Mhaw(160),27,10,2010,26,1,2016,Taw Mhaw,160,2010-10-27,2016-1-26
58,Myanmar  imperial jade,Private,Oo Si(3/10)(28.9.10),27.10.2010,26.1.2016,Jade,1,Kachin State,Taw Mhaw(161),27,10,2010,26,1,2016,Taw Mhaw,161,2010-10-27,2016-1-26
59,Myanmar  imperial jade,Private,Oo Si(3/10)(28.9.10),27.10.2010,26.1.2016,Jade,1,Kachin State,Taw Mhaw(162),27,10,2010,26,1,2016,Taw Mhaw,162,2010-10-27,2016-1-26
60,Myanmar  imperial jade,Private,Oo Si(3/10)(28.9.10),27.10.2010,26.1.2016,Jade,1,Kachin State,Taw Mhaw(163),27,10,2010,26,1,2016,Taw Mhaw,163,2010-10-27,2016-1-26
61,Myanmar  imperial jade,Private,Oo Si(3/10)(28.9.10),27.10.2010,26.1.2016,Jade,1,Kachin State,Taw Mhaw(164),27,10,2010,26,1,2016,Taw Mhaw,164,2010-10-27,2016-1-26
62,Myanmar  imperial jade,Private,Oo Si(3/10)(28.9.10),27.10.2010,26.1.2016,Jade,1,Kachin State,Taw Mhaw(165),27,10,2010,26,1,2016,Taw Mhaw,165,2010-10-27,2016-1-26
63,Myanmar  imperial jade,Private,Oo Si(3/10)(28.9.10),27.10.2010,26.1.2016,Jade,1,Kachin State,Taw Mhaw(166),27,10,2010,26,1,2016,Taw Mhaw,166,2010-10-27,2016-1-26
64,Myanmar  imperial jade,Private,Oo Si(3/10)(28.9.10),27.10.2010,26.1.2016,Jade,1,Kachin State,Taw Mhaw(167),27,10,2010,26,1,2016,Taw Mhaw,167,2010-10-27,2016-1-26
65,Myanmar  imperial jade,Private,Oo Si(3/10)(28.9.10),27.10.2010,26.1.2016,Jade,1,Kachin State,Taw Mhaw(168),27,10,2010,26,1,2016,Taw Mhaw,168,2010-10-27,2016-1-26
66,Myanmar  imperial jade,Private,Oo Si(3/10)(28.9.10),27.10.2010,26.1.2016,Jade,1,Kachin State,Taw Mhaw(169),27,10,2010,26,1,2016,Taw Mhaw,169,2010-10-27,2016-1-26
67,Myanmar  imperial jade,Private,Oo Si(3/10)(28.9.10),27.10.2010,26.1.2016,Jade,1,Kachin State,Taw Mhaw(170),27,10,2010,26,1,2016,Taw Mhaw,170,2010-10-27,2016-1-26
68,Myanmar  imperial jade,Private,Oo Si(3/10)(28.9.10),27.10.2010,26.1.2016,Jade,1,Kachin State,Taw Mhaw(171),27,10,2010,26,1,2016,Taw Mhaw,171,2010-10-27,2016-1-26
69,Myanmar  imperial jade,Private,Oo Si(3/10)(28.9.10),27.10.2010,26.1.2016,Jade,1,Kachin State,Taw Mhaw(172),27,10,2010,26,1,2016,Taw Mhaw,172,2010-10-27,2016-1-26
70,Myanmar  imperial jade,Private,Oo Si(3/10)(28.9.10),27.10.2010,26.1.2016,Jade,1,Kachin State,Taw Mhaw(173),27,10,2010,26,1,2016,Taw Mhaw,173,2010-10-27,2016-1-26
71,Myanmar  imperial jade,Private,Oo Si(3/10)(28.9.10),27.10.2010,26.1.2016,Jade,1,Kachin State,Taw Mhaw(174),27,10,2010,26,1,2016,Taw Mhaw,174,2010-10-27,2016-1-26
72,Myanmar  imperial jade,Private,Oo Si(3/10)(28.9.10),27.10.2010,26.1.2016,Jade,1,Kachin State,Taw Mhaw(175),27,10,2010,26,1,2016,Taw Mhaw,175,2010-10-27,2016-1-26
73,Myanmar  imperial jade,Private,Oo Si(3/10)(28.9.10),27.10.2010,26.1.2016,Jade,1,Kachin State,Taw Mhaw(176),27,10,2010,26,1,2016,Taw Mhaw,176,2010-10-27,2016-1-26
74,Myanmar  imperial jade,Private,Oo Si(3/10)(28.9.10),27.10.2010,26.1.2016,Jade,1,Kachin State,Taw Mhaw(177),27,10,2010,26,1,2016,Taw Mhaw,177,2010-10-27,2016-1-26
75,Myanmar  imperial jade,Private,Oo Si(3/10)(28.9.10),27.10.2010,26.1.2016,Jade,1,Kachin State,Taw Mhaw(178),27,10,2010,26,1,2016,Taw Mhaw,178,2010-10-27,2016-1-26
76,Myanmar  imperial jade,Private,Oo Si(3/10)(28.9.10),27.10.2010,26.1.2016,Jade,1,Kachin State,Taw Mhaw(179),27,10,2010,26,1,2016,Taw Mhaw,179,2010-10-27,2016-1-26
77,Myanmar  imperial jade,Private,Oo Si(3/10)(28.9.10),27.10.2010,26.1.2016,Jade,1,Kachin State,Taw Mhaw(180),27,10,2010,26,1,2016,Taw Mhaw,180,2010-10-27,2016-1-26
78,Myanmar  imperial jade,Private,Oo Si(3/10)(28.9.10),27.10.2010,26.1.2016,Jade,1,Kachin State,Taw Mhaw(181),27,10,2010,26,1,2016,Taw Mhaw,181,2010-10-27,2016-1-26
79,Myanmar  imperial jade,Private,Oo Si(3/10)(28.9.10),27.10.2010,26.1.2016,Jade,1,Kachin State,Taw Mhaw(182),27,10,2010,26,1,2016,Taw Mhaw,182,2010-10-27,2016-1-26
80,Myanmar  imperial jade,Private,Oo Si(3/10)(28.9.10),27.10.2010,26.1.2016,Jade,1,Kachin State,Taw Mhaw(183),27,10,2010,26,1,2016,Taw Mhaw,183,2010-10-27,2016-1-26
81,Myanmar  imperial jade,Private,Oo Si(3/10)(28.9.10),27.10.2010,26.1.2016,Jade,1,Kachin State,Taw Mhaw(184),27,10,2010,26,1,2016,Taw Mhaw,184,2010-10-27,2016-1-26
82,Myanmar  imperial jade,Private,Oo Si(3/10)(28.9.10),27.10.2010,26.1.2016,Jade,1,Kachin State,Taw Mhaw(185),27,10,2010,26,1,2016,Taw Mhaw,185,2010-10-27,2016-1-26
83,Myanmar  imperial jade,Private,Oo Si(3/10)(28.9.10),27.10.2010,26.1.2016,Jade,1,Kachin State,Taw Mhaw(186),27,10,2010,26,1,2016,Taw Mhaw,186,2010-10-27,2016-1-26
84,Myanmar  imperial jade,Private,Oo Si(3/10)(28.9.10),27.10.2010,26.1.2016,Jade,1,Kachin State,Taw Mhaw(187),27,10,2010,26,1,2016,Taw Mhaw,187,2010-10-27,2016-1-26
85,Myanmar  imperial jade,Private,Oo Si(3/10)(28.9.10),27.10.2010,26.1.2016,Jade,1,Kachin State,Taw Mhaw(188),27,10,2010,26,1,2016,Taw Mhaw,188,2010-10-27,2016-1-26
86,Myanmar  imperial jade,Private,Oo Si(3/10)(28.9.10),27.10.2010,26.1.2016,Jade,1,Kachin State,Taw Mhaw(189),27,10,2010,26,1,2016,Taw Mhaw,189,2010-10-27,2016-1-26
87,Myanmar  imperial jade,Private,Oo Si(3/10)(28.9.10),27.10.2010,26.1.2016,Jade,1,Kachin State,Taw Mhaw(190),27,10,2010,26,1,2016,Taw Mhaw,190,2010-10-27,2016-1-26
88,Myanmar  imperial jade,Private,Oo Si(3/10)(28.9.10),27.10.2010,26.1.2016,Jade,1,Kachin State,Taw Mhaw(191),27,10,2010,26,1,2016,Taw Mhaw,191,2010-10-27,2016-1-26
89,Myanmar  imperial jade,Private,Oo Si(3/10)(28.9.10),27.10.2010,26.1.2016,Jade,1,Kachin State,Taw Mhaw(192),27,10,2010,26,1,2016,Taw Mhaw,192,2010-10-27,2016-1-26
90,Myanmar  imperial jade,Private,Oo Si(3/10)(28.9.10),27.10.2010,26.1.2016,Jade,1,Kachin State,Taw Mhaw(193),27,10,2010,26,1,2016,Taw Mhaw,193,2010-10-27,2016-1-26
91,Myanmar  imperial jade,Private,Oo Si(3/10)(28.9.10),27.10.2010,26.1.2016,Jade,1,Kachin State,Taw Mhaw(194),27,10,2010,26,1,2016,Taw Mhaw,194,2010-10-27,2016-1-26
92,Myanmar  imperial jade,Private,Oo Si(3/10)(28.9.10),27.10.2010,26.1.2016,Jade,1,Kachin State,Taw Mhaw(195),27,10,2010,26,1,2016,Taw Mhaw,195,2010-10-27,2016-1-26
93,Myanmar  imperial jade,Private,Oo Si(3/10)(28.9.10),27.10.2010,26.1.2016,Jade,1,Kachin State,Taw Mhaw(196),27,10,2010,26,1,2016,Taw Mhaw,196,2010-10-27,2016-1-26
94,Myanmar  imperial jade,Private,Oo Si(3/10)(28.9.10),27.10.2010,26.1.2016,Jade,1,Kachin State,Taw Mhaw(197),27,10,2010,26,1,2016,Taw Mhaw,197,2010-10-27,2016-1-26
95,Myanmar  imperial jade,Private,Oo Si(3/10)(28.9.10),27.10.2010,26.1.2016,Jade,1,Kachin State,Taw Mhaw(198),27,10,2010,26,1,2016,Taw Mhaw,198,2010-10-27,2016-1-26
96,Myanmar  imperial jade,Private,Oo Si(3/10)(28.9.10),27.10.2010,26.1.2016,Jade,1,Kachin State,Taw Mhaw(199),27,10,2010,26,1,2016,Taw Mhaw,199,2010-10-27,2016-1-26
97,Myanmar  imperial jade,Private,Oo Si(3/10)(28.9.10),27.10.2010,26.1.2016,Jade,1,Kachin State,Taw Mhaw(200),27,10,2010,26,1,2016,Taw Mhaw,200,2010-10-27,2016-1-26
98,Myanmar  imperial jade,Private,Oo Si(3/10)(28.9.10),27.10.2010,26.1.2016,Jade,1,Kachin State,Taw Mhaw(201),27,10,2010,26,1,2016,Taw Mhaw,201,2010-10-27,2016-1-26
99,Myanmar  imperial jade,Private,Oo Si(3/10)(28.9.10),27.10.2010,26.1.2016,Jade,1,Kachin State,Taw Mhaw(202),27,10,2010,26,1,2016,Taw Mhaw,202,2010-10-27,2016-1-26
100,Myanmar  imperial jade,Private,Oo Si(3/10)(28.9.10),27.10.2010,26.1.2016,Jade,1,Kachin State,Taw Mhaw(203),27,10,2010,26,1,2016,Taw Mhaw,203,2010-10-27,2016-1-26
101,Myanmar  imperial jade,Private,Oo Si(3/10)(28.9.10),27.10.2010,26.1.2016,Jade,1,Kachin State,Taw Mhaw(204),27,10,2010,26,1,2016,Taw Mhaw,204,2010-10-27,2016-1-26
102,Myanmar  imperial jade,Private,Oo Si(3/10)(28.9.10),27.10.2010,26.1.2016,Jade,1,Kachin State,Taw Mhaw(205),27,10,2010,26,1,2016,Taw Mhaw,205,2010-10-27,2016-1-26
103,Myanmar  imperial jade,Private,Oo Si(3/10)(28.9.10),27.10.2010,26.1.2016,Jade,1,Kachin State,Taw Mhaw(206),27,10,2010,26,1,2016,Taw Mhaw,206,2010-10-27,2016-1-26
104,Myanmar  imperial jade,Private,Oo Si(3/10)(28.9.10),27.10.2010,26.1.2016,Jade,1,Kachin State,Taw Mhaw(207),27,10,2010,26,1,2016,Taw Mhaw,207,2010-10-27,2016-1-26
105,Myanmar  imperial jade,Private,Oo Si(3/10)(28.9.10),27.10.2010,26.1.2016,Jade,1,Kachin State,Taw Mhaw(208),27,10,2010,26,1,2016,Taw Mhaw,208,2010-10-27,2016-1-26
106,Myanmar  imperial jade,Private,Oo Si(3/10)(28.9.10),27.10.2010,26.1.2016,Jade,1,Kachin State,Taw Mhaw(209),27,10,2010,26,1,2016,Taw Mhaw,209,2010-10-27,2016-1-26
107,Myanmar  imperial jade,Private,Oo Si(3/10)(28.9.10),27.10.2010,26.1.2016,Jade,1,Kachin State,Taw Mhaw(210),27,10,2010,26,1,2016,Taw Mhaw,210,2010-10-27,2016-1-26
108,Myanmar  imperial jade,Private,Oo Si(3/10)(28.9.10),27.10.2010,26.1.2016,Jade,1,Kachin State,Taw Mhaw(211),27,10,2010,26,1,2016,Taw Mhaw,211,2010-10-27,2016-1-26
109,Myanmar  imperial jade,Private,Oo Si(3/10)(28.9.10),27.10.2010,26.1.2016,Jade,1,Kachin State,Taw Mhaw(212),27,10,2010,26,1,2016,Taw Mhaw,212,2010-10-27,2016-1-26
110,Myanmar  imperial jade,Private,Oo Si(3/10)(28.9.10),27.10.2010,26.1.2016,Jade,1,Kachin State,Taw Mhaw(213),27,10,2010,26,1,2016,Taw Mhaw,213,2010-10-27,2016-1-26
111,Myanmar  imperial jade,Private,Oo Si(3/10)(28.9.10),27.10.2010,26.1.2016,Jade,1,Kachin State,Taw Mhaw(214),27,10,2010,26,1,2016,Taw Mhaw,214,2010-10-27,2016-1-26
112,Myanmar  imperial jade,Private,Oo Si(3/10)(28.9.10),27.10.2010,26.1.2016,Jade,1,Kachin State,Taw Mhaw(215),27,10,2010,26,1,2016,Taw Mhaw,215,2010-10-27,2016-1-26
113,Myanmar  imperial jade,Private,Oo Si(3/10)(28.9.10),27.10.2010,26.1.2016,Jade,1,Kachin State,Taw Mhaw(216),27,10,2010,26,1,2016,Taw Mhaw,216,2010-10-27,2016-1-26
114,Myanmar  imperial jade,Private,Oo Si(3/10)(28.9.10),27.10.2010,26.1.2016,Jade,1,Kachin State,Taw Mhaw(217),27,10,2010,26,1,2016,Taw Mhaw,217,2010-10-27,2016-1-26
115,Myanmar  imperial jade,Private,Oo Si(3/10)(28.9.10),27.10.2010,26.1.2016,Jade,1,Kachin State,Taw Mhaw(218),27,10,2010,26,1,2016,Taw Mhaw,218,2010-10-27,2016-1-26
116,Myanmar  imperial jade,Private,Oo Si(3/10)(28.9.10),27.10.2010,26.1.2016,Jade,1,Kachin State,Taw Mhaw(219),27,10,2010,26,1,2016,Taw Mhaw,219,2010-10-27,2016-1-26
117,Myanmar  imperial jade,Private,Oo Si(3/10)(28.9.10),27.10.2010,26.1.2016,Jade,1,Kachin State,Taw Mhaw(220),27,10,2010,26,1,2016,Taw Mhaw,220,2010-10-27,2016-1-26
118,Myanmar  imperial jade,Private,Oo Si(3/10)(28.9.10),27.10.2010,26.1.2016,Jade,1,Kachin State,Taw Mhaw(221),27,10,2010,26,1,2016,Taw Mhaw,221,2010-10-27,2016-1-26
119,Myanmar  imperial jade,Private,Oo Si(3/10)(28.9.10),27.10.2010,26.1.2016,Jade,1,Kachin State,Taw Mhaw(222),27,10,2010,26,1,2016,Taw Mhaw,222,2010-10-27,2016-1-26
120,Myanmar  imperial jade,Private,Oo Si(3/10)(28.9.10),27.10.2010,26.1.2016,Jade,1,Kachin State,Taw Mhaw(223),27,10,2010,26,1,2016,Taw Mhaw,223,2010-10-27,2016-1-26
121,Myanmar  imperial jade,Private,Oo Si(3/10)(28.9.10),27.10.2010,26.1.2016,Jade,1,Kachin State,Taw Mhaw(224),27,10,2010,26,1,2016,Taw Mhaw,224,2010-10-27,2016-1-26
122,Myanmar  imperial jade,Private,Oo Si(3/10)(28.9.10),27.10.2010,26.1.2016,Jade,1,Kachin State,Taw Mhaw(225),27,10,2010,26,1,2016,Taw Mhaw,225,2010-10-27,2016-1-26
123,Myanmar  imperial jade,Private,Oo Si(3/10)(28.9.10),27.10.2010,26.1.2016,Jade,1,Kachin State,Taw Mhaw(226),27,10,2010,26,1,2016,Taw Mhaw,226,2010-10-27,2016-1-26
124,Myanmar  imperial jade,Private,Oo Si(3/10)(28.9.10),27.10.2010,26.1.2016,Jade,1,Kachin State,Taw Mhaw(227),27,10,2010,26,1,2016,Taw Mhaw,227,2010-10-27,2016-1-26
125,Myanmar  imperial jade,Private,Oo Si(3/10)(28.9.10),27.10.2010,26.1.2016,Jade,1,Kachin State,Taw Mhaw(228),27,10,2010,26,1,2016,Taw Mhaw,228,2010-10-27,2016-1-26
126,Myanmar  imperial jade,Private,Oo Si(3/10)(28.9.10),27.10.2010,26.1.2016,Jade,1,Kachin State,Taw Mhaw(229),27,10,2010,26,1,2016,Taw Mhaw,229,2010-10-27,2016-1-26
127,Myanmar  imperial jade,Private,Oo Si(3/10)(28.9.10),27.10.2010,26.1.2016,Jade,1,Kachin State,Taw Mhaw(230),27,10,2010,26,1,2016,Taw Mhaw,230,2010-10-27,2016-1-26
128,Myanmar  imperial jade,Private,Oo Si(3/10)(28.9.10),27.10.2010,26.1.2016,Jade,1,Kachin State,Taw Mhaw(231),27,10,2010,26,1,2016,Taw Mhaw,231,2010-10-27,2016-1-26
129,Myanmar  imperial jade,Private,Oo Si(3/10)(28.9.10),27.10.2010,26.1.2016,Jade,1,Kachin State,Taw Mhaw(232),27,10,2010,26,1,2016,Taw Mhaw,232,2010-10-27,2016-1-26
130,Myanmar  imperial jade,Private,Oo Si(3/10)(28.9.10),27.10.2010,26.1.2016,Jade,1,Kachin State,Taw Mhaw(233),27,10,2010,26,1,2016,Taw Mhaw,233,2010-10-27,2016-1-26
131,Myanmar  imperial jade,Private,Oo Si(3/10)(28.9.10),27.10.2010,26.1.2016,Jade,1,Kachin State,Taw Mhaw(234),27,10,2010,26,1,2016,Taw Mhaw,234,2010-10-27,2016-1-26
132,Myanmar  imperial jade,Private,Oo Si(3/10)(28.9.10),27.10.2010,26.1.2016,Jade,1,Kachin State,Taw Mhaw(235),27,10,2010,26,1,2016,Taw Mhaw,235,2010-10-27,2016-1-26
133,Myanmar  imperial jade,Private,Oo Si(3/10)(28.9.10),27.10.2010,26.1.2016,Jade,1,Kachin State,Taw Mhaw(236),27,10,2010,26,1,2016,Taw Mhaw,236,2010-10-27,2016-1-26
134,Myanmar  imperial jade,Private,Oo Si(3/10)(28.9.10),27.10.2010,26.1.2016,Jade,1,Kachin State,Taw Mhaw(237),27,10,2010,26,1,2016,Taw Mhaw,237,2010-10-27,2016-1-26
135,Myanmar  imperial jade,Private,Oo Si(3/10)(28.9.10),27.10.2010,26.1.2016,Jade,1,Kachin State,Taw Mhaw(238),27,10,2010,26,1,2016,Taw Mhaw,238,2010-10-27,2016-1-26
136,Myanmar  imperial jade,Private,Oo Si(3/10)(28.9.10),27.10.2010,26.1.2016,Jade,1,Kachin State,Taw Mhaw(239),27,10,2010,26,1,2016,Taw Mhaw,239,2010-10-27,2016-1-26
137,Myanmar  imperial jade,Private,Oo Si(3/10)(28.9.10),27.10.2010,26.1.2016,Jade,1,Kachin State,Taw Mhaw(240),27,10,2010,26,1,2016,Taw Mhaw,240,2010-10-27,2016-1-26
138,Myanmar  imperial jade,Private,Oo Si(3/10)(28.9.10),27.10.2010,26.1.2016,Jade,1,Kachin State,Taw Mhaw(241),27,10,2010,26,1,2016,Taw Mhaw,241,2010-10-27,2016-1-26
139,Myanmar  imperial jade,Private,Oo Si(3/10)(28.9.10),27.10.2010,26.1.2016,Jade,1,Kachin State,Taw Mhaw(242),27,10,2010,26,1,2016,Taw Mhaw,242,2010-10-27,2016-1-26
140,Myanmar  imperial jade,Private,Oo Si(3/10)(28.9.10),27.10.2010,26.1.2016,Jade,1,Kachin State,Taw Mhaw(243),27,10,2010,26,1,2016,Taw Mhaw,243,2010-10-27,2016-1-26
141,Myanmar  imperial jade,Private,Oo Si(3/10)(28.9.10),27.10.2010,26.1.2016,Jade,1,Kachin State,Taw Mhaw(244),27,10,2010,26,1,2016,Taw Mhaw,244,2010-10-27,2016-1-26
142,Myanmar  imperial jade,Private,Oo Si(3/10)(28.9.10),27.10.2010,26.1.2016,Jade,1,Kachin State,Taw Mhaw(245),27,10,2010,26,1,2016,Taw Mhaw,245,2010-10-27,2016-1-26
143,Myanmar  imperial jade,Private,Oo Si(3/10)(28.9.10),27.10.2010,26.1.2016,Jade,1,Kachin State,Taw Mhaw(246),27,10,2010,26,1,2016,Taw Mhaw,246,2010-10-27,2016-1-26
144,Myanmar  imperial jade,Private,Oo Si(3/10)(28.9.10),27.10.2010,26.1.2016,Jade,1,Kachin State,Taw Mhaw(247),27,10,2010,26,1,2016,Taw Mhaw,247,2010-10-27,2016-1-26
145,Myanmar  imperial jade,Private,Oo Si(3/10)(28.9.10),27.10.2010,26.1.2016,Jade,1,Kachin State,Taw Mhaw(248),27,10,2010,26,1,2016,Taw Mhaw,248,2010-10-27,2016-1-26
146,Myanmar  imperial jade,Private,Oo Si(3/10)(28.9.10),27.10.2010,26.1.2016,Jade,1,Kachin State,Taw Mhaw(249),27,10,2010,26,1,2016,Taw Mhaw,249,2010-10-27,2016-1-26
147,Myanmar  imperial jade,Private,Oo Si(3/10)(28.9.10),27.10.2010,26.1.2016,Jade,1,Kachin State,Taw Mhaw(250),27,10,2010,26,1,2016,Taw Mhaw,250,2010-10-27,2016-1-26
148,Myanmar  imperial jade,Private,Oo Si(3/10)(28.9.10),27.10.2010,26.1.2016,Jade,1,Kachin State,Taw Mhaw(251),27,10,2010,26,1,2016,Taw Mhaw,251,2010-10-27,2016-1-26
149,Myanmar  imperial jade,Private,Oo Si(3/10)(28.9.10),27.10.2010,26.1.2016,Jade,1,Kachin State,Taw Mhaw(252),27,10,2010,26,1,2016,Taw Mhaw,252,2010-10-27,2016-1-26
150,Myanmar  imperial jade,Private,Oo Si(3/10)(28.9.10),27.10.2010,26.1.2016,Jade,1,Kachin State,Taw Mhaw(253),27,10,2010,26,1,2016,Taw Mhaw,253,2010-10-27,2016-1-26
151,Myanmar  imperial jade,Private,Oo Si(3/10)(28.9.10),27.10.2010,26.1.2016,Jade,1,Kachin State,Taw Mhaw(254),27,10,2010,26,1,2016,Taw Mhaw,254,2010-10-27,2016-1-26
152,Myanmar  imperial jade,Private,Oo Si(3/10)(28.9.10),27.10.2010,26.1.2016,Jade,1,Kachin State,Taw Mhaw(255),27,10,2010,26,1,2016,Taw Mhaw,255,2010-10-27,2016-1-26
153,Myanmar  imperial jade,Private,Oo Si(3/10)(28.9.10),27.10.2010,26.1.2016,Jade,1,Kachin State,Taw Mhaw(256),27,10,2010,26,1,2016,Taw Mhaw,256,2010-10-27,2016-1-26
154,Myanmar  imperial jade,Private,Oo Si(3/10)(28.9.10),27.10.2010,26.1.2016,Jade,1,Kachin State,Taw Mhaw(257),27,10,2010,26,1,2016,Taw Mhaw,257,2010-10-27,2016-1-26
155,Myanmar  imperial jade,Private,Oo Si(3/10)(28.9.10),27.10.2010,26.1.2016,Jade,1,Kachin State,Taw Mhaw(258),27,10,2010,26,1,2016,Taw Mhaw,258,2010-10-27,2016-1-26
156,Myanmar  imperial jade,Private,Oo Si(3/10)(28.9.10),27.10.2010,26.1.2016,Jade,1,Kachin State,Taw Mhaw(259),27,10,2010,26,1,2016,Taw Mhaw,259,2010-10-27,2016-1-26
157,Myanmar  imperial jade,Private,Oo Si(3/10)(28.9.10),27.10.2010,26.1.2016,Jade,1,Kachin State,Taw Mhaw(260),27,10,2010,26,1,2016,Taw Mhaw,260,2010-10-27,2016-1-26
158,Myanmar  imperial jade,Private,Oo Si(3/10)(28.9.10),27.10.2010,26.1.2016,Jade,1,Kachin State,Taw Mhaw(261),27,10,2010,26,1,2016,Taw Mhaw,261,2010-10-27,2016-1-26
159,Myanmar  imperial jade,Private,Oo Si(3/10)(28.9.10),27.10.2010,26.1.2016,Jade,1,Kachin State,Taw Mhaw(262),27,10,2010,26,1,2016,Taw Mhaw,262,2010-10-27,2016-1-26
160,Myanmar  imperial jade,Private,Oo Si(3/10)(28.9.10),27.10.2010,26.1.2016,Jade,1,Kachin State,Taw Mhaw(263),27,10,2010,26,1,2016,Taw Mhaw,263,2010-10-27,2016-1-26
161,Myanmar  imperial jade,Private,Oo Si(3/10)(28.9.10),27.10.2010,26.1.2016,Jade,1,Kachin State,Taw Mhaw(264),27,10,2010,26,1,2016,Taw Mhaw,264,2010-10-27,2016-1-26
162,Myanmar  imperial jade,Private,Oo Si(3/10)(28.9.10),27.10.2010,26.1.2016,Jade,1,Kachin State,Taw Mhaw(265),27,10,2010,26,1,2016,Taw Mhaw,265,2010-10-27,2016-1-26
163,Myanmar  imperial jade,Private,Oo Si(3/10)(28.9.10),27.10.2010,26.1.2016,Jade,1,Kachin State,Taw Mhaw(266),27,10,2010,26,1,2016,Taw Mhaw,266,2010-10-27,2016-1-26
164,Myanmar  imperial jade,Private,Oo Si(3/10)(28.9.10),27.10.2010,26.1.2016,Jade,1,Kachin State,Taw Mhaw(267),27,10,2010,26,1,2016,Taw Mhaw,267,2010-10-27,2016-1-26
165,Myanmar  imperial jade,Private,Oo Si(3/10)(28.9.10),27.10.2010,26.1.2016,Jade,1,Kachin State,Taw Mhaw(268),27,10,2010,26,1,2016,Taw Mhaw,268,2010-10-27,2016-1-26
166,Myanmar  imperial jade,Private,Oo Si(3/10)(28.9.10),27.10.2010,26.1.2016,Jade,1,Kachin State,Taw Mhaw(269),27,10,2010,26,1,2016,Taw Mhaw,269,2010-10-27,2016-1-26
167,Myanmar  imperial jade,Private,Oo Si(3/10)(28.9.10),27.10.2010,26.1.2016,Jade,1,Kachin State,Taw Mhaw(270),27,10,2010,26,1,2016,Taw Mhaw,270,2010-10-27,2016-1-26
168,Myanmar  imperial jade,Private,Oo Si(3/10)(28.9.10),27.10.2010,26.1.2016,Jade,1,Kachin State,Taw Mhaw(271),27,10,2010,26,1,2016,Taw Mhaw,271,2010-10-27,2016-1-26
169,Myanmar  imperial jade,Private,Oo Si(3/10)(28.9.10),27.10.2010,26.1.2016,Jade,1,Kachin State,Taw Mhaw(272),27,10,2010,26,1,2016,Taw Mhaw,272,2010-10-27,2016-1-26
170,Myanmar  imperial jade,Private,Oo Si(3/10)(28.9.10),27.10.2010,26.1.2016,Jade,1,Kachin State,Taw Mhaw(273),27,10,2010,26,1,2016,Taw Mhaw,273,2010-10-27,2016-1-26
171,Myanmar  imperial jade,Private,Oo Si(3/10)(28.9.10),27.10.2010,26.1.2016,Jade,1,Kachin State,Taw Mhaw(274),27,10,2010,26,1,2016,Taw Mhaw,274,2010-10-27,2016-1-26
172,Myanmar  imperial jade,Private,Oo Si(3/10)(28.9.10),27.10.2010,26.1.2016,Jade,1,Kachin State,Taw Mhaw(275),27,10,2010,26,1,2016,Taw Mhaw,275,2010-10-27,2016-1-26
173,Myanmar  imperial jade,Private,Oo Si(3/10)(28.9.10),27.10.2010,26.1.2016,Jade,1,Kachin State,Taw Mhaw(276),27,10,2010,26,1,2016,Taw Mhaw,276,2010-10-27,2016-1-26
174,Myanmar  imperial jade,Private,Oo Si(3/10)(28.9.10),27.10.2010,26.1.2016,Jade,1,Kachin State,Taw Mhaw(277),27,10,2010,26,1,2016,Taw Mhaw,277,2010-10-27,2016-1-26
175,Myanmar  imperial jade,Private,Oo Si(3/10)(28.9.10),27.10.2010,26.1.2016,Jade,1,Kachin State,Taw Mhaw(278),27,10,2010,26,1,2016,Taw Mhaw,278,2010-10-27,2016-1-26
176,Myanmar  imperial jade,Private,Oo Si(3/10)(28.9.10),27.10.2010,26.1.2016,Jade,1,Kachin State,Taw Mhaw(279),27,10,2010,26,1,2016,Taw Mhaw,279,2010-10-27,2016-1-26
177,Myanmar  imperial jade,Private,Oo Si(3/10)(28.9.10),27.10.2010,26.1.2016,Jade,1,Kachin State,Taw Mhaw(280),27,10,2010,26,1,2016,Taw Mhaw,280,2010-10-27,2016-1-26
178,Myanmar  imperial jade,Private,Oo Si(3/10)(28.9.10),27.10.2010,26.1.2016,Jade,1,Kachin State,Taw Mhaw(281),27,10,2010,26,1,2016,Taw Mhaw,281,2010-10-27,2016-1-26
179,Myanmar  imperial jade,Private,Oo Si(3/10)(28.9.10),27.10.2010,26.1.2016,Jade,1,Kachin State,Taw Mhaw(282),27,10,2010,26,1,2016,Taw Mhaw,282,2010-10-27,2016-1-26
180,Myanmar  imperial jade,Private,Oo Si(3/10)(28.9.10),27.10.2010,26.1.2016,Jade,1,Kachin State,Taw Mhaw(283),27,10,2010,26,1,2016,Taw Mhaw,283,2010-10-27,2016-1-26
181,Myanmar  imperial jade,Private,Oo Si(3/10)(28.9.10),27.10.2010,26.1.2016,Jade,1,Kachin State,Taw Mhaw(284),27,10,2010,26,1,2016,Taw Mhaw,284,2010-10-27,2016-1-26
182,Myanmar  imperial jade,Private,Oo Si(3/10)(28.9.10),27.10.2010,26.1.2016,Jade,1,Kachin State,Taw Mhaw(285),27,10,2010,26,1,2016,Taw Mhaw,285,2010-10-27,2016-1-26
183,Myanmar  imperial jade,Private,Oo Si(3/10)(28.9.10),27.10.2010,26.1.2016,Jade,1,Kachin State,Taw Mhaw(286),27,10,2010,26,1,2016,Taw Mhaw,286,2010-10-27,2016-1-26
184,Myanmar  imperial jade,Private,Oo Si(3/10)(28.9.10),27.10.2010,26.1.2016,Jade,1,Kachin State,Taw Mhaw(287),27,10,2010,26,1,2016,Taw Mhaw,287,2010-10-27,2016-1-26
185,Myanmar  imperial jade,Private,Oo Si(3/10)(28.9.10),27.10.2010,26.1.2016,Jade,1,Kachin State,Taw Mhaw(288),27,10,2010,26,1,2016,Taw Mhaw,288,2010-10-27,2016-1-26
186,Myanmar  imperial jade,Private,Oo Si(3/10)(28.9.10),27.10.2010,26.1.2016,Jade,1,Kachin State,Taw Mhaw(289),27,10,2010,26,1,2016,Taw Mhaw,289,2010-10-27,2016-1-26
187,Myanmar  imperial jade,Private,Oo Si(3/10)(28.9.10),27.10.2010,26.1.2016,Jade,1,Kachin State,Taw Mhaw(290),27,10,2010,26,1,2016,Taw Mhaw,290,2010-10-27,2016-1-26
188,Myanmar  imperial jade,Private,Oo Si(3/10)(28.9.10),27.10.2010,26.1.2016,Jade,1,Kachin State,Taw Mhaw(291),27,10,2010,26,1,2016,Taw Mhaw,291,2010-10-27,2016-1-26
189,Myanmar  imperial jade,Private,Oo Si(3/10)(28.9.10),27.10.2010,26.1.2016,Jade,1,Kachin State,Taw Mhaw(292),27,10,2010,26,1,2016,Taw Mhaw,292,2010-10-27,2016-1-26
190,Myanmar  imperial jade,Private,Oo Si(3/10)(28.9.10),27.10.2010,26.1.2016,Jade,1,Kachin State,Taw Mhaw(293),27,10,2010,26,1,2016,Taw Mhaw,293,2010-10-27,2016-1-26
191,Myanmar  imperial jade,Private,Oo Si(3/10)(28.9.10),27.10.2010,26.1.2016,Jade,1,Kachin State,Taw Mhaw(294),27,10,2010,26,1,2016,Taw Mhaw,294,2010-10-27,2016-1-26
192,Myanmar  imperial jade,Private,Oo Si(3/10)(28.9.10),27.10.2010,26.1.2016,Jade,1,Kachin State,Taw Mhaw(295),27,10,2010,26,1,2016,Taw Mhaw,295,2010-10-27,2016-1-26
193,Myanmar  imperial jade,Private,Oo Si(3/10)(28.9.10),27.10.2010,26.1.2016,Jade,1,Kachin State,Taw Mhaw(296),27,10,2010,26,1,2016,Taw Mhaw,296,2010-10-27,2016-1-26
194,Myanmar  imperial jade,Private,Oo Si(3/10)(28.9.10),27.10.2010,26.1.2016,Jade,1,Kachin State,Taw Mhaw(297),27,10,2010,26,1,2016,Taw Mhaw,297,2010-10-27,2016-1-26
195,Myanmar  imperial jade,Private,Oo Si(3/10)(28.9.10),27.10.2010,26.1.2016,Jade,1,Kachin State,Taw Mhaw(298),27,10,2010,26,1,2016,Taw Mhaw,298,2010-10-27,2016-1-26
196,Myanmar  imperial jade,Private,Oo Si(3/10)(28.9.10),27.10.2010,26.1.2016,Jade,1,Kachin State,Taw Mhaw(299),27,10,2010,26,1,2016,Taw Mhaw,299,2010-10-27,2016-1-26
197,Myanmar  imperial jade,Private,Oo Si(3/10)(28.9.10),27.10.2010,26.1.2016,Jade,1,Kachin State,Taw Mhaw(300),27,10,2010,26,1,2016,Taw Mhaw,300,2010-10-27,2016-1-26
198,Myanmar  imperial jade,Private,Oo Si(3/10)(28.9.10),27.10.2010,26.1.2016,Jade,1,Kachin State,Taw Mhaw(301),27,10,2010,26,1,2016,Taw Mhaw,301,2010-10-27,2016-1-26
199,Myanmar  imperial jade,Private,Oo Si(3/10)(28.9.10),27.10.2010,26.1.2016,Jade,1,Kachin State,Taw Mhaw(302),27,10,2010,26,1,2016,Taw Mhaw,302,2010-10-27,2016-1-26
200,Myanmar  imperial jade,Private,Oo Si(3/10)(28.9.10),27.10.2010,26.1.2016,Jade,1,Kachin State,Taw Mhaw(303),27,10,2010,26,1,2016,Taw Mhaw,303,2010-10-27,2016-1-26
201,Myanmar  imperial jade,Private,Oo Si(3/10)(28.9.10),27.10.2010,26.1.2016,Jade,1,Kachin State,Taw Mhaw(304),27,10,2010,26,1,2016,Taw Mhaw,304,2010-10-27,2016-1-26
202,Myanmar  imperial jade,Private,Oo Si(3/10)(28.9.10),27.10.2010,26.1.2016,Jade,1,Kachin State,Taw Mhaw(305),27,10,2010,26,1,2016,Taw Mhaw,305,2010-10-27,2016-1-26
203,Myanmar  imperial jade,Private,Oo Si(3/10)(28.9.10),27.10.2010,26.1.2016,Jade,1,Kachin State,Taw Mhaw(306),27,10,2010,26,1,2016,Taw Mhaw,306,2010-10-27,2016-1-26
204,Myanmar  imperial jade,Private,Oo Si(3/10)(28.9.10),27.10.2010,26.1.2016,Jade,1,Kachin State,Taw Mhaw(307),27,10,2010,26,1,2016,Taw Mhaw,307,2010-10-27,2016-1-26
205,Myanmar  imperial jade,Private,Oo Si(3/10)(28.9.10),27.10.2010,26.1.2016,Jade,1,Kachin State,Taw Mhaw(308),27,10,2010,26,1,2016,Taw Mhaw,308,2010-10-27,2016-1-26
206,Myanmar  imperial jade,Private,Oo Si(3/10)(28.9.10),27.10.2010,26.1.2016,Jade,1,Kachin State,Taw Mhaw(309),27,10,2010,26,1,2016,Taw Mhaw,309,2010-10-27,2016-1-26
207,Myanmar  imperial jade,Private,Oo Si(3/10)(28.9.10),27.10.2010,26.1.2016,Jade,1,Kachin State,Taw Mhaw(310),27,10,2010,26,1,2016,Taw Mhaw,310,2010-10-27,2016-1-26
208,Myanmar  imperial jade,Private,Oo Si(3/10)(28.9.10),27.10.2010,26.1.2016,Jade,1,Kachin State,Taw Mhaw(311),27,10,2010,26,1,2016,Taw Mhaw,311,2010-10-27,2016-1-26
209,Myanmar  imperial jade,Private,Oo Si(3/10)(28.9.10),27.10.2010,26.1.2016,Jade,1,Kachin State,Taw Mhaw(312),27,10,2010,26,1,2016,Taw Mhaw,312,2010-10-27,2016-1-26
210,Myanmar  imperial jade,Private,Oo Si(3/10)(28.9.10),27.10.2010,26.1.2016,Jade,1,Kachin State,Taw Mhaw(313),27,10,2010,26,1,2016,Taw Mhaw,313,2010-10-27,2016-1-26
211,Myanmar  imperial jade,Private,Oo Si(3/10)(28.9.10),27.10.2010,26.1.2016,Jade,1,Kachin State,Taw Mhaw(314),27,10,2010,26,1,2016,Taw Mhaw,314,2010-10-27,2016-1-26
212,Myanmar  imperial jade,Private,Oo Si(3/10)(28.9.10),27.10.2010,26.1.2016,Jade,1,Kachin State,Taw Mhaw(315),27,10,2010,26,1,2016,Taw Mhaw,315,2010-10-27,2016-1-26
213,Myanmar  imperial jade,Private,Oo Si(3/10)(28.9.10),27.10.2010,26.1.2016,Jade,1,Kachin State,Taw Mhaw(316),27,10,2010,26,1,2016,Taw Mhaw,316,2010-10-27,2016-1-26
214,Myanmar  imperial jade,Private,Oo Si(3/10)(28.9.10),27.10.2010,26.1.2016,Jade,1,Kachin State,Taw Mhaw(317),27,10,2010,26,1,2016,Taw Mhaw,317,2010-10-27,2016-1-26
215,Myanmar  imperial jade,Private,Oo Si(3/10)(28.9.10),27.10.2010,26.1.2016,Jade,1,Kachin State,Taw Mhaw(318),27,10,2010,26,1,2016,Taw Mhaw,318,2010-10-27,2016-1-26
216,Myanmar  imperial jade,Private,Oo Si(3/10)(28.9.10),27.10.2010,26.1.2016,Jade,1,Kachin State,Taw Mhaw(319),27,10,2010,26,1,2016,Taw Mhaw,319,2010-10-27,2016-1-26
217,Myanmar  imperial jade,Private,Oo Si(3/10)(28.9.10),27.10.2010,26.1.2016,Jade,1,Kachin State,Taw Mhaw(320),27,10,2010,26,1,2016,Taw Mhaw,320,2010-10-27,2016-1-26
218,Myanmar  imperial jade,Private,Oo Si(3/10)(28.9.10),27.10.2010,26.1.2016,Jade,1,Kachin State,Taw Mhaw(321),27,10,2010,26,1,2016,Taw Mhaw,321,2010-10-27,2016-1-26
219,Myanmar  imperial jade,Private,Oo Si(3/10)(28.9.10),27.10.2010,26.1.2016,Jade,1,Kachin State,Taw Mhaw(322),27,10,2010,26,1,2016,Taw Mhaw,322,2010-10-27,2016-1-26
220,Myanmar  imperial jade,Private,Oo Si(3/10)(28.9.10),27.10.2010,26.1.2016,Jade,1,Kachin State,Taw Mhaw(323),27,10,2010,26,1,2016,Taw Mhaw,323,2010-10-27,2016-1-26
221,Myanmar  imperial jade,Private,Oo Si(3/10)(28.9.10),27.10.2010,26.1.2016,Jade,1,Kachin State,Taw Mhaw(324),27,10,2010,26,1,2016,Taw Mhaw,324,2010-10-27,2016-1-26
222,Myanmar  imperial jade,Private,Oo Si(3/10)(28.9.10),27.10.2010,26.1.2016,Jade,1,Kachin State,Taw Mhaw(325),27,10,2010,26,1,2016,Taw Mhaw,325,2010-10-27,2016-1-26
223,Myanmar  imperial jade,Private,Oo Si(3/10)(28.9.10),27.10.2010,26.1.2016,Jade,1,Kachin State,Taw Mhaw(326),27,10,2010,26,1,2016,Taw Mhaw,326,2010-10-27,2016-1-26
224,Myanmar  imperial jade,Private,Oo Si(3/10)(28.9.10),27.10.2010,26.1.2016,Jade,1,Kachin State,Taw Mhaw(327),27,10,2010,26,1,2016,Taw Mhaw,327,2010-10-27,2016-1-26
225,Myanmar  imperial jade,Private,Oo Si(3/10)(28.9.10),27.10.2010,26.1.2016,Jade,1,Kachin State,Taw Mhaw(328),27,10,2010,26,1,2016,Taw Mhaw,328,2010-10-27,2016-1-26
226,Myanmar  imperial jade,Private,Oo Si(3/10)(28.9.10),27.10.2010,26.1.2016,Jade,1,Kachin State,Taw Mhaw(329),27,10,2010,26,1,2016,Taw Mhaw,329,2010-10-27,2016-1-26
227,Myanmar  imperial jade,Private,Oo Si(3/10)(28.9.10),27.10.2010,26.1.2016,Jade,1,Kachin State,Taw Mhaw(330),27,10,2010,26,1,2016,Taw Mhaw,330,2010-10-27,2016-1-26
228,Myanmar  imperial jade,Private,Oo Si(3/10)(28.9.10),27.10.2010,26.1.2016,Jade,1,Kachin State,Taw Mhaw(331),27,10,2010,26,1,2016,Taw Mhaw,331,2010-10-27,2016-1-26
229,Myanmar  imperial jade,Private,Oo Si(3/10)(28.9.10),27.10.2010,26.1.2016,Jade,1,Kachin State,Taw Mhaw(332),27,10,2010,26,1,2016,Taw Mhaw,332,2010-10-27,2016-1-26
230,Myanmar  imperial jade,Private,Oo Si(3/10)(28.9.10),27.10.2010,26.1.2016,Jade,1,Kachin State,Taw Mhaw(333),27,10,2010,26,1,2016,Taw Mhaw,333,2010-10-27,2016-1-26
231,Myanmar  imperial jade,Private,Oo Si(3/10)(28.9.10),27.10.2010,26.1.2016,Jade,1,Kachin State,Taw Mhaw(334),27,10,2010,26,1,2016,Taw Mhaw,334,2010-10-27,2016-1-26
232,Myanmar  imperial jade,Private,Oo Si(3/10)(28.9.10),27.10.2010,26.1.2016,Jade,1,Kachin State,Taw Mhaw(335),27,10,2010,26,1,2016,Taw Mhaw,335,2010-10-27,2016-1-26
233,Myanmar  imperial jade,Private,Oo Si(3/10)(28.9.10),27.10.2010,26.1.2016,Jade,1,Kachin State,Taw Mhaw(336),27,10,2010,26,1,2016,Taw Mhaw,336,2010-10-27,2016-1-26
234,Myanmar  imperial jade,Private,Oo Si(3/10)(28.9.10),27.10.2010,26.1.2016,Jade,1,Kachin State,Taw Mhaw(337),27,10,2010,26,1,2016,Taw Mhaw,337,2010-10-27,2016-1-26
235,Myanmar  imperial jade,Private,Oo Si(3/10)(28.9.10),27.10.2010,26.1.2016,Jade,1,Kachin State,Taw Mhaw(338),27,10,2010,26,1,2016,Taw Mhaw,338,2010-10-27,2016-1-26
236,Myanmar  imperial jade,Private,Oo Si(3/10)(28.9.10),27.10.2010,26.1.2016,Jade,1,Kachin State,Taw Mhaw(339),27,10,2010,26,1,2016,Taw Mhaw,339,2010-10-27,2016-1-26
237,Myanmar  imperial jade,Private,Oo Si(3/10)(28.9.10),27.10.2010,26.1.2016,Jade,1,Kachin State,Taw Mhaw(340),27,10,2010,26,1,2016,Taw Mhaw,340,2010-10-27,2016-1-26
238,Myanmar  imperial jade,Private,Oo Si(3/10)(28.9.10),27.10.2010,26.1.2016,Jade,1,Kachin State,Taw Mhaw(341),27,10,2010,26,1,2016,Taw Mhaw,341,2010-10-27,2016-1-26
239,Myanmar  imperial jade,Private,Oo Si(3/10)(28.9.10),27.10.2010,26.1.2016,Jade,1,Kachin State,Taw Mhaw(342),27,10,2010,26,1,2016,Taw Mhaw,342,2010-10-27,2016-1-26
240,Myanmar  imperial jade,Private,Oo Si(3/10)(28.9.10),27.10.2010,26.1.2016,Jade,1,Kachin State,Taw Mhaw(343),27,10,2010,26,1,2016,Taw Mhaw,343,2010-10-27,2016-1-26
241,Myanmar  imperial jade,Private,Oo Si(3/10)(28.9.10),27.10.2010,26.1.2016,Jade,1,Kachin State,Taw Mhaw(344),27,10,2010,26,1,2016,Taw Mhaw,344,2010-10-27,2016-1-26
242,Myanmar  imperial jade,Private,Oo Si(3/10)(28.9.10),27.10.2010,26.1.2016,Jade,1,Kachin State,Taw Mhaw(345),27,10,2010,26,1,2016,Taw Mhaw,345,2010-10-27,2016-1-26
243,Myanmar  imperial jade,Private,Oo Si(3/10)(28.9.10),27.10.2010,26.1.2016,Jade,1,Kachin State,Taw Mhaw(346),27,10,2010,26,1,2016,Taw Mhaw,346,2010-10-27,2016-1-26
244,Myanmar  imperial jade,Private,Oo Si(3/10)(28.9.10),27.10.2010,26.1.2016,Jade,1,Kachin State,Taw Mhaw(347),27,10,2010,26,1,2016,Taw Mhaw,347,2010-10-27,2016-1-26
245,Myanmar  imperial jade,Private,Oo Si(3/10)(28.9.10),27.10.2010,26.1.2016,Jade,1,Kachin State,Taw Mhaw(348),27,10,2010,26,1,2016,Taw Mhaw,348,2010-10-27,2016-1-26
246,Myanmar  imperial jade,Private,Oo Si(3/10)(28.9.10),27.10.2010,26.1.2016,Jade,1,Kachin State,Taw Mhaw(349),27,10,2010,26,1,2016,Taw Mhaw,349,2010-10-27,2016-1-26
247,Myanmar  imperial jade,Private,Oo Si(3/10)(28.9.10),27.10.2010,26.1.2016,Jade,1,Kachin State,Taw Mhaw(350),27,10,2010,26,1,2016,Taw Mhaw,350,2010-10-27,2016-1-26
248,Myanmar  imperial jade,Private,Oo Si(3/10)(28.9.10),27.10.2010,26.1.2016,Jade,1,Kachin State,Taw Mhaw(351),27,10,2010,26,1,2016,Taw Mhaw,351,2010-10-27,2016-1-26
249,Myanmar  imperial jade,Private,Oo Si(3/10)(28.9.10),27.10.2010,26.1.2016,Jade,1,Kachin State,Taw Mhaw(352),27,10,2010,26,1,2016,Taw Mhaw,352,2010-10-27,2016-1-26
250,Myanmar  imperial jade,Private,Oo Si(3/10)(28.9.10),27.10.2010,26.1.2016,Jade,1,Kachin State,Taw Mhaw(353),27,10,2010,26,1,2016,Taw Mhaw,353,2010-10-27,2016-1-26
251,Myanmar  imperial jade,Private,Oo Si(3/10)(28.9.10),27.10.2010,26.1.2016,Jade,1,Kachin State,Taw Mhaw(354),27,10,2010,26,1,2016,Taw Mhaw,354,2010-10-27,2016-1-26
252,Myanmar  imperial jade,Private,Oo Si(3/10)(28.9.10),27.10.2010,26.1.2016,Jade,1,Kachin State,Taw Mhaw(355),27,10,2010,26,1,2016,Taw Mhaw,355,2010-10-27,2016-1-26
253,Myanmar  imperial jade,Private,Oo Si(3/10)(28.9.10),27.10.2010,26.1.2016,Jade,1,Kachin State,Taw Mhaw(356),27,10,2010,26,1,2016,Taw Mhaw,356,2010-10-27,2016-1-26
254,Myanmar  imperial jade,Private,Oo Si(3/10)(28.9.10),27.10.2010,26.1.2016,Jade,1,Kachin State,Taw Mhaw(357),27,10,2010,26,1,2016,Taw Mhaw,357,2010-10-27,2016-1-26
255,Myanmar  imperial jade,Private,Oo Si(3/10)(28.9.10),27.10.2010,26.1.2016,Jade,1,Kachin State,Taw Mhaw(358),27,10,2010,26,1,2016,Taw Mhaw,358,2010-10-27,2016-1-26
256,Myanmar  imperial jade,Private,Oo Si(3/10)(28.9.10),27.10.2010,26.1.2016,Jade,1,Kachin State,Taw Mhaw(359),27,10,2010,26,1,2016,Taw Mhaw,359,2010-10-27,2016-1-26
257,Myanmar  imperial jade,Private,Oo Si(3/10)(28.9.10),27.10.2010,26.1.2016,Jade,1,Kachin State,Taw Mhaw(360),27,10,2010,26,1,2016,Taw Mhaw,360,2010-10-27,2016-1-26
258,Myanmar  imperial jade,Private,Oo Si(3/10)(28.9.10),27.10.2010,26.1.2016,Jade,1,Kachin State,Taw Mhaw(361),27,10,2010,26,1,2016,Taw Mhaw,361,2010-10-27,2016-1-26
259,Myanmar  imperial jade,Private,Oo Si(3/10)(28.9.10),27.10.2010,26.1.2016,Jade,1,Kachin State,Taw Mhaw(362),27,10,2010,26,1,2016,Taw Mhaw,362,2010-10-27,2016-1-26
260,Myanmar  imperial jade,Private,Oo Si(3/10)(28.9.10),27.10.2010,26.1.2016,Jade,1,Kachin State,Taw Mhaw(363),27,10,2010,26,1,2016,Taw Mhaw,363,2010-10-27,2016-1-26
261,Myanmar  imperial jade,Private,Oo Si(3/10)(28.9.10),27.10.2010,26.1.2016,Jade,1,Kachin State,Taw Mhaw(364),27,10,2010,26,1,2016,Taw Mhaw,364,2010-10-27,2016-1-26
262,Myanmar  imperial jade,Private,Oo Si(3/10)(28.9.10),27.10.2010,26.1.2016,Jade,1,Kachin State,Taw Mhaw(365),27,10,2010,26,1,2016,Taw Mhaw,365,2010-10-27,2016-1-26
263,Myanmar  imperial jade,Private,Oo Si(3/10)(28.9.10),27.10.2010,26.1.2016,Jade,1,Kachin State,Taw Mhaw(366),27,10,2010,26,1,2016,Taw Mhaw,366,2010-10-27,2016-1-26
264,Myanmar  imperial jade,Private,Oo Si(3/10)(28.9.10),27.10.2010,26.1.2016,Jade,1,Kachin State,Taw Mhaw(367),27,10,2010,26,1,2016,Taw Mhaw,367,2010-10-27,2016-1-26
265,Myanmar  imperial jade,Private,Oo Si(3/10)(28.9.10),27.10.2010,26.1.2016,Jade,1,Kachin State,Taw Mhaw(368),27,10,2010,26,1,2016,Taw Mhaw,368,2010-10-27,2016-1-26
266,Myanmar  imperial jade,Private,Oo Si(3/10)(28.9.10),27.10.2010,26.1.2016,Jade,1,Kachin State,Taw Mhaw(369),27,10,2010,26,1,2016,Taw Mhaw,369,2010-10-27,2016-1-26
267,Myanmar  imperial jade,Private,Oo Si(3/10)(28.9.10),27.10.2010,26.1.2016,Jade,1,Kachin State,Taw Mhaw(370),27,10,2010,26,1,2016,Taw Mhaw,370,2010-10-27,2016-1-26
268,Myanmar  imperial jade,Private,Oo Si(3/10)(28.9.10),27.10.2010,26.1.2016,Jade,1,Kachin State,Taw Mhaw(371),27,10,2010,26,1,2016,Taw Mhaw,371,2010-10-27,2016-1-26
269,Myanmar  imperial jade,Private,Oo Si(3/10)(28.9.10),27.10.2010,26.1.2016,Jade,1,Kachin State,Taw Mhaw(372),27,10,2010,26,1,2016,Taw Mhaw,372,2010-10-27,2016-1-26
270,Myanmar  imperial jade,Private,Oo Si(3/10)(28.9.10),27.10.2010,26.1.2016,Jade,1,Kachin State,Taw Mhaw(373),27,10,2010,26,1,2016,Taw Mhaw,373,2010-10-27,2016-1-26
271,Myanmar  imperial jade,Private,Oo Si(3/10)(28.9.10),27.10.2010,26.1.2016,Jade,1,Kachin State,Taw Mhaw(374),27,10,2010,26,1,2016,Taw Mhaw,374,2010-10-27,2016-1-26
272,Myanmar  imperial jade,Private,Oo Si(3/10)(28.9.10),27.10.2010,26.1.2016,Jade,1,Kachin State,Taw Mhaw(375),27,10,2010,26,1,2016,Taw Mhaw,375,2010-10-27,2016-1-26
273,Myanmar  imperial jade,Private,Oo Si(3/10)(28.9.10),27.10.2010,26.1.2016,Jade,1,Kachin State,Taw Mhaw(376),27,10,2010,26,1,2016,Taw Mhaw,376,2010-10-27,2016-1-26
274,Myanmar  imperial jade,Private,Oo Si(3/10)(28.9.10),27.10.2010,26.1.2016,Jade,1,Kachin State,Taw Mhaw(377),27,10,2010,26,1,2016,Taw Mhaw,377,2010-10-27,2016-1-26
275,Myanmar  imperial jade,Private,Oo Si(3/10)(28.9.10),27.10.2010,26.1.2016,Jade,1,Kachin State,Taw Mhaw(378),27,10,2010,26,1,2016,Taw Mhaw,378,2010-10-27,2016-1-26
276,Myanmar  imperial jade,Private,Oo Si(3/10)(28.9.10),27.10.2010,26.1.2016,Jade,1,Kachin State,Taw Mhaw(379),27,10,2010,26,1,2016,Taw Mhaw,379,2010-10-27,2016-1-26
277,Myanmar  imperial jade,Private,Oo Si(3/10)(28.9.10),27.10.2010,26.1.2016,Jade,1,Kachin State,Taw Mhaw(380),27,10,2010,26,1,2016,Taw Mhaw,380,2010-10-27,2016-1-26
278,Myanmar  imperial jade,Private,Oo Si(3/10)(28.9.10),27.10.2010,26.1.2016,Jade,1,Kachin State,Taw Mhaw(381),27,10,2010,26,1,2016,Taw Mhaw,381,2010-10-27,2016-1-26
279,Myanmar  imperial jade,Private,Oo Si(3/10)(28.9.10),27.10.2010,26.1.2016,Jade,1,Kachin State,Taw Mhaw(382),27,10,2010,26,1,2016,Taw Mhaw,382,2010-10-27,2016-1-26
280,Myanmar  imperial jade,Private,Oo Si(3/10)(28.9.10),27.10.2010,26.1.2016,Jade,1,Kachin State,Taw Mhaw(383),27,10,2010,26,1,2016,Taw Mhaw,383,2010-10-27,2016-1-26
281,Myanmar  imperial jade,Private,Oo Si(3/10)(28.9.10),27.10.2010,26.1.2016,Jade,1,Kachin State,Taw Mhaw(384),27,10,2010,26,1,2016,Taw Mhaw,384,2010-10-27,2016-1-26
282,Myanmar  imperial jade,Private,Oo Si(3/10)(28.9.10),27.10.2010,26.1.2016,Jade,1,Kachin State,Taw Mhaw(385),27,10,2010,26,1,2016,Taw Mhaw,385,2010-10-27,2016-1-26
283,Myanmar  imperial jade,Private,Oo Si(3/10)(28.9.10),27.10.2010,26.1.2016,Jade,1,Kachin State,Taw Mhaw(386),27,10,2010,26,1,2016,Taw Mhaw,386,2010-10-27,2016-1-26
284,Myanmar  imperial jade,Private,Oo Si(3/10)(28.9.10),27.10.2010,26.1.2016,Jade,1,Kachin State,Taw Mhaw(387),27,10,2010,26,1,2016,Taw Mhaw,387,2010-10-27,2016-1-26
285,Myanmar  imperial jade,Private,Oo Si(3/10)(28.9.10),27.10.2010,26.1.2016,Jade,1,Kachin State,Taw Mhaw(388),27,10,2010,26,1,2016,Taw Mhaw,388,2010-10-27,2016-1-26
286,Myanmar  imperial jade,Private,Oo Si(3/10)(28.9.10),27.10.2010,26.1.2016,Jade,1,Kachin State,Taw Mhaw(389),27,10,2010,26,1,2016,Taw Mhaw,389,2010-10-27,2016-1-26
287,Myanmar  imperial jade,Private,Oo Si(3/10)(28.9.10),27.10.2010,26.1.2016,Jade,1,Kachin State,Taw Mhaw(390),27,10,2010,26,1,2016,Taw Mhaw,390,2010-10-27,2016-1-26
288,Myanmar  imperial jade,Private,Oo Si(3/10)(28.9.10),27.10.2010,26.1.2016,Jade,1,Kachin State,Taw Mhaw(391),27,10,2010,26,1,2016,Taw Mhaw,391,2010-10-27,2016-1-26
289,Myanmar  imperial jade,Private,Oo Si(3/10)(28.9.10),27.10.2010,26.1.2016,Jade,1,Kachin State,Taw Mhaw(392),27,10,2010,26,1,2016,Taw Mhaw,392,2010-10-27,2016-1-26
290,Myanmar  imperial jade,Private,Oo Si(3/10)(28.9.10),27.10.2010,26.1.2016,Jade,1,Kachin State,Taw Mhaw(393),27,10,2010,26,1,2016,Taw Mhaw,393,2010-10-27,2016-1-26
291,Myanmar  imperial jade,Private,Oo Si(3/10)(28.9.10),27.10.2010,26.1.2016,Jade,1,Kachin State,Taw Mhaw(394),27,10,2010,26,1,2016,Taw Mhaw,394,2010-10-27,2016-1-26
292,Myanmar  imperial jade,Private,Oo Si(3/10)(28.9.10),27.10.2010,26.1.2016,Jade,1,Kachin State,Taw Mhaw(395),27,10,2010,26,1,2016,Taw Mhaw,395,2010-10-27,2016-1-26
293,Myanmar  imperial jade,Private,Oo Si(3/10)(28.9.10),27.10.2010,26.1.2016,Jade,1,Kachin State,Taw Mhaw(396),27,10,2010,26,1,2016,Taw Mhaw,396,2010-10-27,2016-1-26
294,Myanmar  imperial jade,Private,Oo Si(3/10)(28.9.10),27.10.2010,26.1.2016,Jade,1,Kachin State,Taw Mhaw(397),27,10,2010,26,1,2016,Taw Mhaw,397,2010-10-27,2016-1-26
295,Myanmar  imperial jade,Private,Oo Si(3/10)(28.9.10),27.10.2010,26.1.2016,Jade,1,Kachin State,Taw Mhaw(398),27,10,2010,26,1,2016,Taw Mhaw,398,2010-10-27,2016-1-26
296,Myanmar  imperial jade,Private,Oo Si(3/10)(28.9.10),27.10.2010,26.1.2016,Jade,1,Kachin State,Taw Mhaw(399),27,10,2010,26,1,2016,Taw Mhaw,399,2010-10-27,2016-1-26
297,Myanmar  imperial jade,Private,Oo Si(3/10)(28.9.10),27.10.2010,26.1.2016,Jade,1,Kachin State,Taw Mhaw(400),27,10,2010,26,1,2016,Taw Mhaw,400,2010-10-27,2016-1-26
298,Myanmar  imperial jade,Private,Oo Si(3/10)(28.9.10),27.10.2010,26.1.2016,Jade,1,Kachin State,Taw Mhaw(401),27,10,2010,26,1,2016,Taw Mhaw,401,2010-10-27,2016-1-26
299,Myanmar  imperial jade,Private,Oo Si(3/10)(28.9.10),27.10.2010,26.1.2016,Jade,1,Kachin State,Taw Mhaw(402),27,10,2010,26,1,2016,Taw Mhaw,402,2010-10-27,2016-1-26
300,Myanmar  imperial jade,Private,Oo Si(3/10)(28.9.10),27.10.2010,26.1.2016,Jade,1,Kachin State,Taw Mhaw(403),27,10,2010,26,1,2016,Taw Mhaw,403,2010-10-27,2016-1-26
301,Myanmar  imperial jade,Private,Oo Si(2/11)(19.6.11),15.8.2011,13.11.2016,Jade,1,Kachin State,San Khar(341),15,8,2011,13,11,2016,San Khar,341,2011-8-15,2016-11-13
302,Myanmar  imperial jade,Private,Oo Si(2/11)(19.6.11),15.8.2011,13.11.2016,Jade,1,Kachin State,San Khar(342),15,8,2011,13,11,2016,San Khar,342,2011-8-15,2016-11-13
303,Myanmar  imperial jade,Private,Oo Si(2/11)(19.6.11),15.8.2011,13.11.2016,Jade,1,Kachin State,San Khar(343),15,8,2011,13,11,2016,San Khar,343,2011-8-15,2016-11-13
304,Myanmar  imperial jade,Private,Oo Si(2/11)(19.6.11),15.8.2011,13.11.2016,Jade,1,Kachin State,San Khar(344),15,8,2011,13,11,2016,San Khar,344,2011-8-15,2016-11-13
305,Myanmar  imperial jade,Private,Oo Si(2/11)(19.6.11),15.8.2011,13.11.2016,Jade,1,Kachin State,San Khar(345),15,8,2011,13,11,2016,San Khar,345,2011-8-15,2016-11-13
306,Myanmar  imperial jade,Private,Oo Si(2/11)(19.6.11),15.8.2011,13.11.2016,Jade,1,Kachin State,San Khar(346),15,8,2011,13,11,2016,San Khar,346,2011-8-15,2016-11-13
307,Myanmar  imperial jade,Private,Oo Si(2/11)(19.6.11),15.8.2011,13.11.2016,Jade,1,Kachin State,San Khar(347),15,8,2011,13,11,2016,San Khar,347,2011-8-15,2016-11-13
308,Myanmar  imperial jade,Private,Oo Si(2/11)(19.6.11),15.8.2011,13.11.2016,Jade,1,Kachin State,San Khar(348),15,8,2011,13,11,2016,San Khar,348,2011-8-15,2016-11-13
309,Myanmar  imperial jade,Private,Oo Si(2/11)(19.6.11),15.8.2011,13.11.2016,Jade,1,Kachin State,San Khar(349),15,8,2011,13,11,2016,San Khar,349,2011-8-15,2016-11-13
310,Myanmar  imperial jade,Private,Oo Si(2/11)(19.6.11),15.8.2011,13.11.2016,Jade,1,Kachin State,San Khar(350),15,8,2011,13,11,2016,San Khar,350,2011-8-15,2016-11-13
311,Myanmar  imperial jade,Private,Oo Si(2/11)(19.6.11),15.8.2011,13.11.2016,Jade,1,Kachin State,San Khar(351),15,8,2011,13,11,2016,San Khar,351,2011-8-15,2016-11-13
312,Myanmar  imperial jade,Private,Oo Si(2/11)(19.6.11),15.8.2011,13.11.2016,Jade,1,Kachin State,San Khar(352),15,8,2011,13,11,2016,San Khar,352,2011-8-15,2016-11-13
313,Myanmar  imperial jade,Private,Oo Si(2/11)(19.6.11),15.8.2011,13.11.2016,Jade,1,Kachin State,San Khar(353),15,8,2011,13,11,2016,San Khar,353,2011-8-15,2016-11-13
314,Myanmar  imperial jade,Private,Oo Si(2/11)(19.6.11),15.8.2011,13.11.2016,Jade,1,Kachin State,San Khar(354),15,8,2011,13,11,2016,San Khar,354,2011-8-15,2016-11-13
315,Myanmar  imperial jade,Private,Oo Si(2/11)(19.6.11),15.8.2011,13.11.2016,Jade,1,Kachin State,San Khar(355),15,8,2011,13,11,2016,San Khar,355,2011-8-15,2016-11-13
316,Myanmar  imperial jade,Private,Oo Si(2/11)(19.6.11),15.8.2011,13.11.2016,Jade,1,Kachin State,San Khar(356),15,8,2011,13,11,2016,San Khar,356,2011-8-15,2016-11-13
317,Myanmar  imperial jade,Private,Oo Si(2/11)(19.6.11),15.8.2011,13.11.2016,Jade,1,Kachin State,San Khar(357),15,8,2011,13,11,2016,San Khar,357,2011-8-15,2016-11-13
318,Myanmar  imperial jade,Private,Oo Si(2/11)(19.6.11),15.8.2011,13.11.2016,Jade,1,Kachin State,San Khar(358),15,8,2011,13,11,2016,San Khar,358,2011-8-15,2016-11-13
319,Myanmar  imperial jade,Private,Oo Si(2/11)(19.6.11),15.8.2011,13.11.2016,Jade,1,Kachin State,San Khar(359),15,8,2011,13,11,2016,San Khar,359,2011-8-15,2016-11-13
320,Myanmar  imperial jade,Private,Oo Si(2/11)(19.6.11),15.8.2011,13.11.2016,Jade,1,Kachin State,San Khar(360),15,8,2011,13,11,2016,San Khar,360,2011-8-15,2016-11-13
321,Myanmar  imperial jade,Private,Oo Si(2/11)(19.6.11),15.8.2011,13.11.2016,Jade,1,Kachin State,San Khar(361),15,8,2011,13,11,2016,San Khar,361,2011-8-15,2016-11-13
322,Myanmar  imperial jade,Private,Oo Si(2/11)(19.6.11),15.8.2011,13.11.2016,Jade,1,Kachin State,San Khar(362),15,8,2011,13,11,2016,San Khar,362,2011-8-15,2016-11-13
323,Myanmar  imperial jade,Private,Oo Si(2/11)(19.6.11),15.8.2011,13.11.2016,Jade,1,Kachin State,San Khar(363),15,8,2011,13,11,2016,San Khar,363,2011-8-15,2016-11-13
324,Myanmar  imperial jade,Private,Oo Si(2/11)(19.6.11),15.8.2011,13.11.2016,Jade,1,Kachin State,San Khar(364),15,8,2011,13,11,2016,San Khar,364,2011-8-15,2016-11-13
325,Myanmar  imperial jade,Private,Oo Si(2/11)(19.6.11),15.8.2011,13.11.2016,Jade,1,Kachin State,San Khar(365),15,8,2011,13,11,2016,San Khar,365,2011-8-15,2016-11-13
326,Myanmar  imperial jade,Private,Oo Si(2/11)(19.6.11),15.8.2011,13.11.2016,Jade,1,Kachin State,San Khar(366),15,8,2011,13,11,2016,San Khar,366,2011-8-15,2016-11-13
327,Myanmar  imperial jade,Private,Oo Si(2/11)(19.6.11),15.8.2011,13.11.2016,Jade,1,Kachin State,San Khar(367),15,8,2011,13,11,2016,San Khar,367,2011-8-15,2016-11-13
328,Myanmar  imperial jade,Private,Oo Si(2/11)(19.6.11),15.8.2011,13.11.2016,Jade,1,Kachin State,San Khar(368),15,8,2011,13,11,2016,San Khar,368,2011-8-15,2016-11-13
329,Myanmar  imperial jade,Private,Oo Si(2/11)(19.6.11),15.8.2011,13.11.2016,Jade,1,Kachin State,San Khar(369),15,8,2011,13,11,2016,San Khar,369,2011-8-15,2016-11-13
330,Myanmar  imperial jade,Private,Oo Si(2/11)(19.6.11),15.8.2011,13.11.2016,Jade,1,Kachin State,San Khar(370),15,8,2011,13,11,2016,San Khar,370,2011-8-15,2016-11-13
331,Myanmar  imperial jade,Private,Oo Si(4/15)(18.12.15),1.2.2016,31.1.2019,Jade,1,Kachin State,Ma Kyan Kha Phaw Htot(41),1,2,2016,31,1,2019,Ma Kyan Kha Phaw Htot,41,2016-2-1,2019-1-31
332,Myanmar  imperial jade,Private,Oo Si(4/15)(18.12.15),1.2.2016,31.1.2019,Jade,1,Kachin State,Ma Kyan Kha Phaw Htot(42),1,2,2016,31,1,2019,Ma Kyan Kha Phaw Htot,42,2016-2-1,2019-1-31
333,Myanmar  imperial jade,Private,Oo Si(4/15)(18.12.15),1.2.2016,31.1.2019,Jade,1,Kachin State,Ma Kyan Kha Phaw Htot(43),1,2,2016,31,1,2019,Ma Kyan Kha Phaw Htot,43,2016-2-1,2019-1-31
334,Myanmar  imperial jade,Private,Oo Si(4/15)(18.12.15),1.2.2016,31.1.2019,Jade,1,Kachin State,Ma Kyan Kha Phaw Htot(44),1,2,2016,31,1,2019,Ma Kyan Kha Phaw Htot,44,2016-2-1,2019-1-31
335,Myanmar  imperial jade,Private,Oo Si(4/15)(18.12.15),1.2.2016,31.1.2019,Jade,1,Kachin State,Ma Kyan Kha Phaw Htot(45),1,2,2016,31,1,2019,Ma Kyan Kha Phaw Htot,45,2016-2-1,2019-1-31
336,Myanmar  imperial jade,Private,Oo Si(4/15)(18.12.15),1.2.2016,31.1.2019,Jade,1,Kachin State,Ma Kyan Kha Phaw Htot(57),1,2,2016,31,1,2019,Ma Kyan Kha Phaw Htot,57,2016-2-1,2019-1-31
337,Myanmar  imperial jade,Private,Oo Si(4/15)(18.12.15),1.2.2016,31.1.2019,Jade,1,Kachin State,Ma Kyan Kha Phaw Htot(58),1,2,2016,31,1,2019,Ma Kyan Kha Phaw Htot,58,2016-2-1,2019-1-31
338,Myanmar  imperial jade,Private,Oo Si(4/15)(18.12.15),1.2.2016,31.1.2019,Jade,1,Kachin State,Ma Kyan Kha Phaw Htot(59),1,2,2016,31,1,2019,Ma Kyan Kha Phaw Htot,59,2016-2-1,2019-1-31
339,Myanmar  imperial jade,Private,Oo Si(4/15)(18.12.15),1.2.2016,31.1.2019,Jade,1,Kachin State,Ma Kyan Kha Phaw Htot(60),1,2,2016,31,1,2019,Ma Kyan Kha Phaw Htot,60,2016-2-1,2019-1-31
340,Myanmar  imperial jade,Private,Oo Si(4/15)(18.12.15),1.2.2016,31.1.2019,Jade,1,Kachin State,Ma Kyan Kha Phaw Htot(61),1,2,2016,31,1,2019,Ma Kyan Kha Phaw Htot,61,2016-2-1,2019-1-31
341,Myanmar  imperial jade,Private,Oo Si(4/15)(18.12.15),1.2.2016,31.1.2019,Jade,1,Kachin State,Ma Kyan Kha Phaw Htot(72),1,2,2016,31,1,2019,Ma Kyan Kha Phaw Htot,72,2016-2-1,2019-1-31
342,Myanmar  imperial jade,Private,Oo Si(4/15)(18.12.15),1.2.2016,31.1.2019,Jade,1,Kachin State,Ma Kyan Kha Phaw Htot(73),1,2,2016,31,1,2019,Ma Kyan Kha Phaw Htot,73,2016-2-1,2019-1-31
343,Myanmar  imperial jade,Private,Oo Si(4/15)(18.12.15),1.2.2016,31.1.2019,Jade,1,Kachin State,Ma Kyan Kha Phaw Htot(74),1,2,2016,31,1,2019,Ma Kyan Kha Phaw Htot,74,2016-2-1,2019-1-31
344,Myanmar  imperial jade,Private,Oo Si(4/15)(18.12.15),1.2.2016,31.1.2019,Jade,1,Kachin State,Ma Kyan Kha Phaw Htot(75),1,2,2016,31,1,2019,Ma Kyan Kha Phaw Htot,75,2016-2-1,2019-1-31
345,Myanmar  imperial jade,Private,Oo Si(4/15)(18.12.15),1.2.2016,31.1.2019,Jade,1,Kachin State,Ma Kyan Kha Phaw Htot(76),1,2,2016,31,1,2019,Ma Kyan Kha Phaw Htot,76,2016-2-1,2019-1-31
346,Myanmar  imperial jade,Private,Oo Si(4/15)(18.12.15),1.2.2016,31.1.2019,Jade,1,Kachin State,Ma Kyan Kha Phaw Htot(82),1,2,2016,31,1,2019,Ma Kyan Kha Phaw Htot,82,2016-2-1,2019-1-31
347,Myanmar  imperial jade,Private,Oo Si(4/15)(18.12.15),1.2.2016,31.1.2019,Jade,1,Kachin State,Ma Kyan Kha Phaw Htot(83),1,2,2016,31,1,2019,Ma Kyan Kha Phaw Htot,83,2016-2-1,2019-1-31
348,Myanmar  imperial jade,Private,Oo Si(4/15)(18.12.15),1.2.2016,31.1.2019,Jade,1,Kachin State,Ma Kyan Kha Phaw Htot(84),1,2,2016,31,1,2019,Ma Kyan Kha Phaw Htot,84,2016-2-1,2019-1-31
349,Myanmar  imperial jade,Private,Oo Si(4/15)(18.12.15),1.2.2016,31.1.2019,Jade,1,Kachin State,Ma Kyan Kha Phaw Htot(85),1,2,2016,31,1,2019,Ma Kyan Kha Phaw Htot,85,2016-2-1,2019-1-31
350,Myanmar  imperial jade,Private,Oo Si(4/15)(18.12.15),1.2.2016,31.1.2019,Jade,1,Kachin State,Ma Kyan Kha Phaw Htot(86),1,2,2016,31,1,2019,Ma Kyan Kha Phaw Htot,86,2016-2-1,2019-1-31
351,Myanmar  imperial jade,Private,Oo Si(4/15)(18.12.15),1.2.2016,31.1.2019,Jade,1,Kachin State,Ma Kyan Kha Phaw Htot(90),1,2,2016,31,1,2019,Ma Kyan Kha Phaw Htot,90,2016-2-1,2019-1-31
352,Myanmar  imperial jade,Private,Oo Si(4/15)(18.12.15),1.2.2016,31.1.2019,Jade,1,Kachin State,Ma Kyan Kha Phaw Htot(91),1,2,2016,31,1,2019,Ma Kyan Kha Phaw Htot,91,2016-2-1,2019-1-31
353,Myanmar  imperial jade,Private,Oo Si(4/15)(18.12.15),1.2.2016,31.1.2019,Jade,1,Kachin State,Ma Kyan Kha Phaw Htot(92),1,2,2016,31,1,2019,Ma Kyan Kha Phaw Htot,92,2016-2-1,2019-1-31
354,Myanmar  imperial jade,Private,Oo Si(4/15)(18.12.15),1.2.2016,31.1.2019,Jade,1,Kachin State,Ma Kyan Kha Phaw Htot(93),1,2,2016,31,1,2019,Ma Kyan Kha Phaw Htot,93,2016-2-1,2019-1-31
355,Myanmar  imperial jade,Private,Oo Si(4/15)(18.12.15),1.2.2016,31.1.2019,Jade,1,Kachin State,Ma Kyan Kha Phaw Htot(94),1,2,2016,31,1,2019,Ma Kyan Kha Phaw Htot,94,2016-2-1,2019-1-31
356,Myanmar  imperial jade,Private,Oo Si(4/15)(18.12.15),1.2.2016,31.1.2019,Jade,1,Kachin State,Ma Kyan Kha Phaw Htot(101),1,2,2016,31,1,2019,Ma Kyan Kha Phaw Htot,101,2016-2-1,2019-1-31
357,Myanmar  imperial jade,Private,Oo Si(4/15)(18.12.15),1.2.2016,31.1.2019,Jade,1,Kachin State,Ma Kyan Kha Phaw Htot(102),1,2,2016,31,1,2019,Ma Kyan Kha Phaw Htot,102,2016-2-1,2019-1-31
358,Myanmar  imperial jade,Private,Oo Si(4/15)(18.12.15),1.2.2016,31.1.2019,Jade,1,Kachin State,Ma Kyan Kha Phaw Htot(103),1,2,2016,31,1,2019,Ma Kyan Kha Phaw Htot,103,2016-2-1,2019-1-31
359,Myanmar  imperial jade,Private,Oo Si(4/15)(18.12.15),1.2.2016,31.1.2019,Jade,1,Kachin State,Ma Kyan Kha Phaw Htot(104),1,2,2016,31,1,2019,Ma Kyan Kha Phaw Htot,104,2016-2-1,2019-1-31
360,Myanmar  imperial jade,Private,Oo Si(4/15)(18.12.15),1.2.2016,31.1.2019,Jade,1,Kachin State,Ma Kyan Kha Phaw Htot(105),1,2,2016,31,1,2019,Ma Kyan Kha Phaw Htot,105,2016-2-1,2019-1-31
361,Myanmar  imperial jade,Private,Oo Si(4/15)(18.12.15),1.2.2016,31.1.2019,Jade,1,Kachin State,Ma Kyan Kha Phaw Htot(112),1,2,2016,31,1,2019,Ma Kyan Kha Phaw Htot,112,2016-2-1,2019-1-31
362,Myanmar  imperial jade,Private,Oo Si(4/15)(18.12.15),1.2.2016,31.1.2019,Jade,1,Kachin State,Ma Kyan Kha Phaw Htot(113),1,2,2016,31,1,2019,Ma Kyan Kha Phaw Htot,113,2016-2-1,2019-1-31
363,Myanmar  imperial jade,Private,Oo Si(4/15)(18.12.15),1.2.2016,31.1.2019,Jade,1,Kachin State,Ma Kyan Kha Phaw Htot(114),1,2,2016,31,1,2019,Ma Kyan Kha Phaw Htot,114,2016-2-1,2019-1-31
364,Myanmar  imperial jade,Private,Oo Si(4/15)(18.12.15),1.2.2016,31.1.2019,Jade,1,Kachin State,Ma Kyan Kha Phaw Htot(115),1,2,2016,31,1,2019,Ma Kyan Kha Phaw Htot,115,2016-2-1,2019-1-31
365,Myanmar  imperial jade,Private,Oo Si(4/15)(18.12.15),1.2.2016,31.1.2019,Jade,1,Kachin State,Ma Kyan Kha Phaw Htot(116),1,2,2016,31,1,2019,Ma Kyan Kha Phaw Htot,116,2016-2-1,2019-1-31
366,Myanmar  imperial jade,Private,Oo Si(4/15)(18.12.15),1.2.2016,31.1.2019,Jade,1,Kachin State,Ma Kyan Kha Phaw Htot(123),1,2,2016,31,1,2019,Ma Kyan Kha Phaw Htot,123,2016-2-1,2019-1-31
367,Myanmar  imperial jade,Private,Oo Si(4/15)(18.12.15),1.2.2016,31.1.2019,Jade,1,Kachin State,Ma Kyan Kha Phaw Htot(124),1,2,2016,31,1,2019,Ma Kyan Kha Phaw Htot,124,2016-2-1,2019-1-31
368,Myanmar  imperial jade,Private,Oo Si(4/15)(18.12.15),1.2.2016,31.1.2019,Jade,1,Kachin State,Ma Kyan Kha Phaw Htot(125),1,2,2016,31,1,2019,Ma Kyan Kha Phaw Htot,125,2016-2-1,2019-1-31
369,Myanmar  imperial jade,Private,Oo Si(4/15)(18.12.15),1.2.2016,31.1.2019,Jade,1,Kachin State,Ma Kyan Kha Phaw Htot(126),1,2,2016,31,1,2019,Ma Kyan Kha Phaw Htot,126,2016-2-1,2019-1-31
370,Myanmar  imperial jade,Private,Oo Si(4/15)(18.12.15),1.2.2016,31.1.2019,Jade,1,Kachin State,Ma Kyan Kha Phaw Htot(127),1,2,2016,31,1,2019,Ma Kyan Kha Phaw Htot,127,2016-2-1,2019-1-31
371,Myanmar  imperial jade,Private,Oo Si(4/15)(18.12.15),1.2.2016,31.1.2019,Jade,1,Kachin State,Ma Kyan Kha Phaw Htot(131),1,2,2016,31,1,2019,Ma Kyan Kha Phaw Htot,131,2016-2-1,2019-1-31
372,Myanmar  imperial jade,Private,Oo Si(4/15)(18.12.15),1.2.2016,31.1.2019,Jade,1,Kachin State,Ma Kyan Kha Phaw Htot(132),1,2,2016,31,1,2019,Ma Kyan Kha Phaw Htot,132,2016-2-1,2019-1-31
373,Myanmar  imperial jade,Private,Oo Si(4/15)(18.12.15),1.2.2016,31.1.2019,Jade,1,Kachin State,Ma Kyan Kha Phaw Htot(133),1,2,2016,31,1,2019,Ma Kyan Kha Phaw Htot,133,2016-2-1,2019-1-31
374,Myanmar  imperial jade,Private,Oo Si(4/15)(18.12.15),1.2.2016,31.1.2019,Jade,1,Kachin State,Ma Kyan Kha Phaw Htot(134),1,2,2016,31,1,2019,Ma Kyan Kha Phaw Htot,134,2016-2-1,2019-1-31
375,Myanmar  imperial jade,Private,Oo Si(4/15)(18.12.15),1.2.2016,31.1.2019,Jade,1,Kachin State,Ma Kyan Kha Phaw Htot(135),1,2,2016,31,1,2019,Ma Kyan Kha Phaw Htot,135,2016-2-1,2019-1-31
376,Myanmar  imperial jade,Private,Oo Si(4/15)(18.12.15),1.2.2016,31.1.2019,Jade,1,Kachin State,Ma Kyan Kha Phaw Htot(139),1,2,2016,31,1,2019,Ma Kyan Kha Phaw Htot,139,2016-2-1,2019-1-31
377,Myanmar  imperial jade,Private,Oo Si(4/15)(18.12.15),1.2.2016,31.1.2019,Jade,1,Kachin State,Ma Kyan Kha Phaw Htot(140),1,2,2016,31,1,2019,Ma Kyan Kha Phaw Htot,140,2016-2-1,2019-1-31
378,Myanmar  imperial jade,Private,Oo Si(4/15)(18.12.15),1.2.2016,31.1.2019,Jade,1,Kachin State,Ma Kyan Kha Phaw Htot(141),1,2,2016,31,1,2019,Ma Kyan Kha Phaw Htot,141,2016-2-1,2019-1-31
379,Myanmar  imperial jade,Private,Oo Si(4/15)(18.12.15),1.2.2016,31.1.2019,Jade,1,Kachin State,Ma Kyan Kha Phaw Htot(142),1,2,2016,31,1,2019,Ma Kyan Kha Phaw Htot,142,2016-2-1,2019-1-31
380,Myanmar  imperial jade,Private,Oo Si(4/15)(18.12.15),1.2.2016,31.1.2019,Jade,1,Kachin State,Ma Kyan Kha Phaw Htot(143),1,2,2016,31,1,2019,Ma Kyan Kha Phaw Htot,143,2016-2-1,2019-1-31
381,Myanmar  imperial jade,Private,Oo Si(4/15)(18.12.15),1.2.2016,31.1.2019,Jade,1,Kachin State,Ma Kyan Kha Phaw Htot(150),1,2,2016,31,1,2019,Ma Kyan Kha Phaw Htot,150,2016-2-1,2019-1-31
382,Myanmar  imperial jade,Private,Oo Si(4/15)(18.12.15),1.2.2016,31.1.2019,Jade,1,Kachin State,Ma Kyan Kha Phaw Htot(151),1,2,2016,31,1,2019,Ma Kyan Kha Phaw Htot,151,2016-2-1,2019-1-31
383,Myanmar  imperial jade,Private,Oo Si(4/15)(18.12.15),1.2.2016,31.1.2019,Jade,1,Kachin State,Ma Kyan Kha Phaw Htot(152),1,2,2016,31,1,2019,Ma Kyan Kha Phaw Htot,152,2016-2-1,2019-1-31
384,Myanmar  imperial jade,Private,Oo Si(4/15)(18.12.15),1.2.2016,31.1.2019,Jade,1,Kachin State,Ma Kyan Kha Phaw Htot(153),1,2,2016,31,1,2019,Ma Kyan Kha Phaw Htot,153,2016-2-1,2019-1-31
385,Myanmar  imperial jade,Private,Oo Si(4/15)(18.12.15),1.2.2016,31.1.2019,Jade,1,Kachin State,Ma Kyan Kha Phaw Htot(154),1,2,2016,31,1,2019,Ma Kyan Kha Phaw Htot,154,2016-2-1,2019-1-31
386,Myanmar  imperial jade,Private,(5/10)(28.9.10),1.11.2010,31.1.2016,Jade,1,Kachin State,Ma Kyan Kha Maw Tit  Phaw Htot(161),1,11,2010,31,1,2016,Ma Kyan Kha Maw Tit  Phaw Htot,161,2010-11-1,2016-1-31
387,Myanmar  imperial jade,Private,Oo Si(4/15)(18.12.15),1.2.2016,31.1.2019,Jade,1,Kachin State,Ma Kyan Kha Phaw Htot(162),1,2,2016,31,1,2019,Ma Kyan Kha Phaw Htot,162,2016-2-1,2019-1-31
388,Myanmar  imperial jade,Private,Oo Si(4/15)(18.12.15),1.2.2016,31.1.2019,Jade,1,Kachin State,Ma Kyan Kha Phaw Htot(163),1,2,2016,31,1,2019,Ma Kyan Kha Phaw Htot,163,2016-2-1,2019-1-31
389,Myanmar  imperial jade,Private,Oo Si(4/15)(18.12.15),1.2.2016,31.1.2019,Jade,1,Kachin State,Ma Kyan Kha Phaw Htot(164),1,2,2016,31,1,2019,Ma Kyan Kha Phaw Htot,164,2016-2-1,2019-1-31
390,Myanmar  imperial jade,Private,Oo Si(4/15)(18.12.15),1.2.2016,31.1.2019,Jade,1,Kachin State,Ma Kyan Kha Phaw Htot(165),1,2,2016,31,1,2019,Ma Kyan Kha Phaw Htot,165,2016-2-1,2019-1-31
391,Myanmar  imperial jade,Private,(5/10)(28.9.10),1.11.2010,31.1.2016,Jade,1,Kachin State,Ma Kyan Kha Maw Tit  Phaw Htot(172),1,11,2010,31,1,2016,Ma Kyan Kha Maw Tit  Phaw Htot,172,2010-11-1,2016-1-31
392,Myanmar  imperial jade,Private,Oo Si(4/15)(18.12.15),1.2.2016,31.1.2019,Jade,1,Kachin State,Ma Kyan Kha Phaw Htot(173),1,2,2016,31,1,2019,Ma Kyan Kha Phaw Htot,173,2016-2-1,2019-1-31
393,Myanmar  imperial jade,Private,Oo Si(4/15)(18.12.15),1.2.2016,31.1.2019,Jade,1,Kachin State,Ma Kyan Kha Phaw Htot(174),1,2,2016,31,1,2019,Ma Kyan Kha Phaw Htot,174,2016-2-1,2019-1-31
394,Myanmar  imperial jade,Private,Oo Si(6/11)(18.12.11),4.2.2012,5.5.2017,Jade,1,Kachin State,Ma Kyan Kha Phaw Htot(46),4,2,2012,5,5,2017,Ma Kyan Kha Phaw Htot,46,2012-2-4,2017-5-5
395,Myanmar  imperial jade,Private,Oo Si(6/11)(18.12.11),4.2.2012,5.5.2017,Jade,1,Kachin State,Ma Kyan Kha Phaw Htot(47),4,2,2012,5,5,2017,Ma Kyan Kha Phaw Htot,47,2012-2-4,2017-5-5
396,Myanmar  imperial jade,Private,Oo Si(6/11)(18.12.11),4.2.2012,5.5.2017,Jade,1,Kachin State,Ma Kyan Kha Phaw Htot(48),4,2,2012,5,5,2017,Ma Kyan Kha Phaw Htot,48,2012-2-4,2017-5-5
397,Myanmar  imperial jade,Private,Oo Si(6/11)(18.12.11),4.2.2012,5.5.2017,Jade,1,Kachin State,Ma Kyan Kha Phaw Htot(62),4,2,2012,5,5,2017,Ma Kyan Kha Phaw Htot,62,2012-2-4,2017-5-5
398,Myanmar  imperial jade,Private,Oo Si(6/11)(18.12.11),4.2.2012,5.5.2017,Jade,1,Kachin State,Ma Kyan Kha Phaw Htot(63),4,2,2012,5,5,2017,Ma Kyan Kha Phaw Htot,63,2012-2-4,2017-5-5
399,Myanmar  imperial jade,Private,Oo Si(6/11)(18.12.11),4.2.2012,5.5.2017,Jade,1,Kachin State,Ma Kyan Kha Phaw Htot(64),4,2,2012,5,5,2017,Ma Kyan Kha Phaw Htot,64,2012-2-4,2017-5-5
400,Myanmar  imperial jade,Private,Oo Si(6/11)(18.12.11),4.2.2012,5.5.2017,Jade,1,Kachin State,Ma Kyan Kha Phaw Htot(77),4,2,2012,5,5,2017,Ma Kyan Kha Phaw Htot,77,2012-2-4,2017-5-5
401,Myanmar  imperial jade,Private,Oo Si(6/11)(18.12.11),4.2.2012,5.5.2017,Jade,1,Kachin State,Ma Kyan Kha Phaw Htot(78),4,2,2012,5,5,2017,Ma Kyan Kha Phaw Htot,78,2012-2-4,2017-5-5
402,Myanmar  imperial jade,Private,Oo Si(6/11)(18.12.11),4.2.2012,5.5.2017,Jade,1,Kachin State,Ma Kyan Kha Phaw Htot(79),4,2,2012,5,5,2017,Ma Kyan Kha Phaw Htot,79,2012-2-4,2017-5-5
403,Myanmar  imperial jade,Private,Oo Si(6/11)(18.12.11),4.2.2012,5.5.2017,Jade,1,Kachin State,Ma Kyan Kha Phaw Htot(87),4,2,2012,5,5,2017,Ma Kyan Kha Phaw Htot,87,2012-2-4,2017-5-5
404,Myanmar  imperial jade,Private,Oo Si(6/11)(18.12.11),4.2.2012,5.5.2017,Jade,1,Kachin State,Ma Kyan Kha Phaw Htot(88),4,2,2012,5,5,2017,Ma Kyan Kha Phaw Htot,88,2012-2-4,2017-5-5
405,Myanmar  imperial jade,Private,Oo Si(6/11)(18.12.11),4.2.2012,5.5.2017,Jade,1,Kachin State,Ma Kyan Kha Phaw Htot(89),4,2,2012,5,5,2017,Ma Kyan Kha Phaw Htot,89,2012-2-4,2017-5-5
406,Myanmar  imperial jade,Private,Oo Si(6/11)(18.12.11),4.2.2012,5.5.2017,Jade,1,Kachin State,Ma Kyan Kha Phaw Htot(95),4,2,2012,5,5,2017,Ma Kyan Kha Phaw Htot,95,2012-2-4,2017-5-5
407,Myanmar  imperial jade,Private,Oo Si(6/11)(18.12.11),4.2.2012,5.5.2017,Jade,1,Kachin State,Ma Kyan Kha Phaw Htot(96),4,2,2012,5,5,2017,Ma Kyan Kha Phaw Htot,96,2012-2-4,2017-5-5
408,Myanmar  imperial jade,Private,Oo Si(6/11)(18.12.11),4.2.2012,5.5.2017,Jade,1,Kachin State,Ma Kyan Kha Phaw Htot(97),4,2,2012,5,5,2017,Ma Kyan Kha Phaw Htot,97,2012-2-4,2017-5-5
409,Myanmar  imperial jade,Private,Oo Si(6/11)(18.12.11),4.2.2012,5.5.2017,Jade,1,Kachin State,Ma Kyan Kha Phaw Htot(106),4,2,2012,5,5,2017,Ma Kyan Kha Phaw Htot,106,2012-2-4,2017-5-5
410,Myanmar  imperial jade,Private,Oo Si(6/11)(18.12.11),4.2.2012,5.5.2017,Jade,1,Kachin State,Ma Kyan Kha Phaw Htot(107),4,2,2012,5,5,2017,Ma Kyan Kha Phaw Htot,107,2012-2-4,2017-5-5
411,Myanmar  imperial jade,Private,Oo Si(6/11)(18.12.11),4.2.2012,5.5.2017,Jade,1,Kachin State,Ma Kyan Kha Phaw Htot(108),4,2,2012,5,5,2017,Ma Kyan Kha Phaw Htot,108,2012-2-4,2017-5-5
412,Myanmar  imperial jade,Private,Oo Si(6/11)(18.12.11),4.2.2012,5.5.2017,Jade,1,Kachin State,Ma Kyan Kha Phaw Htot(117),4,2,2012,5,5,2017,Ma Kyan Kha Phaw Htot,117,2012-2-4,2017-5-5
413,Myanmar  imperial jade,Private,Oo Si(6/11)(18.12.11),4.2.2012,5.5.2017,Jade,1,Kachin State,Ma Kyan Kha Phaw Htot(118),4,2,2012,5,5,2017,Ma Kyan Kha Phaw Htot,118,2012-2-4,2017-5-5
414,Myanmar  imperial jade,Private,Oo Si(6/11)(18.12.11),4.2.2012,5.5.2017,Jade,1,Kachin State,Ma Kyan Kha Phaw Htot(119),4,2,2012,5,5,2017,Ma Kyan Kha Phaw Htot,119,2012-2-4,2017-5-5
415,Myanmar  imperial jade,Private,Oo Si(6/11)(18.12.11),4.2.2012,5.5.2017,Jade,1,Kachin State,Ma Kyan Kha Phaw Htot(128),4,2,2012,5,5,2017,Ma Kyan Kha Phaw Htot,128,2012-2-4,2017-5-5
416,Myanmar  imperial jade,Private,Oo Si(6/11)(18.12.11),4.2.2012,5.5.2017,Jade,1,Kachin State,Ma Kyan Kha Phaw Htot(129),4,2,2012,5,5,2017,Ma Kyan Kha Phaw Htot,129,2012-2-4,2017-5-5
417,Myanmar  imperial jade,Private,Oo Si(6/11)(18.12.11),4.2.2012,5.5.2017,Jade,1,Kachin State,Ma Kyan Kha Phaw Htot(130),4,2,2012,5,5,2017,Ma Kyan Kha Phaw Htot,130,2012-2-4,2017-5-5
418,Myanmar  imperial jade,Private,Oo Si(6/11)(18.12.11),4.2.2012,5.5.2017,Jade,1,Kachin State,Ma Kyan Kha Phaw Htot(144),4,2,2012,5,5,2017,Ma Kyan Kha Phaw Htot,144,2012-2-4,2017-5-5
419,Myanmar  imperial jade,Private,Oo Si(6/11)(18.12.11),4.2.2012,5.5.2017,Jade,1,Kachin State,Ma Kyan Kha Phaw Htot(145),4,2,2012,5,5,2017,Ma Kyan Kha Phaw Htot,145,2012-2-4,2017-5-5
420,Myanmar  imperial jade,Private,Oo Si(6/11)(18.12.11),4.2.2012,5.5.2017,Jade,1,Kachin State,Ma Kyan Kha Phaw Htot(146),4,2,2012,5,5,2017,Ma Kyan Kha Phaw Htot,146,2012-2-4,2017-5-5
421,Myanmar  imperial jade,Private,Oo Si(6/11)(18.12.11),4.2.2012,5.5.2017,Jade,1,Kachin State,Ma Kyan Kha Phaw Htot(155),4,2,2012,5,5,2017,Ma Kyan Kha Phaw Htot,155,2012-2-4,2017-5-5
422,Myanmar  imperial jade,Private,Oo Si(6/11)(18.12.11),4.2.2012,5.5.2017,Jade,1,Kachin State,Ma Kyan Kha Phaw Htot(156),4,2,2012,5,5,2017,Ma Kyan Kha Phaw Htot,156,2012-2-4,2017-5-5
423,Myanmar  imperial jade,Private,Oo Si(6/11)(18.12.11),4.2.2012,5.5.2017,Jade,1,Kachin State,Ma Kyan Kha Phaw Htot(157),4,2,2012,5,5,2017,Ma Kyan Kha Phaw Htot,157,2012-2-4,2017-5-5
424,Myanmar  imperial jade,Private,Oo Si(6/11)(18.12.11),4.2.2012,5.5.2017,Jade,1,Kachin State,Ma Kyan Kha Phaw Htot(166),4,2,2012,5,5,2017,Ma Kyan Kha Phaw Htot,166,2012-2-4,2017-5-5
425,Myanmar  imperial jade,Private,Oo Si(6/11)(18.12.11),4.2.2012,5.5.2017,Jade,1,Kachin State,Ma Kyan Kha Phaw Htot(167),4,2,2012,5,5,2017,Ma Kyan Kha Phaw Htot,167,2012-2-4,2017-5-5
426,Myanmar  imperial jade,Private,Oo Si(6/11)(18.12.11),4.2.2012,5.5.2017,Jade,1,Kachin State,Ma Kyan Kha Phaw Htot(168),4,2,2012,5,5,2017,Ma Kyan Kha Phaw Htot,168,2012-2-4,2017-5-5
427,Myanmar  imperial jade,Private,Oo Si(6/11)(18.12.11),4.2.2012,5.5.2017,Jade,1,Kachin State,Ma Kyan Kha Phaw Htot(176),4,2,2012,5,5,2017,Ma Kyan Kha Phaw Htot,176,2012-2-4,2017-5-5
428,Myanmar  imperial jade,Private,Oo Si(6/11)(18.12.11),4.2.2012,5.5.2017,Jade,1,Kachin State,Ma Kyan Kha Phaw Htot(177),4,2,2012,5,5,2017,Ma Kyan Kha Phaw Htot,177,2012-2-4,2017-5-5
1,Myanmar economic coorporation,Private,Oo Si (4/11)(3.11.11),14.7.2011,13.7.2014,Gem,1,Shan State,Lwai Saung htauk(Ta-39),14,7,2011,13,7,2014,Lwai Saung htauk,Ta-39,2011-7-14,2014-7-13
2,Myanmar economic coorporation,Private,Oo Si (4/11)(3.11.11),14.7.2011,13.7.2014,Gem,1,Shan State,Lwai Saung htauk(Ta-40),14,7,2011,13,7,2014,Lwai Saung htauk,Ta-40,2011-7-14,2014-7-13
3,Myanmar economic coorporation,Private,Oo Si (4/11)(3.11.11),14.7.2011,13.7.2014,Gem,1,Shan State,Lwai Saung htauk(Ta-41),14,7,2011,13,7,2014,Lwai Saung htauk,Ta-41,2011-7-14,2014-7-13
4,Myanmar economic coorporation,Private,Oo Si (4/11)(3.11.11),14.7.2011,13.7.2014,Gem,1,Shan State,Lwai Saung htauk(Ta-42),14,7,2011,13,7,2014,Lwai Saung htauk,Ta-42,2011-7-14,2014-7-13
5,Myanmar economic coorporation,Private,Oo Si (4/11)(3.11.11),14.7.2011,13.7.2014,Gem,1,Shan State,Lwai Saung htauk(Ta-43),14,7,2011,13,7,2014,Lwai Saung htauk,Ta-43,2011-7-14,2014-7-13
6,Myanmar economic coorporation,Private,Oo Si (4/11)(3.11.11),14.7.2011,13.7.2014,Gem,1,Shan State,Lwai Saung htauk(Ta-44),14,7,2011,13,7,2014,Lwai Saung htauk,Ta-44,2011-7-14,2014-7-13
7,Myanmar economic coorporation,Private,Oo Si (4/11)(3.11.11),14.7.2011,13.7.2014,Gem,1,Shan State,Lwai Saung htauk(Ta-45),14,7,2011,13,7,2014,Lwai Saung htauk,Ta-45,2011-7-14,2014-7-13
8,Myanmar economic coorporation,Private,Oo Si (4/11)(3.11.11),14.7.2011,13.7.2014,Gem,1,Shan State,Lwai Saung htauk(Ta-46),14,7,2011,13,7,2014,Lwai Saung htauk,Ta-46,2011-7-14,2014-7-13
9,Myanmar economic coorporation,Private,Oo Si (4/11)(3.11.11),14.7.2011,13.7.2014,Gem,1,Shan State,Lwai Saung htauk(Ta-47),14,7,2011,13,7,2014,Lwai Saung htauk,Ta-47,2011-7-14,2014-7-13
10,Myanmar economic coorporation,Private,Oo Si (4/11)(3.11.11),14.7.2011,13.7.2014,Gem,1,Shan State,Lwai Saung htauk(Ta-48),14,7,2011,13,7,2014,Lwai Saung htauk,Ta-48,2011-7-14,2014-7-13
11,Myanmar economic coorporation,Private,Oo Si (4/11)(3.11.11),14.7.2011,13.7.2014,Gem,1,Shan State,Lwai Saung htauk(Ta-49),14,7,2011,13,7,2014,Lwai Saung htauk,Ta-49,2011-7-14,2014-7-13
12,Myanmar economic coorporation,Private,Oo Si (4/11)(3.11.11),14.7.2011,13.7.2014,Gem,1,Shan State,Lwai Saung htauk(Ta-50),14,7,2011,13,7,2014,Lwai Saung htauk,Ta-50,2011-7-14,2014-7-13
13,Myanmar economic coorporation,Private,Oo Si (4/11)(3.11.11),14.7.2011,13.7.2014,Gem,1,Shan State,Lwai Saung htauk(Ta-51),14,7,2011,13,7,2014,Lwai Saung htauk,Ta-51,2011-7-14,2014-7-13
14,Myanmar economic coorporation,Private,Oo Si (6/11)(18.12.11),18.10.2011,17.10.2014,Gem,1,Shan State,Lwai Saung htauk(Ta-38),18,10,2011,17,10,2014,Lwai Saung htauk,Ta-38,2011-10-18,2014-10-17
15,Myanmar economic coorporation,Private,Oo Si (4/13)(16.5.13),7.1.2013,6.1.2016,Gem,1,Shan State,Lwai Saung htauk(Ta-5),7,1,2013,6,1,2016,Lwai Saung htauk,Ta-5,2013-1-7,2016-1-6
16,Myanmar economic coorporation,Private,Oo Si (4/13)(16.5.13),7.1.2013,6.1.2016,Gem,1,Shan State,Lwai Saung htauk(Ta-6),7,1,2013,6,1,2016,Lwai Saung htauk,Ta-6,2013-1-7,2016-1-6
17,Myanmar economic coorporation,Private,Oo Si (4/13)(16.5.13),7.1.2013,6.1.2016,Gem,1,Shan State,Lwai Saung htauk(Ta-7),7,1,2013,6,1,2016,Lwai Saung htauk,Ta-7,2013-1-7,2016-1-6
18,Myanmar economic coorporation,Private,Oo Si (4/13)(16.5.13),7.1.2013,6.1.2016,Gem,1,Shan State,Lwai Saung htauk(Ta-8),7,1,2013,6,1,2016,Lwai Saung htauk,Ta-8,2013-1-7,2016-1-6
19,Myanmar economic coorporation,Private,Oo Si (4/13)(16.5.13),7.1.2013,6.1.2016,Gem,1,Shan State,Lwai Saung htauk(Ta-9),7,1,2013,6,1,2016,Lwai Saung htauk,Ta-9,2013-1-7,2016-1-6
20,Myanmar economic coorporation,Private,Oo Si (4/13)(16.5.13),7.1.2013,6.1.2016,Gem,1,Shan State,Lwai Saung htauk(Ta-10),7,1,2013,6,1,2016,Lwai Saung htauk,Ta-10,2013-1-7,2016-1-6
21,Myanmar economic coorporation,Private,Oo Si (4/13)(16.5.13),13.3.2013,12.3.2016,Gem,1,Shan State,Lwai Saung htauk(Ta-33),13,3,2013,12,3,2016,Lwai Saung htauk,Ta-33,2013-3-13,2016-3-12
22,Myanmar economic coorporation,Private,Oo Si (5/13)(21.8.13),23.5.2013,22.5.2016,Gem,1,Shan State,Lwai Saung htauk(Ta-2),23,5,2013,22,5,2016,Lwai Saung htauk,Ta-2,2013-5-23,2016-5-22
23,Myanmar economic coorporation,Private,Oo Si (5/13)(21.8.13),13.3.2013,12.3.2016,Gem,1,Shan State,Lwai Saung htauk(Ta-3),13,3,2013,12,3,2016,Lwai Saung htauk,Ta-3,2013-3-13,2016-3-12
24,Myanmar economic coorporation,Private,Oo Si (5/13)(21.8.13),23.5.2013,22.5.2016,Gem,1,Shan State,Lwai Saung htauk(Ta-4),23,5,2013,22,5,2016,Lwai Saung htauk,Ta-4,2013-5-23,2016-5-22
25,Myanmar economic coorporation,Private,Oo Si (5/13)(21.8.13),13.3.2013,12.3.2016,Gem,1,Shan State,Lwai Saung htauk(Ta-11),13,3,2013,12,3,2016,Lwai Saung htauk,Ta-11,2013-3-13,2016-3-12
26,Myanmar economic coorporation,Private,Oo Si (5/13)(21.8.13),13.3.2013,12.3.2016,Gem,1,Shan State,Lwai Saung htauk(Ta-13),13,3,2013,12,3,2016,Lwai Saung htauk,Ta-13,2013-3-13,2016-3-12
27,Myanmar economic coorporation,Private,Oo Si (5/13)(21.8.13),13.3.2013,12.3.2016,Gem,1,Shan State,Lwai Saung htauk(Ta-19),13,3,2013,12,3,2016,Lwai Saung htauk,Ta-19,2013-3-13,2016-3-12
28,Myanmar economic coorporation,Private,Oo Si (5/13)(21.8.13),13.3.2013,12.3.2016,Gem,1,Shan State,Lwai Saung htauk(Ta-20),13,3,2013,12,3,2016,Lwai Saung htauk,Ta-20,2013-3-13,2016-3-12
29,Myanmar economic coorporation,Private,Oo Si (5/13)(21.8.13),13.3.2013,12.3.2016,Gem,1,Shan State,Lwai Saung htauk(Ta-23),13,3,2013,12,3,2016,Lwai Saung htauk,Ta-23,2013-3-13,2016-3-12
30,Myanmar economic coorporation,Private,Oo Si (5/13)(21.8.13),13.3.2013,12.3.2016,Gem,1,Shan State,Lwai Saung htauk(Ta-24),13,3,2013,12,3,2016,Lwai Saung htauk,Ta-24,2013-3-13,2016-3-12
31,Myanmar economic coorporation,Private,Oo Si (5/13)(21.8.13),13.3.2013,12.3.2016,Gem,1,Shan State,Lwai Saung htauk(Ta-32),13,3,2013,12,3,2016,Lwai Saung htauk,Ta-32,2013-3-13,2016-3-12
32,Myanmar economic coorporation,Private,Oo Si(3/11)(18.12.11),23.9.2011,22.12.2016,Jade,1,Kachin State,Sha Yaung Kha(65),23,9,2011,22,12,2016,Sha Yaung Kha,65,2011-9-23,2016-12-22
33,Myanmar economic coorporation,Private,Oo Si(3/11)(18.12.11),23.9.2011,22.12.2016,Jade,1,Kachin State,Sha Yaung Kha(69),23,9,2011,22,12,2016,Sha Yaung Kha,69,2011-9-23,2016-12-22
34,Myanmar economic coorporation,Private,Oo Si(3/11)(18.12.11),23.9.2011,22.12.2016,Jade,1,Kachin State,Sha Yaung Kha(71),23,9,2011,22,12,2016,Sha Yaung Kha,71,2011-9-23,2016-12-22
35,Myanmar economic coorporation,Private,Oo Si(3/11)(18.12.11),23.9.2011,22.12.2016,Jade,1,Kachin State,Sha Yaung Kha(81),23,9,2011,22,12,2016,Sha Yaung Kha,81,2011-9-23,2016-12-22
36,Myanmar economic coorporation,Private,Oo Si(3/11)(18.12.11),23.9.2011,22.12.2016,Jade,1,Kachin State,Sha Yaung Kha(100),23,9,2011,22,12,2016,Sha Yaung Kha,100,2011-9-23,2016-12-22
37,Myanmar economic coorporation,Private,Oo Si(3/11)(18.12.11),23.9.2011,22.12.2016,Jade,1,Kachin State,Sha Yaung Kha(101),23,9,2011,22,12,2016,Sha Yaung Kha,101,2011-9-23,2016-12-22
38,Myanmar economic coorporation,Private,Oo Si(3/11)(18.12.11),23.9.2011,22.12.2016,Jade,1,Kachin State,Sha Yaung Kha(258),23,9,2011,22,12,2016,Sha Yaung Kha,258,2011-9-23,2016-12-22
39,Myanmar economic coorporation,Private,Oo Si(3/11)(18.12.11),23.9.2011,22.12.2016,Jade,1,Kachin State,Sha Yaung Kha(259),23,9,2011,22,12,2016,Sha Yaung Kha,259,2011-9-23,2016-12-22
40,Myanmar economic coorporation,Private,Oo Si(3/11)(18.12.11),23.9.2011,22.12.2016,Jade,1,Kachin State,Sha Yaung Kha(260),23,9,2011,22,12,2016,Sha Yaung Kha,260,2011-9-23,2016-12-22
41,Myanmar economic coorporation,Private,Oo Si(3/11)(18.12.11),23.9.2011,22.12.2016,Jade,1,Kachin State,Sha Yaung Kha(261),23,9,2011,22,12,2016,Sha Yaung Kha,261,2011-9-23,2016-12-22
42,Myanmar economic coorporation,Private,Oo Si(3/11)(18.12.11),23.9.2011,22.12.2016,Jade,1,Kachin State,Sha Yaung Kha(262),23,9,2011,22,12,2016,Sha Yaung Kha,262,2011-9-23,2016-12-22
43,Myanmar economic coorporation,Private,Oo Si(3/11)(18.12.11),23.9.2011,22.12.2016,Jade,1,Kachin State,Sha Yaung Kha(263),23,9,2011,22,12,2016,Sha Yaung Kha,263,2011-9-23,2016-12-22
44,Myanmar economic coorporation,Private,Oo Si(3/11)(18.12.11),23.9.2011,22.12.2016,Jade,1,Kachin State,Sha Yaung Kha(264),23,9,2011,22,12,2016,Sha Yaung Kha,264,2011-9-23,2016-12-22
45,Myanmar economic coorporation,Private,Oo Si(3/11)(18.12.11),23.9.2011,22.12.2016,Jade,1,Kachin State,Sha Yaung Kha(265),23,9,2011,22,12,2016,Sha Yaung Kha,265,2011-9-23,2016-12-22
46,Myanmar economic coorporation,Private,Oo Si(3/11)(18.12.11),23.9.2011,22.12.2016,Jade,1,Kachin State,Sha Yaung Kha(266),23,9,2011,22,12,2016,Sha Yaung Kha,266,2011-9-23,2016-12-22
47,Myanmar economic coorporation,Private,Oo Si(3/11)(18.12.11),23.9.2011,22.12.2016,Jade,1,Kachin State,Sha Yaung Kha(272),23,9,2011,22,12,2016,Sha Yaung Kha,272,2011-9-23,2016-12-22
48,Myanmar economic coorporation,Private,Oo Si(3/11)(18.12.11),23.9.2011,22.12.2016,Jade,1,Kachin State,Sha Yaung Kha(273),23,9,2011,22,12,2016,Sha Yaung Kha,273,2011-9-23,2016-12-22
49,Myanmar economic coorporation,Private,Oo Si(3/11)(18.12.11),23.9.2011,22.12.2016,Jade,1,Kachin State,Sha Yaung Kha(274),23,9,2011,22,12,2016,Sha Yaung Kha,274,2011-9-23,2016-12-22
50,Myanmar economic coorporation,Private,Oo Si(3/11)(18.12.11),23.9.2011,22.12.2016,Jade,1,Kachin State,Sha Yaung Kha(275),23,9,2011,22,12,2016,Sha Yaung Kha,275,2011-9-23,2016-12-22
51,Myanmar economic coorporation,Private,Oo Si(3/11)(18.12.11),23.9.2011,22.12.2016,Jade,1,Kachin State,Sha Yaung Kha(276),23,9,2011,22,12,2016,Sha Yaung Kha,276,2011-9-23,2016-12-22
52,Myanmar economic coorporation,Private,Oo Si(3/11)(18.12.11),23.9.2011,22.12.2016,Jade,1,Kachin State,Sha Yaung Kha(277),23,9,2011,22,12,2016,Sha Yaung Kha,277,2011-9-23,2016-12-22
53,Myanmar economic coorporation,Private,Oo Si(3/11)(18.12.11),23.9.2011,22.12.2016,Jade,1,Kachin State,Sha Yaung Kha(278),23,9,2011,22,12,2016,Sha Yaung Kha,278,2011-9-23,2016-12-22
54,Myanmar economic coorporation,Private,Oo Si(3/11)(18.12.11),4.6.2012,3.9.2017,Jade,1,Kachin State,Sha Yaung Kha(496),4,6,2012,3,9,2017,Sha Yaung Kha,496,2012-6-4,2017-9-3
55,Myanmar economic coorporation,Private,Oo Si(3/11)(18.12.11),4.6.2012,3.9.2017,Jade,1,Kachin State,Sha Yaung Kha(497),4,6,2012,3,9,2017,Sha Yaung Kha,497,2012-6-4,2017-9-3
56,Myanmar economic coorporation,Private,Oo Si(3/11)(18.12.11),4.6.2012,3.9.2017,Jade,1,Kachin State,Sha Yaung Kha(498),4,6,2012,3,9,2017,Sha Yaung Kha,498,2012-6-4,2017-9-3
57,Myanmar economic coorporation,Private,Oo Si(3/11)(18.12.11),4.6.2012,3.9.2017,Jade,1,Kachin State,Sha Yaung Kha(499),4,6,2012,3,9,2017,Sha Yaung Kha,499,2012-6-4,2017-9-3
58,Myanmar economic coorporation,Private,Oo Si(3/11)(18.12.11),4.6.2012,3.9.2017,Jade,1,Kachin State,Sha Yaung Kha(500),4,6,2012,3,9,2017,Sha Yaung Kha,500,2012-6-4,2017-9-3
59,Myanmar economic coorporation,Private,Oo Si(3/11)(18.12.11),4.6.2012,3.9.2017,Jade,1,Kachin State,Sha Yaung Kha(501),4,6,2012,3,9,2017,Sha Yaung Kha,501,2012-6-4,2017-9-3
60,Myanmar economic coorporation,Private,Oo Si(3/11)(18.12.11),4.6.2012,3.9.2017,Jade,1,Kachin State,Sha Yaung Kha(502),4,6,2012,3,9,2017,Sha Yaung Kha,502,2012-6-4,2017-9-3
61,Myanmar economic coorporation,Private,Oo Si(3/11)(18.12.11),4.6.2012,3.9.2017,Jade,1,Kachin State,Sha Yaung Kha(503),4,6,2012,3,9,2017,Sha Yaung Kha,503,2012-6-4,2017-9-3
62,Myanmar economic coorporation,Private,Oo Si(3/11)(18.12.11),4.6.2012,3.9.2017,Jade,1,Kachin State,Sha Yaung Kha(504),4,6,2012,3,9,2017,Sha Yaung Kha,504,2012-6-4,2017-9-3
63,Myanmar economic coorporation,Private,Oo Si(3/11)(18.12.11),4.6.2012,3.9.2017,Jade,1,Kachin State,Sha Yaung Kha(505),4,6,2012,3,9,2017,Sha Yaung Kha,505,2012-6-4,2017-9-3
64,Myanmar economic coorporation,Private,Oo Si(3/11)(18.12.11),4.6.2012,3.9.2017,Jade,1,Kachin State,Sha Yaung Kha(506),4,6,2012,3,9,2017,Sha Yaung Kha,506,2012-6-4,2017-9-3
65,Myanmar economic coorporation,Private,Oo Si(3/11)(18.12.11),4.6.2012,3.9.2017,Jade,1,Kachin State,Sha Yaung Kha(507),4,6,2012,3,9,2017,Sha Yaung Kha,507,2012-6-4,2017-9-3
66,Myanmar economic coorporation,Private,Oo Si(3/11)(18.12.11),4.6.2012,3.9.2017,Jade,1,Kachin State,Sha Yaung Kha(508),4,6,2012,3,9,2017,Sha Yaung Kha,508,2012-6-4,2017-9-3
67,Myanmar economic coorporation,Private,Oo Si(3/11)(18.12.11),4.6.2012,3.9.2017,Jade,1,Kachin State,Sha Yaung Kha(509),4,6,2012,3,9,2017,Sha Yaung Kha,509,2012-6-4,2017-9-3
68,Myanmar economic coorporation,Private,Oo Si(3/11)(18.12.11),4.6.2012,3.9.2017,Jade,1,Kachin State,Sha Yaung Kha(510),4,6,2012,3,9,2017,Sha Yaung Kha,510,2012-6-4,2017-9-3
69,Myanmar economic coorporation,Private,Oo Si(3/11)(18.12.11),4.6.2012,3.9.2017,Jade,1,Kachin State,Sha Yaung Kha(511),4,6,2012,3,9,2017,Sha Yaung Kha,511,2012-6-4,2017-9-3
70,Myanmar economic coorporation,Private,Oo Si(3/11)(18.12.11),4.6.2012,3.9.2017,Jade,1,Kachin State,Sha Yaung Kha(512),4,6,2012,3,9,2017,Sha Yaung Kha,512,2012-6-4,2017-9-3
71,Myanmar economic coorporation,Private,Oo Si(3/11)(18.12.11),4.6.2012,3.9.2017,Jade,1,Kachin State,Sha Yaung Kha(513),4,6,2012,3,9,2017,Sha Yaung Kha,513,2012-6-4,2017-9-3
72,Myanmar economic coorporation,Private,Oo Si(3/11)(18.12.11),4.6.2012,3.9.2017,Jade,1,Kachin State,Sha Yaung Kha(514),4,6,2012,3,9,2017,Sha Yaung Kha,514,2012-6-4,2017-9-3
73,Myanmar economic coorporation,Private,Oo Si(3/11)(18.12.11),4.6.2012,3.9.2017,Jade,1,Kachin State,Sha Yaung Kha(515),4,6,2012,3,9,2017,Sha Yaung Kha,515,2012-6-4,2017-9-3
74,Myanmar economic coorporation,Private,Oo Si(3/11)(18.12.11),4.6.2012,3.9.2017,Jade,1,Kachin State,Sha Yaung Kha(516),4,6,2012,3,9,2017,Sha Yaung Kha,516,2012-6-4,2017-9-3
75,Myanmar economic coorporation,Private,Oo Si(3/11)(18.12.11),4.6.2012,3.9.2017,Jade,1,Kachin State,Sha Yaung Kha(517),4,6,2012,3,9,2017,Sha Yaung Kha,517,2012-6-4,2017-9-3
76,Myanmar economic coorporation,Private,Oo Si(3/11)(18.12.11),4.6.2012,3.9.2017,Jade,1,Kachin State,Sha Yaung Kha(518),4,6,2012,3,9,2017,Sha Yaung Kha,518,2012-6-4,2017-9-3
77,Myanmar economic coorporation,Private,Oo Si(3/11)(18.12.11),4.6.2012,3.9.2017,Jade,1,Kachin State,Sha Yaung Kha(519),4,6,2012,3,9,2017,Sha Yaung Kha,519,2012-6-4,2017-9-3
78,Myanmar economic coorporation,Private,Oo Si(3/11)(18.12.11),4.6.2012,3.9.2017,Jade,1,Kachin State,Sha Yaung Kha(520),4,6,2012,3,9,2017,Sha Yaung Kha,520,2012-6-4,2017-9-3
79,Myanmar economic coorporation,Private,Oo Si(3/11)(18.12.11),4.6.2012,3.9.2017,Jade,1,Kachin State,Sha Yaung Kha(521),4,6,2012,3,9,2017,Sha Yaung Kha,521,2012-6-4,2017-9-3
80,Myanmar economic coorporation,Private,Oo Si(3/11)(18.12.11),4.6.2012,3.9.2017,Jade,1,Kachin State,Sha Yaung Kha(522),4,6,2012,3,9,2017,Sha Yaung Kha,522,2012-6-4,2017-9-3
81,Myanmar economic coorporation,Private,Oo Si(3/11)(18.12.11),4.6.2012,3.9.2017,Jade,1,Kachin State,Sha Yaung Kha(523),4,6,2012,3,9,2017,Sha Yaung Kha,523,2012-6-4,2017-9-3
82,Myanmar economic coorporation,Private,Oo Si(3/11)(18.12.11),4.6.2012,3.9.2017,Jade,1,Kachin State,Sha Yaung Kha(524),4,6,2012,3,9,2017,Sha Yaung Kha,524,2012-6-4,2017-9-3
83,Myanmar economic coorporation,Private,Oo Si(3/11)(18.12.11),4.6.2012,3.9.2017,Jade,1,Kachin State,Sha Yaung Kha(525),4,6,2012,3,9,2017,Sha Yaung Kha,525,2012-6-4,2017-9-3
84,Myanmar economic coorporation,Private,Oo Si(3/11)(18.12.11),4.6.2012,3.9.2017,Jade,1,Kachin State,Sha Yaung Kha(526),4,6,2012,3,9,2017,Sha Yaung Kha,526,2012-6-4,2017-9-3
85,Myanmar economic coorporation,Private,Oo Si(3/11)(18.12.11),4.6.2012,3.9.2017,Jade,1,Kachin State,Sha Yaung Kha(527),4,6,2012,3,9,2017,Sha Yaung Kha,527,2012-6-4,2017-9-3
86,Myanmar economic coorporation,Private,Oo Si(3/11)(18.12.11),4.6.2012,3.9.2017,Jade,1,Kachin State,Sha Yaung Kha(528),4,6,2012,3,9,2017,Sha Yaung Kha,528,2012-6-4,2017-9-3
87,Myanmar economic coorporation,Private,Oo Si(3/11)(18.12.11),4.6.2012,3.9.2017,Jade,1,Kachin State,Sha Yaung Kha(529),4,6,2012,3,9,2017,Sha Yaung Kha,529,2012-6-4,2017-9-3
88,Myanmar economic coorporation,Private,Oo Si(3/11)(18.12.11),4.6.2012,3.9.2017,Jade,1,Kachin State,Sha Yaung Kha(530),4,6,2012,3,9,2017,Sha Yaung Kha,530,2012-6-4,2017-9-3
89,Myanmar economic coorporation,Private,Oo Si(3/11)(18.12.11),4.6.2012,3.9.2017,Jade,1,Kachin State,Sha Yaung Kha(531),4,6,2012,3,9,2017,Sha Yaung Kha,531,2012-6-4,2017-9-3
90,Myanmar economic coorporation,Private,Oo Si(3/11)(18.12.11),4.6.2012,3.9.2017,Jade,1,Kachin State,Sha Yaung Kha(532),4,6,2012,3,9,2017,Sha Yaung Kha,532,2012-6-4,2017-9-3
91,Myanmar economic coorporation,Private,Oo Si(3/11)(18.12.11),4.6.2012,3.9.2017,Jade,1,Kachin State,Sha Yaung Kha(533),4,6,2012,3,9,2017,Sha Yaung Kha,533,2012-6-4,2017-9-3
92,Myanmar economic coorporation,Private,Oo Si(3/11)(18.12.11),4.6.2012,3.9.2017,Jade,1,Kachin State,Sha Yaung Kha(534),4,6,2012,3,9,2017,Sha Yaung Kha,534,2012-6-4,2017-9-3
93,Myanmar economic coorporation,Private,Oo Si(3/11)(18.12.11),4.6.2012,3.9.2017,Jade,1,Kachin State,Sha Yaung Kha(535),4,6,2012,3,9,2017,Sha Yaung Kha,535,2012-6-4,2017-9-3
94,Myanmar economic coorporation,Private,Oo Si(3/11)(18.12.11),4.6.2012,3.9.2017,Jade,1,Kachin State,Sha Yaung Kha(536),4,6,2012,3,9,2017,Sha Yaung Kha,536,2012-6-4,2017-9-3
95,Myanmar economic coorporation,Private,Oo Si(3/11)(18.12.11),4.6.2012,3.9.2017,Jade,1,Kachin State,Sha Yaung Kha(537),4,6,2012,3,9,2017,Sha Yaung Kha,537,2012-6-4,2017-9-3
96,Myanmar economic coorporation,Private,Oo Si(2/09)(2.8.09),28.1.2010,29.4.2015,Jade,1,Kachin State,Sha Yaung Kha(559),28,1,2010,29,4,2015,Sha Yaung Kha,559,2010-1-28,2015-4-29
97,Myanmar economic coorporation,Private,Oo Si(2/09)(2.8.09),28.1.2010,29.4.2015,Jade,1,Kachin State,Sha Yaung Kha(560),28,1,2010,29,4,2015,Sha Yaung Kha,560,2010-1-28,2015-4-29
98,Myanmar economic coorporation,Private,Oo Si(2/09)(2.8.09),28.1.2010,29.4.2015,Jade,1,Kachin State,Sha Yaung Kha(561),28,1,2010,29,4,2015,Sha Yaung Kha,561,2010-1-28,2015-4-29
99,Myanmar economic coorporation,Private,Oo Si(2/09)(2.8.09),28.1.2010,29.4.2015,Jade,1,Kachin State,Sha Yaung Kha(562),28,1,2010,29,4,2015,Sha Yaung Kha,562,2010-1-28,2015-4-29
100,Myanmar economic coorporation,Private,Oo Si(1/10)(4.2.10),6.10.2009,5.1.2015,Jade,1,Kachin State,Sha Yaung Kha(267),6,10,2009,5,1,2015,Sha Yaung Kha,267,2009-10-6,2015-1-5
101,Myanmar economic coorporation,Private,Oo Si(1/10)(4.2.10),6.10.2009,5.1.2015,Jade,1,Kachin State,Sha Yaung Kha(268),6,10,2009,5,1,2015,Sha Yaung Kha,268,2009-10-6,2015-1-5
102,Myanmar economic coorporation,Private,Oo Si(1/10)(4.2.10),6.10.2009,5.1.2015,Jade,1,Kachin State,Sha Yaung Kha(269),6,10,2009,5,1,2015,Sha Yaung Kha,269,2009-10-6,2015-1-5
103,Myanmar economic coorporation,Private,Oo Si(1/10)(4.2.10),6.10.2009,5.1.2015,Jade,1,Kachin State,Sha Yaung Kha(270),6,10,2009,5,1,2015,Sha Yaung Kha,270,2009-10-6,2015-1-5
104,Myanmar economic coorporation,Private,Oo Si(1/10)(4.2.10),6.10.2009,5.1.2015,Jade,1,Kachin State,Sha Yaung Kha(271),6,10,2009,5,1,2015,Sha Yaung Kha,271,2009-10-6,2015-1-5
105,Myanmar economic coorporation,Private,Oo Si(6/11)(18.12.11),23.9.2011,22.12.2016,Jade,1,Kachin State,Sha Yaung Kha(272),23,9,2011,22,12,2016,Sha Yaung Kha,272,2011-9-23,2016-12-22
106,Myanmar economic coorporation,Private,Oo Si(6/11)(18.12.11),23.9.2011,22.12.2016,Jade,1,Kachin State,Sha Yaung Kha(273),23,9,2011,22,12,2016,Sha Yaung Kha,273,2011-9-23,2016-12-22
107,Myanmar economic coorporation,Private,Oo Si(6/11)(18.12.11),23.9.2011,22.12.2016,Jade,1,Kachin State,Sha Yaung Kha(274),23,9,2011,22,12,2016,Sha Yaung Kha,274,2011-9-23,2016-12-22
108,Myanmar economic coorporation,Private,Oo Si(6/11)(18.12.11),23.9.2011,22.12.2016,Jade,1,Kachin State,Sha Yaung Kha(275),23,9,2011,22,12,2016,Sha Yaung Kha,275,2011-9-23,2016-12-22
109,Myanmar economic coorporation,Private,Oo Si(6/11)(18.12.11),23.9.2011,22.12.2016,Jade,1,Kachin State,Sha Yaung Kha(276),23,9,2011,22,12,2016,Sha Yaung Kha,276,2011-9-23,2016-12-22
110,Myanmar economic coorporation,Private,Oo Si(6/11)(18.12.11),23.9.2011,22.12.2016,Jade,1,Kachin State,Sha Yaung Kha(277),23,9,2011,22,12,2016,Sha Yaung Kha,277,2011-9-23,2016-12-22
111,Myanmar economic coorporation,Private,Oo Si(6/11)(18.12.11),23.9.2011,22.12.2016,Jade,1,Kachin State,Sha Yaung Kha(278),23,9,2011,22,12,2016,Sha Yaung Kha,278,2011-9-23,2016-12-22
112,Myanmar economic coorporation,Private,Oo Si(2/10)(17.5.10),6.6.2010,5.9.2015,Jade,1,Kachin State,Sha Yaung Kha(399),6,6,2010,5,9,2015,Sha Yaung Kha,399,2010-6-6,2015-9-5
113,Myanmar economic coorporation,Private,Oo Si(2/10)(17.5.10),6.6.2010,5.9.2015,Jade,1,Kachin State,Sha Yaung Kha(400),6,6,2010,5,9,2015,Sha Yaung Kha,400,2010-6-6,2015-9-5
114,Myanmar economic coorporation,Private,Oo Si(2/10)(17.5.10),6.6.2010,5.9.2015,Jade,1,Kachin State,Sha Yaung Kha(401),6,6,2010,5,9,2015,Sha Yaung Kha,401,2010-6-6,2015-9-5
115,Myanmar economic coorporation,Private,Oo Si(2/10)(17.5.10),6.6.2010,5.9.2015,Jade,1,Kachin State,Sha Yaung Kha(402),6,6,2010,5,9,2015,Sha Yaung Kha,402,2010-6-6,2015-9-5
116,Myanmar economic coorporation,Private,Oo Si(2/10)(17.5.10),6.6.2010,5.9.2015,Jade,1,Kachin State,Sha Yaung Kha(403),6,6,2010,5,9,2015,Sha Yaung Kha,403,2010-6-6,2015-9-5
117,Myanmar economic coorporation,Private,Oo Si(2/10)(17.5.10),6.6.2010,5.9.2015,Jade,1,Kachin State,Sha Yaung Kha(404),6,6,2010,5,9,2015,Sha Yaung Kha,404,2010-6-6,2015-9-5
118,Myanmar economic coorporation,Private,Oo Si(2/10)(17.5.10),6.6.2010,5.9.2015,Jade,1,Kachin State,Sha Yaung Kha(405),6,6,2010,5,9,2015,Sha Yaung Kha,405,2010-6-6,2015-9-5
119,Myanmar economic coorporation,Private,Oo Si(2/10)(17.5.10),6.6.2010,5.9.2015,Jade,1,Kachin State,Sha Yaung Kha(406),6,6,2010,5,9,2015,Sha Yaung Kha,406,2010-6-6,2015-9-5
120,Myanmar economic coorporation,Private,Oo Si(2/10)(17.5.10),6.6.2010,5.9.2015,Jade,1,Kachin State,Sha Yaung Kha(407),6,6,2010,5,9,2015,Sha Yaung Kha,407,2010-6-6,2015-9-5
121,Myanmar economic coorporation,Private,Oo Si(2/10)(17.5.10),6.6.2010,5.9.2015,Jade,1,Kachin State,Sha Yaung Kha(408),6,6,2010,5,9,2015,Sha Yaung Kha,408,2010-6-6,2015-9-5
122,Myanmar economic coorporation,Private,Oo Si(2/10)(17.5.10),6.6.2010,5.9.2015,Jade,1,Kachin State,Sha Yaung Kha(409),6,6,2010,5,9,2015,Sha Yaung Kha,409,2010-6-6,2015-9-5
123,Myanmar economic coorporation,Private,Oo Si(2/10)(17.5.10),6.6.2010,5.9.2015,Jade,1,Kachin State,Sha Yaung Kha(410),6,6,2010,5,9,2015,Sha Yaung Kha,410,2010-6-6,2015-9-5
124,Myanmar economic coorporation,Private,Oo Si(2/10)(17.5.10),6.6.2010,5.9.2015,Jade,1,Kachin State,Sha Yaung Kha(411),6,6,2010,5,9,2015,Sha Yaung Kha,411,2010-6-6,2015-9-5
125,Myanmar economic coorporation,Private,Oo Si(2/10)(17.5.10),6.6.2010,5.9.2015,Jade,1,Kachin State,Sha Yaung Kha(412),6,6,2010,5,9,2015,Sha Yaung Kha,412,2010-6-6,2015-9-5
126,Myanmar economic coorporation,Private,Oo Si(2/10)(17.5.10),6.6.2010,5.9.2015,Jade,1,Kachin State,Sha Yaung Kha(413),6,6,2010,5,9,2015,Sha Yaung Kha,413,2010-6-6,2015-9-5
127,Myanmar economic coorporation,Private,Oo Si(2/10)(17.5.10),6.6.2010,5.9.2015,Jade,1,Kachin State,Sha Yaung Kha(414),6,6,2010,5,9,2015,Sha Yaung Kha,414,2010-6-6,2015-9-5
128,Myanmar economic coorporation,Private,Oo Si(2/10)(17.5.10),6.6.2010,5.9.2015,Jade,1,Kachin State,Sha Yaung Kha(415),6,6,2010,5,9,2015,Sha Yaung Kha,415,2010-6-6,2015-9-5
129,Myanmar economic coorporation,Private,Oo Si(2/10)(17.5.10),6.6.2010,5.9.2015,Jade,1,Kachin State,Sha Yaung Kha(416),6,6,2010,5,9,2015,Sha Yaung Kha,416,2010-6-6,2015-9-5
130,Myanmar economic coorporation,Private,Oo Si(2/10)(17.5.10),6.6.2010,5.9.2015,Jade,1,Kachin State,Sha Yaung Kha(417),6,6,2010,5,9,2015,Sha Yaung Kha,417,2010-6-6,2015-9-5
131,Myanmar economic coorporation,Private,Oo Si(2/10)(17.5.10),6.6.2010,5.9.2015,Jade,1,Kachin State,Sha Yaung Kha(418),6,6,2010,5,9,2015,Sha Yaung Kha,418,2010-6-6,2015-9-5
132,Myanmar economic coorporation,Private,Oo Si(2/10)(17.5.10),6.6.2010,5.9.2015,Jade,1,Kachin State,Sha Yaung Kha(419),6,6,2010,5,9,2015,Sha Yaung Kha,419,2010-6-6,2015-9-5
133,Myanmar economic coorporation,Private,Oo Si(2/10)(17.5.10),6.6.2010,5.9.2015,Jade,1,Kachin State,Sha Yaung Kha(420),6,6,2010,5,9,2015,Sha Yaung Kha,420,2010-6-6,2015-9-5
134,Myanmar economic coorporation,Private,Oo Si(2/10)(17.5.10),6.6.2010,5.9.2015,Jade,1,Kachin State,Sha Yaung Kha(421),6,6,2010,5,9,2015,Sha Yaung Kha,421,2010-6-6,2015-9-5
135,Myanmar economic coorporation,Private,Oo Si(2/10)(17.5.10),6.6.2010,5.9.2015,Jade,1,Kachin State,Sha Yaung Kha(422),6,6,2010,5,9,2015,Sha Yaung Kha,422,2010-6-6,2015-9-5
136,Myanmar economic coorporation,Private,Oo Si(2/15)(5.6.15),6.9.2015,5.9.2018,Jade,1,Kachin State,Sha Yaung Kha(399),6,9,2015,5,9,2018,Sha Yaung Kha,399,2015-9-6,2018-9-5
137,Myanmar economic coorporation,Private,Oo Si(2/15)(5.6.15),6.9.2015,5.9.2018,Jade,1,Kachin State,Sha Yaung Kha(400),6,9,2015,5,9,2018,Sha Yaung Kha,400,2015-9-6,2018-9-5
1,Thit Sar Pan,Private,Kyie Kyat(6/12)(),10.10.2012,9.10.2015,Gem,1,Madalay Division,Moe House(16),10,10,2012,9,10,2015,Moe House,16,2012-10-10,2015-10-9
2,Thit Sar Pan,Private,Kyie Kyat(6/12)(),10.10.2012,9.10.2015,Gem,1,Madalay Division,Moe House(17),10,10,2012,9,10,2015,Moe House,17,2012-10-10,2015-10-9
3,Thit Sar Pan,Private,Kyie Kyat(6/12)(),10.10.2012,9.10.2015,Gem,1,Madalay Division,Moe House(18),10,10,2012,9,10,2015,Moe House,18,2012-10-10,2015-10-9
4,Thit Sar Pan,Private,Kyie Kyat(6/12)(),10.10.2012,9.10.2015,Gem,1,Madalay Division,Moe House(19),10,10,2012,9,10,2015,Moe House,19,2012-10-10,2015-10-9
5,Thit Sar Pan,Private,Kyie Kyat(6/12)(),10.10.2012,9.10.2015,Gem,1,Madalay Division,Moe House(20),10,10,2012,9,10,2015,Moe House,20,2012-10-10,2015-10-9
6,Thit Sar Pan,Private,Kyie Kyat(6/12)(),10.10.2012,9.10.2015,Gem,1,Madalay Division,Moe House(21),10,10,2012,9,10,2015,Moe House,21,2012-10-10,2015-10-9
7,Thit Sar Pan,Private,Kyie Kyat(6/12)(),10.10.2012,9.10.2015,Gem,1,Madalay Division,Moe House(22),10,10,2012,9,10,2015,Moe House,22,2012-10-10,2015-10-9
8,Thit Sar Pan,Private,Kyie Kyat(6/12)(),10.10.2012,9.10.2015,Gem,1,Madalay Division,Moe House(23),10,10,2012,9,10,2015,Moe House,23,2012-10-10,2015-10-9
9,Thit Sar Pan,Private,Kyie Kyat(6/12)(),10.10.2012,9.10.2015,Gem,1,Madalay Division,Moe House(24),10,10,2012,9,10,2015,Moe House,24,2012-10-10,2015-10-9
10,Thit Sar Pan,Private,Kyie Kyat(6/12)(),10.10.2012,9.10.2015,Gem,1,Madalay Division,Moe House(25),10,10,2012,9,10,2015,Moe House,25,2012-10-10,2015-10-9
11,Thit Sar Pan,Private,Kyie Kyat(6/12)(),10.10.2012,9.10.2015,Gem,1,Madalay Division,Moe House(26),10,10,2012,9,10,2015,Moe House,26,2012-10-10,2015-10-9
12,Thit Sar Pan,Private,Kyie Kyat(6/12)(),10.10.2012,9.10.2015,Gem,1,Madalay Division,Moe House(27),10,10,2012,9,10,2015,Moe House,27,2012-10-10,2015-10-9
13,Thit Sar Pan,Private,Kyie Kyat(6/12)(),10.10.2012,9.10.2015,Gem,1,Madalay Division,Moe House(28),10,10,2012,9,10,2015,Moe House,28,2012-10-10,2015-10-9
14,Thit Sar Pan,Private,Kyie Kyat(6/12)(),10.10.2012,9.10.2015,Gem,1,Madalay Division,Moe House(29),10,10,2012,9,10,2015,Moe House,29,2012-10-10,2015-10-9
15,Thit Sar Pan,Private,Kyie Kyat(6/12)(),10.10.2012,9.10.2015,Gem,1,Madalay Division,Moe House(30),10,10,2012,9,10,2015,Moe House,30,2012-10-10,2015-10-9
16,Thit Sar Pan,Private,Kyie Kyat(6/12)(),10.10.2012,9.10.2015,Gem,1,Madalay Division,Moe House(31),10,10,2012,9,10,2015,Moe House,31,2012-10-10,2015-10-9
17,Thit Sar Pan,Private,Kyie Kyat(6/12)(),10.10.2012,9.10.2015,Gem,1,Madalay Division,Moe House(32),10,10,2012,9,10,2015,Moe House,32,2012-10-10,2015-10-9
18,Thit Sar Pan,Private,Kyie Kyat(6/12)(),10.10.2012,9.10.2015,Gem,1,Madalay Division,Moe House(33),10,10,2012,9,10,2015,Moe House,33,2012-10-10,2015-10-9
19,Thit Sar Pan,Private,Kyie Kyat(6/12)(),10.10.2012,9.10.2015,Gem,1,Madalay Division,Moe House(34),10,10,2012,9,10,2015,Moe House,34,2012-10-10,2015-10-9
20,Thit Sar Pan,Private,Kyie Kyat(6/12)(),10.10.2012,9.10.2015,Gem,1,Madalay Division,Moe House(35),10,10,2012,9,10,2015,Moe House,35,2012-10-10,2015-10-9
21,Thit Sar Pan,Private,Kyie Kyat(6/12)(),10.10.2012,9.10.2015,Gem,1,Madalay Division,Moe House(36),10,10,2012,9,10,2015,Moe House,36,2012-10-10,2015-10-9
22,Thit Sar Pan,Private,Kyie Kyat(6/12)(),10.10.2012,9.10.2015,Gem,1,Madalay Division,Moe House(37),10,10,2012,9,10,2015,Moe House,37,2012-10-10,2015-10-9
23,Thit Sar Pan,Private,Kyie Kyat(6/12)(),10.10.2012,9.10.2015,Gem,1,Madalay Division,Moe House(38),10,10,2012,9,10,2015,Moe House,38,2012-10-10,2015-10-9
24,Thit Sar Pan,Private,Kyie Kyat(6/12)(),10.10.2012,9.10.2015,Gem,1,Madalay Division,Moe House(39),10,10,2012,9,10,2015,Moe House,39,2012-10-10,2015-10-9
25,Thit Sar Pan,Private,Kyie Kyat(6/12)(),10.10.2012,9.10.2015,Gem,1,Madalay Division,Moe House(40),10,10,2012,9,10,2015,Moe House,40,2012-10-10,2015-10-9
26,Thit Sar Pan,Private,Kyie Kyat(6/12)(),10.10.2012,9.10.2015,Gem,1,Madalay Division,Moe House(41),10,10,2012,9,10,2015,Moe House,41,2012-10-10,2015-10-9
27,Thit Sar Pan,Private,Kyie Kyat(6/12)(),10.10.2012,9.10.2015,Gem,1,Madalay Division,Moe House(42),10,10,2012,9,10,2015,Moe House,42,2012-10-10,2015-10-9
28,Thit Sar Pan,Private,Kyie Kyat(6/12)(),10.10.2012,9.10.2015,Gem,1,Madalay Division,Moe House(43),10,10,2012,9,10,2015,Moe House,43,2012-10-10,2015-10-9
29,Thit Sar Pan,Private,Kyie Kyat(6/12)(),10.10.2012,9.10.2015,Gem,1,Madalay Division,Moe House(44),10,10,2012,9,10,2015,Moe House,44,2012-10-10,2015-10-9
30,Thit Sar Pan,Private,Kyie Kyat(6/12)(),10.10.2012,9.10.2015,Gem,1,Madalay Division,Moe House(45),10,10,2012,9,10,2015,Moe House,45,2012-10-10,2015-10-9
31,Thit Sar Pan,Private,Kyie Kyat(6/12)(),10.10.2012,9.10.2015,Gem,1,Madalay Division,Moe House(46),10,10,2012,9,10,2015,Moe House,46,2012-10-10,2015-10-9
32,Thit Sar Pan,Private,Kyie Kyat(6/12)(),10.10.2012,9.10.2015,Gem,1,Madalay Division,Moe House(47),10,10,2012,9,10,2015,Moe House,47,2012-10-10,2015-10-9
33,Thit Sar Pan,Private,Kyie Kyat(6/12)(),10.10.2012,9.10.2015,Gem,1,Madalay Division,Moe House(48),10,10,2012,9,10,2015,Moe House,48,2012-10-10,2015-10-9
34,Thit Sar Pan,Private,Kyie Kyat(6/12)(),10.10.2012,9.10.2015,Gem,1,Madalay Division,Moe House(49),10,10,2012,9,10,2015,Moe House,49,2012-10-10,2015-10-9
35,Thit Sar Pan,Private,Kyie Kyat(6/12)(),10.10.2012,9.10.2015,Gem,1,Madalay Division,Moe House(50),10,10,2012,9,10,2015,Moe House,50,2012-10-10,2015-10-9
36,Thit Sar Pan,Private,Kyie Kyat(6/12)(),10.10.2012,9.10.2015,Gem,1,Madalay Division,Moe House(51),10,10,2012,9,10,2015,Moe House,51,2012-10-10,2015-10-9
37,Thit Sar Pan,Private,Kyie Kyat(6/12)(),10.10.2012,9.10.2015,Gem,1,Madalay Division,Moe House(52),10,10,2012,9,10,2015,Moe House,52,2012-10-10,2015-10-9
38,Thit Sar Pan,Private,Kyie Kyat(6/12)(),10.10.2012,9.10.2015,Gem,1,Madalay Division,Moe House(53),10,10,2012,9,10,2015,Moe House,53,2012-10-10,2015-10-9
39,Thit Sar Pan,Private,Kyie Kyat(6/12)(),10.10.2012,9.10.2015,Gem,1,Madalay Division,Moe House(54),10,10,2012,9,10,2015,Moe House,54,2012-10-10,2015-10-9
40,Thit Sar Pan,Private,Kyie Kyat(6/12)(),10.10.2012,9.10.2015,Gem,1,Madalay Division,Moe House(55),10,10,2012,9,10,2015,Moe House,55,2012-10-10,2015-10-9
41,Thit Sar Pan,Private,Kyie Kyat(6/12)(),10.10.2012,9.10.2015,Gem,1,Madalay Division,Moe House(56),10,10,2012,9,10,2015,Moe House,56,2012-10-10,2015-10-9
42,Thit Sar Pan,Private,Kyie Kyat(6/12)(),10.10.2012,9.10.2015,Gem,1,Madalay Division,Moe House(57),10,10,2012,9,10,2015,Moe House,57,2012-10-10,2015-10-9
43,Thit Sar Pan,Private,Kyie Kyat(6/12)(),10.10.2012,9.10.2015,Gem,1,Madalay Division,Moe House(58),10,10,2012,9,10,2015,Moe House,58,2012-10-10,2015-10-9
44,Thit Sar Pan,Private,Kyie Kyat(6/12)(),10.10.2012,9.10.2015,Gem,1,Madalay Division,Moe House(59),10,10,2012,9,10,2015,Moe House,59,2012-10-10,2015-10-9
45,Thit Sar Pan,Private,Kyie Kyat(6/12)(),10.10.2012,9.10.2015,Gem,1,Madalay Division,Moe House(60),10,10,2012,9,10,2015,Moe House,60,2012-10-10,2015-10-9
46,Thit Sar Pan,Private,Kyie Kyat(6/12)(),10.10.2012,9.10.2015,Gem,1,Madalay Division,Moe House(61),10,10,2012,9,10,2015,Moe House,61,2012-10-10,2015-10-9
47,Thit Sar Pan,Private,Kyie Kyat(6/12)(),10.10.2012,9.10.2015,Gem,1,Madalay Division,Moe House(62),10,10,2012,9,10,2015,Moe House,62,2012-10-10,2015-10-9
48,Thit Sar Pan,Private,Kyie Kyat(6/12)(),10.10.2012,9.10.2015,Gem,1,Madalay Division,Moe House(63),10,10,2012,9,10,2015,Moe House,63,2012-10-10,2015-10-9
49,Thit Sar Pan,Private,Kyie Kyat(6/12)(),10.10.2012,9.10.2015,Gem,1,Madalay Division,Moe House(64),10,10,2012,9,10,2015,Moe House,64,2012-10-10,2015-10-9
50,Thit Sar Pan,Private,Kyie Kyat(6/12)(),10.10.2012,9.10.2015,Gem,1,Madalay Division,Moe House(65),10,10,2012,9,10,2015,Moe House,65,2012-10-10,2015-10-9
1,Thawka,Private,Kyi Kyat(4/12)(1.6.2012),20.3.2012,18.6.2017,Jade,1,Kachin State,Maw One Lay(145),20,3,2012,18,6,2017,Maw One Lay,145,2012-3-20,2017-6-18
2,Thawka,Private,Kyi Kyat(4/12)(1.6.2012),20.3.2012,18.6.2017,Jade,1,Kachin State,Maw One Lay(146),20,3,2012,18,6,2017,Maw One Lay,146,2012-3-20,2017-6-18
3,Thawka,Private,Kyi Kyat(4/12)(1.6.2012),20.3.2012,18.6.2017,Jade,1,Kachin State,Maw One Lay(147),20,3,2012,18,6,2017,Maw One Lay,147,2012-3-20,2017-6-18
4,Thawka,Private,Kyi Kyat(4/12)(1.6.2012),20.3.2012,18.6.2017,Jade,1,Kachin State,Maw One Lay(148),20,3,2012,18,6,2017,Maw One Lay,148,2012-3-20,2017-6-18
5,Thawka,Private,Kyi Kyat(4/12)(1.6.2012),20.3.2012,18.6.2017,Jade,1,Kachin State,Maw One Lay(149),20,3,2012,18,6,2017,Maw One Lay,149,2012-3-20,2017-6-18
6,Thawka,Private,Kyi Kyat(4/12)(1.6.2012),20.3.2012,18.6.2017,Jade,1,Kachin State,Maw One Lay(150),20,3,2012,18,6,2017,Maw One Lay,150,2012-3-20,2017-6-18
7,Thawka,Private,Kyi Kyat(4/12)(1.6.2012),20.3.2012,18.6.2017,Jade,1,Kachin State,Maw One Lay(151),20,3,2012,18,6,2017,Maw One Lay,151,2012-3-20,2017-6-18
8,Thawka,Private,Kyi Kyat(4/12)(1.6.2012),20.3.2012,18.6.2017,Jade,1,Kachin State,Maw One Lay(152),20,3,2012,18,6,2017,Maw One Lay,152,2012-3-20,2017-6-18
9,Thawka,Private,Kyi Kyat(4/12)(1.6.2012),20.3.2012,18.6.2017,Jade,1,Kachin State,Maw One Lay(153),20,3,2012,18,6,2017,Maw One Lay,153,2012-3-20,2017-6-18
10,Thawka,Private,Kyi Kyat(4/12)(1.6.2012),20.3.2012,18.6.2017,Jade,1,Kachin State,Maw One Lay(154),20,3,2012,18,6,2017,Maw One Lay,154,2012-3-20,2017-6-18
11,Thawka,Private,Kyi Kyat(4/12)(1.6.2012),20.3.2012,18.6.2017,Jade,1,Kachin State,Maw One Lay(155),20,3,2012,18,6,2017,Maw One Lay,155,2012-3-20,2017-6-18
12,Thawka,Private,Kyi Kyat(4/12)(1.6.2012),20.3.2012,18.6.2017,Jade,1,Kachin State,Maw One Lay(156),20,3,2012,18,6,2017,Maw One Lay,156,2012-3-20,2017-6-18
13,Thawka,Private,Kyi Kyat(4/12)(1.6.2012),20.3.2012,18.6.2017,Jade,1,Kachin State,Maw One Lay(157),20,3,2012,18,6,2017,Maw One Lay,157,2012-3-20,2017-6-18
14,Thawka,Private,Kyi Kyat(4/12)(1.6.2012),20.3.2012,18.6.2017,Jade,1,Kachin State,Maw One Lay(158),20,3,2012,18,6,2017,Maw One Lay,158,2012-3-20,2017-6-18
15,Thawka,Private,Kyi Kyat(4/12)(1.6.2012),20.3.2012,18.6.2017,Jade,1,Kachin State,Maw One Lay(159),20,3,2012,18,6,2017,Maw One Lay,159,2012-3-20,2017-6-18
16,Thawka,Private,Kyi Kyat(4/12)(1.6.2012),20.3.2012,18.6.2017,Jade,1,Kachin State,Maw One Lay(160),20,3,2012,18,6,2017,Maw One Lay,160,2012-3-20,2017-6-18
17,Thawka,Private,Kyi Kyat(4/12)(1.6.2012),20.3.2012,18.6.2017,Jade,1,Kachin State,Maw One Lay(161),20,3,2012,18,6,2017,Maw One Lay,161,2012-3-20,2017-6-18
18,Thawka,Private,Kyi Kyat(4/12)(1.6.2012),20.3.2012,18.6.2017,Jade,1,Kachin State,Maw One Lay(162),20,3,2012,18,6,2017,Maw One Lay,162,2012-3-20,2017-6-18
19,Thawka,Private,Kyi Kyat(4/12)(1.6.2012),20.3.2012,18.6.2017,Jade,1,Kachin State,Maw One Lay(163),20,3,2012,18,6,2017,Maw One Lay,163,2012-3-20,2017-6-18
20,Thawka,Private,Kyi Kyat(4/12)(1.6.2012),20.3.2012,18.6.2017,Jade,1,Kachin State,Maw One Lay(164),20,3,2012,18,6,2017,Maw One Lay,164,2012-3-20,2017-6-18
21,Thawka,Private,Kyi Kyat(4/12)(1.6.2012),20.3.2012,18.6.2017,Jade,1,Kachin State,Maw One Lay(165),20,3,2012,18,6,2017,Maw One Lay,165,2012-3-20,2017-6-18
22,Thawka,Private,Kyi Kyat(4/12)(1.6.2012),20.3.2012,18.6.2017,Jade,1,Kachin State,Maw One Lay(166),20,3,2012,18,6,2017,Maw One Lay,166,2012-3-20,2017-6-18
23,Thawka,Private,Kyi Kyat(4/12)(1.6.2012),20.3.2012,18.6.2017,Jade,1,Kachin State,Maw One Lay(167),20,3,2012,18,6,2017,Maw One Lay,167,2012-3-20,2017-6-18
24,Thawka,Private,Kyi Kyat(4/12)(1.6.2012),20.3.2012,18.6.2017,Jade,1,Kachin State,Maw One Lay(168),20,3,2012,18,6,2017,Maw One Lay,168,2012-3-20,2017-6-18
25,Thawka,Private,Kyi Kyat(4/12)(1.6.2012),20.3.2012,18.6.2017,Jade,1,Kachin State,Maw One Lay(169),20,3,2012,18,6,2017,Maw One Lay,169,2012-3-20,2017-6-18
26,Thawka,Private,Kyi Kyat(4/12)(1.6.2012),20.3.2012,18.6.2017,Jade,1,Kachin State,Maw One Lay(170),20,3,2012,18,6,2017,Maw One Lay,170,2012-3-20,2017-6-18
27,Thawka,Private,Kyi Kyat(4/12)(1.6.2012),20.3.2012,18.6.2017,Jade,1,Kachin State,Maw One Lay(171),20,3,2012,18,6,2017,Maw One Lay,171,2012-3-20,2017-6-18
28,Thawka,Private,Kyi Kyat(4/12)(1.6.2012),20.3.2012,18.6.2017,Jade,1,Kachin State,Maw One Lay(172),20,3,2012,18,6,2017,Maw One Lay,172,2012-3-20,2017-6-18
29,Thawka,Private,Kyi Kyat(4/12)(1.6.2012),20.3.2012,18.6.2017,Jade,1,Kachin State,Maw One Lay(173),20,3,2012,18,6,2017,Maw One Lay,173,2012-3-20,2017-6-18
30,Thawka,Private,Kyi Kyat(4/12)(1.6.2012),20.3.2012,18.6.2017,Jade,1,Kachin State,Maw One Lay(174),20,3,2012,18,6,2017,Maw One Lay,174,2012-3-20,2017-6-18
31,Thawka,Private,Kyi Kyat(4/12)(1.6.2012),20.3.2012,18.6.2017,Jade,1,Kachin State,Maw One Lay(175),20,3,2012,18,6,2017,Maw One Lay,175,2012-3-20,2017-6-18
32,Thawka,Private,Kyi Kyat(4/12)(1.6.2012),20.3.2012,18.6.2017,Jade,1,Kachin State,Maw One Lay(176),20,3,2012,18,6,2017,Maw One Lay,176,2012-3-20,2017-6-18
33,Thawka,Private,Kyi Kyat(4/12)(1.6.2012),20.3.2012,18.6.2017,Jade,1,Kachin State,Maw One Lay(177),20,3,2012,18,6,2017,Maw One Lay,177,2012-3-20,2017-6-18
34,Thawka,Private,Kyi Kyat(4/12)(1.6.2012),20.3.2012,18.6.2017,Jade,1,Kachin State,Maw One Lay(178),20,3,2012,18,6,2017,Maw One Lay,178,2012-3-20,2017-6-18
35,Thawka,Private,Kyi Kyat(4/12)(1.6.2012),20.3.2012,18.6.2017,Jade,1,Kachin State,Maw One Lay(179),20,3,2012,18,6,2017,Maw One Lay,179,2012-3-20,2017-6-18
36,Thawka,Private,Kyi Kyat(4/12)(1.6.2012),20.3.2012,18.6.2017,Jade,1,Kachin State,Maw One Lay(180),20,3,2012,18,6,2017,Maw One Lay,180,2012-3-20,2017-6-18
37,Thawka,Private,Kyi Kyat(4/12)(1.6.2012),20.3.2012,18.6.2017,Jade,1,Kachin State,Maw One Lay(181),20,3,2012,18,6,2017,Maw One Lay,181,2012-3-20,2017-6-18
38,Thawka,Private,Kyi Kyat(4/12)(1.6.2012),20.3.2012,18.6.2017,Jade,1,Kachin State,Maw One Lay(182),20,3,2012,18,6,2017,Maw One Lay,182,2012-3-20,2017-6-18
39,Thawka,Private,Kyi Kyat(4/12)(1.6.2012),20.3.2012,18.6.2017,Jade,1,Kachin State,Maw One Lay(183),20,3,2012,18,6,2017,Maw One Lay,183,2012-3-20,2017-6-18
40,Thawka,Private,Kyi Kyat(4/12)(1.6.2012),20.3.2012,18.6.2017,Jade,1,Kachin State,Maw One Lay(184),20,3,2012,18,6,2017,Maw One Lay,184,2012-3-20,2017-6-18
41,Thawka,Private,Kyi Kyat(4/12)(1.6.2012),20.3.2012,18.6.2017,Jade,1,Kachin State,Maw One Lay(185),20,3,2012,18,6,2017,Maw One Lay,185,2012-3-20,2017-6-18
42,Thawka,Private,Kyi Kyat(4/12)(1.6.2012),20.3.2012,18.6.2017,Jade,1,Kachin State,Maw One Lay(186),20,3,2012,18,6,2017,Maw One Lay,186,2012-3-20,2017-6-18
43,Thawka,Private,Kyi Kyat(4/12)(1.6.2012),20.3.2012,18.6.2017,Jade,1,Kachin State,Maw One Lay(187),20,3,2012,18,6,2017,Maw One Lay,187,2012-3-20,2017-6-18
44,Thawka,Private,Kyi Kyat(4/12)(1.6.2012),20.3.2012,18.6.2017,Jade,1,Kachin State,Maw One Lay(188),20,3,2012,18,6,2017,Maw One Lay,188,2012-3-20,2017-6-18
45,Thawka,Private,Kyi Kyat(4/12)(1.6.2012),20.3.2012,18.6.2017,Jade,1,Kachin State,Maw One Lay(189),20,3,2012,18,6,2017,Maw One Lay,189,2012-3-20,2017-6-18
46,Thawka,Private,Kyi Kyat(4/12)(1.6.2012),20.3.2012,18.6.2017,Jade,1,Kachin State,Maw One Lay(190),20,3,2012,18,6,2017,Maw One Lay,190,2012-3-20,2017-6-18
47,Thawka,Private,Kyi Kyat(4/12)(1.6.2012),20.3.2012,18.6.2017,Jade,1,Kachin State,Maw One Lay(191),20,3,2012,18,6,2017,Maw One Lay,191,2012-3-20,2017-6-18
48,Thawka,Private,Kyi Kyat(4/12)(1.6.2012),20.3.2012,18.6.2017,Jade,1,Kachin State,Maw One Lay(192),20,3,2012,18,6,2017,Maw One Lay,192,2012-3-20,2017-6-18
49,Thawka,Private,Kyi Kyat(4/12)(1.6.2012),20.3.2012,18.6.2017,Jade,1,Kachin State,Maw One Lay(193),20,3,2012,18,6,2017,Maw One Lay,193,2012-3-20,2017-6-18
50,Thawka,Private,Kyi Kyat(4/12)(1.6.2012),20.3.2012,18.6.2017,Jade,1,Kachin State,Maw One Lay(194),20,3,2012,18,6,2017,Maw One Lay,194,2012-3-20,2017-6-18
1,Kyaw Asia,Private,Oo Si (1/14)(10.6.14),9.7.2014,8.7.2017,Gem,1,Madalay Division,Baw Mar Ah Sha Pyat(54),9,7,2014,8,7,2017,Baw Mar Ah Sha Pyat,54,2014-7-9,2017-7-8
2,Kyaw Asia,Private,Oo Si (1/14)(10.6.14),9.7.2014,8.7.2017,Gem,1,Madalay Division,Baw Mar Ah Sha Pyat(55),9,7,2014,8,7,2017,Baw Mar Ah Sha Pyat,55,2014-7-9,2017-7-8
3,Kyaw Asia,Private,Oo Si (1/14)(10.6.14),9.7.2014,8.7.2017,Gem,1,Madalay Division,Baw Mar Ah Sha Pyat(56),9,7,2014,8,7,2017,Baw Mar Ah Sha Pyat,56,2014-7-9,2017-7-8
4,Kyaw Asia,Private,Oo Si (1/14)(10.6.14),9.7.2014,8.7.2017,Gem,1,Madalay Division,Baw Mar Ah Sha Pyat(66),9,7,2014,8,7,2017,Baw Mar Ah Sha Pyat,66,2014-7-9,2017-7-8
5,Kyaw Asia,Private,Oo Si (1/14)(10.6.14),9.7.2014,8.7.2017,Gem,1,Madalay Division,Baw Mar Ah Sha Pyat(67),9,7,2014,8,7,2017,Baw Mar Ah Sha Pyat,67,2014-7-9,2017-7-8
6,Kyaw Asia,Private,Oo Si (1/14)(10.6.14),9.7.2014,8.7.2017,Gem,1,Madalay Division,Baw Mar Ah Sha Pyat(68),9,7,2014,8,7,2017,Baw Mar Ah Sha Pyat,68,2014-7-9,2017-7-8
7,Kyaw Asia,Private,Oo Si (1/14)(10.6.14),9.7.2014,8.7.2017,Gem,1,Madalay Division,Baw Mar Ah Sha Pyat(75),9,7,2014,8,7,2017,Baw Mar Ah Sha Pyat,75,2014-7-9,2017-7-8
8,Kyaw Asia,Private,Oo Si (1/14)(10.6.14),9.7.2014,8.7.2017,Gem,1,Madalay Division,Baw Mar Ah Sha Pyat(76),9,7,2014,8,7,2017,Baw Mar Ah Sha Pyat,76,2014-7-9,2017-7-8
1,Kaung Su Yadanar,Private,Oo Si(1/10)(4.2.10),16.1.2010,16.4.2017,Jade,1,Kachin State,Sai Taung(95),16,1,2010,16,4,2017,Sai Taung,95,2010-1-16,2017-4-16
2,Kaung Su Yadanar,Private,Oo Si(2/10)(17.5.10),26.4.2010,25.7.2017,Jade,1,Kachin State,Sai Taung(92),26,4,2010,25,7,2017,Sai Taung,92,2010-4-26,2017-7-25
3,Kaung Su Yadanar,Private,Oo Si(2/10)(17.5.10),26.4.2010,25.7.2017,Jade,1,Kachin State,Sai Taung(93),26,4,2010,25,7,2017,Sai Taung,93,2010-4-26,2017-7-25
1,Kaung Bhone Yadanar,Private,Oo Si(2/11)(19.6.11),31.8.2011,29.11.2016,Jade,1,Kachin State,Shin Ta Thaung(7),31,8,2011,29,11,2016,Shin Ta Thaung,7,2011-8-31,2016-11-29
1,Kaung Bhone Yadanar,Private,Kyi Kyat (10.1.12),30.4.2012,29.7.2017,Jade,1,Kachin State,Dan Tin Kyi Phawhtoke(95),30,4,2012,29,7,2017,Dan Tin Kyi Phawhtoke,95,2012-4-30,2017-7-29
2,Kaung Bhone Yadanar,Private,Kyi Kyat (10.1.12),30.4.2012,29.7.2017,Jade,1,Kachin State,Dan Tin Kyi Phawhtoke(96),30,4,2012,29,7,2017,Dan Tin Kyi Phawhtoke,96,2012-4-30,2017-7-29
3,Kaung Bhone Yadanar,Private,Kyi Kyat (10.1.12),30.4.2012,29.7.2017,Jade,1,Kachin State,Dan Tin Kyi Phawhtoke(97),30,4,2012,29,7,2017,Dan Tin Kyi Phawhtoke,97,2012-4-30,2017-7-29
4,Kaung Bhone Yadanar,Private,Kyi Kyat (10.1.12),30.4.2012,29.7.2017,Jade,1,Kachin State,Dan Tin Kyi Phawhtoke(98),30,4,2012,29,7,2017,Dan Tin Kyi Phawhtoke,98,2012-4-30,2017-7-29
5,Kaung Bhone Yadanar,Private,Kyi Kyat (10.1.12),30.4.2012,29.7.2017,Jade,1,Kachin State,Dan Tin Kyi Phawhtoke(99),30,4,2012,29,7,2017,Dan Tin Kyi Phawhtoke,99,2012-4-30,2017-7-29
6,Kaung Bhone Yadanar,Private,Kyi Kyat (10.1.12),30.4.2012,29.7.2017,Jade,1,Kachin State,Dan Tin Kyi Phawhtoke(100),30,4,2012,29,7,2017,Dan Tin Kyi Phawhtoke,100,2012-4-30,2017-7-29
7,Kaung Bhone Yadanar,Private,Kyi Kyat (10.1.12),30.4.2012,29.7.2017,Jade,1,Kachin State,Dan Tin Kyi Phawhtoke(101),30,4,2012,29,7,2017,Dan Tin Kyi Phawhtoke,101,2012-4-30,2017-7-29
8,Kaung Bhone Yadanar,Private,Kyi Kyat (10.1.12),30.4.2012,29.7.2017,Jade,1,Kachin State,Dan Tin Kyi Phawhtoke(102),30,4,2012,29,7,2017,Dan Tin Kyi Phawhtoke,102,2012-4-30,2017-7-29
9,Kaung Bhone Yadanar,Private,Kyi Kyat (10.1.12),30.4.2012,29.7.2017,Jade,1,Kachin State,Dan Tin Kyi Phawhtoke(103),30,4,2012,29,7,2017,Dan Tin Kyi Phawhtoke,103,2012-4-30,2017-7-29
10,Kaung Bhone Yadanar,Private,Kyi Kyat (10.1.12),30.4.2012,29.7.2017,Jade,1,Kachin State,Maw Lu Phawhtoke(145),30,4,2012,29,7,2017,Maw Lu Phawhtoke,145,2012-4-30,2017-7-29
11,Kaung Bhone Yadanar,Private,Kyi Kyat (10.1.12),30.4.2012,29.7.2017,Jade,1,Kachin State,Maw Lu Phawhtoke(146),30,4,2012,29,7,2017,Maw Lu Phawhtoke,146,2012-4-30,2017-7-29
12,Kaung Bhone Yadanar,Private,Kyi Kyat (10.1.12),30.4.2012,29.7.2017,Jade,1,Kachin State,Maw Lu Phawhtoke(147),30,4,2012,29,7,2017,Maw Lu Phawhtoke,147,2012-4-30,2017-7-29
13,Kaung Bhone Yadanar,Private,Kyi Kyat (10.1.12),30.4.2012,29.7.2017,Jade,1,Kachin State,Maw Lu Phawhtoke(148),30,4,2012,29,7,2017,Maw Lu Phawhtoke,148,2012-4-30,2017-7-29
14,Kaung Bhone Yadanar,Private,Kyi Kyat (10.1.12),30.4.2012,29.7.2017,Jade,1,Kachin State,Maw Lu Phawhtoke(149),30,4,2012,29,7,2017,Maw Lu Phawhtoke,149,2012-4-30,2017-7-29
15,Kaung Bhone Yadanar,Private,Kyi Kyat (10.1.12),30.4.2012,29.7.2017,Jade,1,Kachin State,Maw Lu Phawhtoke(150),30,4,2012,29,7,2017,Maw Lu Phawhtoke,150,2012-4-30,2017-7-29
16,Kaung Bhone Yadanar,Private,Kyi Kyat (10.1.12),30.4.2012,29.7.2017,Jade,1,Kachin State,Maw Lu Phawhtoke(151),30,4,2012,29,7,2017,Maw Lu Phawhtoke,151,2012-4-30,2017-7-29
17,Kaung Bhone Yadanar,Private,Kyi Kyat (10.1.12),30.4.2012,29.7.2017,Jade,1,Kachin State,Maw Lu Phawhtoke(152),30,4,2012,29,7,2017,Maw Lu Phawhtoke,152,2012-4-30,2017-7-29
18,Kaung Bhone Yadanar,Private,Kyi Kyat (10.1.12),30.4.2012,29.7.2017,Jade,1,Kachin State,Maw Lu Phawhtoke(153),30,4,2012,29,7,2017,Maw Lu Phawhtoke,153,2012-4-30,2017-7-29
19,Kaung Bhone Yadanar,Private,Kyi Kyat (10.1.12),30.4.2012,29.7.2017,Jade,1,Kachin State,Maw Lu Phawhtoke(154),30,4,2012,29,7,2017,Maw Lu Phawhtoke,154,2012-4-30,2017-7-29
20,Kaung Bhone Yadanar,Private,Kyi Kyat (10.1.12),30.4.2012,29.7.2017,Jade,1,Kachin State,Maw Lu Phawhtoke(155),30,4,2012,29,7,2017,Maw Lu Phawhtoke,155,2012-4-30,2017-7-29
21,Kaung Bhone Yadanar,Private,Kyi Kyat (10.1.12),30.4.2012,29.7.2017,Jade,1,Kachin State,Maw Lu Phawhtoke(156),30,4,2012,29,7,2017,Maw Lu Phawhtoke,156,2012-4-30,2017-7-29
22,Kaung Bhone Yadanar,Private,Kyi Kyat (10.1.12),30.4.2012,29.7.2017,Jade,1,Kachin State,Maw Lu Phawhtoke(157),30,4,2012,29,7,2017,Maw Lu Phawhtoke,157,2012-4-30,2017-7-29
23,Kaung Bhone Yadanar,Private,Kyi Kyat (10.1.12),30.4.2012,29.7.2017,Jade,1,Kachin State,Maw Lu Phawhtoke(158),30,4,2012,29,7,2017,Maw Lu Phawhtoke,158,2012-4-30,2017-7-29
24,Kaung Bhone Yadanar,Private,Kyi Kyat (10.1.12),30.4.2012,29.7.2017,Jade,1,Kachin State,Maw Lu Phawhtoke(159),30,4,2012,29,7,2017,Maw Lu Phawhtoke,159,2012-4-30,2017-7-29
25,Kaung Bhone Yadanar,Private,Kyi Kyat (9.4.12),7.6.2012,31.8.2017,Jade,1,Kachin State,Kaung yo Phawhtoke(1407),7,6,2012,31,8,2017,Kaung yo Phawhtoke,1407,2012-6-7,2017-8-31
26,Kaung Bhone Yadanar,Private,Kyi Kyat (9.4.12),7.6.2012,31.8.2017,Jade,1,Kachin State,Kaung yo Phawhtoke(1408),7,6,2012,31,8,2017,Kaung yo Phawhtoke,1408,2012-6-7,2017-8-31
27,Kaung Bhone Yadanar,Private,Kyi Kyat (9.4.12),7.6.2012,31.8.2017,Jade,1,Kachin State,Kaung yo Phawhtoke(1409),7,6,2012,31,8,2017,Kaung yo Phawhtoke,1409,2012-6-7,2017-8-31
28,Kaung Bhone Yadanar,Private,Kyi Kyat (9.4.12),7.6.2012,31.8.2017,Jade,1,Kachin State,Kaung yo Phawhtoke(1410),7,6,2012,31,8,2017,Kaung yo Phawhtoke,1410,2012-6-7,2017-8-31
29,Kaung Bhone Yadanar,Private,Kyi Kyat (9.4.12),7.6.2012,31.8.2017,Jade,1,Kachin State,Kaung yo Phawhtoke(1411),7,6,2012,31,8,2017,Kaung yo Phawhtoke,1411,2012-6-7,2017-8-31
30,Kaung Bhone Yadanar,Private,Kyi Kyat (9.4.12),7.6.2012,31.8.2017,Jade,1,Kachin State,Kaung yo Phawhtoke(1412),7,6,2012,31,8,2017,Kaung yo Phawhtoke,1412,2012-6-7,2017-8-31
31,Kaung Bhone Yadanar,Private,Kyi Kyat (9.4.12),7.6.2012,31.8.2017,Jade,1,Kachin State,Kaung yo Phawhtoke(1413),7,6,2012,31,8,2017,Kaung yo Phawhtoke,1413,2012-6-7,2017-8-31
32,Kaung Bhone Yadanar,Private,Kyi Kyat (9.4.12),7.6.2012,31.8.2017,Jade,1,Kachin State,Kaung yo Phawhtoke(1414),7,6,2012,31,8,2017,Kaung yo Phawhtoke,1414,2012-6-7,2017-8-31
33,Kaung Bhone Yadanar,Private,Kyi Kyat (9.4.12),7.6.2012,31.8.2017,Jade,1,Kachin State,Kaung yo Phawhtoke(1415),7,6,2012,31,8,2017,Kaung yo Phawhtoke,1415,2012-6-7,2017-8-31
34,Kaung Bhone Yadanar,Private,Kyi Kyat (9.4.12),7.6.2012,31.8.2017,Jade,1,Kachin State,Kaung yo Phawhtoke(1416),7,6,2012,31,8,2017,Kaung yo Phawhtoke,1416,2012-6-7,2017-8-31
35,Kaung Bhone Yadanar,Private,Kyi Kyat (9.4.12),7.6.2012,31.8.2017,Jade,1,Kachin State,Kaung yo Phawhtoke(1417),7,6,2012,31,8,2017,Kaung yo Phawhtoke,1417,2012-6-7,2017-8-31
36,Kaung Bhone Yadanar,Private,Kyi Kyat (9.4.12),7.6.2012,31.8.2017,Jade,1,Kachin State,Kaung yo Phawhtoke(1418),7,6,2012,31,8,2017,Kaung yo Phawhtoke,1418,2012-6-7,2017-8-31
37,Kaung Bhone Yadanar,Private,Kyi Kyat (9.4.12),7.6.2012,31.8.2017,Jade,1,Kachin State,Kaung yo Phawhtoke(1419),7,6,2012,31,8,2017,Kaung yo Phawhtoke,1419,2012-6-7,2017-8-31
38,Kaung Bhone Yadanar,Private,Kyi Kyat (9.4.12),7.6.2012,31.8.2017,Jade,1,Kachin State,Kaung yo Phawhtoke(1420),7,6,2012,31,8,2017,Kaung yo Phawhtoke,1420,2012-6-7,2017-8-31
39,Kaung Bhone Yadanar,Private,Kyi Kyat (9.4.12),7.6.2012,31.8.2017,Jade,1,Kachin State,Kaung yo Phawhtoke(1421),7,6,2012,31,8,2017,Kaung yo Phawhtoke,1421,2012-6-7,2017-8-31
40,Kaung Bhone Yadanar,Private,Kyi Kyat (9.4.12),7.6.2012,31.8.2017,Jade,1,Kachin State,Kaung yo Phawhtoke(1422),7,6,2012,31,8,2017,Kaung yo Phawhtoke,1422,2012-6-7,2017-8-31
41,Kaung Bhone Yadanar,Private,Kyi Kyat (9.4.12),7.6.2012,31.8.2017,Jade,1,Kachin State,Kaung yo Phawhtoke(1423),7,6,2012,31,8,2017,Kaung yo Phawhtoke,1423,2012-6-7,2017-8-31
42,Kaung Bhone Yadanar,Private,Kyi Kyat (9.4.12),7.6.2012,31.8.2017,Jade,1,Kachin State,Kaung yo Phawhtoke(1424),7,6,2012,31,8,2017,Kaung yo Phawhtoke,1424,2012-6-7,2017-8-31
43,Kaung Bhone Yadanar,Private,Kyi Kyat (9.4.12),7.6.2012,31.8.2017,Jade,1,Kachin State,Kaung yo Phawhtoke(1425),7,6,2012,31,8,2017,Kaung yo Phawhtoke,1425,2012-6-7,2017-8-31
44,Kaung Bhone Yadanar,Private,Kyi Kyat (9.4.12),7.6.2012,31.8.2017,Jade,1,Kachin State,Kaung yo Phawhtoke(1426),7,6,2012,31,8,2017,Kaung yo Phawhtoke,1426,2012-6-7,2017-8-31
45,Kaung Bhone Yadanar,Private,Kyi Kyat (9.4.12),7.6.2012,31.8.2017,Jade,1,Kachin State,Kaung yo Phawhtoke(1427),7,6,2012,31,8,2017,Kaung yo Phawhtoke,1427,2012-6-7,2017-8-31
46,Kaung Bhone Yadanar,Private,Kyi Kyat (9.4.12),7.6.2012,31.8.2017,Jade,1,Kachin State,Kaung yo Phawhtoke(1428),7,6,2012,31,8,2017,Kaung yo Phawhtoke,1428,2012-6-7,2017-8-31
47,Kaung Bhone Yadanar,Private,Kyi Kyat (9.4.12),7.6.2012,31.8.2017,Jade,1,Kachin State,Kaung yo Phawhtoke(1429),7,6,2012,31,8,2017,Kaung yo Phawhtoke,1429,2012-6-7,2017-8-31
48,Kaung Bhone Yadanar,Private,Kyi Kyat (9.4.12),7.6.2012,31.8.2017,Jade,1,Kachin State,Kaung yo Phawhtoke(1430),7,6,2012,31,8,2017,Kaung yo Phawhtoke,1430,2012-6-7,2017-8-31
49,Kaung Bhone Yadanar,Private,Kyi Kyat (1.6.12),27.7.2012,31.8.2017,Jade,1,Kachin State,Khun Sine Phawhtoke(890),27,7,2012,31,8,2017,Khun Sine Phawhtoke,890,2012-7-27,2017-8-31
50,Kaung Bhone Yadanar,Private,Kyi Kyat (1.6.12),27.7.2012,31.8.2017,Jade,1,Kachin State,Khun Sine Phawhtoke(891),27,7,2012,31,8,2017,Khun Sine Phawhtoke,891,2012-7-27,2017-8-31
51,Kaung Bhone Yadanar,Private,Kyi Kyat (1.6.12),27.7.2012,31.8.2017,Jade,1,Kachin State,Namachi  Hmaw Thit  Phawhtoke(997),27,7,2012,31,8,2017,Namachi  Hmaw Thit  Phawhtoke,997,2012-7-27,2017-8-31
52,Kaung Bhone Yadanar,Private,Kyi Kyat (1.6.12),27.7.2012,31.8.2017,Jade,1,Kachin State,Namachi  Hmaw Thit  Phawhtoke(998),27,7,2012,31,8,2017,Namachi  Hmaw Thit  Phawhtoke,998,2012-7-27,2017-8-31
53,Kaung Bhone Yadanar,Private,Kyi Kyat (1.6.12),27.7.2012,31.8.2017,Jade,1,Kachin State,Namachi  Hmaw Thit  Phawhtoke(999),27,7,2012,31,8,2017,Namachi  Hmaw Thit  Phawhtoke,999,2012-7-27,2017-8-31
54,Kaung Bhone Yadanar,Private,Kyi Kyat (1.6.12),27.7.2012,31.8.2017,Jade,1,Kachin State,Namachi  Hmaw Thit  Phawhtoke(1000),27,7,2012,31,8,2017,Namachi  Hmaw Thit  Phawhtoke,1000,2012-7-27,2017-8-31
55,Kaung Bhone Yadanar,Private,Kyi Kyat (1.6.12),27.7.2012,31.8.2017,Jade,1,Kachin State,Namachi  Hmaw Thit  Phawhtoke(1001),27,7,2012,31,8,2017,Namachi  Hmaw Thit  Phawhtoke,1001,2012-7-27,2017-8-31
56,Kaung Bhone Yadanar,Private,Kyi Kyat (1.6.12),27.7.2012,31.8.2017,Jade,1,Kachin State,Namachi  Hmaw Thit  Phawhtoke(1002),27,7,2012,31,8,2017,Namachi  Hmaw Thit  Phawhtoke,1002,2012-7-27,2017-8-31
57,Kaung Bhone Yadanar,Private,Kyi Kyat (1.6.12),27.7.2012,31.8.2017,Jade,1,Kachin State,Namachi  Hmaw Thit  Phawhtoke(1003),27,7,2012,31,8,2017,Namachi  Hmaw Thit  Phawhtoke,1003,2012-7-27,2017-8-31
58,Kaung Bhone Yadanar,Private,Kyi Kyat (1.6.12),27.7.2012,31.8.2017,Jade,1,Kachin State,Namachi  Hmaw Thit  Phawhtoke(1004),27,7,2012,31,8,2017,Namachi  Hmaw Thit  Phawhtoke,1004,2012-7-27,2017-8-31
59,Kaung Bhone Yadanar,Private,Kyi Kyat (1.6.12),27.7.2012,31.8.2017,Jade,1,Kachin State,Namachi  Hmaw Thit  Phawhtoke(1005),27,7,2012,31,8,2017,Namachi  Hmaw Thit  Phawhtoke,1005,2012-7-27,2017-8-31
60,Kaung Bhone Yadanar,Private,Kyi Kyat (1.6.12),27.7.2012,31.8.2017,Jade,1,Kachin State,Namachi  Hmaw Thit  Phawhtoke(1006),27,7,2012,31,8,2017,Namachi  Hmaw Thit  Phawhtoke,1006,2012-7-27,2017-8-31
61,Kaung Bhone Yadanar,Private,Kyi Kyat (1.6.12),27.7.2012,31.8.2017,Jade,1,Kachin State,Namachi  Hmaw Thit  Phawhtoke(1007),27,7,2012,31,8,2017,Namachi  Hmaw Thit  Phawhtoke,1007,2012-7-27,2017-8-31
62,Kaung Bhone Yadanar,Private,Kyi Kyat (1.6.12),27.7.2012,31.8.2017,Jade,1,Kachin State,Namachi  Hmaw Thit  Phawhtoke(1008),27,7,2012,31,8,2017,Namachi  Hmaw Thit  Phawhtoke,1008,2012-7-27,2017-8-31
63,Kaung Bhone Yadanar,Private,Kyi Kyat (1.6.12),27.7.2012,31.8.2017,Jade,1,Kachin State,Namachi  Hmaw Thit  Phawhtoke(1009),27,7,2012,31,8,2017,Namachi  Hmaw Thit  Phawhtoke,1009,2012-7-27,2017-8-31
64,Kaung Bhone Yadanar,Private,Kyi Kyat (1.6.12),27.7.2012,31.8.2017,Jade,1,Kachin State,Namachi  Hmaw Thit  Phawhtoke(1010),27,7,2012,31,8,2017,Namachi  Hmaw Thit  Phawhtoke,1010,2012-7-27,2017-8-31
65,Kaung Bhone Yadanar,Private,Kyi Kyat (1.6.12),27.7.2012,31.8.2017,Jade,1,Kachin State,Namachi  Hmaw Thit  Phawhtoke(1011),27,7,2012,31,8,2017,Namachi  Hmaw Thit  Phawhtoke,1011,2012-7-27,2017-8-31
66,Kaung Bhone Yadanar,Private,Kyi Kyat (1.6.12),27.7.2012,31.8.2017,Jade,1,Kachin State,Namachi  Hmaw Thit  Phawhtoke(1012),27,7,2012,31,8,2017,Namachi  Hmaw Thit  Phawhtoke,1012,2012-7-27,2017-8-31
67,Kaung Bhone Yadanar,Private,Kyi Kyat (1.6.12),27.7.2012,31.8.2017,Jade,1,Kachin State,Namachi  Hmaw Thit  Phawhtoke(1013),27,7,2012,31,8,2017,Namachi  Hmaw Thit  Phawhtoke,1013,2012-7-27,2017-8-31
68,Kaung Bhone Yadanar,Private,Kyi Kyat (1.6.12),27.7.2012,31.8.2017,Jade,1,Kachin State,Namachi  Hmaw Thit  Phawhtoke(1014),27,7,2012,31,8,2017,Namachi  Hmaw Thit  Phawhtoke,1014,2012-7-27,2017-8-31
69,Kaung Bhone Yadanar,Private,Kyi Kyat (1.6.12),27.7.2012,31.8.2017,Jade,1,Kachin State,Namachi  Hmaw Thit  Phawhtoke(1015),27,7,2012,31,8,2017,Namachi  Hmaw Thit  Phawhtoke,1015,2012-7-27,2017-8-31
70,Kaung Bhone Yadanar,Private,Kyi Kyat (1.6.12),27.7.2012,31.8.2017,Jade,1,Kachin State,Namachi  Hmaw Thit  Phawhtoke(1016),27,7,2012,31,8,2017,Namachi  Hmaw Thit  Phawhtoke,1016,2012-7-27,2017-8-31
71,Kaung Bhone Yadanar,Private,Kyi Kyat (1.6.12),27.7.2012,31.8.2017,Jade,1,Kachin State,Namachi  Hmaw Thit  Phawhtoke(1017),27,7,2012,31,8,2017,Namachi  Hmaw Thit  Phawhtoke,1017,2012-7-27,2017-8-31
72,Kaung Bhone Yadanar,Private,Kyi Kyat (1.6.12),27.7.2012,31.8.2017,Jade,1,Kachin State,Namachi  Hmaw Thit  Phawhtoke(1018),27,7,2012,31,8,2017,Namachi  Hmaw Thit  Phawhtoke,1018,2012-7-27,2017-8-31
73,Kaung Bhone Yadanar,Private,Kyi Kyat (1.6.12),27.7.2012,31.8.2017,Jade,1,Kachin State,Namachi  Hmaw Thit  Phawhtoke(1019),27,7,2012,31,8,2017,Namachi  Hmaw Thit  Phawhtoke,1019,2012-7-27,2017-8-31
74,Kaung Bhone Yadanar,Private,Kyi Kyat (1.6.12),27.7.2012,31.8.2017,Jade,1,Kachin State,Namachi  Hmaw Thit  Phawhtoke(1020),27,7,2012,31,8,2017,Namachi  Hmaw Thit  Phawhtoke,1020,2012-7-27,2017-8-31
75,Kaung Bhone Yadanar,Private,Kyi Kyat (1.6.12),27.7.2012,31.8.2017,Jade,1,Kachin State,Namachi  Hmaw Thit  Phawhtoke(1021),27,7,2012,31,8,2017,Namachi  Hmaw Thit  Phawhtoke,1021,2012-7-27,2017-8-31
76,Kaung Bhone Yadanar,Private,Kyi Kyat (1.6.12),27.7.2012,31.8.2017,Jade,1,Kachin State,Namachi  Hmaw Thit  Phawhtoke(1022),27,7,2012,31,8,2017,Namachi  Hmaw Thit  Phawhtoke,1022,2012-7-27,2017-8-31
77,Kaung Bhone Yadanar,Private,Kyi Kyat (1.6.12),27.7.2012,31.8.2017,Jade,1,Kachin State,Namachi  Hmaw Thit  Phawhtoke(1023),27,7,2012,31,8,2017,Namachi  Hmaw Thit  Phawhtoke,1023,2012-7-27,2017-8-31
78,Kaung Bhone Yadanar,Private,Kyi Kyat (1.6.12),27.7.2012,31.8.2017,Jade,1,Kachin State,Namachi  Hmaw Thit  Phawhtoke(1024),27,7,2012,31,8,2017,Namachi  Hmaw Thit  Phawhtoke,1024,2012-7-27,2017-8-31
79,Kaung Bhone Yadanar,Private,Kyi Kyat (1.6.12),27.7.2012,31.8.2017,Jade,1,Kachin State,Namachi  Hmaw Thit  Phawhtoke(1025),27,7,2012,31,8,2017,Namachi  Hmaw Thit  Phawhtoke,1025,2012-7-27,2017-8-31
80,Kaung Bhone Yadanar,Private,Kyi Kyat (1.6.12),27.7.2012,31.8.2017,Jade,1,Kachin State,Namachi  Hmaw Thit  Phawhtoke(1026),27,7,2012,31,8,2017,Namachi  Hmaw Thit  Phawhtoke,1026,2012-7-27,2017-8-31
81,Kaung Bhone Yadanar,Private,Kyi Kyat (1.6.12),27.7.2012,31.8.2017,Jade,1,Kachin State,Walar  Phawhtoke(426),27,7,2012,31,8,2017,Walar  Phawhtoke,426,2012-7-27,2017-8-31
82,Kaung Bhone Yadanar,Private,Kyi Kyat (1.6.12),27.7.2012,31.8.2017,Jade,1,Kachin State,Walar  Phawhtoke(427),27,7,2012,31,8,2017,Walar  Phawhtoke,427,2012-7-27,2017-8-31
83,Kaung Bhone Yadanar,Private,Kyi Kyat (1.6.12),27.7.2012,31.8.2017,Jade,1,Kachin State,Walar  Phawhtoke(428),27,7,2012,31,8,2017,Walar  Phawhtoke,428,2012-7-27,2017-8-31
84,Kaung Bhone Yadanar,Private,Kyi Kyat (1.6.12),27.7.2012,31.8.2017,Jade,1,Kachin State,Walar  Phawhtoke(429),27,7,2012,31,8,2017,Walar  Phawhtoke,429,2012-7-27,2017-8-31
85,Kaung Bhone Yadanar,Private,Kyi Kyat (1.6.12),27.7.2012,31.8.2017,Jade,1,Kachin State,Walar  Phawhtoke(430),27,7,2012,31,8,2017,Walar  Phawhtoke,430,2012-7-27,2017-8-31
1,Kaung Mon Yadanar,Private,Oo Si(1/09)(5.4.09),9.3.2009,7.6.2016,Jade,1,Kachin State,Shan Kone(34),9,3,2009,7,6,2016,Shan Kone,34,2009-3-9,2016-6-7
2,Kaung Mon Yadanar,Private,Oo Si(6/11)(18.2.11),20.2.2012,21.5.2017,Jade,1,Kachin State,Sai Lo(99),20,2,2012,21,5,2017,Sai Lo,99,2012-2-20,2017-5-21
3,Kaung Mon Yadanar,Private,Oo Si(6/11)(18.2.11),20.2.2012,21.5.2017,Jade,1,Kachin State,Sai Lo(100),20,2,2012,21,5,2017,Sai Lo,100,2012-2-20,2017-5-21
4,Kaung Mon Yadanar,Private,Oo Si(6/11)(18.2.11),20.2.2012,21.5.2017,Jade,1,Kachin State,Sai Lo(101),20,2,2012,21,5,2017,Sai Lo,101,2012-2-20,2017-5-21
5,Kaung Mon Yadanar,Private,Oo Si(6/11)(18.2.11),20.2.2012,21.5.2017,Jade,1,Kachin State,Sai Lo(102),20,2,2012,21,5,2017,Sai Lo,102,2012-2-20,2017-5-21
6,Kaung Mon Yadanar,Private,Oo Si(6/11)(18.2.11),20.2.2012,21.5.2017,Jade,1,Kachin State,Sai Lo(103),20,2,2012,21,5,2017,Sai Lo,103,2012-2-20,2017-5-21
7,Kaung Mon Yadanar,Private,Oo Si(6/11)(18.2.11),20.2.2012,21.5.2017,Jade,1,Kachin State,Sai Lo(105),20,2,2012,21,5,2017,Sai Lo,105,2012-2-20,2017-5-21
8,Kaung Mon Yadanar,Private,Oo Si(6/11)(18.2.11),20.2.2012,21.5.2017,Jade,1,Kachin State,Sai Lo(106),20,2,2012,21,5,2017,Sai Lo,106,2012-2-20,2017-5-21
9,Kaung Mon Yadanar,Private,Oo Si(6/11)(18.2.11),20.2.2012,21.5.2017,Jade,1,Kachin State,Sai Lo(107),20,2,2012,21,5,2017,Sai Lo,107,2012-2-20,2017-5-21
10,Kaung Mon Yadanar,Private,Oo Si(6/11)(18.2.11),26.4.2010,25.7.2017,Jade,1,Kachin State,Sai Taung(89),26,4,2010,25,7,2017,Sai Taung,89,2010-4-26,2017-7-25
11,Kaung Mon Yadanar,Private,Oo Si(6/11)(18.2.11),26.4.2010,25.7.2017,Jade,1,Kachin State,Sai Taung(90),26,4,2010,25,7,2017,Sai Taung,90,2010-4-26,2017-7-25
12,Kaung Mon Yadanar,Private,Oo Si(6/11)(18.2.11),26.4.2010,25.7.2017,Jade,1,Kachin State,Sai Taung(91),26,4,2010,25,7,2017,Sai Taung,91,2010-4-26,2017-7-25
13,Kaung Mon Yadanar,Private,Oo Si(3/13)(15.2.13),5.5.2012,3.8.2017,Jade,1,Kachin State,Sai Taung Satemu(26),5,5,2012,3,8,2017,Sai Taung Satemu,26,2012-5-5,2017-8-3
14,Kaung Mon Yadanar,Private,Oo Si(3/13)(15.2.13),5.5.2012,3.8.2017,Jade,1,Kachin State,Shan Kone(9),5,5,2012,3,8,2017,Shan Kone,9,2012-5-5,2017-8-3
15,Kaung Mon Yadanar,Private,Oo Si(3/13)(15.2.13),5.5.2012,3.8.2017,Jade,1,Kachin State,Shan Kone(20),5,5,2012,3,8,2017,Shan Kone,20,2012-5-5,2017-8-3
16,Kaung Mon Yadanar,Private,Oo Si(3/13)(15.2.13),5.5.2012,3.8.2017,Jade,1,Kachin State,Shan Kone(21),5,5,2012,3,8,2017,Shan Kone,21,2012-5-5,2017-8-3
17,Kaung Mon Yadanar,Private,Oo Si(3/13)(15.2.13),5.5.2012,3.8.2017,Jade,1,Kachin State,Shan Kone(22),5,5,2012,3,8,2017,Shan Kone,22,2012-5-5,2017-8-3
18,Kaung Mon Yadanar,Private,Oo Si(3/10)(28.9.10),3.9.2010,2.12.2017,Jade,1,Kachin State,Sport(132),3,9,2010,2,12,2017,Sport,132,2010-9-3,2017-12-2
19,Kaung Mon Yadanar,Private,Oo Si(3/10)(28.9.10),3.9.2010,2.12.2017,Jade,1,Kachin State,Sport(133),3,9,2010,2,12,2017,Sport,133,2010-9-3,2017-12-2
20,Kaung Mon Yadanar,Private,Oo Si(3/10)(28.9.10),3.9.2010,2.12.2017,Jade,1,Kachin State,Sport(134),3,9,2010,2,12,2017,Sport,134,2010-9-3,2017-12-2
21,Kaung Mon Yadanar,Private,Oo Si(3/10)(28.9.10),3.9.2010,2.12.2017,Jade,1,Kachin State,Whay Khar(521),3,9,2010,2,12,2017,Whay Khar,521,2010-9-3,2017-12-2
22,Kaung Mon Yadanar,Private,Oo Si(3/10)(28.9.10),3.9.2010,2.12.2017,Jade,1,Kachin State,Whay Khar(522),3,9,2010,2,12,2017,Whay Khar,522,2010-9-3,2017-12-2
23,Kaung Mon Yadanar,Private,Oo Si(3/10)(28.9.10),3.9.2010,2.12.2017,Jade,1,Kachin State,Whay Khar(523),3,9,2010,2,12,2017,Whay Khar,523,2010-9-3,2017-12-2
24,Kaung Mon Yadanar,Private,Oo Si(3/10)(28.9.10),3.9.2010,2.12.2017,Jade,1,Kachin State,Whay Khar(524),3,9,2010,2,12,2017,Whay Khar,524,2010-9-3,2017-12-2
25,Kaung Mon Yadanar,Private,Oo Si(3/10)(28.9.10),3.9.2010,2.12.2017,Jade,1,Kachin State,Whay Khar(525),3,9,2010,2,12,2017,Whay Khar,525,2010-9-3,2017-12-2
26,Kaung Mon Yadanar,Private,Oo Si(3/10)(28.9.10),3.9.2010,2.12.2017,Jade,1,Kachin State,Whay Khar(526),3,9,2010,2,12,2017,Whay Khar,526,2010-9-3,2017-12-2
27,Kaung Mon Yadanar,Private,Oo Si(3/10)(28.9.10),3.9.2010,2.12.2017,Jade,1,Kachin State,Whay Khar(527),3,9,2010,2,12,2017,Whay Khar,527,2010-9-3,2017-12-2
28,Kaung Mon Yadanar,Private,Oo Si(3/12)(4.9.12),30.11.2012,30.11.2015,Jade,1,Kachin State,Sai Taung(51),30,11,2012,30,11,2015,Sai Taung,51,2012-11-30,2015-11-30
29,Kaung Mon Yadanar,Private,Oo Si(3/12)(4.9.12),30.11.2012,30.11.2015,Jade,1,Kachin State,Sai Taung(52),30,11,2012,30,11,2015,Sai Taung,52,2012-11-30,2015-11-30
30,Kaung Mon Yadanar,Private,Oo Si(3/12)(4.9.12),30.11.2012,30.11.2015,Jade,1,Kachin State,Sai Taung(53),30,11,2012,30,11,2015,Sai Taung,53,2012-11-30,2015-11-30
31,Kaung Mon Yadanar,Private,Oo Si(3/12)(4.9.12),30.11.2012,30.11.2015,Jade,1,Kachin State,Sai Taung(54),30,11,2012,30,11,2015,Sai Taung,54,2012-11-30,2015-11-30
1,Kaung Myat Yadanar,Private,Oo Si(2/10)(17.5.10),30.6.2010,28.9.2017,Jade,1,Kachin State,Sport(127),30,6,2010,28,9,2017,Sport,127,2010-6-30,2017-9-28
2,Kaung Myat Yadanar,Private,Oo Si(2/10)(17.5.10),30.6.2010,28.9.2017,Jade,1,Kachin State,Sport(128),30,6,2010,28,9,2017,Sport,128,2010-6-30,2017-9-28
3,Kaung Myat Yadanar,Private,Oo Si(2/10)(17.5.10),30.6.2010,28.9.2017,Jade,1,Kachin State,Sport(129),30,6,2010,28,9,2017,Sport,129,2010-6-30,2017-9-28
4,Kaung Myat Yadanar,Private,Oo Si(2/10)(17.5.10),30.6.2010,28.9.2017,Jade,1,Kachin State,Sport(130),30,6,2010,28,9,2017,Sport,130,2010-6-30,2017-9-28
5,Kaung Myat Yadanar,Private,Oo Si(2/10)(17.5.10),30.6.2010,28.9.2017,Jade,1,Kachin State,Sport(131),30,6,2010,28,9,2017,Sport,131,2010-6-30,2017-9-28
1,Kaung Myat Mon,Private,Oo Si(2/11)(19.6.11),18.8.2011,16.11.2016,Jade,1,Kachin State,Kho Ma(53),18,8,2011,16,11,2016,Kho Ma,53,2011-8-18,2016-11-16
2,Kaung Myat Mon,Private,Oo Si(2/11)(19.6.11),18.8.2011,16.11.2016,Jade,1,Kachin State,Kho Ma(104),18,8,2011,16,11,2016,Kho Ma,104,2011-8-18,2016-11-16
1,Kaung Myat Thu Kha,Private,Oo Si(2/15)(5.6.15),10.8.2012,9.8.2015,Jade,1,Kachin State,Mhaw Si Sar(71),10,8,2012,9,8,2015,Mhaw Si Sar,71,2012-8-10,2015-8-9
2,Kaung Myat Thu Kha,Private,Oo Si(2/15)(5.6.15),10.8.2012,9.8.2015,Jade,1,Kachin State,Mhaw Si Sar(73),10,8,2012,9,8,2015,Mhaw Si Sar,73,2012-8-10,2015-8-9
3,Kaung Myat Thu Kha,Private,Oo Si(2/15)(5.6.15),10.8.2012,9.8.2015,Jade,1,Kachin State,Mhaw Si Sar(246),10,8,2012,9,8,2015,Mhaw Si Sar,246,2012-8-10,2015-8-9
4,Kaung Myat Thu Kha,Private,Oo Si(2/15)(5.6.15),10.8.2012,9.8.2015,Jade,1,Kachin State,Mhaw Si Sar(248),10,8,2012,9,8,2015,Mhaw Si Sar,248,2012-8-10,2015-8-9
5,Kaung Myat Thu Kha,Private,Oo Si(2/15)(5.6.15),10.8.2012,9.8.2015,Jade,1,Kachin State,Mhaw Si Sar(327),10,8,2012,9,8,2015,Mhaw Si Sar,327,2012-8-10,2015-8-9
6,Kaung Myat Thu Kha,Private,Oo Si(3/15)(4.9.15),10.8.2012,9.8.2015,Jade,1,Kachin State,Ma Mon(126),10,8,2012,9,8,2015,Ma Mon,126,2012-8-10,2015-8-9
7,Kaung Myat Thu Kha,Private,Oo Si(3/15)(4.9.15),10.8.2012,9.8.2015,Jade,1,Kachin State,Ma Mon(127),10,8,2012,9,8,2015,Ma Mon,127,2012-8-10,2015-8-9
8,Kaung Myat Thu Kha,Private,Oo Si(3/15)(4.9.15),10.8.2012,9.8.2015,Jade,1,Kachin State,Mat Lin Chaung(39),10,8,2012,9,8,2015,Mat Lin Chaung,39,2012-8-10,2015-8-9
9,Kaung Myat Thu Kha,Private,Oo Si(3/15)(4.9.15),10.8.2012,9.8.2015,Jade,1,Kachin State,Mhaw Si Sar(72),10,8,2012,9,8,2015,Mhaw Si Sar,72,2012-8-10,2015-8-9
10,Kaung Myat Thu Kha,Private,Oo Si(3/15)(4.9.15),10.8.2012,9.8.2015,Jade,1,Kachin State,Mhaw Si Sar(74),10,8,2012,9,8,2015,Mhaw Si Sar,74,2012-8-10,2015-8-9
11,Kaung Myat Thu Kha,Private,Oo Si(3/15)(4.9.15),10.8.2012,9.8.2015,Jade,1,Kachin State,Mhaw Si Sar(247),10,8,2012,9,8,2015,Mhaw Si Sar,247,2012-8-10,2015-8-9
1,Kaung Htet Khaing,Private,Oo Si(3/08)(1.11.08),15.1.2009,15.4.2016,Jade,1,Kachin State,Maw One Gyi(204),15,1,2009,15,4,2016,Maw One Gyi,204,2009-1-15,2016-4-15
2,Kaung Htet Khaing,Private,Oo Si(3/08)(1.11.08),15.1.2009,15.4.2016,Jade,1,Kachin State,Maw One Gyi(207),15,1,2009,15,4,2016,Maw One Gyi,207,2009-1-15,2016-4-15
3,Kaung Htet Khaing,Private,Oo Si(3/08)(1.11.08),15.1.2009,15.4.2016,Jade,1,Kachin State,Maw One Gyi(208),15,1,2009,15,4,2016,Maw One Gyi,208,2009-1-15,2016-4-15
4,Kaung Htet Khaing,Private,Oo Si(3/08)(1.11.08),15.1.2009,15.4.2016,Jade,1,Kachin State,Maw One Gyi(209),15,1,2009,15,4,2016,Maw One Gyi,209,2009-1-15,2016-4-15
5,Kaung Htet Khaing,Private,Oo Si(3/08)(1.11.08),15.1.2009,15.4.2016,Jade,1,Kachin State,Maw One Gyi(210),15,1,2009,15,4,2016,Maw One Gyi,210,2009-1-15,2016-4-15
6,Kaung Htet Khaing,Private,Oo Si(3/13)(15.2.13),29.4.2012,28.7.2017,Jade,1,Kachin State,San Kyawl(161),29,4,2012,28,7,2017,San Kyawl,161,2012-4-29,2017-7-28
7,Kaung Htet Khaing,Private,Oo Si(1/11)(14.5.11),3.12.2010,3.3.2018,Jade,1,Kachin State,Maw Maung(178),3,12,2010,3,3,2018,Maw Maung,178,2010-12-3,2018-3-3
1,Kaung Hlan Htoo,Private,Kyi Kyat (12.11.10),10.1.2011,10.4.2016,Jade,1,Kachin State,Tha Phan Phawhtoke(69),10,1,2011,10,4,2016,Tha Phan Phawhtoke,69,2011-1-10,2016-4-10
2,Kaung Hlan Htoo,Private,Kyi Kyat (12.11.10),10.1.2012,10.4.2017,Jade,1,Kachin State,Tha Phan Phawhtoke(72),10,1,2012,10,4,2017,Tha Phan Phawhtoke,72,2012-1-10,2017-4-10
3,Kaung Hlan Htoo,Private,Kyi Kyat (12.11.10),10.1.2013,10.4.2018,Jade,1,Kachin State,Tha Phan Phawhtoke(75),10,1,2013,10,4,2018,Tha Phan Phawhtoke,75,2013-1-10,2018-4-10
4,Kaung Hlan Htoo,Private,Kyi Kyat (12.11.10),10.1.2014,10.4.2019,Jade,1,Kachin State,Tha Phan Phawhtoke(79),10,1,2014,10,4,2019,Tha Phan Phawhtoke,79,2014-1-10,2019-4-10
5,Kaung Hlan Htoo,Private,Kyi Kyat (12.11.10),10.1.2015,10.4.2020,Jade,1,Kachin State,Tha Phan Phawhtoke(85),10,1,2015,10,4,2020,Tha Phan Phawhtoke,85,2015-1-10,2020-4-10
6,Kaung Hlan Htoo,Private,Kyi Kyat (16.16.12),17.7.2012,16.7.2015,Jade,1,Kachin State,Khwan Scine Phawhtoke(1086),17,7,2012,16,7,2015,Khwan Scine Phawhtoke,1086,2012-7-17,2015-7-16
1,Kaung Su Wai Hlan,Private,Oo Si(2/12)(5.6.12),14.9.2012,13.9.2015,Jade,1,Kachin State,Ba La Kha(88),14,9,2012,13,9,2015,Ba La Kha,88,2012-9-14,2015-9-13
2,Kaung Su Wai Hlan,Private,Oo Si(2/12)(5.6.12),14.9.2012,13.9.2015,Jade,1,Kachin State,Ba La Kha(89),14,9,2012,13,9,2015,Ba La Kha,89,2012-9-14,2015-9-13
3,Kaung Su Wai Hlan,Private,Oo Si(2/12)(5.6.12),14.9.2012,13.9.2015,Jade,1,Kachin State,Mana(41),14,9,2012,13,9,2015,Mana,41,2012-9-14,2015-9-13
4,Kaung Su Wai Hlan,Private,Oo Si(2/12)(5.6.12),14.9.2012,13.9.2015,Jade,1,Kachin State,Mhaw Kyan(42),14,9,2012,13,9,2015,Mhaw Kyan,42,2012-9-14,2015-9-13
5,Kaung Su Wai Hlan,Private,Oo Si(2/12)(5.6.12),14.9.2012,13.9.2015,Jade,1,Kachin State,Mhaw Kyan(53),14,9,2012,13,9,2015,Mhaw Kyan,53,2012-9-14,2015-9-13
1,Kaung Wai Yan,Private,Oo Si(2/09)(19.6.09),28.10.2009,27.1.2015,Gem,1,Kachin State,Sa baw(363),28,10,2009,27,1,2015,Sa baw,363,2009-10-28,2015-1-27
2,Kaung Wai Yan,Private,Oo Si(2/09)(19.6.09),28.10.2009,27.1.2015,Gem,1,Kachin State,Sa baw(364),28,10,2009,27,1,2015,Sa baw,364,2009-10-28,2015-1-27
3,Kaung Wai Yan,Private,Oo Si(2/09)(19.6.09),28.10.2009,27.1.2015,Gem,1,Kachin State,Sa baw(365),28,10,2009,27,1,2015,Sa baw,365,2009-10-28,2015-1-27
1,Kaung Wai Yan,Private,Oo Si(2/11)(19.6.11),31.8.2011,30.11.2018,Jade,1,Kachin State,Ma Kar Pin(33),31,8,2011,30,11,2018,Ma Kar Pin,33,2011-8-31,2018-11-30
2,Kaung Wai Yan,Private,Oo Si(2/11)(19.6.11),31.8.2011,30.11.2018,Jade,1,Kachin State,Ma Kar Pin(43),31,8,2011,30,11,2018,Ma Kar Pin,43,2011-8-31,2018-11-30
3,Kaung Wai Yan,Private,Oo Si(5/11)(16.11.11),5.6.2011,4.9.2018,Jade,1,Kachin State,Whay Khar Sai New(380),5,6,2011,4,9,2018,Whay Khar Sai New,380,2011-6-5,2018-9-4
4,Kaung Wai Yan,Private,Oo Si(5/11)(16.11.11),5.6.2011,4.9.2018,Jade,1,Kachin State,Whay Khar Sai New(384),5,6,2011,4,9,2018,Whay Khar Sai New,384,2011-6-5,2018-9-4
5,Kaung Wai Yan,Private,Oo Si(5/11)(16.11.11),5.6.2011,4.9.2018,Jade,1,Kachin State,Whay Khar Sai New(385),5,6,2011,4,9,2018,Whay Khar Sai New,385,2011-6-5,2018-9-4
6,Kaung Wai Yan,Private,Oo Si(5/11)(16.11.11),5.6.2011,4.9.2018,Jade,1,Kachin State,Whay Khar Sai New(386),5,6,2011,4,9,2018,Whay Khar Sai New,386,2011-6-5,2018-9-4
7,Kaung Wai Yan,Private,Oo Si(2/12)(5.6.12),6.7.2012,5.7.2015,Jade,1,Kachin State,Sport(123),6,7,2012,5,7,2015,Sport,123,2012-7-6,2015-7-5
8,Kaung Wai Yan,Private,Oo Si(2/12)(5.6.12),31.8.2009,30.8.2015,Jade,1,Kachin State,Sport(124),31,8,2009,30,8,2015,Sport,124,2009-8-31,2015-8-30
9,Kaung Wai Yan,Private,Oo Si(2/12)(5.6.12),31.8.2009,30.8.2015,Jade,1,Kachin State,Sport(140),31,8,2009,30,8,2015,Sport,140,2009-8-31,2015-8-30
10,Kaung Wai Yan,Private,Oo Si(2/12)(5.6.12),31.8.2009,30.8.2015,Jade,1,Kachin State,Sport(141),31,8,2009,30,8,2015,Sport,141,2009-8-31,2015-8-30
11,Kaung Wai Yan,Private,Oo Si(2/12)(5.6.12),31.8.2009,30.8.2015,Jade,1,Kachin State,Sport(142),31,8,2009,30,8,2015,Sport,142,2009-8-31,2015-8-30
12,Kaung Wai Yan,Private,Oo Si(2/12)(5.6.12),9.1.2013,8.1.2016,Jade,1,Kachin State,Sport(64),9,1,2013,8,1,2016,Sport,64,2013-1-9,2016-1-8
13,Kaung Wai Yan,Private,Oo Si(2/12)(5.6.12),9.1.2013,8.1.2016,Jade,1,Kachin State,Sport(65),9,1,2013,8,1,2016,Sport,65,2013-1-9,2016-1-8
14,Kaung Wai Yan,Private,Oo Si(2/12)(5.6.12),9.1.2013,8.1.2016,Jade,1,Kachin State,Sport(69),9,1,2013,8,1,2016,Sport,69,2013-1-9,2016-1-8
1,Kaung Wai Yan,Private,Oo Si(3/13)(15.2.13),19.2.2012,20.5.2017,Jade,1,Kachin State,Namachi (25),19,2,2012,20,5,2017,Namachi ,25,2012-2-19,2017-5-20
2,Kaung Wai Yan,Private,Oo Si(3/13)(15.2.13),19.2.2012,20.5.2017,Jade,1,Kachin State,Namachi (26),19,2,2012,20,5,2017,Namachi ,26,2012-2-19,2017-5-20
3,Kaung Wai Yan,Private,Oo Si(3/13)(15.2.13),19.2.2012,20.5.2017,Jade,1,Kachin State,Namachi (27),19,2,2012,20,5,2017,Namachi ,27,2012-2-19,2017-5-20
4,Kaung Wai Yan,Private,Oo Si(3/13)(15.2.13),10.12.2011,10.3.2017,Jade,1,Kachin State,Namachi  Hmaw Thit  (25),10,12,2011,10,3,2017,Namachi  Hmaw Thit  ,25,2011-12-10,2017-3-10
5,Kaung Wai Yan,Private,Oo Si(3/13)(15.2.13),10.12.2011,10.3.2017,Jade,1,Kachin State,Namachi  Hmaw Thit  (26),10,12,2011,10,3,2017,Namachi  Hmaw Thit  ,26,2011-12-10,2017-3-10
6,Kaung Wai Yan,Private,Oo Si(3/13)(15.2.13),10.12.2011,10.3.2017,Jade,1,Kachin State,Namachi  Hmaw Thit  (27),10,12,2011,10,3,2017,Namachi  Hmaw Thit  ,27,2011-12-10,2017-3-10
7,Kaung Wai Yan,Private,Oo Si(3/13)(15.2.13),10.12.2011,10.3.2017,Jade,1,Kachin State,Namachi  Hmaw Thit  (28),10,12,2011,10,3,2017,Namachi  Hmaw Thit  ,28,2011-12-10,2017-3-10
8,Kaung Wai Yan,Private,Oo Si(3/13)(15.2.13),6.7.2013,5.7.2016,Jade,1,Kachin State,Namachi  Hmaw Thit  (13),6,7,2013,5,7,2016,Namachi  Hmaw Thit  ,13,2013-7-6,2016-7-5
9,Kaung Wai Yan,Private,Oo Si(3/13)(15.2.13),31.8.2012,30.8.2016,Jade,1,Kachin State,Namachi  Hmaw Thit  (24),31,8,2012,30,8,2016,Namachi  Hmaw Thit  ,24,2012-8-31,2016-8-30
10,Kaung Wai Yan,Private,Oo Si(3/13)(15.2.13),31.8.2012,30.8.2016,Jade,1,Kachin State,Namachi  Hmaw Thit  (29),31,8,2012,30,8,2016,Namachi  Hmaw Thit  ,29,2012-8-31,2016-8-30
11,Kaung Wai Yan,Private,Oo Si(3/13)(15.2.13),31.8.2012,30.8.2016,Jade,1,Kachin State,Namachi  Hmaw Thit  (30),31,8,2012,30,8,2016,Namachi  Hmaw Thit  ,30,2012-8-31,2016-8-30
12,Kaung Wai Yan,Private,Oo Si(3/13)(15.2.13),31.8.2012,30.8.2016,Jade,1,Kachin State,Namachi  Hmaw Thit  (31),31,8,2012,30,8,2016,Namachi  Hmaw Thit  ,31,2012-8-31,2016-8-30
1,Kaung Taw Myay,Private,Oo Si(3/10)(28.9.10),26.10.2010,24.1.2018,Jade,1,Kachin State,Ba Zan Chaut(82),26,10,2010,24,1,2018,Ba Zan Chaut,82,2010-10-26,2018-1-24
2,Kaung Taw Myay,Private,Oo Si(3/10)(28.9.10),18.11.2010,16.2.2018,Jade,1,Kachin State,Nant Mhaw(383),18,11,2010,16,2,2018,Nant Mhaw,383,2010-11-18,2018-2-16
3,Kaung Taw Myay,Private,Oo Si(2/11)(19.6.11),31.8.2011,30.11.2018,Jade,1,Kachin State,Nant Mhaw(226),31,8,2011,30,11,2018,Nant Mhaw,226,2011-8-31,2018-11-30
4,Kaung Taw Myay,Private,Oo Si(2/11)(19.6.11),31.8.2011,30.11.2018,Jade,1,Kachin State,Nant Mhaw(228),31,8,2011,30,11,2018,Nant Mhaw,228,2011-8-31,2018-11-30
1,Kaung Taw Myay,Private,Kyi Kyat(4/12)(13.1.14),9.7.2012,31.8.2017,Jade,1,Kachin State,Nat Maw Chaung Ton Koa Phaw Htot(Pha-49),9,7,2012,31,8,2017,Nat Maw Chaung Ton Koa Phaw Htot,Pha-49,2012-7-9,2017-8-31
2,Kaung Taw Myay,Private,Kyi Kyat(4/12)(13.1.14),9.7.2012,31.8.2017,Jade,1,Kachin State,Nat Maw Chaung Ton Koa Phaw Htot(Pha-60),9,7,2012,31,8,2017,Nat Maw Chaung Ton Koa Phaw Htot,Pha-60,2012-7-9,2017-8-31
3,Kaung Taw Myay,Private,Kyi Kyat(4/12)(13.1.14),9.7.2012,31.8.2017,Jade,1,Kachin State,Nat Maw Chaung Ton Koa Phaw Htot(Pha-61),9,7,2012,31,8,2017,Nat Maw Chaung Ton Koa Phaw Htot,Pha-61,2012-7-9,2017-8-31
4,Kaung Taw Myay,Private,Kyi Kyat(4/12)(13.1.14),9.7.2012,31.8.2017,Jade,1,Kachin State,Nat Maw Chaung Ton Koa Phaw Htot(Pha-62),9,7,2012,31,8,2017,Nat Maw Chaung Ton Koa Phaw Htot,Pha-62,2012-7-9,2017-8-31
5,Kaung Taw Myay,Private,Kyi Kyat(4/12)(13.1.14),9.7.2012,31.8.2017,Jade,1,Kachin State,Nat Maw Chaung Ton Koa Phaw Htot(Pha-70),9,7,2012,31,8,2017,Nat Maw Chaung Ton Koa Phaw Htot,Pha-70,2012-7-9,2017-8-31
6,Kaung Taw Myay,Private,Kyi Kyat(4/12)(13.1.14),9.7.2012,31.8.2017,Jade,1,Kachin State,Nat Maw Chaung Ton Koa Phaw Htot(Pha-71),9,7,2012,31,8,2017,Nat Maw Chaung Ton Koa Phaw Htot,Pha-71,2012-7-9,2017-8-31
1,Kaung Taw Myay,Private,Oo Si(1/15)(26.3.15),8.5.2012,7.5.2015,Jade,1,Kachin State,Namachi Satkyin Phawhtoke(185),8,5,2012,7,5,2015,Namachi Satkyin Phawhtoke,185,2012-5-8,2015-5-7
2,Kaung Taw Myay,Private,Oo Si(1/12)(26.3.12),8.5.2012,7.5.2015,Jade,1,Kachin State,Namachi Satkyin Phawhtoke(186),8,5,2012,7,5,2015,Namachi Satkyin Phawhtoke,186,2012-5-8,2015-5-7
3,Kaung Taw Myay,Private,Oo Si(1/12)(26.3.12),8.5.2012,7.5.2015,Jade,1,Kachin State,Namachi Satkyin Phawhtoke(187),8,5,2012,7,5,2015,Namachi Satkyin Phawhtoke,187,2012-5-8,2015-5-7
4,Kaung Taw Myay,Private,Oo Si(1/12)(26.3.12),8.5.2012,7.5.2015,Jade,1,Kachin State,Namachi Satkyin Phawhtoke(188),8,5,2012,7,5,2015,Namachi Satkyin Phawhtoke,188,2012-5-8,2015-5-7
5,Kaung Taw Myay,Private,Oo Si(1/12)(26.3.12),8.5.2012,7.5.2015,Jade,1,Kachin State,Namachi Satkyin Phawhtoke(189),8,5,2012,7,5,2015,Namachi Satkyin Phawhtoke,189,2012-5-8,2015-5-7
6,Kaung Taw Myay,Private,Oo Si(1/12)(26.3.12),8.5.2012,7.5.2015,Jade,1,Kachin State,Namachi Satkyin Phawhtoke(190),8,5,2012,7,5,2015,Namachi Satkyin Phawhtoke,190,2012-5-8,2015-5-7
7,Kaung Taw Myay,Private,Oo Si(1/12)(26.3.12),8.5.2012,7.5.2015,Jade,1,Kachin State,Namachi Satkyin Phawhtoke(191),8,5,2012,7,5,2015,Namachi Satkyin Phawhtoke,191,2012-5-8,2015-5-7
8,Kaung Taw Myay,Private,Oo Si(1/12)(26.3.12),8.5.2012,7.5.2015,Jade,1,Kachin State,Namachi Satkyin Phawhtoke(192),8,5,2012,7,5,2015,Namachi Satkyin Phawhtoke,192,2012-5-8,2015-5-7
9,Kaung Taw Myay,Private,Oo Si(1/12)(26.3.12),8.5.2012,7.5.2015,Jade,1,Kachin State,Namachi Satkyin Phawhtoke(193),8,5,2012,7,5,2015,Namachi Satkyin Phawhtoke,193,2012-5-8,2015-5-7
10,Kaung Taw Myay,Private,Oo Si(1/12)(26.3.12),8.5.2012,7.5.2015,Jade,1,Kachin State,Namachi Satkyin Phawhtoke(194),8,5,2012,7,5,2015,Namachi Satkyin Phawhtoke,194,2012-5-8,2015-5-7
1,Kaung Thant Lin,Private,Oo Si (4/13)(16.5.13),11.9.2013,10.9.2016,Gem,1,Madalay Division,Ka Paing(Pha Hta-8),11,9,2013,10,9,2016,Ka Paing,Pha Hta-8,2013-9-11,2016-9-10
2,Kaung Thant Lin,Private,Oo Si (4/13)(16.5.13),11.9.2013,10.9.2016,Gem,1,Madalay Division,Li Suu Kone Zan(Pha Hta-60),11,9,2013,10,9,2016,Li Suu Kone Zan,Pha Hta-60,2013-9-11,2016-9-10
1,Kaung Thant Lin,Private,Oo Si(6/11)(18.12.11),20.2.2012,21.5.2017,Jade,1,Kachin State,Sai Lo(90),20,2,2012,21,5,2017,Sai Lo,90,2012-2-20,2017-5-21
2,Kaung Thant Lin,Private,Oo Si(6/11)(18.12.11),20.2.2012,21.5.2017,Jade,1,Kachin State,Sai Lo(91),20,2,2012,21,5,2017,Sai Lo,91,2012-2-20,2017-5-21
3,Kaung Thant Lin,Private,Oo Si(6/11)(18.12.11),20.2.2012,21.5.2017,Jade,1,Kachin State,Sai Lo(92),20,2,2012,21,5,2017,Sai Lo,92,2012-2-20,2017-5-21
4,Kaung Thant Lin,Private,Oo Si(6/11)(18.12.11),20.2.2012,21.5.2017,Jade,1,Kachin State,Sai Lo(93),20,2,2012,21,5,2017,Sai Lo,93,2012-2-20,2017-5-21
5,Kaung Thant Lin,Private,Oo Si(6/11)(18.12.11),20.2.2012,21.5.2017,Jade,1,Kachin State,Sai Lo(94),20,2,2012,21,5,2017,Sai Lo,94,2012-2-20,2017-5-21
6,Kaung Thant Lin,Private,Oo Si(6/11)(18.12.11),20.2.2012,21.5.2017,Jade,1,Kachin State,Sai Lo(95),20,2,2012,21,5,2017,Sai Lo,95,2012-2-20,2017-5-21
7,Kaung Thant Lin,Private,Oo Si(6/11)(18.12.11),20.2.2012,21.5.2017,Jade,1,Kachin State,Sai Lo(96),20,2,2012,21,5,2017,Sai Lo,96,2012-2-20,2017-5-21
8,Kaung Thant Lin,Private,Oo Si(6/11)(18.12.11),20.2.2012,21.5.2017,Jade,1,Kachin State,Sai Lo(97),20,2,2012,21,5,2017,Sai Lo,97,2012-2-20,2017-5-21
9,Kaung Thant Lin,Private,Oo Si(6/11)(18.12.11),20.2.2012,21.5.2017,Jade,1,Kachin State,Sai Lo(98),20,2,2012,21,5,2017,Sai Lo,98,2012-2-20,2017-5-21
10,Kaung Thant Lin,Private,Oo Si(3/13)(15.2.13),24.6.2012,23.9.2017,Jade,1,Kachin State,Taung Kaut(20),24,6,2012,23,9,2017,Taung Kaut,20,2012-6-24,2017-9-23
1,Kaung Moe Hein,Private,Oo Si(6/11)(18.12.11),20.2.2012,21.5.2017,Jade,1,Kachin State,Whay Khar(997),20,2,2012,21,5,2017,Whay Khar,997,2012-2-20,2017-5-21
2,Kaung Moe Hein,Private,Oo Si(6/11)(18.12.11),20.2.2012,21.5.2017,Jade,1,Kachin State,Whay Khar(998),20,2,2012,21,5,2017,Whay Khar,998,2012-2-20,2017-5-21
3,Kaung Moe Hein,Private,Oo Si(6/11)(18.12.11),20.2.2012,21.5.2017,Jade,1,Kachin State,Whay Khar(1076),20,2,2012,21,5,2017,Whay Khar,1076,2012-2-20,2017-5-21
4,Kaung Moe Hein,Private,Oo Si(6/11)(18.12.11),20.2.2012,21.5.2017,Jade,1,Kachin State,Whay Khar(1077),20,2,2012,21,5,2017,Whay Khar,1077,2012-2-20,2017-5-21
1,Kaung San Hein,Private,Oo Si(4/12)(18.12.12),15.1.2012,14.1.2015,Jade,1,Kachin State,Khun Sine Phawhtoke(68),15,1,2012,14,1,2015,Khun Sine Phawhtoke,68,2012-1-15,2015-1-14
2,Kaung San Hein,Private,Oo Si(4/12)(18.12.12),15.1.2012,14.1.2015,Jade,1,Kachin State,Khun Sine Phawhtoke(85),15,1,2012,14,1,2015,Khun Sine Phawhtoke,85,2012-1-15,2015-1-14
3,Kaung San Hein,Private,Oo Si(4/12)(18.12.12),15.1.2012,14.1.2015,Jade,1,Kachin State,Khun Sine Phawhtoke(125),15,1,2012,14,1,2015,Khun Sine Phawhtoke,125,2012-1-15,2015-1-14
4,Kaung San Hein,Private,Oo Si(4/12)(18.12.12),15.1.2012,14.1.2015,Jade,1,Kachin State,Khun Sine Phawhtoke(126),15,1,2012,14,1,2015,Khun Sine Phawhtoke,126,2012-1-15,2015-1-14
5,Kaung San Hein,Private,Oo Si(4/12)(18.12.12),15.1.2012,14.1.2015,Jade,1,Kachin State,Walar  Phawhtoke(91),15,1,2012,14,1,2015,Walar  Phawhtoke,91,2012-1-15,2015-1-14
6,Kaung San Hein,Private,Oo Si(4/12)(18.12.12),15.1.2012,14.1.2015,Jade,1,Kachin State,Walar  Phawhtoke(92),15,1,2012,14,1,2015,Walar  Phawhtoke,92,2012-1-15,2015-1-14
7,Kaung San Hein,Private,Oo Si(4/12)(18.12.12),15.1.2012,14.1.2015,Jade,1,Kachin State,Walar  Phawhtoke(93),15,1,2012,14,1,2015,Walar  Phawhtoke,93,2012-1-15,2015-1-14
1,Kaung Si,Private,Oo Si(2/11)(19.6.11),23.8.2011,21.11.2016,Jade,1,Kachin State,Khauk Khaw(102),23,8,2011,21,11,2016,Khauk Khaw,102,2011-8-23,2016-11-21
1,Kaung Swem Htet,Private,Oo Si(6/11)(18.12.11),20.2.2012,21.5.2017,Jade,1,Kachin State,Whay Khar(915),20,2,2012,21,5,2017,Whay Khar,915,2012-2-20,2017-5-21
2,Kaung Swem Htet,Private,Oo Si(6/11)(18.12.11),20.2.2012,21.5.2017,Jade,1,Kachin State,Whay Khar(933),20,2,2012,21,5,2017,Whay Khar,933,2012-2-20,2017-5-21
3,Kaung Swem Htet,Private,Oo Si(6/11)(18.12.11),20.2.2012,21.5.2017,Jade,1,Kachin State,Whay Khar(951),20,2,2012,21,5,2017,Whay Khar,951,2012-2-20,2017-5-21
4,Kaung Swem Htet,Private,Oo Si(6/11)(18.12.11),20.2.2012,21.5.2017,Jade,1,Kachin State,Whay Khar(1071),20,2,2012,21,5,2017,Whay Khar,1071,2012-2-20,2017-5-21
5,Kaung Swem Htet,Private,Oo Si(6/11)(18.12.11),20.2.2012,21.5.2017,Jade,1,Kachin State,Whay Khar(871),20,2,2012,21,5,2017,Whay Khar,871,2012-2-20,2017-5-21
6,Kaung Swem Htet,Private,Oo Si(6/11)(18.12.11),20.2.2012,21.5.2017,Jade,1,Kachin State,Whay Khar(1063),20,2,2012,21,5,2017,Whay Khar,1063,2012-2-20,2017-5-21
7,Kaung Swem Htet,Private,Oo Si(6/11)(18.12.11),20.2.2012,21.5.2017,Jade,1,Kachin State,Whay Khar(1079),20,2,2012,21,5,2017,Whay Khar,1079,2012-2-20,2017-5-21
8,Kaung Swem Htet,Private,Oo Si(6/11)(18.12.11),20.2.2012,21.5.2017,Jade,1,Kachin State,Whay Khar(1087),20,2,2012,21,5,2017,Whay Khar,1087,2012-2-20,2017-5-21
9,Kaung Swem Htet,Private,Oo Si(6/11)(18.12.11),20.2.2012,21.5.2017,Jade,1,Kachin State,Whay Khar(1095),20,2,2012,21,5,2017,Whay Khar,1095,2012-2-20,2017-5-21
10,Kaung Swem Htet,Private,Oo Si(6/11)(18.12.11),20.2.2012,21.5.2017,Jade,1,Kachin State,Whay Khar(1103),20,2,2012,21,5,2017,Whay Khar,1103,2012-2-20,2017-5-21
11,Kaung Swem Htet,Private,Oo Si(3/13)(15.2.13),31.5.2013,31.8.2017,Jade,1,Kachin State,Mhaw Si Sar(344),31,5,2013,31,8,2017,Mhaw Si Sar,344,2013-5-31,2017-8-31
12,Kaung Swem Htet,Private,Oo Si(3/13)(15.2.13),31.5.2013,31.8.2017,Jade,1,Kachin State,Mhaw Si Sar(345),31,5,2013,31,8,2017,Mhaw Si Sar,345,2013-5-31,2017-8-31
13,Kaung Swem Htet,Private,Oo Si(6/11)(18.12.11),31.1.2012,2.5.2019,Jade,1,Kachin State,Ka Lar Mhaw Myauk Phyu(9),31,1,2012,2,5,2019,Ka Lar Mhaw Myauk Phyu,9,2012-1-31,2019-5-2
14,Kaung Swem Htet,Private,Oo Si(6/11)(18.12.11),31.1.2012,2.5.2019,Jade,1,Kachin State,Ba La Kha(177),31,1,2012,2,5,2019,Ba La Kha,177,2012-1-31,2019-5-2
15,Kaung Swem Htet,Private,Oo Si(6/11)(18.12.11),31.1.2012,2.5.2019,Jade,1,Kachin State,Ba La Kha(178),31,1,2012,2,5,2019,Ba La Kha,178,2012-1-31,2019-5-2
16,Kaung Swem Htet,Private,Oo Si(6/11)(18.12.11),20.2.2012,22.5.2019,Jade,1,Kachin State,Mhaw Si Sar(534),20,2,2012,22,5,2019,Mhaw Si Sar,534,2012-2-20,2019-5-22
17,Kaung Swem Htet,Private,Oo Si(3/12)(4.9.12),25.12.2012,24.12.2015,Jade,1,Kachin State,Lawl Gaung(7),25,12,2012,24,12,2015,Lawl Gaung,7,2012-12-25,2015-12-24
18,Kaung Swem Htet,Private,Oo Si(3/12)(4.9.12),25.12.2012,24.12.2015,Jade,1,Kachin State,Lawl Gaung(8),25,12,2012,24,12,2015,Lawl Gaung,8,2012-12-25,2015-12-24
19,Kaung Swem Htet,Private,Oo Si(3/12)(4.9.12),25.12.2012,24.12.2015,Jade,1,Kachin State,Lawl Gaung(9),25,12,2012,24,12,2015,Lawl Gaung,9,2012-12-25,2015-12-24
20,Kaung Swem Htet,Private,Oo Si(3/12)(4.9.12),25.12.2012,24.12.2015,Jade,1,Kachin State,Lawl Gaung(10),25,12,2012,24,12,2015,Lawl Gaung,10,2012-12-25,2015-12-24
21,Kaung Swem Htet,Private,Oo Si(3/12)(4.9.12),25.12.2012,24.12.2015,Jade,1,Kachin State,Lawl Gaung(11),25,12,2012,24,12,2015,Lawl Gaung,11,2012-12-25,2015-12-24
22,Kaung Swem Htet,Private,Oo Si(3/12)(4.9.12),25.12.2012,24.12.2015,Jade,1,Kachin State,Nant Mhaw(320),25,12,2012,24,12,2015,Nant Mhaw,320,2012-12-25,2015-12-24
23,Kaung Swem Htet,Private,Oo Si(3/12)(4.9.12),25.12.2012,24.12.2015,Jade,1,Kachin State,Nant Mhaw(321),25,12,2012,24,12,2015,Nant Mhaw,321,2012-12-25,2015-12-24
1,Kaung Swem Htet,Private,Oo Si(3/13)(15.2.13),26.9.2014,25.9.2017,Jade,1,Kachin State,Nan Sa Lin Chaung Phar(294),26,9,2014,25,9,2017,Nan Sa Lin Chaung Phar,294,2014-9-26,2017-9-25
2,Kaung Swem Htet,Private,Oo Si(3/13)(15.2.13),26.9.2014,25.9.2017,Jade,1,Kachin State,Nan Sa Lin Chaung Phar(296),26,9,2014,25,9,2017,Nan Sa Lin Chaung Phar,296,2014-9-26,2017-9-25
3,Kaung Swem Htet,Private,Oo Si(3/13)(15.2.13),26.9.2014,25.9.2017,Jade,1,Kachin State,Nan Sa Lin Chaung Phar(298),26,9,2014,25,9,2017,Nan Sa Lin Chaung Phar,298,2014-9-26,2017-9-25
4,Kaung Swem Htet,Private,Oo Si(3/13)(15.2.13),26.9.2014,25.9.2017,Jade,1,Kachin State,Nan Sa Lin Chaung Phar(306),26,9,2014,25,9,2017,Nan Sa Lin Chaung Phar,306,2014-9-26,2017-9-25
5,Kaung Swem Htet,Private,Oo Si(3/13)(15.2.13),26.9.2014,25.9.2017,Jade,1,Kachin State,Nan Sa Lin Chaung Phar(308),26,9,2014,25,9,2017,Nan Sa Lin Chaung Phar,308,2014-9-26,2017-9-25
1,Kaung Min Htet,Private,Oo Si(1/12)(26.3.12),1.7.2012,30.6.2016,Jade,1,Kachin State,Whay Khar(738),1,7,2012,30,6,2016,Whay Khar,738,2012-7-1,2016-6-30
1,Kaung Htike,Private,Oo Si(1/12)(26.3.12),14.4.2012,13.4.2015,Jade,1,Kachin State,Sport(217),14,4,2012,13,4,2015,Sport,217,2012-4-14,2015-4-13
2,Kaung Htike,Private,Oo Si(1/12)(26.3.12),14.4.2012,13.4.2015,Jade,1,Kachin State,Sport(261),14,4,2012,13,4,2015,Sport,261,2012-4-14,2015-4-13
3,Kaung Htike,Private,Oo Si(1/12)(26.3.12),14.4.2012,13.4.2015,Jade,1,Kachin State,Sport(262),14,4,2012,13,4,2015,Sport,262,2012-4-14,2015-4-13
4,Kaung Htike,Private,Oo Si(1/12)(26.3.12),14.4.2012,13.4.2015,Jade,1,Kachin State,Sport(263),14,4,2012,13,4,2015,Sport,263,2012-4-14,2015-4-13
5,Kaung Htike,Private,Oo Si(1/12)(26.3.12),14.4.2012,13.4.2015,Jade,1,Kachin State,Sport(266),14,4,2012,13,4,2015,Sport,266,2012-4-14,2015-4-13
6,Kaung Htike,Private,Oo Si(1/12)(26.3.12),14.4.2012,13.4.2015,Jade,1,Kachin State,Sport(269),14,4,2012,13,4,2015,Sport,269,2012-4-14,2015-4-13
1,Kyaut Thwe Aung,Private,Oo Si(2/12)(5.6.12),24.7.2012,23.7.2018,Jade,1,Kachin State,Ma Kar Pin(203),24,7,2012,23,7,2018,Ma Kar Pin,203,2012-7-24,2018-7-23
2,Kyaut Thwe Aung,Private,Oo Si(2/12)(5.6.12),24.7.2012,23.7.2018,Jade,1,Kachin State,Ma Kar Pin(204),24,7,2012,23,7,2018,Ma Kar Pin,204,2012-7-24,2018-7-23
3,Kyaut Thwe Aung,Private,Oo Si(2/12)(5.6.12),24.7.2012,23.7.2018,Jade,1,Kachin State,Ma Kar Pin(205),24,7,2012,23,7,2018,Ma Kar Pin,205,2012-7-24,2018-7-23
4,Kyaut Thwe Aung,Private,Oo Si(2/12)(5.6.12),24.7.2012,23.7.2018,Jade,1,Kachin State,Ma Kar Pin(206),24,7,2012,23,7,2018,Ma Kar Pin,206,2012-7-24,2018-7-23
5,Kyaut Thwe Aung,Private,Oo Si(2/12)(5.6.12),24.7.2012,23.7.2018,Jade,1,Kachin State,Ma Kar Pin(293),24,7,2012,23,7,2018,Ma Kar Pin,293,2012-7-24,2018-7-23
1,Kyaut Kwe Pan,Private,Oo Si(3/12)(4.9.12),17.10.2013,16.10.2016,Jade,1,Kachin State,Mhaw Kyan(61),17,10,2013,16,10,2016,Mhaw Kyan,61,2013-10-17,2016-10-16
2,Kyaut Kwe Pan,Private,Oo Si(3/12)(4.9.12),17.10.2013,16.10.2016,Jade,1,Kachin State,Mhaw Kyan(62),17,10,2013,16,10,2016,Mhaw Kyan,62,2013-10-17,2016-10-16
1,Kyaut Kyi Kone,Private,Oo Si(6/11)(18.12.11),20.2.2012,21.5.2017,Jade,1,Kachin State,Whay Lone(65),20,2,2012,21,5,2017,Whay Lone,65,2012-2-20,2017-5-21
2,Kyaut Kyi Kone,Private,Oo Si(6/11)(18.12.11),20.2.2012,21.5.2017,Jade,1,Kachin State,Whay Lone(66),20,2,2012,21,5,2017,Whay Lone,66,2012-2-20,2017-5-21
3,Kyaut Kyi Kone,Private,Oo Si(6/11)(18.12.11),20.2.2012,21.5.2017,Jade,1,Kachin State,Whay Lone(67),20,2,2012,21,5,2017,Whay Lone,67,2012-2-20,2017-5-21
4,Kyaut Kyi Kone,Private,Oo Si(6/11)(18.12.11),20.2.2012,21.5.2017,Jade,1,Kachin State,Whay Lone(68),20,2,2012,21,5,2017,Whay Lone,68,2012-2-20,2017-5-21
5,Kyaut Kyi Kone,Private,Oo Si(6/11)(18.12.11),20.2.2012,21.5.2017,Jade,1,Kachin State,Whay Lone(69),20,2,2012,21,5,2017,Whay Lone,69,2012-2-20,2017-5-21
6,Kyaut Kyi Kone,Private,Oo Si(6/11)(18.12.11),20.2.2012,21.5.2017,Jade,1,Kachin State,Whay Lone(70),20,2,2012,21,5,2017,Whay Lone,70,2012-2-20,2017-5-21
7,Kyaut Kyi Kone,Private,Oo Si(6/11)(18.12.11),20.2.2012,21.5.2017,Jade,1,Kachin State,Whay Lone(71),20,2,2012,21,5,2017,Whay Lone,71,2012-2-20,2017-5-21
8,Kyaut Kyi Kone,Private,Oo Si(6/11)(18.12.11),20.2.2012,21.5.2017,Jade,1,Kachin State,Whay Lone(72),20,2,2012,21,5,2017,Whay Lone,72,2012-2-20,2017-5-21
9,Kyaut Kyi Kone,Private,Oo Si(6/11)(18.12.11),20.2.2012,21.5.2017,Jade,1,Kachin State,Whay Lone(73),20,2,2012,21,5,2017,Whay Lone,73,2012-2-20,2017-5-21
10,Kyaut Kyi Kone,Private,Oo Si(6/11)(18.12.11),20.2.2012,21.5.2017,Jade,1,Kachin State,Whay Lone(74),20,2,2012,21,5,2017,Whay Lone,74,2012-2-20,2017-5-21
11,Kyaut Kyi Kone,Private,Oo Si(6/11)(18.12.11),20.2.2012,21.5.2017,Jade,1,Kachin State,Whay Lone(75),20,2,2012,21,5,2017,Whay Lone,75,2012-2-20,2017-5-21
12,Kyaut Kyi Kone,Private,Oo Si(6/11)(18.12.11),20.2.2012,21.5.2017,Jade,1,Kachin State,Whay Lone(76),20,2,2012,21,5,2017,Whay Lone,76,2012-2-20,2017-5-21
13,Kyaut Kyi Kone,Private,Oo Si(6/11)(18.12.11),20.2.2012,21.5.2017,Jade,1,Kachin State,Whay Lone(77),20,2,2012,21,5,2017,Whay Lone,77,2012-2-20,2017-5-21
14,Kyaut Kyi Kone,Private,Oo Si(6/11)(18.12.11),20.2.2012,21.5.2017,Jade,1,Kachin State,Whay Lone(78),20,2,2012,21,5,2017,Whay Lone,78,2012-2-20,2017-5-21
15,Kyaut Kyi Kone,Private,Oo Si(6/11)(18.12.11),20.2.2012,21.5.2017,Jade,1,Kachin State,Whay Lone(79),20,2,2012,21,5,2017,Whay Lone,79,2012-2-20,2017-5-21
16,Kyaut Kyi Kone,Private,Oo Si(6/11)(18.12.11),20.2.2012,21.5.2017,Jade,1,Kachin State,Whay Lone(80),20,2,2012,21,5,2017,Whay Lone,80,2012-2-20,2017-5-21
17,Kyaut Kyi Kone,Private,Oo Si(6/11)(18.12.11),20.2.2012,21.5.2017,Jade,1,Kachin State,Whay Lone(81),20,2,2012,21,5,2017,Whay Lone,81,2012-2-20,2017-5-21
18,Kyaut Kyi Kone,Private,Oo Si(6/11)(18.12.11),20.2.2012,21.5.2017,Jade,1,Kachin State,Whay Lone(82),20,2,2012,21,5,2017,Whay Lone,82,2012-2-20,2017-5-21
19,Kyaut Kyi Kone,Private,Oo Si(6/11)(18.12.11),20.2.2012,21.5.2017,Jade,1,Kachin State,Whay Lone(83),20,2,2012,21,5,2017,Whay Lone,83,2012-2-20,2017-5-21
20,Kyaut Kyi Kone,Private,Oo Si(6/11)(18.12.11),20.2.2012,21.5.2017,Jade,1,Kachin State,Whay Lone(84),20,2,2012,21,5,2017,Whay Lone,84,2012-2-20,2017-5-21
21,Kyaut Kyi Kone,Private,Oo Si(3/13)(15.2.13),27.8.2012,26.11.2017,Jade,1,Kachin State,Nant Mhaw(294),27,8,2012,26,11,2017,Nant Mhaw,294,2012-8-27,2017-11-26
1,Kyaut Khet Yor Family,Private,Oo Si(2/11)(19.6.11),31.8.2011,29.11.2016,Jade,1,Kachin State,Ma Kar Pin(315),31,8,2011,29,11,2016,Ma Kar Pin,315,2011-8-31,2016-11-29
2,Kyaut Khet Yor Family,Private,Oo Si(2/11)(19.6.11),31.8.2011,29.11.2016,Jade,1,Kachin State,Ma Kar Pin(316),31,8,2011,29,11,2016,Ma Kar Pin,316,2011-8-31,2016-11-29
3,Kyaut Khet Yor Family,Private,Oo Si(2/11)(19.6.11),23.8.2011,21.11.2016,Jade,1,Kachin State,Ma Kar Pin(336),23,8,2011,21,11,2016,Ma Kar Pin,336,2011-8-23,2016-11-21
4,Kyaut Khet Yor Family,Private,Oo Si(2/11)(19.6.11),23.8.2011,21.11.2016,Jade,1,Kachin State,Ma Kar Pin(337),23,8,2011,21,11,2016,Ma Kar Pin,337,2011-8-23,2016-11-21
5,Kyaut Khet Yor Family,Private,Oo Si(2/11)(19.6.11),23.8.2011,21.11.2016,Jade,1,Kachin State,Ma Kar Pin(338),23,8,2011,21,11,2016,Ma Kar Pin,338,2011-8-23,2016-11-21
6,Kyaut Khet Yor Family,Private,Oo Si(2/11)(19.6.11),23.8.2011,21.11.2016,Jade,1,Kachin State,Ma Kar Pin(339),23,8,2011,21,11,2016,Ma Kar Pin,339,2011-8-23,2016-11-21
7,Kyaut Khet Yor Family,Private,Oo Si(2/11)(19.6.11),23.8.2011,21.11.2016,Jade,1,Kachin State,Ma Kar Pin(340),23,8,2011,21,11,2016,Ma Kar Pin,340,2011-8-23,2016-11-21
8,Kyaut Khet Yor Family,Private,Oo Si(2/11)(19.6.11),23.8.2011,21.11.2016,Jade,1,Kachin State,Ma Kar Pin(341),23,8,2011,21,11,2016,Ma Kar Pin,341,2011-8-23,2016-11-21
9,Kyaut Khet Yor Family,Private,Oo Si(2/11)(19.6.11),23.8.2011,21.11.2016,Jade,1,Kachin State,Ma Kar Pin(345),23,8,2011,21,11,2016,Ma Kar Pin,345,2011-8-23,2016-11-21
10,Kyaut Khet Yor Family,Private,Oo Si(2/11)(19.6.11),23.8.2011,21.11.2016,Jade,1,Kachin State,Ma Kar Pin(346),23,8,2011,21,11,2016,Ma Kar Pin,346,2011-8-23,2016-11-21
11,Kyaut Khet Yor Family,Private,Oo Si(2/11)(19.6.11),23.8.2011,21.11.2016,Jade,1,Kachin State,Ma Kar Pin(347),23,8,2011,21,11,2016,Ma Kar Pin,347,2011-8-23,2016-11-21
12,Kyaut Khet Yor Family,Private,Oo Si(2/11)(19.6.11),23.8.2011,21.11.2016,Jade,1,Kachin State,Ma Kar Pin(348),23,8,2011,21,11,2016,Ma Kar Pin,348,2011-8-23,2016-11-21
13,Kyaut Khet Yor Family,Private,Oo Si(2/11)(19.6.11),23.8.2011,21.11.2016,Jade,1,Kachin State,Ma Kar Pin(349),23,8,2011,21,11,2016,Ma Kar Pin,349,2011-8-23,2016-11-21
14,Kyaut Khet Yor Family,Private,Oo Si(2/11)(19.6.11),23.8.2011,21.11.2016,Jade,1,Kachin State,Ma Kar Pin(350),23,8,2011,21,11,2016,Ma Kar Pin,350,2011-8-23,2016-11-21
15,Kyaut Khet Yor Family,Private,Oo Si(2/11)(19.6.11),23.8.2011,21.11.2016,Jade,1,Kachin State,Ma Kar Pin(351),23,8,2011,21,11,2016,Ma Kar Pin,351,2011-8-23,2016-11-21
16,Kyaut Khet Yor Family,Private,Oo Si(2/11)(19.6.11),23.8.2011,21.11.2016,Jade,1,Kachin State,Ma Kar Pin(352),23,8,2011,21,11,2016,Ma Kar Pin,352,2011-8-23,2016-11-21
17,Kyaut Khet Yor Family,Private,Oo Si(2/11)(19.6.11),23.8.2011,21.11.2016,Jade,1,Kachin State,Ma Kar Pin(353),23,8,2011,21,11,2016,Ma Kar Pin,353,2011-8-23,2016-11-21
18,Kyaut Khet Yor Family,Private,Oo Si(2/11)(19.6.11),23.8.2011,21.11.2016,Jade,1,Kachin State,Ma Kar Pin(354),23,8,2011,21,11,2016,Ma Kar Pin,354,2011-8-23,2016-11-21
19,Kyaut Khet Yor Family,Private,Oo Si(2/11)(19.6.11),23.8.2011,21.11.2016,Jade,1,Kachin State,Ma Kar Pin(355),23,8,2011,21,11,2016,Ma Kar Pin,355,2011-8-23,2016-11-21
20,Kyaut Khet Yor Family,Private,Oo Si(2/11)(19.6.11),23.8.2011,21.11.2016,Jade,1,Kachin State,Ma Kar Pin(356),23,8,2011,21,11,2016,Ma Kar Pin,356,2011-8-23,2016-11-21
21,Kyaut Khet Yor Family,Private,Oo Si(2/11)(19.6.11),31.8.2011,29.11.2016,Jade,1,Kachin State,Mhaw Ga Lone(46),31,8,2011,29,11,2016,Mhaw Ga Lone,46,2011-8-31,2016-11-29
22,Kyaut Khet Yor Family,Private,Oo Si(2/11)(19.6.11),19.12.2011,19.3.2017,Jade,1,Kachin State,Shin Ta Thaung(8),19,12,2011,19,3,2017,Shin Ta Thaung,8,2011-12-19,2017-3-19
1,Kyaut San Water,Private,Oo Si (4/12)(18.12.12),29.2.2013,28.2.2019,Gem,1,Madalay Division,Li Suu Kyauk Pone(Pha Hta-1),29,2,2013,28,2,2019,Li Suu Kyauk Pone,Pha Hta-1,2013-2-29,2019-2-28
1,Kyaut Sin,Private,Oo Si (5/13)(23.8.13),14.10.2013,13.10.2016,Gem,1,Madalay Division,Kyauk Sinn(Pha Hta-84),14,10,2013,13,10,2016,Kyauk Sinn,Pha Hta-84,2013-10-14,2016-10-13
2,Kyaut Sin,Private,Oo Si (5/13)(23.8.13),14.10.2013,13.10.2016,Gem,1,Madalay Division,Your Thar Ah Chouh Taw(Pha Hta-16),14,10,2013,13,10,2016,Your Thar Ah Chouh Taw,Pha Hta-16,2013-10-14,2016-10-13
3,Kyaut Sin,Private,Oo Si (7/13)(25.10.13),25.11.2013,24.11.2016,Gem,1,Madalay Division,Kyauk Sinn(1),25,11,2013,24,11,2016,Kyauk Sinn,1,2013-11-25,2016-11-24
4,Kyaut Sin,Private,Oo Si (7/13)(25.10.13),25.11.2013,24.11.2016,Gem,1,Madalay Division,Kyauk Sinn(Sa-11),25,11,2013,24,11,2016,Kyauk Sinn,Sa-11,2013-11-25,2016-11-24
5,Kyaut Sin,Private,Oo Si (7/13)(25.10.13),25.11.2013,24.11.2016,Gem,1,Madalay Division,Kyauk Sinn(Pha Hta-86),25,11,2013,24,11,2016,Kyauk Sinn,Pha Hta-86,2013-11-25,2016-11-24
6,Kyaut Sin,Private,Oo Si (2/14)(30.10.14),21.11.2014,20.11.2017,Gem,1,Madalay Division,Kyauk Sinn(15),21,11,2014,20,11,2017,Kyauk Sinn,15,2014-11-21,2017-11-20
7,Kyaut Sin,Private,Oo Si (2/14)(30.10.14),21.11.2014,20.11.2017,Gem,1,Madalay Division,Kyauk Sinn(14),21,11,2014,20,11,2017,Kyauk Sinn,14,2014-11-21,2017-11-20
8,Kyaut Sin,Private,Oo Si (2/14)(30.10.14),21.11.2014,20.11.2017,Gem,1,Madalay Division,Kyauk Sinn(156,21,11,2014,20,11,2017,Kyauk Sinn,156,2014-11-21,2017-11-20
9,Kyaut Sin,Private,Oo Si (2/14)(30.10.14),21.11.2014,20.11.2017,Gem,1,Madalay Division,Kyauk Sinn(17),21,11,2014,20,11,2017,Kyauk Sinn,17,2014-11-21,2017-11-20
1,Gem's Thakhin,Private,Oo Si (1/14)(10.6.14),29.7.2014,28.7.2017,Gem,1,Madalay Division,Dat Taw Kwet Thit(2),29,7,2014,28,7,2017,Dat Taw Kwet Thit,2,2014-7-29,2017-7-28
2,Gem's Thakhin,Private,Oo Si (1/14)(10.6.14),29.7.2014,28.7.2017,Gem,1,Madalay Division,Dat Taw Kwet Thit(4),29,7,2014,28,7,2017,Dat Taw Kwet Thit,4,2014-7-29,2017-7-28
3,Gem's Thakhin,Private,Oo Si (1/14)(10.6.14),29.7.2014,28.7.2017,Gem,1,Madalay Division,Dat Taw Kwet Thit(5),29,7,2014,28,7,2017,Dat Taw Kwet Thit,5,2014-7-29,2017-7-28
1,Kyaut Myat Yadanar Bayin,Private,Oo Si(2/11)(19.6.11),1.4.2011,30.6.2016,Jade,1,Kachin State,War Kyale(91),1,4,2011,30,6,2016,War Kyale,91,2011-4-1,2016-6-30
2,Kyaut Myat Yadanar Bayin,Private,Oo Si(2/11)(19.6.11),9.9.2012,9.12.2017,Jade,1,Kachin State,Whay Khar(179),9,9,2012,9,12,2017,Whay Khar,179,2012-9-9,2017-12-9
3,Kyaut Myat Yadanar Bayin,Private,Oo Si(2/11)(19.6.11),31.5.2013,14.10.2017,Jade,1,Kachin State,Ngo Pin(122),31,5,2013,14,10,2017,Ngo Pin,122,2013-5-31,2017-10-14
1,Kyaut Myat Shwe Pyi,Private,Oo Si(3/14)(11.12.14),19.2.2015,18.2.2018,Jade,1,Kachin State,Ma Mon(180),19,2,2015,18,2,2018,Ma Mon,180,2015-2-19,2018-2-18
2,Kyaut Myat Shwe Pyi,Private,Oo Si(3/14)(11.12.14),19.2.2015,18.2.2018,Jade,1,Kachin State,Ma Mon(181),19,2,2015,18,2,2018,Ma Mon,181,2015-2-19,2018-2-18
3,Kyaut Myat Shwe Pyi,Private,Oo Si(3/14)(11.12.14),19.2.2015,18.2.2018,Jade,1,Kachin State,Ma Mon(182),19,2,2015,18,2,2018,Ma Mon,182,2015-2-19,2018-2-18
4,Kyaut Myat Shwe Pyi,Private,Oo Si(3/14)(11.12.14),19.2.2015,18.2.2018,Jade,1,Kachin State,Ma Mon(183),19,2,2015,18,2,2018,Ma Mon,183,2015-2-19,2018-2-18
5,Kyaut Myat Shwe Pyi,Private,Oo Si(3/14)(11.12.14),19.2.2015,18.2.2018,Jade,1,Kachin State,Mat Lin Chaung(155),19,2,2015,18,2,2018,Mat Lin Chaung,155,2015-2-19,2018-2-18
6,Kyaut Myat Shwe Pyi,Private,Oo Si(3/14)(11.12.14),19.2.2015,18.2.2018,Jade,1,Kachin State,Mat Lin Chaung(156),19,2,2015,18,2,2018,Mat Lin Chaung,156,2015-2-19,2018-2-18
7,Kyaut Myat Shwe Pyi,Private,Oo Si(3/14)(11.12.14),19.2.2015,18.2.2018,Jade,1,Kachin State,Mat Lin Chaung(157),19,2,2015,18,2,2018,Mat Lin Chaung,157,2015-2-19,2018-2-18
8,Kyaut Myat Shwe Pyi,Private,Oo Si(3/14)(11.12.14),19.2.2015,18.2.2018,Jade,1,Kachin State,Mat Lin Chaung(158),19,2,2015,18,2,2018,Mat Lin Chaung,158,2015-2-19,2018-2-18
9,Kyaut Myat Shwe Pyi,Private,Oo Si(3/14)(11.12.14),19.2.2015,18.2.2018,Jade,1,Kachin State,Mat Lin Chaung(159),19,2,2015,18,2,2018,Mat Lin Chaung,159,2015-2-19,2018-2-18
10,Kyaut Myat Shwe Pyi,Private,Oo Si(1/12)(26.3.12),18.6.2012,17.6.2016,Jade,1,Kachin State,Mat Lin Chaung(205),18,6,2012,17,6,2016,Mat Lin Chaung,205,2012-6-18,2016-6-17
11,Kyaut Myat Shwe Pyi,Private,Oo Si(1/12)(26.3.12),18.6.2012,17.6.2016,Jade,1,Kachin State,Whay Khar Mhaw Thit Kone(558),18,6,2012,17,6,2016,Whay Khar Mhaw Thit Kone,558,2012-6-18,2016-6-17
12,Kyaut Myat Shwe Pyi,Private,Oo Si(1/12)(26.3.12),18.6.2012,17.6.2016,Jade,1,Kachin State,Whay Khar Mhaw Thit Kone(559),18,6,2012,17,6,2016,Whay Khar Mhaw Thit Kone,559,2012-6-18,2016-6-17
13,Kyaut Myat Shwe Pyi,Private,Oo Si(1/12)(26.3.12),18.6.2012,17.6.2016,Jade,1,Kachin State,Whay Khar Mhaw Thit Kone(560),18,6,2012,17,6,2016,Whay Khar Mhaw Thit Kone,560,2012-6-18,2016-6-17
14,Kyaut Myat Shwe Pyi,Private,Oo Si(1/12)(26.3.12),18.6.2012,17.6.2016,Jade,1,Kachin State,Whay Khar Mhaw Thit Kone(561),18,6,2012,17,6,2016,Whay Khar Mhaw Thit Kone,561,2012-6-18,2016-6-17
15,Kyaut Myat Shwe Pyi,Private,Oo Si(1/12)(26.3.12),18.6.2012,17.6.2016,Jade,1,Kachin State,Whay Khar Mhaw Thit Kone(562),18,6,2012,17,6,2016,Whay Khar Mhaw Thit Kone,562,2012-6-18,2016-6-17
16,Kyaut Myat Shwe Pyi,Private,Oo Si(1/12)(26.3.12),18.6.2012,17.6.2016,Jade,1,Kachin State,Whay Khar Mhaw Thit Kone(563),18,6,2012,17,6,2016,Whay Khar Mhaw Thit Kone,563,2012-6-18,2016-6-17
17,Kyaut Myat Shwe Pyi,Private,Oo Si(1/12)(26.3.12),18.6.2012,17.6.2016,Jade,1,Kachin State,Whay Khar Mhaw Thit Kone(564),18,6,2012,17,6,2016,Whay Khar Mhaw Thit Kone,564,2012-6-18,2016-6-17
18,Kyaut Myat Shwe Pyi,Private,Oo Si(1/12)(26.3.12),18.6.2012,17.6.2016,Jade,1,Kachin State,Whay Khar Mhaw Thit Kone(565),18,6,2012,17,6,2016,Whay Khar Mhaw Thit Kone,565,2012-6-18,2016-6-17
19,Kyaut Myat Shwe Pyi,Private,Oo Si(1/12)(26.3.12),18.6.2012,17.6.2016,Jade,1,Kachin State,Whay Khar Mhaw Thit Kone(566),18,6,2012,17,6,2016,Whay Khar Mhaw Thit Kone,566,2012-6-18,2016-6-17
20,Kyaut Myat Shwe Pyi,Private,Oo Si(1/12)(26.3.12),18.6.2012,17.6.2016,Jade,1,Kachin State,Whay Khar Mhaw Thit Kone(567),18,6,2012,17,6,2016,Whay Khar Mhaw Thit Kone,567,2012-6-18,2016-6-17
21,Kyaut Myat Shwe Pyi,Private,Oo Si(1/12)(26.3.12),18.6.2012,17.6.2016,Jade,1,Kachin State,Whay Khar Mhaw Thit Kone(568),18,6,2012,17,6,2016,Whay Khar Mhaw Thit Kone,568,2012-6-18,2016-6-17
22,Kyaut Myat Shwe Pyi,Private,Oo Si(1/12)(26.3.12),18.6.2012,17.6.2016,Jade,1,Kachin State,Whay Khar Mhaw Thit Kone(569),18,6,2012,17,6,2016,Whay Khar Mhaw Thit Kone,569,2012-6-18,2016-6-17
23,Kyaut Myat Shwe Pyi,Private,Oo Si(1/12)(26.3.12),18.6.2012,17.6.2016,Jade,1,Kachin State,Whay Khar Mhaw Thit Kone(570),18,6,2012,17,6,2016,Whay Khar Mhaw Thit Kone,570,2012-6-18,2016-6-17
24,Kyaut Myat Shwe Pyi,Private,Oo Si(1/12)(26.3.12),18.6.2012,17.6.2016,Jade,1,Kachin State,Whay Khar Mhaw Thit Kone(571),18,6,2012,17,6,2016,Whay Khar Mhaw Thit Kone,571,2012-6-18,2016-6-17
25,Kyaut Myat Shwe Pyi,Private,Oo Si(1/12)(26.3.12),18.6.2012,17.6.2016,Jade,1,Kachin State,Whay Khar Mhaw Thit Kone(572),18,6,2012,17,6,2016,Whay Khar Mhaw Thit Kone,572,2012-6-18,2016-6-17
26,Kyaut Myat Shwe Pyi,Private,Oo Si(1/12)(26.3.12),18.6.2012,17.6.2016,Jade,1,Kachin State,Whay Khar Mhaw Thit Kone(573),18,6,2012,17,6,2016,Whay Khar Mhaw Thit Kone,573,2012-6-18,2016-6-17
27,Kyaut Myat Shwe Pyi,Private,Oo Si(1/12)(26.3.12),18.6.2012,17.6.2016,Jade,1,Kachin State,Whay Khar Mhaw Thit Kone(574),18,6,2012,17,6,2016,Whay Khar Mhaw Thit Kone,574,2012-6-18,2016-6-17
28,Kyaut Myat Shwe Pyi,Private,Oo Si(1/12)(26.3.12),18.6.2012,17.6.2016,Jade,1,Kachin State,Whay Khar Mhaw Thit Kone(575),18,6,2012,17,6,2016,Whay Khar Mhaw Thit Kone,575,2012-6-18,2016-6-17
29,Kyaut Myat Shwe Pyi,Private,Oo Si(1/12)(26.3.12),18.6.2012,17.6.2016,Jade,1,Kachin State,Whay Khar Mhaw Thit Kone(576),18,6,2012,17,6,2016,Whay Khar Mhaw Thit Kone,576,2012-6-18,2016-6-17
30,Kyaut Myat Shwe Pyi,Private,Oo Si(1/12)(26.3.12),18.6.2012,17.6.2016,Jade,1,Kachin State,Whay Khar Mhaw Thit Kone(577),18,6,2012,17,6,2016,Whay Khar Mhaw Thit Kone,577,2012-6-18,2016-6-17
31,Kyaut Myat Shwe Pyi,Private,Oo Si(1/12)(26.3.12),18.6.2012,17.6.2016,Jade,1,Kachin State,Whay Khar Mhaw Thit Kone(578),18,6,2012,17,6,2016,Whay Khar Mhaw Thit Kone,578,2012-6-18,2016-6-17
32,Kyaut Myat Shwe Pyi,Private,Oo Si(1/12)(26.3.12),18.6.2012,17.6.2016,Jade,1,Kachin State,Whay Khar Mhaw Thit Kone(579),18,6,2012,17,6,2016,Whay Khar Mhaw Thit Kone,579,2012-6-18,2016-6-17
33,Kyaut Myat Shwe Pyi,Private,Oo Si(1/12)(26.3.12),18.6.2012,17.6.2016,Jade,1,Kachin State,Whay Khar Mhaw Thit Kone(580),18,6,2012,17,6,2016,Whay Khar Mhaw Thit Kone,580,2012-6-18,2016-6-17
34,Kyaut Myat Shwe Pyi,Private,Oo Si(1/12)(26.3.12),18.6.2012,17.6.2016,Jade,1,Kachin State,Whay Khar Mhaw Thit Kone(581),18,6,2012,17,6,2016,Whay Khar Mhaw Thit Kone,581,2012-6-18,2016-6-17
35,Kyaut Myat Shwe Pyi,Private,Oo Si(1/12)(26.3.12),18.6.2012,17.6.2016,Jade,1,Kachin State,Whay Khar Mhaw Thit Kone(582),18,6,2012,17,6,2016,Whay Khar Mhaw Thit Kone,582,2012-6-18,2016-6-17
36,Kyaut Myat Shwe Pyi,Private,Oo Si(1/12)(26.3.12),18.6.2012,17.6.2016,Jade,1,Kachin State,Whay Khar Mhaw Thit Kone(583),18,6,2012,17,6,2016,Whay Khar Mhaw Thit Kone,583,2012-6-18,2016-6-17
37,Kyaut Myat Shwe Pyi,Private,Oo Si(1/12)(26.3.12),18.6.2012,17.6.2016,Jade,1,Kachin State,Whay Khar Mhaw Thit Kone(584),18,6,2012,17,6,2016,Whay Khar Mhaw Thit Kone,584,2012-6-18,2016-6-17
38,Kyaut Myat Shwe Pyi,Private,Oo Si(1/12)(26.3.12),18.6.2012,17.6.2016,Jade,1,Kachin State,Whay Khar Mhaw Thit Kone(585),18,6,2012,17,6,2016,Whay Khar Mhaw Thit Kone,585,2012-6-18,2016-6-17
39,Kyaut Myat Shwe Pyi,Private,Oo Si(1/12)(26.3.12),18.6.2012,17.6.2016,Jade,1,Kachin State,Whay Khar Mhaw Thit Kone(586),18,6,2012,17,6,2016,Whay Khar Mhaw Thit Kone,586,2012-6-18,2016-6-17
40,Kyaut Myat Shwe Pyi,Private,Oo Si(1/12)(26.3.12),18.6.2012,17.6.2016,Jade,1,Kachin State,Whay Khar Mhaw Thit Kone(587),18,6,2012,17,6,2016,Whay Khar Mhaw Thit Kone,587,2012-6-18,2016-6-17
41,Kyaut Myat Shwe Pyi,Private,Oo Si(1/12)(26.3.12),18.6.2012,17.6.2016,Jade,1,Kachin State,Whay Khar Mhaw Thit Kone(588),18,6,2012,17,6,2016,Whay Khar Mhaw Thit Kone,588,2012-6-18,2016-6-17
42,Kyaut Myat Shwe Pyi,Private,Oo Si(1/12)(26.3.12),18.6.2012,17.6.2016,Jade,1,Kachin State,Whay Khar Mhaw Thit Kone(589),18,6,2012,17,6,2016,Whay Khar Mhaw Thit Kone,589,2012-6-18,2016-6-17
43,Kyaut Myat Shwe Pyi,Private,Oo Si(1/12)(26.3.12),18.6.2012,17.6.2016,Jade,1,Kachin State,Whay Khar Mhaw Thit Kone(590),18,6,2012,17,6,2016,Whay Khar Mhaw Thit Kone,590,2012-6-18,2016-6-17
44,Kyaut Myat Shwe Pyi,Private,Oo Si(1/12)(26.3.12),18.6.2012,17.6.2016,Jade,1,Kachin State,Whay Khar Mhaw Thit Kone(591),18,6,2012,17,6,2016,Whay Khar Mhaw Thit Kone,591,2012-6-18,2016-6-17
45,Kyaut Myat Shwe Pyi,Private,Oo Si(1/12)(26.3.12),18.6.2012,17.6.2016,Jade,1,Kachin State,Whay Khar Mhaw Thit Kone(592),18,6,2012,17,6,2016,Whay Khar Mhaw Thit Kone,592,2012-6-18,2016-6-17
46,Kyaut Myat Shwe Pyi,Private,Oo Si(1/12)(26.3.12),18.6.2012,17.6.2016,Jade,1,Kachin State,Whay Khar Mhaw Thit Kone(593),18,6,2012,17,6,2016,Whay Khar Mhaw Thit Kone,593,2012-6-18,2016-6-17
47,Kyaut Myat Shwe Pyi,Private,Oo Si(1/12)(26.3.12),18.6.2012,17.6.2016,Jade,1,Kachin State,Whay Khar Mhaw Thit Kone(594),18,6,2012,17,6,2016,Whay Khar Mhaw Thit Kone,594,2012-6-18,2016-6-17
48,Kyaut Myat Shwe Pyi,Private,Oo Si(1/12)(26.3.12),18.6.2012,17.6.2016,Jade,1,Kachin State,Whay Khar Mhaw Thit Kone(595),18,6,2012,17,6,2016,Whay Khar Mhaw Thit Kone,595,2012-6-18,2016-6-17
49,Kyaut Myat Shwe Pyi,Private,Oo Si(1/12)(26.3.12),18.6.2012,17.6.2016,Jade,1,Kachin State,Whay Khar Mhaw Thit Kone(596),18,6,2012,17,6,2016,Whay Khar Mhaw Thit Kone,596,2012-6-18,2016-6-17
50,Kyaut Myat Shwe Pyi,Private,Oo Si(1/12)(26.3.12),18.6.2012,17.6.2016,Jade,1,Kachin State,Whay Khar Mhaw Thit Kone(597),18,6,2012,17,6,2016,Whay Khar Mhaw Thit Kone,597,2012-6-18,2016-6-17
1,Kyuat M ,Private,Oo Si (7/13)(25.10.13),21.11.2013,20.11.2016,Gem,1,Shan State,Lwai Saung htauk(Pha La-179),21,11,2013,20,11,2016,Lwai Saung htauk,Pha La-179,2013-11-21,2016-11-20
2,Kyuat M ,Private,Oo Si (7/13)(25.10.13),3.12.2013,2.12.2016,Gem,1,Shan State,Lwai Saung htauk(Pha La-138),3,12,2013,2,12,2016,Lwai Saung htauk,Pha La-138,2013-12-3,2016-12-2
3,Kyuat M ,Private,Oo Si (7/13)(25.10.13),3.12.2013,2.12.2016,Gem,1,Shan State,Lwai Saung htauk(Pha La-165),3,12,2013,2,12,2016,Lwai Saung htauk,Pha La-165,2013-12-3,2016-12-2
4,Kyuat M ,Private,Oo Si (7/13)(25.10.13),3.12.2013,2.12.2016,Gem,1,Shan State,Lwai Saung htauk(Pha La-350),3,12,2013,2,12,2016,Lwai Saung htauk,Pha La-350,2013-12-3,2016-12-2
5,Kyuat M ,Private,Oo Si (7/13)(25.10.13),9.11.2013,8.11.2016,Gem,1,Shan State,Lwai Saung htauk(Pha La-369),9,11,2013,8,11,2016,Lwai Saung htauk,Pha La-369,2013-11-9,2016-11-8
6,Kyuat M ,Private,Oo Si (1/14)(10.6.14),22.5.2014,21.5.2017,Gem,1,Shan State,Lwai Saung htauk(Pha La-176),22,5,2014,21,5,2017,Lwai Saung htauk,Pha La-176,2014-5-22,2017-5-21
7,Kyuat M ,Private,Oo Si (1/14)(10.6.14),30.8.2014,29.8.2017,Gem,1,Shan State,Lwai Saung htauk(Pha La-56),30,8,2014,29,8,2017,Lwai Saung htauk,Pha La-56,2014-8-30,2017-8-29
8,Kyuat M ,Private,Oo Si (1/14)(10.6.14),22.5.2014,21.5.2017,Gem,1,Shan State,Lwai Saung htauk(Pha La-178),22,5,2014,21,5,2017,Lwai Saung htauk,Pha La-178,2014-5-22,2017-5-21
9,Kyuat M ,Private,Oo Si (1/14)(10.6.14),22.5.2014,21.5.2017,Gem,1,Shan State,Lwai Saung htauk(La-21),22,5,2014,21,5,2017,Lwai Saung htauk,La-21,2014-5-22,2017-5-21
10,Kyuat M ,Private,Oo Si (3/14)(18.12.14),22.3.2015,21.3.2018,Gem,1,Shan State,Lwai Saung htauk(Pha La-98),22,3,2015,21,3,2018,Lwai Saung htauk,Pha La-98,2015-3-22,2018-3-21
11,Kyuat M ,Private,Oo Si (3/14)(18.12.14),22.3.2015,21.3.2018,Gem,1,Shan State,Lwai Saung htauk(Pha La-103),22,3,2015,21,3,2018,Lwai Saung htauk,Pha La-103,2015-3-22,2018-3-21
12,Kyuat M ,Private,Oo Si (3/14)(18.12.14),1.2.2015,31.1.2018,Gem,1,Shan State,Lwai Saung htauk(Pha La-194),1,2,2015,31,1,2018,Lwai Saung htauk,Pha La-194,2015-2-1,2018-1-31
13,Kyuat M ,Private,Oo Si (3/14)(18.12.14),2/4,2/3,Gem,1,Shan State,Lwai Saung htauk(Pha La-313),4,2,,3,2,,Lwai Saung htauk,Pha La-313,1900-2-4,1900-2-3
14,Kyuat M ,Private,Oo Si (1/13)(26.3.13),1.6.2012,31.5.2016,Gem,1,Shan State,Lwai Saung htauk(Pha La-119),1,6,2012,31,5,2016,Lwai Saung htauk,Pha La-119,2012-6-1,2016-5-31
15,Kyuat M ,Private,Oo Si (1/13)(26.3.13),1.7.2012,30.6.2015,Gem,1,Shan State,Lwai Saung htauk(Pha La-197),1,7,2012,30,6,2015,Lwai Saung htauk,Pha La-197,2012-7-1,2015-6-30
16,Kyuat M ,Private,Oo Si (3/15)(4.9.15),10.2.2015,9.2.2018,Gem,1,Shan State,Lwai Saung htauk(Pha La-394),10,2,2015,9,2,2018,Lwai Saung htauk,Pha La-394,2015-2-10,2018-2-9
1,Kyaut Myat Min,Private,Oo Si(1/11)(14.5.11),11.7.2011,9.10.2016,Jade,1,Kachin State,Maw Maung(261),11,7,2011,9,10,2016,Maw Maung,261,2011-7-11,2016-10-9
2,Kyaut Myat Min,Private,Oo Si(2/11)(19.6.11),31.8.2011,29.11.2016,Jade,1,Kachin State,Ma Kar Pin(57),31,8,2011,29,11,2016,Ma Kar Pin,57,2011-8-31,2016-11-29
3,Kyaut Myat Min,Private,Oo Si(2/11)(19.6.11),31.8.2011,29.11.2016,Jade,1,Kachin State,Maw Maung(51),31,8,2011,29,11,2016,Maw Maung,51,2011-8-31,2016-11-29
4,Kyaut Myat Min,Private,Oo Si(2/11)(19.6.11),31.8.2011,29.11.2016,Jade,1,Kachin State,Sha Yaung Kha(282),31,8,2011,29,11,2016,Sha Yaung Kha,282,2011-8-31,2016-11-29
5,Kyaut Myat Min,Private,Oo Si(2/11)(19.6.11),31.8.2011,29.11.2016,Jade,1,Kachin State,Nant Mhaw(224),31,8,2011,29,11,2016,Nant Mhaw,224,2011-8-31,2016-11-29
6,Kyaut Myat Min,Private,Oo Si(2/11)(19.6.11),31.8.2011,29.11.2016,Jade,1,Kachin State,Sha Yaung Kha(34),31,8,2011,29,11,2016,Sha Yaung Kha,34,2011-8-31,2016-11-29
7,Kyaut Myat Min,Private,Oo Si(2/11)(19.6.11),31.8.2011,30.11.2018,Jade,1,Kachin State,Sha Yaung Kha(149),31,8,2011,30,11,2018,Sha Yaung Kha,149,2011-8-31,2018-11-30
8,Kyaut Myat Min,Private,Oo Si(2/11)(19.6.11),31.8.2011,30.11.2018,Jade,1,Kachin State,Sha Yaung Kha(151),31,8,2011,30,11,2018,Sha Yaung Kha,151,2011-8-31,2018-11-30
9,Kyaut Myat Min,Private,Oo Si(2/11)(19.6.11),31.8.2011,30.11.2018,Jade,1,Kachin State,Sha Yaung Kha(162),31,8,2011,30,11,2018,Sha Yaung Kha,162,2011-8-31,2018-11-30
10,Kyaut Myat Min,Private,Oo Si(2/11)(19.6.11),31.8.2011,30.11.2018,Jade,1,Kachin State,Mana(97),31,8,2011,30,11,2018,Mana,97,2011-8-31,2018-11-30
11,Kyaut Myat Min,Private,Oo Si(2/11)(19.6.11),31.8.2011,30.11.2018,Jade,1,Kachin State,Mana(141),31,8,2011,30,11,2018,Mana,141,2011-8-31,2018-11-30
12,Kyaut Myat Min,Private,Oo Si(2/11)(19.6.11),31.8.2011,30.11.2018,Jade,1,Kachin State,Mana(142),31,8,2011,30,11,2018,Mana,142,2011-8-31,2018-11-30
13,Kyaut Myat Min,Private,Oo Si(2/11)(19.6.11),31.8.2011,30.11.2018,Jade,1,Kachin State,Sha Yaung Kha(51),31,8,2011,30,11,2018,Sha Yaung Kha,51,2011-8-31,2018-11-30
14,Kyaut Myat Min,Private,Oo Si(6/11)(18.12.11),20.2.2012,22.5.2019,Jade,1,Kachin State,Maw One Gyi(242),20,2,2012,22,5,2019,Maw One Gyi,242,2012-2-20,2019-5-22
15,Kyaut Myat Min,Private,Oo Si(6/11)(18.12.11),20.2.2012,22.5.2019,Jade,1,Kachin State,Sport(313),20,2,2012,22,5,2019,Sport,313,2012-2-20,2019-5-22
16,Kyaut Myat Min,Private,Oo Si(6/11)(18.12.11),20.1.2012,22.5.2019,Jade,1,Kachin State,Maw One Gyi(243),20,1,2012,22,5,2019,Maw One Gyi,243,2012-1-20,2019-5-22
17,Kyaut Myat Min,Private,Oo Si(6/11)(18.12.11),20.1.2012,22.5.2019,Jade,1,Kachin State,Maw One Gyi(244),20,1,2012,22,5,2019,Maw One Gyi,244,2012-1-20,2019-5-22
18,Kyaut Myat Min,Private,Oo Si(3/12)(4.9.12),15.12.2012,14.12.2016,Jade,1,Kachin State,Mhaw Si Sar(315),15,12,2012,14,12,2016,Mhaw Si Sar,315,2012-12-15,2016-12-14
1,Kyaut Myat Min,Private,Oo Si(6/11)(18.12.11),31.1.2012,2.5.2019,Jade,1,Kachin State,Maw Taung Kaw Phaw Htot(Pha-9),31,1,2012,2,5,2019,Maw Taung Kaw Phaw Htot,Pha-9,2012-1-31,2019-5-2
2,Kyaut Myat Min,Private,Oo Si(6/11)(18.12.11),31.1.2012,2.5.2019,Jade,1,Kachin State,Kyar Maw(7),31,1,2012,2,5,2019,Kyar Maw,7,2012-1-31,2019-5-2
1,Kyaut Myat Myoetaw,Private,Oo Si (4/13)(16.5.13),20.8.2013,19.8.2016,Gem,1,Madalay Division,Sal Oo(28),20,8,2013,19,8,2016,Sal Oo,28,2013-8-20,2016-8-19
2,Kyaut Myat Myoetaw,Private,Oo Si (4/13)(16.5.13),20.8.2013,19.8.2016,Gem,1,Madalay Division,Sal Oo(29),20,8,2013,19,8,2016,Sal Oo,29,2013-8-20,2016-8-19
3,Kyaut Myat Myoetaw,Private,Oo Si (1/12)(26.3.12),8.5.2012,7.5.2016,Gem,1,Madalay Division,Ye Hnyar Oo(Pha Hta-1),8,5,2012,7,5,2016,Ye Hnyar Oo,Pha Hta-1,2012-5-8,2016-5-7
1,Kyaut Myat Myoetaw,Private,Oo Si (2/11)(19.6.11),31.8.2011,29.11.2016,Gem,1,Kachin State,Sha Baw(180),31,8,2011,29,11,2016,Sha Baw,180,2011-8-31,2016-11-29
1,Gems Nilar Patamyar Palace,Private,Oo Si (2/13)(18.1.13),23.3.2012,21.6.2017,Gem,1,Kachin State,Sha Baw(60),23,3,2012,21,6,2017,Sha Baw,60,2012-3-23,2017-6-21
2,Gems Nilar Patamyar Palace,Private,Oo Si (2/13)(18.1.13),18.1.2012,18.4.2017,Gem,1,Kachin State,Sha Baw(61),18,1,2012,18,4,2017,Sha Baw,61,2012-1-18,2017-4-18
3,Gems Nilar Patamyar Palace,Private,Oo Si (2/13)(18.1.13),23.3.2012,21.6.2017,Gem,1,Kachin State,Sha Baw(69),23,3,2012,21,6,2017,Sha Baw,69,2012-3-23,2017-6-21
4,Gems Nilar Patamyar Palace,Private,Oo Si (2/13)(18.1.13),18.1.2012,18.4.2017,Gem,1,Kachin State,Sha Baw(70),18,1,2012,18,4,2017,Sha Baw,70,2012-1-18,2017-4-18
1,Gems Nilar Patamyar Palace,Private,Oo Si(2/09)(2.8.09),5.10.2009,3.1.2017,Jade,1,Kachin State,Ka Lar Mhaw(215),5,10,2009,3,1,2017,Ka Lar Mhaw,215,2009-10-5,2017-1-3
2,Gems Nilar Patamyar Palace,Private,Oo Si(2/10)(17.5.10),27.7.2010,25.10.2017,Jade,1,Kachin State,Ka Yin Chaung(56),27,7,2010,25,10,2017,Ka Yin Chaung,56,2010-7-27,2017-10-25
3,Gems Nilar Patamyar Palace,Private,Oo Si(3/14)(11.12.14),7.3.2015,6.3.2018,Jade,1,Kachin State,Mat Lin Chaung(33),7,3,2015,6,3,2018,Mat Lin Chaung,33,2015-3-7,2018-3-6
4,Gems Nilar Patamyar Palace,Private,Oo Si(3/14)(11.12.14),31.1.2015,30.1.2018,Jade,1,Kachin State,Sha Yaung Kha(105),31,1,2015,30,1,2018,Sha Yaung Kha,105,2015-1-31,2018-1-30
5,Gems Nilar Patamyar Palace,Private,Oo Si(3/12)(4.9.12),27.10.2012,26.10.2015,Jade,1,Kachin State,Maw Maung(90),27,10,2012,26,10,2015,Maw Maung,90,2012-10-27,2015-10-26
6,Gems Nilar Patamyar Palace,Private,Oo Si(3/12)(4.9.12),27.10.2012,26.10.2015,Jade,1,Kachin State,Maw Maung(92),27,10,2012,26,10,2015,Maw Maung,92,2012-10-27,2015-10-26
7,Gems Nilar Patamyar Palace,Private,Oo Si(3/12)(4.9.12),27.10.2012,26.10.2015,Jade,1,Kachin State,Maw La Kin(55),27,10,2012,26,10,2015,Maw La Kin,55,2012-10-27,2015-10-26
8,Gems Nilar Patamyar Palace,Private,Oo Si(3/12)(4.9.12),27.10.2012,26.10.2015,Jade,1,Kachin State,Maw La Kin(63),27,10,2012,26,10,2015,Maw La Kin,63,2012-10-27,2015-10-26
9,Gems Nilar Patamyar Palace,Private,Oo Si(3/12)(4.9.12),27.10.2012,26.10.2015,Jade,1,Kachin State,Sha Yaung Kha(379),27,10,2012,26,10,2015,Sha Yaung Kha,379,2012-10-27,2015-10-26
10,Gems Nilar Patamyar Palace,Private,Oo Si(3/12)(4.9.12),27.10.2012,26.10.2015,Jade,1,Kachin State,Ka Lar Mhaw(52),27,10,2012,26,10,2015,Ka Lar Mhaw,52,2012-10-27,2015-10-26
11,Gems Nilar Patamyar Palace,Private,Oo Si(3/12)(4.9.12),27.10.2012,26.10.2015,Jade,1,Kachin State,Ka Lar Mhaw(53),27,10,2012,26,10,2015,Ka Lar Mhaw,53,2012-10-27,2015-10-26
1,"Kyaut Myat Yadanar""s Kwe Wa Chan Thar Taw Myay",Private,Oo Si(1/11)(26.3.11),20.6.2011,19.6.2016,Jade,1,Kachin State,Myout Phyu(72),20,6,2011,19,6,2016,Myout Phyu,72,2011-6-20,2016-6-19
1,Jade Crystal Palace,Private,Oo Si (5/13)(23.8.13),8.7.2013,7.7.2016,Gem,1,Shan State,Lwai Saung htauk(Pha La-671),8,7,2013,7,7,2016,Lwai Saung htauk,Pha La-671,2013-7-8,2016-7-7
2,Jade Crystal Palace,Private,Oo Si (5/13)(23.8.13),8.7.2013,7.7.2016,Gem,1,Shan State,Lwai Saung htauk(Pha La-672),8,7,2013,7,7,2016,Lwai Saung htauk,Pha La-672,2013-7-8,2016-7-7
1,Jade Crystal Palace,Private,Oo Si(6/11)(18.12.11),2.9.2011,1.12.2016,Jade,1,Kachin State,Whay Khar Saw Boua Chaung(69),2,9,2011,1,12,2016,Whay Khar Saw Boua Chaung,69,2011-9-2,2016-12-1
2,Jade Crystal Palace,Private,Oo Si(1/12)(26.3.12),7.6.2012,6.6.2018,Jade,1,Kachin State,Mana(120),7,6,2012,6,6,2018,Mana,120,2012-6-7,2018-6-6
3,Jade Crystal Palace,Private,Oo Si(1/12)(26.3.12),7.6.2012,6.6.2018,Jade,1,Kachin State,Mana(121),7,6,2012,6,6,2018,Mana,121,2012-6-7,2018-6-6
4,Jade Crystal Palace,Private,Oo Si(1/12)(26.3.12),7.6.2012,6.6.2018,Jade,1,Kachin State,Mana(122),7,6,2012,6,6,2018,Mana,122,2012-6-7,2018-6-6
5,Jade Crystal Palace,Private,Oo Si(1/12)(26.3.12),7.6.2012,6.6.2018,Jade,1,Kachin State,Whay Khar(56),7,6,2012,6,6,2018,Whay Khar,56,2012-6-7,2018-6-6
6,Jade Crystal Palace,Private,Oo Si(1/12)(26.3.12),7.6.2012,6.6.2018,Jade,1,Kachin State,Whay Khar Saw Boua Chaung(55),7,6,2012,6,6,2018,Whay Khar Saw Boua Chaung,55,2012-6-7,2018-6-6
1,Jade Palace,Private,Oo Si (6/13)(20.9.13),14.8.2013,13.8.2016,Gem,1,Madalay Division,Kyat Pyin Tha Dut Shuo(Sa-12),14,8,2013,13,8,2016,Kyat Pyin Tha Dut Shuo,Sa-12,2013-8-14,2016-8-13
2,Jade Palace,Private,Oo Si (6/13)(20.9.13),14.8.2013,13.8.2016,Gem,1,Madalay Division,Kyauk Sinn(Pha Hta-74),14,8,2013,13,8,2016,Kyauk Sinn,Pha Hta-74,2013-8-14,2016-8-13
3,Jade Palace,Private,Oo Si (6/13)(20.9.13),14.8.2013,13.8.2016,Gem,1,Madalay Division,Chaung Kyie Center Village(Sa-44),14,8,2013,13,8,2016,Chaung Kyie Center Village,Sa-44,2013-8-14,2016-8-13
4,Jade Palace,Private,Oo Si (6/13)(20.9.13),14.8.2013,13.8.2016,Gem,1,Madalay Division,Chaung Kyie Center Village(Sa-45),14,8,2013,13,8,2016,Chaung Kyie Center Village,Sa-45,2013-8-14,2016-8-13
5,Jade Palace,Private,Oo Si (6/13)(20.9.13),14.8.2013,13.8.2016,Gem,1,Madalay Division,Sa Khan Kyie(Sa-5),14,8,2013,13,8,2016,Sa Khan Kyie,Sa-5,2013-8-14,2016-8-13
6,Jade Palace,Private,Oo Si (6/13)(20.9.13),14.8.2013,13.8.2016,Gem,1,Madalay Division,Pint Ku Taung Gae(21),14,8,2013,13,8,2016,Pint Ku Taung Gae,21,2013-8-14,2016-8-13
7,Jade Palace,Private,Oo Si (6/13)(20.9.13),14.8.2013,13.8.2016,Gem,1,Madalay Division,Pint Ku Taung Gae(22),14,8,2013,13,8,2016,Pint Ku Taung Gae,22,2013-8-14,2016-8-13
8,Jade Palace,Private,Oo Si (6/13)(20.9.13),14.8.2013,13.8.2016,Gem,1,Madalay Division,Pint Ku Taung Gae(23),14,8,2013,13,8,2016,Pint Ku Taung Gae,23,2013-8-14,2016-8-13
9,Jade Palace,Private,Oo Si (6/13)(20.9.13),14.8.2013,13.8.2016,Gem,1,Madalay Division,Pint Ku Taung Gae(24),14,8,2013,13,8,2016,Pint Ku Taung Gae,24,2013-8-14,2016-8-13
10,Jade Palace,Private,Oo Si (6/13)(20.9.13),14.8.2013,13.8.2016,Gem,1,Madalay Division,Pint Ku Taung Mawl (9),14,8,2013,13,8,2016,Pint Ku Taung Mawl ,9,2013-8-14,2016-8-13
11,Jade Palace,Private,Oo Si (6/13)(20.9.13),14.8.2013,13.8.2016,Gem,1,Madalay Division,Pint Ku Taung East chan(Pha Hta-53),14,8,2013,13,8,2016,Pint Ku Taung East chan,Pha Hta-53,2013-8-14,2016-8-13
12,Jade Palace,Private,Oo Si (6/13)(20.9.13),14.8.2013,13.8.2016,Gem,1,Madalay Division,Baw Mar(Pha Hta-72),14,8,2013,13,8,2016,Baw Mar,Pha Hta-72,2013-8-14,2016-8-13
13,Jade Palace,Private,Oo Si (6/13)(20.9.13),14.8.2013,13.8.2016,Gem,1,Madalay Division,Baw Mar Nyaung Pin shuo(Pha Hta-83),14,8,2013,13,8,2016,Baw Mar Nyaung Pin shuo,Pha Hta-83,2013-8-14,2016-8-13
14,Jade Palace,Private,Oo Si (6/13)(20.9.13),14.8.2013,13.8.2016,Gem,1,Madalay Division,Baw Mar Nyaung Pin shuo(Pha Hta-84),14,8,2013,13,8,2016,Baw Mar Nyaung Pin shuo,Pha Hta-84,2013-8-14,2016-8-13
15,Jade Palace,Private,Oo Si (6/13)(20.9.13),14.8.2013,13.8.2016,Gem,1,Madalay Division,Mawl Pyat(2),14,8,2013,13,8,2016,Mawl Pyat,2,2013-8-14,2016-8-13
16,Jade Palace,Private,Oo Si (6/13)(20.9.13),14.8.2013,13.8.2016,Gem,1,Madalay Division,Mawl Pyat(3),14,8,2013,13,8,2016,Mawl Pyat,3,2013-8-14,2016-8-13
17,Jade Palace,Private,Oo Si (6/13)(20.9.13),14.8.2013,13.8.2016,Gem,1,Madalay Division,Ye Pu Ah Htet Pyat(Pha Hta-45),14,8,2013,13,8,2016,Ye Pu Ah Htet Pyat,Pha Hta-45,2013-8-14,2016-8-13
18,Jade Palace,Private,Oo Si (6/13)(20.9.13),14.8.2013,13.8.2016,Gem,1,Madalay Division,Ye Aye(J),14,8,2013,13,8,2016,Ye Aye,J,2013-8-14,2016-8-13
19,Jade Palace,Private,Oo Si (6/13)(20.9.13),14.8.2013,13.8.2016,Gem,1,Madalay Division,Li Suu Kone Zan(Pha Hta-1),14,8,2013,13,8,2016,Li Suu Kone Zan,Pha Hta-1,2013-8-14,2016-8-13
20,Jade Palace,Private,Oo Si (6/13)(20.9.13),14.8.2013,13.8.2016,Gem,1,Madalay Division,Tha Phan Pin Kyi taung(Pha Hta-55),14,8,2013,13,8,2016,Tha Phan Pin Kyi taung,Pha Hta-55,2013-8-14,2016-8-13
21,Jade Palace,Private,Oo Si (6/13)(20.9.13),14.8.2013,13.8.2016,Gem,1,Madalay Division,Tha Phan Pin Kyi taung(Pha Hta-56),14,8,2013,13,8,2016,Tha Phan Pin Kyi taung,Pha Hta-56,2013-8-14,2016-8-13
22,Jade Palace,Private,Oo Si (6/13)(20.9.13),14.8.2013,13.8.2016,Gem,1,Madalay Division,Tha Phan Pin Kyi taung(Pha Hta-57),14,8,2013,13,8,2016,Tha Phan Pin Kyi taung,Pha Hta-57,2013-8-14,2016-8-13
23,Jade Palace,Private,Oo Si (6/13)(20.9.13),14.8.2013,13.8.2016,Gem,1,Madalay Division,Tha Phan Pin Kyi taung(Pha Hta-59),14,8,2013,13,8,2016,Tha Phan Pin Kyi taung,Pha Hta-59,2013-8-14,2016-8-13
1,Jade Palace,Private,Oo Si(2/10)(17.5.10),7/27,10/26,Jade,1,Kachin State,Ka Lar Mhaw(21),27,7,,26,10,,Ka Lar Mhaw,21,1900-7-27,1900-10-26
2,Jade Palace,Private,Oo Si(2/10)(17.5.10),7/29,10/28,Jade,1,Kachin State,Ka Lar Mhaw(22),29,7,,28,10,,Ka Lar Mhaw,22,1900-7-29,1900-10-28
3,Jade Palace,Private,Oo Si(2/11)(19.6.11),29.5.2011,27.8.2016,Jade,1,Kachin State,Ka Lar Mhaw(31),29,5,2011,27,8,2016,Ka Lar Mhaw,31,2011-5-29,2016-8-27
4,Jade Palace,Private,Oo Si(2/10)(17.5.10),7/27,10/26,Jade,1,Kachin State,Ka Lar Mhaw(35),27,7,,26,10,,Ka Lar Mhaw,35,1900-7-27,1900-10-26
5,Jade Palace,Private,Oo Si(2/10)(17.5.10),7/29,10/28,Jade,1,Kachin State,Kyat Paung Chaung Phyar(1),29,7,,28,10,,Kyat Paung Chaung Phyar,1,1900-7-29,1900-10-28
6,Jade Palace,Private,Oo Si(1/10)(4.2.10),5/18,8/17,Jade,1,Kachin State,Kyat Paung Chaung Phyar(3),18,5,,17,8,,Kyat Paung Chaung Phyar,3,1900-5-18,1900-8-17
7,Jade Palace,Private,Oo Si(5/11)(16.11.11),2.7.2011,30.9.2016,Jade,1,Kachin State,Kyat Poung Chaung Phyar(2),2,7,2011,30,9,2016,Kyat Poung Chaung Phyar,2,2011-7-2,2016-9-30
8,Jade Palace,Private,Oo Si(3/10)(28.9.10),11/18,2/17,Jade,1,Kachin State,Ma Mon(124),18,11,,17,2,,Ma Mon,124,1900-11-18,1900-2-17
9,Jade Palace,Private,Oo Si(1/10)(4.2.10),3/16,6/15,Jade,1,Kachin State,Ma Mon(151),16,3,,15,6,,Ma Mon,151,1900-3-16,1900-6-15
10,Jade Palace,Private,Oo Si(1/10)(4.2.10),3/16,6/15,Jade,1,Kachin State,Ma Mon(152),16,3,,15,6,,Ma Mon,152,1900-3-16,1900-6-15
11,Jade Palace,Private,Oo Si(1/10)(4.2.10),3/16,6/15,Jade,1,Kachin State,Ma Mon(153),16,3,,15,6,,Ma Mon,153,1900-3-16,1900-6-15
12,Jade Palace,Private,Oo Si(2/10)(17.5.10),7/29,10/28,Jade,1,Kachin State,Ma Mon(199),29,7,,28,10,,Ma Mon,199,1900-7-29,1900-10-28
13,Jade Palace,Private,Oo Si(2/10)(17.5.10),7/29,10/28,Jade,1,Kachin State,Ma Mon(26),29,7,,28,10,,Ma Mon,26,1900-7-29,1900-10-28
14,Jade Palace,Private,Oo Si(3/13)(15.2.13),31.5.2013,31.8.2018,Jade,1,Kachin State,Mamon(161),31,5,2013,31,8,2018,Mamon,161,2013-5-31,2018-8-31
15,Jade Palace,Private,Oo Si(3/13)(15.2.13),31.5.2013,31.8.2018,Jade,1,Kachin State,Mamon(162),31,5,2013,31,8,2018,Mamon,162,2013-5-31,2018-8-31
16,Jade Palace,Private,Oo Si(3/13)(15.2.13),31.5.2013,31.8.2018,Jade,1,Kachin State,Mamon(163),31,5,2013,31,8,2018,Mamon,163,2013-5-31,2018-8-31
17,Jade Palace,Private,Oo Si(3/13)(15.2.13),31.5.2013,31.8.2018,Jade,1,Kachin State,Mamon(164),31,5,2013,31,8,2018,Mamon,164,2013-5-31,2018-8-31
18,Jade Palace,Private,Oo Si(3/13)(15.2.13),31.5.2013,31.8.2018,Jade,1,Kachin State,Mamon(165),31,5,2013,31,8,2018,Mamon,165,2013-5-31,2018-8-31
19,Jade Palace,Private,Oo Si(3/13)(15.2.13),31.5.2013,31.8.2018,Jade,1,Kachin State,Mamon(166),31,5,2013,31,8,2018,Mamon,166,2013-5-31,2018-8-31
20,Jade Palace,Private,Oo Si(3/13)(15.2.13),31.5.2013,31.8.2018,Jade,1,Kachin State,Mamon(167),31,5,2013,31,8,2018,Mamon,167,2013-5-31,2018-8-31
21,Jade Palace,Private,Oo Si(3/13)(15.2.13),31.5.2013,31.8.2018,Jade,1,Kachin State,Mamon(168),31,5,2013,31,8,2018,Mamon,168,2013-5-31,2018-8-31
22,Jade Palace,Private,Oo Si(3/13)(15.2.13),31.5.2013,31.8.2018,Jade,1,Kachin State,Mamon(169),31,5,2013,31,8,2018,Mamon,169,2013-5-31,2018-8-31
23,Jade Palace,Private,Oo Si(3/13)(15.2.13),31.5.2013,31.8.2018,Jade,1,Kachin State,Mamon(48),31,5,2013,31,8,2018,Mamon,48,2013-5-31,2018-8-31
24,Jade Palace,Private,Oo Si(2/11)(19.6.11),20.4.2011,19.7.2016,Jade,1,Kachin State,Mar Sar(39),20,4,2011,19,7,2016,Mar Sar,39,2011-4-20,2016-7-19
25,Jade Palace,Private,Oo Si(1/10)(4.2.10),23.2.2010,24.5.2017,Jade,1,Kachin State,Mat Lin Chaung(115),23,2,2010,24,5,2017,Mat Lin Chaung,115,2010-2-23,2017-5-24
26,Jade Palace,Private,Oo Si(2/11)(5.6.11),18.8.2011,17.8.2015,Jade,1,Kachin State,Mat Lin Chaung(122),18,8,2011,17,8,2015,Mat Lin Chaung,122,2011-8-18,2015-8-17
27,Jade Palace,Private,Oo Si(3/13)(15.2.13),31.5.2013,14.11.2017,Jade,1,Kachin State,Mat Lin Chaung(128),31,5,2013,14,11,2017,Mat Lin Chaung,128,2013-5-31,2017-11-14
28,Jade Palace,Private,Oo Si(3/10)(28.9.10),11/18,2/17,Jade,1,Kachin State,Mat Lin Chaung(132),18,11,,17,2,,Mat Lin Chaung,132,1900-11-18,1900-2-17
29,Jade Palace,Private,Oo Si(3/10)(28.9.10),11/18,2/17,Jade,1,Kachin State,Mat Lin Chaung(153),18,11,,17,2,,Mat Lin Chaung,153,1900-11-18,1900-2-17
30,Jade Palace,Private,Oo Si(3/10)(28.9.10),11/18,2/17,Jade,1,Kachin State,Mat Lin Chaung(154),18,11,,17,2,,Mat Lin Chaung,154,1900-11-18,1900-2-17
31,Jade Palace,Private,Oo Si(3/10)(28.9.10),11/18,2/17,Jade,1,Kachin State,Mat Lin Chaung(23),18,11,,17,2,,Mat Lin Chaung,23,1900-11-18,1900-2-17
32,Jade Palace,Private,Oo Si(5/11)(16.11.11),20.1.2012,20.4.2017,Jade,1,Kachin State,Mat Lin Chaung(41),20,1,2012,20,4,2017,Mat Lin Chaung,41,2012-1-20,2017-4-20
33,Jade Palace,Private,Oo Si(1/10)(4.2.10),3/16,6/15,Jade,1,Kachin State,Mat Lin Chaung(65),16,3,,15,6,,Mat Lin Chaung,65,1900-3-16,1900-6-15
34,Jade Palace,Private,Oo Si(3/10)(28.9.10),11/18,2/17,Jade,1,Kachin State,Mat Lin Chaung(69),18,11,,17,2,,Mat Lin Chaung,69,1900-11-18,1900-2-17
35,Jade Palace,Private,Oo Si(3/13)(15.2.13),31.5.2013,31.8.2018,Jade,1,Kachin State,Mat Lin Chaung(72),31,5,2013,31,8,2018,Mat Lin Chaung,72,2013-5-31,2018-8-31
36,Jade Palace,Private,Oo Si(3/13)(15.2.13),31.5.2013,31.8.2018,Jade,1,Kachin State,Mat Lin Chaung(73),31,5,2013,31,8,2018,Mat Lin Chaung,73,2013-5-31,2018-8-31
37,Jade Palace,Private,Oo Si(3/13)(15.2.13),31.5.2013,31.8.2018,Jade,1,Kachin State,Mat Lin Chaung(74),31,5,2013,31,8,2018,Mat Lin Chaung,74,2013-5-31,2018-8-31
38,Jade Palace,Private,Oo Si(2/11)(19.6.11),11.5.2011,10.8.2018,Jade,1,Kachin State,Maw Maung(141),11,5,2011,10,8,2018,Maw Maung,141,2011-5-11,2018-8-10
39,Jade Palace,Private,Oo Si(1/10)(4.2.10),3/18,6/17,Jade,1,Kachin State,Maw Maung(144),18,3,,17,6,,Maw Maung,144,1900-3-18,1900-6-17
40,Jade Palace,Private,Oo Si(1/10)(4.2.10),3/18,6/17,Jade,1,Kachin State,Maw Maung(145),18,3,,17,6,,Maw Maung,145,1900-3-18,1900-6-17
41,Jade Palace,Private,Oo Si(1/10)(4.2.10),3/18,6/17,Jade,1,Kachin State,Maw Maung(146),18,3,,17,6,,Maw Maung,146,1900-3-18,1900-6-17
42,Jade Palace,Private,Oo Si(2/10)(17.5.10),7/25,10/24,Jade,1,Kachin State,Maw Maung(182),25,7,,24,10,,Maw Maung,182,1900-7-25,1900-10-24
43,Jade Palace,Private,Oo Si(2/10)(17.5.10),7/25,10/24,Jade,1,Kachin State,Maw Maung(183),25,7,,24,10,,Maw Maung,183,1900-7-25,1900-10-24
44,Jade Palace,Private,Oo Si(2/10)(17.5.10),7/29,10/28,Jade,1,Kachin State,Maw Maung(21),29,7,,28,10,,Maw Maung,21,1900-7-29,1900-10-28
45,Jade Palace,Private,Oo Si(2/10)(17.5.10),7/29,10/28,Jade,1,Kachin State,Maw Maung(22),29,7,,28,10,,Maw Maung,22,1900-7-29,1900-10-28
46,Jade Palace,Private,Oo Si(3/10)(28.9.10),11/18,2/17,Jade,1,Kachin State,Maw Maung(231),18,11,,17,2,,Maw Maung,231,1900-11-18,1900-2-17
47,Jade Palace,Private,Oo Si(2/10)(17.5.10),7/29,10/28,Jade,1,Kachin State,Maw Maung(232),29,7,,28,10,,Maw Maung,232,1900-7-29,1900-10-28
48,Jade Palace,Private,Oo Si(2/10)(17.5.10),7/29,10/28,Jade,1,Kachin State,Maw Maung(233),29,7,,28,10,,Maw Maung,233,1900-7-29,1900-10-28
49,Jade Palace,Private,Oo Si(5/11)(16.11.11),2.7.2011,1.10.2018,Jade,1,Kachin State,Mhaw Si Sar(137),2,7,2011,1,10,2018,Mhaw Si Sar,137,2011-7-2,2018-10-1
50,Jade Palace,Private,Oo Si(1/11)(14.5.11),17.1.2011,17.4.2016,Jade,1,Kachin State,Nant Mhaw(105),17,1,2011,17,4,2016,Nant Mhaw,105,2011-1-17,2016-4-17
51,Jade Palace,Private,Oo Si(1/11)(14.5.11),17.1.2011,17.4.2016,Jade,1,Kachin State,Nant Mhaw(106),17,1,2011,17,4,2016,Nant Mhaw,106,2011-1-17,2016-4-17
52,Jade Palace,Private,Oo Si(3/13)(15.2.13),17.1.2012,17.4.2017,Jade,1,Kachin State,Nant Mhaw(115),17,1,2012,17,4,2017,Nant Mhaw,115,2012-1-17,2017-4-17
53,Jade Palace,Private,Oo Si(3/13)(15.2.13),28.1.2012,28.4.2017,Jade,1,Kachin State,Nant Mhaw(13),28,1,2012,28,4,2017,Nant Mhaw,13,2012-1-28,2017-4-28
54,Jade Palace,Private,Oo Si(2/11)(5.6.11),18.8.2011,17.8.2015,Jade,1,Kachin State,Nant Mhaw(140),18,8,2011,17,8,2015,Nant Mhaw,140,2011-8-18,2015-8-17
55,Jade Palace,Private,Oo Si(1/10)(4.2.10),5/18,8/17,Jade,1,Kachin State,Nant Mhaw(141),18,5,,17,8,,Nant Mhaw,141,1900-5-18,1900-8-17
56,Jade Palace,Private,Oo Si(3/10)(28.9.10),11/18,2/17,Jade,1,Kachin State,Nant Mhaw(18),18,11,,17,2,,Nant Mhaw,18,1900-11-18,1900-2-17
57,Jade Palace,Private,Oo Si(3/10)(28.9.10),11/18,2/17,Jade,1,Kachin State,Nant Mhaw(180),18,11,,17,2,,Nant Mhaw,180,1900-11-18,1900-2-17
58,Jade Palace,Private,Oo Si(3/10)(28.9.10),11/18,2/17,Jade,1,Kachin State,Nant Mhaw(19),18,11,,17,2,,Nant Mhaw,19,1900-11-18,1900-2-17
59,Jade Palace,Private,Oo Si(3/10)(28.9.10),11/18,2/17,Jade,1,Kachin State,Nant Mhaw(20),18,11,,17,2,,Nant Mhaw,20,1900-11-18,1900-2-17
60,Jade Palace,Private,Oo Si(2/10)(17.5.10),6/30,9/29,Jade,1,Kachin State,Nant Mhaw(43),30,6,,29,9,,Nant Mhaw,43,1900-6-30,1900-9-29
61,Jade Palace,Private,Oo Si(3/10)(28.9.10),11/18,2/17,Jade,1,Kachin State,Nant Mhaw(49),18,11,,17,2,,Nant Mhaw,49,1900-11-18,1900-2-17
62,Jade Palace,Private,Oo Si(3/10)(28.9.10),11/18,2/17,Jade,1,Kachin State,Nant Mhaw(50),18,11,,17,2,,Nant Mhaw,50,1900-11-18,1900-2-17
63,Jade Palace,Private,Oo Si(2/11)(5.6.11),18.8.2011,17.8.2015,Jade,1,Kachin State,Nant Mhaw(6),18,8,2011,17,8,2015,Nant Mhaw,6,2011-8-18,2015-8-17
64,Jade Palace,Private,Oo Si(1/10)(4.2.10),5/18,8/17,Jade,1,Kachin State,Nant Mhaw(8),18,5,,17,8,,Nant Mhaw,8,1900-5-18,1900-8-17
65,Jade Palace,Private,Oo Si(2/11)(5.6.11),18.8.2011,17.8.2015,Jade,1,Kachin State,Nant Mhaw(88),18,8,2011,17,8,2015,Nant Mhaw,88,2011-8-18,2015-8-17
66,Jade Palace,Private,Oo Si(3/10)(28.9.10),11/18,2/17,Jade,1,Kachin State,Nant Mhaw(89),18,11,,17,2,,Nant Mhaw,89,1900-11-18,1900-2-17
67,Jade Palace,Private,Oo Si(5/11)(16.11.11),2.7.2011,30.9.2016,Jade,1,Kachin State,Nant Mhaw(91),2,7,2011,30,9,2016,Nant Mhaw,91,2011-7-2,2016-9-30
68,Jade Palace,Private,Oo Si(5/11)(16.11.11),13.7.2011,11.10.2016,Jade,1,Kachin State,Nant Mhaw(95),13,7,2011,11,10,2016,Nant Mhaw,95,2011-7-13,2016-10-11
69,Jade Palace,Private,Oo Si(5/11)(16.11.11),13.7.2011,11.10.2016,Jade,1,Kachin State,Nant Mhaw(96),13,7,2011,11,10,2016,Nant Mhaw,96,2011-7-13,2016-10-11
70,Jade Palace,Private,Oo Si(2/10)(17.5.10),7/29,10/28,Jade,1,Kachin State,Sai Kyar Bwan(11),29,7,,28,10,,Sai Kyar Bwan,11,1900-7-29,1900-10-28
71,Jade Palace,Private,Oo Si(2/10)(17.5.10),7/29,10/28,Jade,1,Kachin State,Sai Kyar Bwan(12),29,7,,28,10,,Sai Kyar Bwan,12,1900-7-29,1900-10-28
72,Jade Palace,Private,Oo Si(2/10)(17.5.10),7/29,10/28,Jade,1,Kachin State,Sai Kyar Bwan(13),29,7,,28,10,,Sai Kyar Bwan,13,1900-7-29,1900-10-28
73,Jade Palace,Private,Oo Si(3/10)(28.9.10),11/18,2/17,Jade,1,Kachin State,Sai Kyar Bwan(8),18,11,,17,2,,Sai Kyar Bwan,8,1900-11-18,1900-2-17
74,Jade Palace,Private,Oo Si(3/13)(15.2.13),10.7.2012,9.10.2017,Jade,1,Kachin State,Sai Taung(27),10,7,2012,9,10,2017,Sai Taung,27,2012-7-10,2017-10-9
75,Jade Palace,Private,Oo Si(5/11)(16.11.11),2.7.2011,30.9.2016,Jade,1,Kachin State,Sha Yaung Kha(144),2,7,2011,30,9,2016,Sha Yaung Kha,144,2011-7-2,2016-9-30
76,Jade Palace,Private,Oo Si(2/11)(19.6.11),31.8.2011,29.11.2016,Jade,1,Kachin State,Sha Yaung Kha(190),31,8,2011,29,11,2016,Sha Yaung Kha,190,2011-8-31,2016-11-29
77,Jade Palace,Private,Oo Si(3/10)(28.9.10),11/18,2/17,Jade,1,Kachin State,Sha Yaung Kha(283),18,11,,17,2,,Sha Yaung Kha,283,1900-11-18,1900-2-17
78,Jade Palace,Private,Oo Si(3/10)(28.9.10),11/18,2/17,Jade,1,Kachin State,Sha Yaung Kha(301),18,11,,17,2,,Sha Yaung Kha,301,1900-11-18,1900-2-17
79,Jade Palace,Private,Oo Si(3/10)(28.9.10),11/18,2/17,Jade,1,Kachin State,Sha Yaung Kha(302),18,11,,17,2,,Sha Yaung Kha,302,1900-11-18,1900-2-17
80,Jade Palace,Private,Oo Si(2/10)(17.5.10),7/29,10/28,Jade,1,Kachin State,Sha Yaung Kha(397),29,7,,28,10,,Sha Yaung Kha,397,1900-7-29,1900-10-28
81,Jade Palace,Private,Oo Si(2/10)(17.5.10),7/29,10/28,Jade,1,Kachin State,Sha Yaung Kha(398),29,7,,28,10,,Sha Yaung Kha,398,1900-7-29,1900-10-28
82,Jade Palace,Private,Oo Si(3/10)(28.9.10),11/18,2/17,Jade,1,Kachin State,Sha Yaung Kha(83),18,11,,17,2,,Sha Yaung Kha,83,1900-11-18,1900-2-17
83,Jade Palace,Private,Oo Si(3/13)(15.2.13),10.7.2012,9.10.2017,Jade,1,Kachin State,Shan Kone(13),10,7,2012,9,10,2017,Shan Kone,13,2012-7-10,2017-10-9
84,Jade Palace,Private,Oo Si(3/13)(15.2.13),10.7.2012,9.10.2017,Jade,1,Kachin State,Shan Kone(14),10,7,2012,9,10,2017,Shan Kone,14,2012-7-10,2017-10-9
85,Jade Palace,Private,Oo Si(3/13)(15.2.13),10.7.2012,9.10.2017,Jade,1,Kachin State,Shan Kone(15),10,7,2012,9,10,2017,Shan Kone,15,2012-7-10,2017-10-9
86,Jade Palace,Private,Oo Si(3/13)(15.2.13),10.7.2012,9.10.2017,Jade,1,Kachin State,Shan Kone(19),10,7,2012,9,10,2017,Shan Kone,19,2012-7-10,2017-10-9
87,Jade Palace,Private,Oo Si(3/10)(28.9.10),11/18,2/17,Jade,1,Kachin State,Shan Kone(24),18,11,,17,2,,Shan Kone,24,1900-11-18,1900-2-17
88,Jade Palace,Private,Oo Si(3/13)(15.2.13),10.7.2012,9.10.2017,Jade,1,Kachin State,Shan Kone(25),10,7,2012,9,10,2017,Shan Kone,25,2012-7-10,2017-10-9
89,Jade Palace,Private,Oo Si(3/13)(15.2.13),10.7.2012,9.10.2017,Jade,1,Kachin State,Shan Kone(7),10,7,2012,9,10,2017,Shan Kone,7,2012-7-10,2017-10-9
90,Jade Palace,Private,Oo Si(2/10)(17.5.10),7/27,10/26,Jade,1,Kachin State,Sport(213),27,7,,26,10,,Sport,213,1900-7-27,1900-10-26
91,Jade Palace,Private,Oo Si(2/10)(17.5.10),7/27,10/26,Jade,1,Kachin State,Sport(214),27,7,,26,10,,Sport,214,1900-7-27,1900-10-26
92,Jade Palace,Private,Oo Si(2/10)(17.5.10),7/29,10/28,Jade,1,Kachin State,Taung Kot(106),29,7,,28,10,,Taung Kot,106,1900-7-29,1900-10-28
